DEPARTMENT OF ENERGY,USA,Federal Register,ce899e93c4372f1de66bfaa9765dd95650f0e204.txt,https://api.govinfo.gov/packages/FR-2019-01-08/granules/2018-28476/htm?api_key=stD22vRTT0I2MUAFJNi0299a8nvz45dSlFuYd00i,Regulatory Information,2019-01-08,2018-28476,Federal,,Notice of Petition for Declaratory Order: Plantation Pipe Line Company,https://api.govinfo.gov/packages/FR-2019-01-08/granules/2018-28476/summary?api_key=
BUREAU OF CONSUMER FINANCIAL PROTECTION,USA,Federal Register,f6f62e602a61f3ee2d9cb8d6248386f586aef765.txt,https://api.govinfo.gov/packages/FR-2019-02-14/granules/2019-01905/htm?api_key=stD22vRTT0I2MUAFJNi0299a8nvz45dSlFuYd00i,Regulatory Information,2019-02-14,2019-01905,Federal,"The Bureau of Consumer Financial Protection (Bureau) is proposing to delay the August 19, 2019 compliance date for the mandatory underwriting provisions of the regulation promulgated by the Bureau in November 2017 governing Payday, Vehicle Title, and Certain High-Cost Installment Loans (2017 Final Rule or Rule) by 15 months to November 19, 2020. This proposal is related to another proposal, published separately in this issue of the Federal Register, seeking comment on whether the Bureau should rescind the mandatory underwriting provisions of the 2017 Final Rule.","Payday, Vehicle Title, and Certain High-Cost Installment Loans; Delay of Compliance Date",https://api.govinfo.gov/packages/FR-2019-02-14/granules/2019-01905/summary?api_key=
DEPARTMENT OF AGRICULTURE,USA,Federal Register,cab1b13d8a872447d29fcd4f588bef4a93bfcf78.txt,https://api.govinfo.gov/packages/FR-2019-02-20/granules/2019-02701/htm?api_key=stD22vRTT0I2MUAFJNi0299a8nvz45dSlFuYd00i,Regulatory Information,2019-02-20,2019-02701,Federal,"NRCS gives notice of the deauthorization of Federal funding for the Lick Creek Watershed project, Russell, Dickenson and Wise Counties, Virginia.","Lick Creek Watershed, Russell, Dickenson and Wise Counties, Virginia",https://api.govinfo.gov/packages/FR-2019-02-20/granules/2019-02701/summary?api_key=
DEPARTMENT OF THE TREASURY,USA,Federal Register,be40a912c6d6dfd81e79adcab013058068fbd5e6.txt,https://api.govinfo.gov/packages/FR-2019-02-20/granules/2019-02650/htm?api_key=stD22vRTT0I2MUAFJNi0299a8nvz45dSlFuYd00i,Regulatory Information,2019-02-20,2019-02650,Federal,"The Office of the Comptroller of the Currency (OCC), the Board of Governors of the Federal Reserve System (Board), the Federal Deposit Insurance Corporation (FDIC), the Farm Credit Administration (FCA), and the National Credit Union Administration (NCUA) are amending their regulations regarding loans in areas having special flood hazards to implement the private flood insurance provisions of the Biggert-Waters Flood Insurance Reform Act of 2012 (Biggert-Waters Act). Specifically, the final rule requires regulated lending institutions to accept policies that meet the statutory definition of ``private flood insurance'' in the Biggert-Waters Act; and permits regulated lending institutions to exercise their discretion to accept flood insurance policies issued by private insurers and plans providing flood coverage issued by mutual aid societies that do not meet the statutory definition of ``private flood insurance,'' subject to certain restrictions.",Loans in Areas Having Special Flood Hazards,https://api.govinfo.gov/packages/FR-2019-02-20/granules/2019-02650/summary?api_key=
DEPARTMENT OF TRANSPORTATION,USA,Federal Register,eacd3779d73fccc8d15c975cdb5f736edd332ee2.txt,https://api.govinfo.gov/packages/FR-2019-02-19/granules/2019-02680/htm?api_key=stD22vRTT0I2MUAFJNi0299a8nvz45dSlFuYd00i,Regulatory Information,2019-02-19,2019-02680,Federal,"By Federal Register notice on July 31, 2018 the National Park Service (NPS) and the Federal Aviation Administration (FAA) invited interested persons to apply to fill one current and three future openings on the National Parks Overflights Advisory Group (NPOAG) to represent air tour operator concerns, general aviation, and Native American interests. This notice informs the public of the selection made for the vacancies representing air tour operator concerns and Native American interests and invites persons interested in serving on the NPOAG to apply for current openings representing Native American concerns and general aviation.",Membership in the National Parks Overflights Advisory Group,https://api.govinfo.gov/packages/FR-2019-02-19/granules/2019-02680/summary?api_key=
DEPARTMENT OF HEALTH AND HUMAN SERVICES,USA,Federal Register,c81b1b93abb5d14ced038b573afa6637101f145b.txt,https://api.govinfo.gov/packages/FR-2019-02-19/granules/2019-02683/htm?api_key=stD22vRTT0I2MUAFJNi0299a8nvz45dSlFuYd00i,Regulatory Information,2019-02-19,2019-02683,Federal,"The National Toxicology Program (NTP) at the National Institute of Environmental Health Sciences is seeking input on assays and approaches for evaluating chemical effects on cancer pathways, specifically, pathways that map to the hallmarks of cancer and key characteristics of carcinogens.",Request for Information (RFI) on Assays and Approaches for Evaluating Chemical Effects on Cancer Pathways,https://api.govinfo.gov/packages/FR-2019-02-19/granules/2019-02683/summary?api_key=
DEPARTMENT OF COMMERCE,USA,Federal Register,194d8ba1f6d5066f36e2a5b21fdf79df7624a64b.txt,https://api.govinfo.gov/packages/FR-2019-02-19/granules/2019-02685/htm?api_key=stD22vRTT0I2MUAFJNi0299a8nvz45dSlFuYd00i,Regulatory Information,2019-02-19,2019-02685,Federal,"In accordance with the regulations implementing the Marine Mammal Protection Act (MMPA), as amended, notification is hereby given that NMFS has issued an incidental harassment authorization (IHA) to White Pass & Yukon Route (WP&YR) to incidentally take, by Level A and Level B harassment, seven species of marine mammals during the Railroad Dock dolphin installation project in Skagway, Alaska.","Takes of Marine Mammals Incidental to Specified Activities; Taking Marine Mammals Incidental to the Railroad Dock Dolphin Installation Project, Skagway, Alaska",https://api.govinfo.gov/packages/FR-2019-02-19/granules/2019-02685/summary?api_key=
DEPARTMENT OF COMMERCE,USA,Federal Register,83b77721d645fc529933c4d909ab959790789d7f.txt,https://api.govinfo.gov/packages/FR-2019-02-19/granules/2019-02591/htm?api_key=stD22vRTT0I2MUAFJNi0299a8nvz45dSlFuYd00i,Regulatory Information,2019-02-19,2019-02591,Federal,"NMFS issued regulations to implement management measures described in Amendment 31 to the Fishery Management Plan (FMP) for Coastal Migratory Pelagics (CMP) of the Gulf of Mexico (Gulf) and Atlantic Region (Amendment 31), as prepared by the Gulf of Mexico (Gulf Council) and South Atlantic Fishery Management Councils (South Atlantic Council) (Councils). This final rule removes Atlantic migratory group cobia (Atlantic cobia) from Federal management under the Magnuson- Stevens Fishery Conservation and Management Act (Magnuson-Stevens Act). At the same time, this final rule implements comparable regulations under the Atlantic Coastal Fisheries Cooperative Management Act (Atlantic Coastal Act) to replace the existing Magnuson-Stevens Act based regulations in Atlantic Federal waters. The purpose of Amendment 31 is to facilitate improved coordination of Atlantic cobia in state and Federal waters, thereby more effectively constraining harvest and preventing overfishing and decreasing adverse socio-economic effects to fishermen.","Fisheries of the Caribbean, Gulf of Mexico, and South Atlantic; Coastal Migratory Pelagics Resources in the Gulf of Mexico and Atlantic Region; Amendment 31",https://api.govinfo.gov/packages/FR-2019-02-19/granules/2019-02591/summary?api_key=
DEPARTMENT OF HOMELAND SECURITY,USA,Federal Register,b8e75f9abd7c64bcb9e1fe8fb2478fa59a670a35.txt,https://api.govinfo.gov/packages/FR-2019-02-15/granules/2019-02564/htm?api_key=stD22vRTT0I2MUAFJNi0299a8nvz45dSlFuYd00i,Regulatory Information,2019-02-15,2019-02564,Federal,"Comments are requested on proposed flood hazard determinations, which may include additions or modifications of any Base Flood Elevation (BFE), base flood depth, Special Flood Hazard Area (SFHA) boundary or zone designation, or regulatory floodway on the Flood Insurance Rate Maps (FIRMs), and where applicable, in the supporting Flood Insurance Study (FIS) reports for the communities listed in the table below. The purpose of this notice is to seek general information and comment regarding the preliminary FIRM, and where applicable, the FIS report that the Federal Emergency Management Agency (FEMA) has provided to the affected communities. The FIRM and FIS report are the basis of the floodplain management measures that the community is required either to adopt or to show evidence of having in effect in order to qualify or remain qualified for participation in the National Flood Insurance Program (NFIP). In addition, the FIRM and FIS report, once effective, will be used by insurance agents and others to calculate appropriate flood insurance premium rates for new buildings and the contents of those buildings.",Proposed Flood Hazard Determinations,https://api.govinfo.gov/packages/FR-2019-02-15/granules/2019-02564/summary?api_key=
DEPARTMENT OF HOMELAND SECURITY,USA,Federal Register,6d2190f248beb6439fd0d4a7470da1ba67923ddc.txt,https://api.govinfo.gov/packages/FR-2019-02-15/granules/2019-02563/htm?api_key=stD22vRTT0I2MUAFJNi0299a8nvz45dSlFuYd00i,Regulatory Information,2019-02-15,2019-02563,Federal,"Comments are requested on proposed flood hazard determinations, which may include additions or modifications of any Base Flood Elevation (BFE), base flood depth, Special Flood Hazard Area (SFHA) boundary or zone designation, or regulatory floodway on the Flood Insurance Rate Maps (FIRMs), and where applicable, in the supporting Flood Insurance Study (FIS) reports for the communities listed in the table below. The purpose of this notice is to seek general information and comment regarding the preliminary FIRM, and where applicable, the FIS report that the Federal Emergency Management Agency (FEMA) has provided to the affected communities. The FIRM and FIS report are the basis of the floodplain management measures that the community is required either to adopt or to show evidence of having in effect in order to qualify or remain qualified for participation in the National Flood Insurance Program (NFIP). In addition, the FIRM and FIS report, once effective, will be used by insurance agents and others to calculate appropriate flood insurance premium rates for new buildings and the contents of those buildings.",Proposed Flood Hazard Determinations,https://api.govinfo.gov/packages/FR-2019-02-15/granules/2019-02563/summary?api_key=
DEPARTMENT OF HEALTH AND HUMAN SERVICES,USA,Federal Register,ce03bf86752060fb53195168c0be7374dcbf21e4.txt,https://api.govinfo.gov/packages/FR-2019-02-15/granules/2019-02430/htm?api_key=stD22vRTT0I2MUAFJNi0299a8nvz45dSlFuYd00i,Regulatory Information,2019-02-15,2019-02430,Federal,,National Institute of Environmental Health Sciences; Notice of Meetings,https://api.govinfo.gov/packages/FR-2019-02-15/granules/2019-02430/summary?api_key=
DEPARTMENT OF AGRICULTURE,USA,Federal Register,0754983a3cfaebf110e5af9e1a71830bb066b34c.txt,https://api.govinfo.gov/packages/FR-2019-02-15/granules/2019-02518/htm?api_key=stD22vRTT0I2MUAFJNi0299a8nvz45dSlFuYd00i,Regulatory Information,2019-02-15,2019-02518,Federal,"This proposed rule would amend the National List of Allowed and Prohibited Substances (National List) section of the United States Department of Agriculture's (USDA's) organic regulations to implement recommendations submitted to the Secretary of Agriculture (Secretary) by the National Organic Standards Board (NOSB). This rule proposes to add elemental sulfur for use as a molluscicide in organic crop production, add polyoxin D zinc salt to control fungal diseases in organic crop production, and reclassify magnesium chloride from an allowed synthetic to an allowed nonsynthetic ingredient in organic handling.",National Organic Program; Proposed Amendments to the National List of Allowed and Prohibited Substances for April 2018 NOSB Recommendations (Crops and Handling),https://api.govinfo.gov/packages/FR-2019-02-15/granules/2019-02518/summary?api_key=
FEDERAL RESERVE SYSTEM,USA,Federal Register,1f518314d92255ed670e18357b034e288a91eb5e.txt,https://api.govinfo.gov/packages/FR-2019-02-15/granules/2019-02516/htm?api_key=stD22vRTT0I2MUAFJNi0299a8nvz45dSlFuYd00i,Regulatory Information,2019-02-15,2019-02516,Federal,"On November 21, 2018, the Board of Governors of the Federal Reserve System (Board) published a final rule in the Federal Register regarding the Large Financial Institution Rating System. That document included two typographical errors in ``Appendix A--Text of Large Financial Institution Rating System'' relating to the description of the conditionally meets expectation rating. This document corrects those typographical errors.",Large Financial Institution Rating System; Regulations K and LL; Correction,https://api.govinfo.gov/packages/FR-2019-02-15/granules/2019-02516/summary?api_key=
BUREAU OF CONSUMER FINANCIAL PROTECTION,USA,Federal Register,da96efdd724b96e07ef3a31eb0637b70f05ca4ee.txt,https://api.govinfo.gov/packages/FR-2019-02-14/granules/2019-01906/htm?api_key=stD22vRTT0I2MUAFJNi0299a8nvz45dSlFuYd00i,Regulatory Information,2019-02-14,2019-01906,Federal,"The Bureau of Consumer Financial Protection (Bureau) is proposing to rescind certain provisions of the regulation promulgated by the Bureau in November 2017 governing Payday, Vehicle Title, and Certain High-Cost Installment Loans (2017 Final Rule or Rule). The provisions of the Rule which the Bureau proposes to rescind provide that it is an unfair and abusive practice for a lender to make a covered short-term or longer-term balloon-payment loan, including payday and vehicle title loans, without reasonably determining that consumers have the ability to repay those loans according to their terms; prescribe mandatory underwriting requirements for making the ability-to-repay determination; exempt certain loans from the mandatory underwriting requirements; and establish related definitions, reporting, and recordkeeping requirements. This proposal is related to another proposal, published separately in this issue of the Federal Register, seeking comment on whether the Bureau should delay the August 19, 2019 compliance date for these portions of the 2017 Final Rule.","Payday, Vehicle Title, and Certain High-Cost Installment Loans",https://api.govinfo.gov/packages/FR-2019-02-14/granules/2019-01906/summary?api_key=
DEPARTMENT OF THE TREASURY,USA,Federal Register,a4e10b0be5949f16125cfbfe9e4f11fe400e7546.txt,https://api.govinfo.gov/packages/FR-2019-02-14/granules/2018-28281/htm?api_key=stD22vRTT0I2MUAFJNi0299a8nvz45dSlFuYd00i,Regulatory Information,2019-02-14,2018-28281,Federal,"The Office of the Comptroller of the Currency, the Board of Governors of the Federal Reserve System, and the Federal Deposit Insurance Corporation (collectively, the agencies) are adopting a final rule to address changes to credit loss accounting under U.S. generally accepted accounting principles, including banking organizations' implementation of the current expected credit losses methodology (CECL). The final rule provides banking organizations the option to phase in over a three-year period the day-one adverse effects on regulatory capital that may result from the adoption of the new accounting standard. In addition, the final rule revises the agencies' regulatory capital rule, stress testing rules, and regulatory disclosure requirements to reflect CECL, and makes conforming amendments to other regulations that reference credit loss allowances.",Regulatory Capital Rule: Implementation and Transition of the Current Expected Credit Losses Methodology for Allowances and Related Adjustments to the Regulatory Capital Rule and Conforming Amendments to Other Regulations,https://api.govinfo.gov/packages/FR-2019-02-14/granules/2018-28281/summary?api_key=
DEPARTMENT OF VETERANS AFFAIRS,USA,Federal Register,426c7bfff45d63438a365a668c112b98b3c761cf.txt,https://api.govinfo.gov/packages/FR-2019-02-14/granules/2019-02315/htm?api_key=stD22vRTT0I2MUAFJNi0299a8nvz45dSlFuYd00i,Regulatory Information,2019-02-14,2019-02315,Federal,"As required by the Privacy Act of 1974, notice is hereby given that the Department of Veterans Affairs (VA) proposes to modify an existing system of records, Compensation, Pension, Education, and Vocational Rehabilitation and Employment Records--VA'' (58VA21/22/28).",Privacy Act of 1974; System of Records,https://api.govinfo.gov/packages/FR-2019-02-14/granules/2019-02315/summary?api_key=
DEPARTMENT OF JUSTICE,USA,Federal Register,6b3422c239259504199d846cbf8efa64bea18497.txt,https://api.govinfo.gov/packages/FR-2019-02-14/granules/2019-02302/htm?api_key=stD22vRTT0I2MUAFJNi0299a8nvz45dSlFuYd00i,Regulatory Information,2019-02-14,2019-02302,Federal,,Notice Pursuant to The National Cooperative Research and Production Act of 1993-Petroleum Environmental Research Forum,https://api.govinfo.gov/packages/FR-2019-02-14/granules/2019-02302/summary?api_key=
ENVIRONMENTAL PROTECTION AGENCY,USA,Federal Register,5a5d82a266b7446bbf1afb1f892895e1646c39ad.txt,https://api.govinfo.gov/packages/FR-2019-02-14/granules/2019-02385/htm?api_key=stD22vRTT0I2MUAFJNi0299a8nvz45dSlFuYd00i,Regulatory Information,2019-02-14,2019-02385,Federal,"This notice announces EPA's order for the cancellations and amendments to terminate uses, voluntarily requested by the registrants and accepted by the Agency, of the products listed in Table 1 and Table 2 of Unit II, pursuant to the Federal Insecticide, Fungicide, and Rodenticide Act (FIFRA). This cancellation order follows an October 17, 2018 Federal Register Notice of Receipt of Requests from the registrants listed in Table 3 of Unit II to voluntarily cancel and amend to terminate uses of these product registrations. In the October 17, 2018 notice, EPA indicated that it would issue an order implementing the cancellations and amendments to terminate uses, unless the Agency received substantive comments within the 30-day comment period that would merit its further review of these requests, or unless the registrants withdrew their requests. The Agency did not receive any comments on the notice. Further, the registrants did not withdraw their requests. Accordingly, EPA hereby issues in this notice a cancellation order granting the requested cancellations and amendments to terminate uses. Any distribution, sale, or use of the products subject to this cancellation order is permitted only in accordance with the terms of this order, including any existing stocks provisions.",Product Cancellation Order for Certain Pesticide Registrations and Amendments To Terminate Uses,https://api.govinfo.gov/packages/FR-2019-02-14/granules/2019-02385/summary?api_key=
ENVIRONMENTAL PROTECTION AGENCY,USA,Federal Register,0e8ebba5e452cbe66edc2ce374dc47abc6af1724.txt,https://api.govinfo.gov/packages/FR-2019-02-14/granules/2019-02354/htm?api_key=stD22vRTT0I2MUAFJNi0299a8nvz45dSlFuYd00i,Regulatory Information,2019-02-14,2019-02354,Federal,"EPA has granted emergency exemptions under the Federal Insecticide, Fungicide, and Rodenticide Act (FIFRA) for use of pesticides as listed in this notice. The exemptions were granted during the period of April 1, 2018 to September 30, 2018 to control unforeseen pest outbreaks.",Pesticide Emergency Exemptions; Agency Decisions and State and Federal Agency Crisis Declarations,https://api.govinfo.gov/packages/FR-2019-02-14/granules/2019-02354/summary?api_key=
DEPARTMENT OF AGRICULTURE,USA,Federal Register,11acb43d5f2ea98b2c7e3d69de254363a891b734.txt,https://api.govinfo.gov/packages/FR-2019-02-14/granules/2019-02360/htm?api_key=stD22vRTT0I2MUAFJNi0299a8nvz45dSlFuYd00i,Regulatory Information,2019-02-14,2019-02360,Federal,"In preparing to implement the Agriculture Improvement Act of 2018 (commonly referred to as the 2018 Farm Bill), we are hosting a listening session for initial public input about new programs and changes to existing programs implemented by the Farm Service Agency (FSA), the Natural Resources Conservation Service (NRCS), and the Risk Management Agency (RMA). The 2018 Farm Bill is intended to provide support, certainty, and stability to our Nation's farmers, ranchers, and land stewards by enhancing farm support programs, improving crop insurance, maintaining disaster programs, and promoting and supporting voluntary conservation. We invite you to participate in the listening session. The listening session is open to the public.",2018 Farm Bill Implementation Listening Session,https://api.govinfo.gov/packages/FR-2019-02-14/granules/2019-02360/summary?api_key=
ENVIRONMENTAL PROTECTION AGENCY,USA,Federal Register,897b2c72106c21d6451f9d5b6f0e8968a54500c3.txt,https://api.govinfo.gov/packages/FR-2019-02-14/granules/2019-02348/htm?api_key=stD22vRTT0I2MUAFJNi0299a8nvz45dSlFuYd00i,Regulatory Information,2019-02-14,2019-02348,Federal,"The Environmental Protection Agency (EPA) Region 9 is issuing a Notice of Intent to Delete the soil portion of the Beckman Instruments Superfund Site (Site) located in Porterville, California, from the National Priorities List (NPL) and requests public comments on this proposed action. The NPL, promulgated pursuant to section 105 of the Comprehensive Environmental Response, Compensation, and Liability Act (CERCLA) of 1980, as amended, is an appendix of the National Oil and Hazardous Substances Pollution Contingency Plan (NCP). EPA and the State of California, through the Department of Toxic Substances Control (DTSC), have determined that all appropriate soil response actions under CERCLA have been completed. However, this deletion does not preclude future actions under Superfund. This partial deletion pertains to the soil; a map indicating the area to be deleted is in the public docket. The groundwater will remain on the NPL and is not being considered for deletion as part of this action. Maintenance, monitoring, and five-year reviews of the groundwater remedy will continue until all drinking water standards have been met.",National Oil and Hazardous Substances Pollution Contingency Plan; National Priorities List: Partial Deletion of the Beckman Instruments Superfund Site,https://api.govinfo.gov/packages/FR-2019-02-14/granules/2019-02348/summary?api_key=
ENVIRONMENTAL PROTECTION AGENCY,USA,Federal Register,c703e781b58e3e05186bd876e806ddeb480a2ada.txt,https://api.govinfo.gov/packages/FR-2019-02-14/granules/2019-02202/htm?api_key=stD22vRTT0I2MUAFJNi0299a8nvz45dSlFuYd00i,Regulatory Information,2019-02-14,2019-02202,Federal,"On December 13, 2018, the Environmental Protection Agency (EPA) sent the State of Connecticut a letter approving Connecticut's request for delegation of the New Source Performance Standards for Stationary Combustion Turbines. To inform regulated facilities and the public of the EPA's approval of Connecticut's request for delegation of authority to implement and enforce these standards, the EPA is making available a copy of EPA's letter to Connecticut through this document.",Notice of Delegation of Authority; Connecticut; New Source Performance Standards for Stationary Combustion Turbines,https://api.govinfo.gov/packages/FR-2019-02-14/granules/2019-02202/summary?api_key=
DEPARTMENT OF ENERGY,USA,Federal Register,ad965e9fa280cf5e86d9f03b9ddbe4b4d825961f.txt,https://api.govinfo.gov/packages/FR-2019-02-13/granules/2019-02144/htm?api_key=stD22vRTT0I2MUAFJNi0299a8nvz45dSlFuYd00i,Regulatory Information,2019-02-13,2019-02144,Federal,,"Corpus Christi Liquefaction Stage III, LLC; Corpus Christi Liquefaction, LLC; and Cheniere Corpus Christi Pipeline, L.P.; Notice of Revised Schedule for Environmental Review of the Stage 3 Project",https://api.govinfo.gov/packages/FR-2019-02-13/granules/2019-02144/summary?api_key=
ENVIRONMENTAL PROTECTION AGENCY,USA,Federal Register,7ebe56c7e50a3c8981ffe1efbbadac535670fddd.txt,https://api.govinfo.gov/packages/FR-2019-02-13/granules/2019-02217/htm?api_key=stD22vRTT0I2MUAFJNi0299a8nvz45dSlFuYd00i,Regulatory Information,2019-02-13,2019-02217,Federal,"The Environmental Protection Agency (EPA) proposes to approve state implementation plan (SIP) revisions submitted by the Idaho Department of Environmental Quality (IDEQ) on November 2, 2018. The submitted revisions update Idaho's rules by removing obsolete and duplicative requirements as well as requirements less stringent than applicable Federal regulations.","Air Plan Approval; ID, Kraft Pulp Mill Rule Revisions",https://api.govinfo.gov/packages/FR-2019-02-13/granules/2019-02217/summary?api_key=
ENVIRONMENTAL PROTECTION AGENCY,USA,Federal Register,62e997c692ca1c5b4cba907acdf548691a5223e5.txt,https://api.govinfo.gov/packages/FR-2019-02-13/granules/2019-02215/htm?api_key=stD22vRTT0I2MUAFJNi0299a8nvz45dSlFuYd00i,Regulatory Information,2019-02-13,2019-02215,Federal,"The Environmental Protection Agency (EPA) is proposing to approve a March 6, 2018 request by the Indiana Department of Environmental Management (IDEM) to revise its State Implementation Plan (SIP) for the United States Steel-Gary Works (US Steel-Gary Works). The proposed SIP revision pertains to the removal of all sulfur dioxide (SO<INF>2</INF>) emission limitations for the facility's coke plant, which permanently ceased operation on March 30, 2015, and other administrative changes. The SIP revision provides for an overall reduction in SO<INF>2</INF> emissions at the facility.",Air Plan Approval; Indiana; Proposed Approval of a Revision to the Sulfur Dioxide State Implementation Plan for United States Steel-Gary Works,https://api.govinfo.gov/packages/FR-2019-02-13/granules/2019-02215/summary?api_key=
