DEPARTMENT OF COMMERCE,USA,Federal Register,401af4ee588fa1d485d52a16ed2823241bdbca57.txt,https://api.govinfo.gov/packages/FR-2019-02-13/granules/2019-02190/htm?api_key=stD22vRTT0I2MUAFJNi0299a8nvz45dSlFuYd00i,Regulatory Information,2019-02-13,2019-02190,Federal,"NMFS transfers 26 metric tons (mt) of Atlantic bluefin tuna (BFT) quota from the Reserve category to the General category January 2019 period (from January 1 through March 31, 2019, or until the available subquota for this period is reached, whichever comes first). This action is based on consideration of the regulatory determination criteria regarding inseason adjustments and applies to Atlantic tunas General category (commercial) permitted vessels and Highly Migratory Species (HMS) Charter/Headboat category permitted vessels with a commercial sale endorsement when fishing commercially for BFT.",Atlantic Highly Migratory Species; Atlantic Bluefin Tuna Fisheries; General Category Fishery,https://api.govinfo.gov/packages/FR-2019-02-13/granules/2019-02190/summary?api_key=
DEPARTMENT OF COMMERCE,USA,Federal Register,9a24170777e02c697a582bf306330256774db022.txt,https://api.govinfo.gov/packages/FR-2019-02-13/granules/2019-02193/htm?api_key=stD22vRTT0I2MUAFJNi0299a8nvz45dSlFuYd00i,Regulatory Information,2019-02-13,2019-02193,Federal,"NMFS implements an accountability measure (AM) through this temporary rule for commercial harvest of king mackerel in the southern zone of the Gulf of Mexico (Gulf) exclusive economic zone (EEZ) using run-around gillnet gear. NMFS has determined that the commercial annual catch limit (equivalent to the commercial quota) for king mackerel using run-around gillnet gear in the southern zone of the Gulf EEZ has been reached. Therefore, NMFS closes the southern zone to commercial king mackerel fishing using run-around gillnet gear in the Gulf EEZ on February 8, 2019. This closure is necessary to protect the Gulf king mackerel resource.",Coastal Migratory Pelagic Resources of the Gulf of Mexico and Atlantic Region; 2018-2019 Commercial Run-Around Gillnet Closure for King Mackerel,https://api.govinfo.gov/packages/FR-2019-02-13/granules/2019-02193/summary?api_key=
DEPARTMENT OF AGRICULTURE,USA,Federal Register,fedcf276376f5ef06592403c2902094d78c53241.txt,https://api.govinfo.gov/packages/FR-2019-02-13/granules/2019-02106/htm?api_key=stD22vRTT0I2MUAFJNi0299a8nvz45dSlFuYd00i,Regulatory Information,2019-02-13,2019-02106,Federal,"On June 24, 2010, the Rural Utilities Service (RUS) issued a final rule to establish the regulation for the Special Evaluation Assistance for Rural Communities and Households Program (SEARCH) as authorized by Section 306(a) of the Consolidated Farm and Rural Development Act (CONACT). Following final implementation of this final rule, RUS found that the wording for the definition of a rural area is inconsistent with the statute. This document corrects the final regulation.",Special Evaluation Assistance for Rural Communities and Households Program (SEARCH),https://api.govinfo.gov/packages/FR-2019-02-13/granules/2019-02106/summary?api_key=
ENVIRONMENTAL PROTECTION AGENCY,USA,Federal Register,df0f2dcbdce2a20c22ebf927822ad19bb3cf80a0.txt,https://api.govinfo.gov/packages/FR-2019-02-12/granules/2019-01923/htm?api_key=stD22vRTT0I2MUAFJNi0299a8nvz45dSlFuYd00i,Regulatory Information,2019-02-12,2019-01923,Federal,"This notice announces that the Environmental Protection Agency (EPA) issued Federal operating permits to the Mille Lacs Band Corporate Commission for Grand Casino Mille Lacs. The source is in Onamia, Minnesota on lands held in trust for the Mille Lacs Band of Ojibwe Indians. The permits authorize a change in the testing requirements for oxides of nitrogen (NO<INF>X</INF>) emissions from three existing diesel-fired internal combustion engines. These engines are used for peak load management as well as for backup power. NO<INF>x</INF> performance test requirements are increased in frequency from once in five years to once in three years.",Notice of Issuance of Grand Casino Mille Lacs PSD and Part 71 Permits,https://api.govinfo.gov/packages/FR-2019-02-12/granules/2019-01923/summary?api_key=
ENVIRONMENTAL PROTECTION AGENCY,USA,Federal Register,705860c271df230f4f73325c218021fd018a7910.txt,https://api.govinfo.gov/packages/FR-2019-02-12/granules/2019-02070/htm?api_key=stD22vRTT0I2MUAFJNi0299a8nvz45dSlFuYd00i,Regulatory Information,2019-02-12,2019-02070,Federal,The Environmental Protection Agency (EPA) is providing notice of the availability of data on emission allowance allocations to certain units under the Cross-State Air Pollution Rule (CSAPR) trading programs. EPA has completed final calculations for the second round of allocations of allowances from the CSAPR new unit set-asides (NUSAs) for the 2018 control periods and has posted spreadsheets containing the calculations on EPA's website. EPA has also completed calculations for allocations of the remaining 2018 NUSA allowances to existing units and has posted spreadsheets containing those calculations on EPA's website as well.,Allocations of Cross-State Air Pollution Rule Allowances From New Unit Set-Asides for 2018 Control Periods,https://api.govinfo.gov/packages/FR-2019-02-12/granules/2019-02070/summary?api_key=
DEPARTMENT OF ENERGY,USA,Federal Register,abdb0382da4a71b5eb8070e76792c2f0b6549ceb.txt,https://api.govinfo.gov/packages/FR-2019-02-12/granules/2019-02085/htm?api_key=stD22vRTT0I2MUAFJNi0299a8nvz45dSlFuYd00i,Regulatory Information,2019-02-12,2019-02085,Federal,,"Ochoco Irrigation District; Notice of Intent To File License Application, Filing of Pre-Application Document, Approving Use of the Traditional Licensing Process",https://api.govinfo.gov/packages/FR-2019-02-12/granules/2019-02085/summary?api_key=
DEPARTMENT OF COMMERCE,USA,Federal Register,46dc7aadea85d7ea806aa296988d39c2eb29d502.txt,https://api.govinfo.gov/packages/FR-2019-02-12/granules/2019-01929/htm?api_key=stD22vRTT0I2MUAFJNi0299a8nvz45dSlFuYd00i,Regulatory Information,2019-02-12,2019-01929,Federal,"NMFS finalizes specifications for the 2019 Mid-Atlantic blueline tilefish fishery north of the North Carolina/Virginia border and projects specifications for 2020 and 2021. This action is necessary to establish allowable harvest levels and other management measures to prevent overfishing while allowing optimum yield, consistent with the Magnuson-Stevens Fishery Conservation and Management Act and the Tilefish Fishery Management Plan. It is also intended to inform the public of these specifications for the 2019 fishing year and projected specifications for 2020-2021.",Fisheries of the Northeastern United States; Mid-Atlantic Blueline Tilefish Fishery; 2019 and Projected 2020-2021 Specifications,https://api.govinfo.gov/packages/FR-2019-02-12/granules/2019-01929/summary?api_key=
DEPARTMENT OF TRANSPORTATION,USA,Federal Register,16184706c9220bd084f329e1fdca254091c5eb8f.txt,https://api.govinfo.gov/packages/FR-2019-02-11/granules/2019-01808/htm?api_key=stD22vRTT0I2MUAFJNi0299a8nvz45dSlFuYd00i,Regulatory Information,2019-02-11,2019-01808,Federal,"This notice announces that FHWA has received and reviewed an application from the Arizona Department of Transportation (ADOT) requesting participation in the Surface Transportation Project Delivery Program (Program). This Program allows for FHWA to assign, and States to assume, responsibilities under the National Environmental Policy Act of 1969 (NEPA), and all or part of FHWA's responsibilities for environmental review, consultation, or other actions required under any Federal environmental law with respect to one or more Federal highway projects within the State. The FHWA has determined the application to be complete and developed a draft MOU with ADOT outlining how the State would implement the program with FHWA oversight. The FHWA invites the public to comment on ADOT's request, including its application and the proposed MOU, which includes the proposed assignments and assumptions of environmental review, consultation, and other activities.",Application From the State of Arizona to the Surface Transportation Project Delivery Program and Proposed Memorandum of Understanding (MOU) Assigning Environmental Responsibilities to the State,https://api.govinfo.gov/packages/FR-2019-02-11/granules/2019-01808/summary?api_key=
NATIONAL CAPITAL PLANNING COMMISSION,USA,Federal Register,92074d1e6805b5d51a55bc9147df47225f564905.txt,https://api.govinfo.gov/packages/FR-2019-02-11/granules/2019-01710/htm?api_key=stD22vRTT0I2MUAFJNi0299a8nvz45dSlFuYd00i,Regulatory Information,2019-02-11,2019-01710,Federal,"The National Capital Planning Commission (NCPC) and the Smithsonian Institution (Smithsonian) have entered into a Memorandum of Agreement (MOA) effective December 20, 2018. The MOA details the process the two agencies will follow to comply with the National Environmental Policy Act (NEPA) 42 U.S.C. 4371). NCPC has a NEPA obligation for projects submitted by the Smithsonian to NCPC for review and approval. The Smithsonian is not considered a federal agency for NEPA purposes and has no NEPA obligation. The MOA is required by NCPC's NEPA Regulations (1 CFR part 601) to establish a cooperative working relationship between the parties to ensure NCPC's compliance with NEPA. A copy of the MOA is online at NCPC's website at the following location: https:// www.ncpc.gov/docs/MOA_NCPC_Smithsonian_NEPA_December2018.pdf.",Notice of Memorandum of Agreement,https://api.govinfo.gov/packages/FR-2019-02-11/granules/2019-01710/summary?api_key=
