b6ffa9d_38	1	0.4925900009888542	Se prohíbe el pago de intereses al capital, la distribución de excedentes en dinero entre sus socios y la emisión de cuotas de participación liberadas en favor de éstos
d3123a5_283	2	0.4549757896706952	En los aspectos relativos a la declaración y pago del Impuesto a la Renta, el Concesionario se deberá regir por lo dispuesto en el D
06cbac6_115	3	0.43256252377680715	Asimismo, podrá suscribir un convenio con el Servicio de Impuestos Internos y con el Servicio de Tesorerías para efectos de la emisión y despacho de las boletas de cobro
1739c19_41	4	0.40867373159278675	Adquisición de acciones de primera emisión y/o mediante la adquisición de acciones o participaciones sociales, de terceros y/o la adquisición de opciones
67240be_182	5	0.406822411036024	La Sociedad Concesionaria y sus accionistas renuncian, asimismo, a cualquier pretensión o derecho respecto de dicha nueva licitación
aa75f37_45	6	0.40585708936705156	El monto de dichos depósitos podrá ser expresado en pesos o unidades de fomento y devengarán intereses en favor de INDAP, de acuerdo a las condiciones establecidas en el Contrato de Administración
e7508a5_64	7	0.404059513165019	Para tal efecto, los integrantes deberán autorizar a una empresa para que ejerza en su nombre todos los derechos y cumpla todas las obligaciones del consorcio frente a las autoridades tributarias y los respectivos contribuyentes, en virtud de la implementación y ejecución del sistema a que se refiere el presente reglamento, inclusive y sin limitación, para recibir instrucciones y percibir los pagos correspondientes
01e1622_45	8	0.39636097977098217	f) Las comisiones que perciba en virtud de los convenios que celebre con terceros, para el otorgamiento de beneficios y/o venta de bienes o servicios a los afiliados;
cfb8115_42	9	0.39414389022457785	a) celebrar un contrato de prestación de servicios por escrito entre operador y propietario o el cesionario de las bonificaciones, en el cual se detallarán las actividades a desarrollar y los derechos y obligaciones de ambas partes
e7508a5_123	10	0.3909500185941027	Los contribuyentes obligados mediante resolución del SII y el respectivo proveedor del sistema deberán suscribir un contrato marco de adhesión, establecido por dicho Servicio y podrán suscribir contratos especiales sujetos a aquel, previamente informados al Servicio de Impuestos Internos
fe9c066_117	11	0.3881608687337569	La planta lechera será la responsable de todas las obligaciones laborales, sociales, previsionales, tributarias y de aseguramiento de las personas o servicios que deba contratar para la ejecución del programa de trabajo
7cffd6b_62	12	0.387396405848799	i) Coordinar, entre las Proveedoras Donante y Receptora, la mensajería relacionada con la administración de saldos y con eventuales acuerdos de recaudación, pago y/o novación que existan entre ellas
c3a586c_48	13	0.38490619168307105	Ministerio de Bienes Nacionales: A fin de que informe si todo o parte de la solicitud de concesión recae en terrenos fiscales o si existe algún tipo de concesión, servidumbre, permiso de ocupación o arriendo otorgado por dicha repartición
c7baa1f_50	14	0.38399131564703526	La extracción de desechos domiciliarios y comerciales para que el que requiera de un tiempo adicional al previsto para cada sector o contribuyente, de acuerdo con el servicio ordinario
b9ec777_16	15	0.38394017429351956	Segmentación de beneficiarios titulares de concesiones de acuicultura o que ejerza algún derecho sobre la concesión que lo habilite para ejercer la actividad
c7255b0_839	16	0.38315704658092	Los porcentajes mencionados se aplicarán respecto del monto de subsidios que forman parte del contrato respectivo
b1855c7_135	17	0.3827648190836601	Todo contribuyente deberá disponer de los residuos en un contenedor con tapa y demarcado con su dirección y/o patente comercial
3434b51_451	18	0.3810547631854895	El Coordinador deberá asignar los mencionados descuentos entre los propietarios, arrendatarios, usufructuarios o quienes exploten a cualquier título de las restantes instalaciones del respectivo sistema y segmento de transmisión
0219260_80	19	0.37801772218659124	- Serán solidariamente responsables de la transgresión de la presente ordenanza y el pago de las multas, los dueños de los predios, los arrendatarios, los ocupantes a cualquier título de los mismos, los encargados de las respectivas obras y aquellos que hayan obtenido la concesión o permiso
630f624_15	20	0.3736196590144275	"Según la ley de Rentas Municipales en su Título IV ""De los Impuestos Municipales"" se establece que quedan gravados con tributación municipal ""El ejercicio de toda profesión, oficio, industria, comercio, arte o cualquier otra actividad lucrativa secundaria o terciaria"
74d057e_225	21	0.37266950500057083	Además en estas transacciones y/o avenimientos los intereses que se pacten por el período de la prórroga no podrán exceder de la tasa fijada en el mutuo respectivo
c7255b0_271	22	0.3704783128455884	Se entenderá que el deudor se encuentra al día en el servicio de su deuda cuando paga oportunamente sus dividendos y/o la cuota correspondiente del convenio de pago, si lo hubiere, en la fecha establecida para ello, no existiendo en consecuencia deuda en mora
f9cf338_48	23	0.3696299670659383	g) Organismo Subprogramado: Servicio, órgano de la administración del Estado u organismo sectorial con el cual la Superintendencia ha celebrado un convenio de encomendación de acciones o de colaboración de fiscalización, y al que le ha encomendado actividades de fiscalización por medio de un subprograma sectorial de fiscalización
c7255b0_262	24	0.3682381450110275	Además, en estas transacciones y/o avenimientos los intereses que se pacten por el período de la prórroga no podrán exceder de la tasa fijada en el mutuo respectivo
01e1622_110	25	0.3653883799304608	Los ingresos generados se destinarán al mantenimiento y funcionamiento de los inmuebles y se administrarán separados de los fondos que el Servicio de Bienestar destina al otorgamiento de beneficios a sus afiliados
c349ac5_23	26	0.3648231864019891	4) Durante el traslado del recurso Huiro negro (Lessonia berteroana) y/o sus productos derivados, los agentes comercializadores y/o elaboradores deberán portar el documento tributario de traslado, junto con las declaraciones de abastecimiento, producción y/o destino correspondiente
c7255b0_649	27	0.36481361635308684	e) Contratar las obras, incluyendo la supervisión del contrato con el objeto de que se lleve a efecto en todos sus términos, culminando con la entrega a los beneficiarios de las obras terminadas y recepcionadas por la DOM
2bb3805_319	28	0.36294945505801834	El monto a pagar podrá alcanzar hasta el 90% del contrato de fiscalización, descontados los pagos o anticipos ya efectuados
52ef3c0_141	29	0.35821723461316657	agorgojados, partidos o quebrados y chupados, empleando separación
4905fb9_12	30	0.35689151148947196	La importación, exportación, venta, tenencia destinada a la venta, oferta de venta y toda cesión, material en proceso de acondicionamiento, entrega o transmisión con fines de explotación comercial de semillas, a título oneroso o no, excluyéndose el material para investigación
0ab7396_98	31	0.35660105934898656	El SAG podrá instruir a los proveedores y/o distribuidores el retiro y/o remplazo de los DIIO anómalos que se encuentren en su cadena de distribución, sin perjuicio de las determinaciones que el Servicio pueda tomar respecto de estos DIIO
3a803a7_13	32	0.35585503832223275	"23 y siguientes, se establece que quedan gravados con tributación municipal ""El ejercicio de toda profesión, oficio, industria, comercio, arte o cualquier otra actividad lucrativa secundaria o terciaria"
e7508a5_71	33	0.3553949423336906	Las marcaciones serán producidas y entregadas o incorporadas, según corresponda, por el proveedor del sistema, tanto para productores, fabricantes, importadores, elaboradores, envasadores, distribuidores y comerciantes, debiendo cumplir con el formato y procedimiento definido por el Servicio de Impuestos Internos
c7255b0_822	34	0.354219164481701	Los porcentajes mencionados en el inciso precedente se aplicarán respecto del monto de subsidios que forman parte del contrato respectivo
67f07dc_20	35	0.35400016163300996	- La extracción de desechos domiciliarios, comerciales o industriales para la que se requiera de un tiempo adicional al previsto para cada sector o contribuyente, de acuerdo al servicio ordinario y,
e7508a5_18	36	0.3509196812064992	El Sistema de Trazabilidad Fiscal consiste en una plataforma integral que contendrá información respecto a la producción, fabricación, importación, elaboración, envasado, distribución, comercialización y aspectos de interés tributario, de bienes afectos al impuesto específico al tabaco, y operará a través de la colocación y activación de componentes físicos y tecnológicos de seguridad en cada producto
5571de3_172	37	0.3495972054971792	El Servicio Agrícola y Ganadero preparará el convenio que deberá celebrar cada adjudicado con el SAG, en el cual se especificarán las obligaciones y compromisos que asumen ambas partes
d3b3f42_504	38	0.34939883053027665	- Sin perjuicio de lo establecido en los Títulos I al IV del presente reglamento, las instalaciones que reciben a granel CL para su almacenamiento, mezcla y/o envasado, para su posterior consumo o distribución, deberán cumplir, además, con las disposiciones del presente Título
1739c19_33	39	0.3490848683817154	Empresas, Beneficiarios Finales e Instrumentos elegibles para efectuar los aportes de capital o las operaciones de crédito
f33fed1_101	40	0.3483686544762896	De la Adjudicación, del Contrato de Concesión y de los Derechos y Obligaciones del Concesionario
8dbb961_126	41	0.3481289671926895	- Al término de la presente concesión, cualquiera sea la causa que la produzca, las mejoras introducidas en el inmueble quedarán a beneficio del Fisco, sin derecho a indemnización ni cargo alguno para éste, excepto aquellas que puedan retirarse sin detrimento del inmueble fiscal
17e53e8_46	42	0.34793561109277826	g) Organismo Subprogramado: Órgano sectorial con el cual la Superintendencia ha celebrado un convenio de encomendación de acciones, y le ha encomendado actividades de fiscalización por medio de un subprograma sectorial de fiscalización
65f3814_44	43	0.3461346251892743	Noveno: Las Partes acuerdan solucionar toda cuestión o controversia relativa a la interpretación o ejecución del contrato, amigablemente y de común acuerdo
67240be_199	44	0.3454532964910345	- La Sociedad Concesionaria renuncia a toda acción o reclamación contra el Fisco de Chile y el Ministerio de Obras Públicas, que diga relación con el contrato de concesión terminado anticipadamente y de sus convenios complementarios y renuncia además a solicitar cualquier indemnización
efda249_37	45	0.3447755700451317	Además cada uno de los cursos de capacitación contempla la entrega de un aporte básico de colación y/o movilización, para cada asistente, el que será entregado de acuerdo a los términos convenidos con la respectiva empresa capacitadora, conforme al curso adjudicado
3fa42ac_51	46	0.34446273198218136	Etapa de Explotación y Beneficio: Durante esta etapa el contratista extraerá las sustancias de litio y procederá a su beneficio con apego a los términos que se establezcan en el contrato
74d057e_224	47	0.3427625744545266	Tratándose de transacciones extrajudiciales y/o de avenimientos o transacciones judiciales, las obligaciones pactadas en ellos deberán consistir solamente en la prórroga del plazo para el pago de la parte morosa de dicho mutuo, sin que esta prórroga constituya novación
7546484_20	48	0.3426308958744926	Dirección y rol del Servicio de Impuestos Internos del o los predios de que se extraen áridos
f7cbe02_30	49	0.3425194466040111	En el contrato de concesión podrá establecerse, de común acuerdo, que todas las mejoras quedarán a beneficio fiscal
c7255b0_281	50	0.3415956676868981	El procedimiento para la aplicación del beneficio contemplado en este artículo, se establecerá en convenios que se suscribirán entre el MINVU y las respectivas entidades financieras o sus cesionarias
3fa42ac_36	51	0.34007500807037483	La futura suscripción y aprobación del contrato es sin perjuicio de la obligación del contratista de dar cumplimiento al ordenamiento legal vigente, debiendo obtener todas las autorizaciones, concesiones y permisos necesarios para ejecutar las labores de exploración, explotación y beneficio de yacimientos de litio, tales como los permisos ambientales, sectoriales y otros que sean aplicables
4e83264_216	52	0.3391202676677161	Cuentas de pagos y reliquidaciones por concepto de peajes e ingresos tarifarios entre empresas transmisoras y generadoras;
2bb3805_416	53	0.33732850807799597	Participar, cuando corresponda y sea pertinente, de la coordinación con las EGR, constructoras o contratistas y fiscalizador técnico de obras, para reforzar el adecuado desarrollo de sus funciones en cada proyecto
3434b51_424	54	0.3363450929189826	el valor correspondiente a los derechos relacionados con el uso de suelo y los gastos e indemnizaciones pagadas para el establecimiento de las servidumbres voluntarias o forzosas, entre otros
042f3d7_12	55	0.33597445499673073	oferta de venta y toda cesión, entrega o transmisión con fines de
c3e1746_54	56	0.3335336532570472	Individualización de otras concesiones o de áreas de manejo de las que sea titular el postulante o en que participa como socio;
3434b51_518	57	0.3333878970391946	Sean socios o accionistas actuales o socios o accionistas que hayan poseído o controlado, directa o indirectamente, una proporción del capital de las Empresas Transmisoras a la fecha de la publicación de las Bases Preliminares o en cualquier momento dentro de los 12 meses anteriores a dicha fecha
1739c19_214	58	0.33312370644496636	Se incluirá en el porcentaje anteriormente indicado, la suma de cualquier otro gasto con cargo al Fondo, en beneficio de los accionistas, directores o ejecutivos de la Administradora, o las personas naturales o jurídicas relacionadas a cualquiera de ellos
96193f8_83	59	0.330663372126064	obtenida en cada caso y mediante divisiones sucesivas, utilizando el
d3123a5_282	60	0.32999040399614865	Los ingresos de explotación corresponderán a los percibidos por concepto de pagos del Subsidio Fijo a la Operación y los Pagos Variables a la Operación
418ca89_147	61	0.32879030657402164	erogaciones voluntarias y asignaciones que la empresa, los afiliados
ce638af_366	62	0.32851501670497063	- Podrán participar y obtener los beneficios otorgados por este Programa aquellas personas, tanto naturales como jurídicas, que sean propietarias, usufructuarias, arrendatarias, medieras o comodatarias de los suelos que propongan intervenir
e7414a8_678	63	0.32851501670497063	- Podrán participar y obtener los beneficios otorgados por este Programa aquellas personas, tanto naturales como jurídicas, que sean propietarias, usufructuarias, arrendatarias, medieras o comodatarias de los suelos que propongan intervenir
a8454aa_16	64	0.3280931938980185	6º Que las instalaciones del ducto de entrega de gas natural regasificado, así como sus obras complementarias y anexas, cruzarán obras y bienes nacionales de uso público y afectarán la propiedad fiscal, bajo tuición de la I
06cbac6_117	65	0.32682873438437055	No obstante, los usufructuarios, arrendatarios y, en general, los que ocupen la propiedad en virtud de un acto o contrato que no importe transferencia, no estarán obligados a pagar el derecho de aseo devengado con anterioridad al acto o contrato; efectuado el pago por el arrendatario, éste quedará autorizado para deducir la suma respectiva de los cánones de arrendamiento
d739811_10	66	0.32682873438437055	No obstante, los usufructuarios, arrendatarios y, en general, los que ocupen la propiedad en virtud de un acto o contrato que no importe transferencia, no estarán obligados a pagar el derecho de aseo devengado con anterioridad al acto o contrato; efectuado el pago por el arrendatario, éste quedará autorizado para deducir la suma respectiva de los cánones de arrendamiento
c7255b0_276	67	0.32664067782555106	En caso de atraso: en el pago de un dividendo o que se encuentre en mora, el deudor no obtendrá la subvención correspondiente a dicho dividendo, lo que no afectará a la que corresponda por los posteriores dividendos que pague oportunamente, siempre que al efectuar el pago de éstos se encuentre al día en el servicio de su deuda
f9cf338_127	68	0.3247235005332948	El ingreso al proyecto, actividad o fuente fiscalizada se debe realizar por los accesos habilitados o públicos, según corresponda
01e1622_119	69	0.3240953728335185	- Los afiliados activos o pasivos que renuncien a su pertenencia al Servicio de Bienestar, podrán reincorporarse por una sola vez, pagando cuota de incorporación y sujetos a la carencia de tres meses para el uso de todos los beneficios
fe9c066_119	70	0.3235985968552625	El SAG preparará el convenio que deberá celebrar cada adjudicado con el Servicio, en el cual se especificarán las obligaciones y compromisos que asumen ambas partes
e7508a5_128	71	0.32261536502440147	En caso que se acrediten acuerdos directos o indirectos, relativos al sistema en Chile, previos al proceso de contratación del proveedor del sistema, entre los contribuyentes obligados y la empresa proveedora del sistema, se aplicarán las normas legales que correspondan
3fa42ac_41	72	0.3225078489978124	El contrato estará compuesto de las siguientes fases: fase de exploración y prospección; fase de construcción y explotación; y fase de cierre de faenas
52ea45c_82	73	0.321859062375897	e) Respecto de instalaciones en que sean socios de quien efectuó la instalación y/o mantención o exista o hubiere existido durante los cinco años anteriores, a lo menos, alguna relación contractual y/o dependencia económica de algún tipo entre éstos, o tenga intereses comerciales en el proyecto específico o participación, de cualquier naturaleza, en el proyecto en cuestión
bd52956_115	74	0.321859062375897	e) Respecto de instalaciones en que sean socios de quien efectuó la instalación y/o mantención o exista o hubiere existido durante los cinco años anteriores, a lo menos, alguna relación contractual y/o dependencia económica de algún tipo entre éstos, o tenga intereses comerciales en el proyecto específico o participación, de cualquier naturaleza, en el proyecto en cuestión
15df6c5_178	75	0.3217583927291511	Los beneficios a que se refiere la letra a) podrán otorgarse, mediante bonificaciones o ayudas, sólo para actividades grupales o individuales en que se haya convocado y toda vez que los beneficios se otorgan a los afiliados
2bb3805_322	76	0.32142471318008414	En aquellos proyectos en que no proceda la post venta, el pago de este porcentaje se cursará contra el término de las obras y la recepción SERVIU y/o de la DOM, según corresponda
cf4bd92_55	77	0.32131852797340055	- Mutuo acuerdo entre el Municipio y el concesionario o extractor, cuando ocurran razones de interés público, calificadas por el Municipio
ce8afcd_14	78	0.32014228071915163	- El dueño, arrendatario, ocupante y/o regente del local comercial en que se encuentran la o las máquinas de juego de destreza, pagará un derecho municipal semestral de 1,5 Unidades Tributarias Mensuales UTM por máquina y su funcionamiento se encontrará autorizado, siempre que se cumplan las siguientes condiciones:
e7508a5_79	79	0.3199388956262321	Las marcaciones deben ser incorporadas e instaladas en cada producto y/o envase permitiendo la relación entre estas unidades -producto y envase- conforme se defina por resolución del Servicio de Impuestos Internos
2bb3805_99	80	0.31973344955974137	- A la Entidad de Gestión Rural y al contratista les estará prohibido formular cobro alguno a los postulantes y beneficiarios por la realización de los servicios, actividades, trámites y gestiones que se indican en la presente resolución
469698c_88	81	0.3190087203816525	Cualquier discrepancia con relación a esta disposición, entre el prestador y el interesado, a solicitud de cualquiera de las partes, resolverá la Superintendencia
12c0ba4_104	82	0.31863463575077944	Cuando se trate de bosques fiscales, el plan de manejo deberá ser suscrito por el concesionario o arrendatario del respectivo inmueble fiscal, quien será responsable del cumplimiento de las obligaciones contenidas en él
3fa42ac_84	83	0.3182306278929279	El pago específico estará compuesto por un pago trimestral, asociado a las ventas de productos de litio; y por un pago anual asociado a la utilidad operacional, entendiéndose ésta por todos los ingresos anuales del contratista provenientes de las ventas de productos de litio, menos el impuesto al valor agregado, y menos los costos y gastos operacionales necesarios para producir esos ingresos
4024b75_18	84	0.3178516187645488	La presentación oportuna de esta Declaración será requisito además para todos los usuarios que, estando obligados a efectuar esta Declaración, deseen optar a los beneficios, incentivos, aportes, bonificaciones, etc
e7508a5_73	85	0.3175868272492759	Una vez realizada la entrega, el contribuyente será el responsable del resguardo de las estampillas y deberá dar cuenta en caso de pérdida, robo o deterioro de las mismas
8a779e6_76	86	0.3173401260624673	h) Celebrar contratos de arrendamiento de inmuebles, comodatos, uso, servidumbres, y usufructo de bienes necesarios para las actividades del Comité
371e773_6	87	0.3172808239239697	a) De los impuestos a la renta y contribuciones territoriales que afecten a los bienes raíces de su propiedad
4861b11_28	88	0.3171930521110484	Empresa concesionaria o concesionario: entidad que goza de una o más concesiones para prestar el servicio público de distribución de gas de red o de transporte de gas de red, según corresponda
80f5263_12	89	0.3171272594758232	Mediante procesos participativos que involucran a los operadores turísticos y dueños de embarcaciones (
e7508a5_126	90	0.316772673064007	El contrato marco deberá contener la información necesaria para identificar a las partes, sus representantes, los volúmenes esperados, los puntos de marcación, instalación o incorporación, las garantías y mantenciones, los precios o costos de utilización del sistema de trazabilidad, como así también la información adicional que establezca el Servicio de Impuestos Internos mediante resolución
15df6c5_181	91	0.31638437493029226	Lo anterior será aplicable a los afiliados activos o jubilados
17e53e8_120	92	0.31619716839916245	El ingreso al proyecto o actividad fiscalizada se debe realizar por los accesos habilitados o públicos, según corresponda
60cd142_44	93	0.31613891123899507	del respectivo tramo, ajustados por los efectos de impuestos a la renta
a4ac0fd_50	94	0.31373904097629635	a) Con multa de 2 a 100 Unidades Tributarias Mensuales a quien encargue el traslado o depósito, siempre que cualquiera de ellos se haya ejecutado
6c3cb89_9	95	0.31275824445069333	Serán públicos la tarifa y sus antecedentes, de cálculo y recálculo particularmente los referidos al proceso de licitación y los contratos de adjudicación, en caso de encargarse a terceros el servicio, y deberán estar disponibles para su consulta en el Departamento de Aseo dependiente de la Dirección de Aseo, Ornato y Mantención
3fa42ac_32	96	0.312384132493857	El objeto del contrato será autorizar al contratista para realizar, llevar a cabo y desarrollar en forma exclusiva, toda clase de actividades y labores de exploración, sobre las sustancias de litio ubicadas en el área del contrato, definida en el artículo 3º del presente decreto, como operaciones de explotación y beneficio sobre las sustancias de litio ubicadas en el área que se defina como consecuencia de las labores desarrolladas por éste en la fase de exploración y prospección, a cambio de una retribución y sujeto a un pago específico, con excepción de aquellas zonas cubiertas por concesiones mineras constituidas conforme al Código de Minería de 1932
f0dbed2_47	97	0.3119791837861807	"Todos los beneficios y/o asignaciones descritas en el presente Reglamento y que otorgue el Bienestar serán entregados siempre y cuando sus recursos presupuestarios lo permitan (incluye bonos, asignaciones y préstamos)"""
1739c19_97	98	0.31172034016928807	Cada vez que el Fondo reparta dividendos a sus aportantes, deberá pagar simultáneamente a Corfo un monto equivalente al resultante de multiplicar la razón Deuda/Aportes al Fondo (de acuerdo al balance del Fondo sobre el cual se calcularon los dividendos a repartir) por el monto distribuido a los aportantes
dfe46c7_82	99	0.3100523341578969	Material de propagación: Todo órgano vegetal y sus partes (rizomas, tubérculos, esquejes, raíces, corte de hoja o de tallo, yemas, entre otros) que se utilizan en la producción y propagación de plantas, incluyendo plantines o plántulas
3fa42ac_57	100	0.310022016277936	Los administradores de contrato designados se reunirán al menos trimestralmente, para evaluar la marcha del contrato, así como las actividades y/o dificultades durante su ejecución
