ed1f15e_217	707	0.28404623197220635	El plan de emergencia mencionado en el MSGNL deberá contemplar una organización de excepción y procedimientos operativos normalizados, que permitan actuar en forma sistemática, minimizando las improvisaciones en el manejo de las eventuales emergencias que se puedan presentar
cfb8115_66	708	0.283953952336931	El sistema de evaluación de desempeño estará basado en criterios de calidad y estándares técnicos relacionados con la ejecución de las actividades bonificables y respecto de la participación de los operadores en las capacitaciones y/o talleres que se dicten por la Corporación sobre temáticas atingentes a su labor
cd20008_3946	709	0.28372947765761725	El uso y mantenimiento de los artefactos a gas deberán ser realizados de acuerdo a las disposiciones establecidas en el presente reglamento y a las instrucciones del fabricante
131f13b_7	710	0.2837054770336491	Que la situación de catástrofe decretada por el Supremo Gobierno hizo necesario complementar medidas para concurrir a favor de los damnificados, mediante préstamos o asistencia técnica, a través de un Decreto Supremo que reguló tales prestaciones
e7414a8_347	711	0.28363695812919176	agrícola del usuario e indique las recomendaciones que debe implementar
0984111_147	712	0.2835929900033717	Para determinar dichos metros cúbicos se considerará el proyecto presentado por el interesado y aprobado por el prestador en la forma que establece el Reglamento y las instrucciones dadas por la Superintendencia de Servicios Sanitarios
047b8c5_417	713	0.2835306307284202	Las dosis de fertilizantes serán definidas, atendiendo a lo indicado en las pautas técnicas que para este efecto defina el respectivo Director Regional, con opinión del CTR
e7bd831_20	714	0.28348238561207073	Que, resulta necesario elaborar un mecanismo técnico legislativo más depurado y consensuado del proyecto en cuestión, que permita recoger la opinión de todos los actores involucrados del sector, dadas las observaciones respecto al mismo
f443f15_68	715	0.2834660639908948	Cumplido un año de iniciada la ejecución de las actividades, el interesado deberá acreditar anualmente el grado de avance del plan respectivo, a través de un informe que señale las actividades ejecutadas y el cumplimiento de las medidas de protección, de acuerdo a las prescripciones técnicas contenidas en dicho plan, acompañado de la cartografía señalada en el artículo 14 letra i) de este reglamento que fuere presentada con antelación
12c0ba4_127	716	0.28343079401617155	Respecto de las personas jurídicas que deseen acogerse a un plan de manejo tipo, deberán acompañar los antecedentes exigidos respecto de éstas en el artículo 23 de este reglamento
d7726f7_28	717	0.28342915385971035	Para acreditar la experiencia deberá presentarse una declaración jurada indicando la institución, lugar y período en que el responsable técnico o el analista se ha desempeñado en metrología y calibración de equipos
ce638af_477	718	0.2833789250968626	- Una vez efectuadas las labores y prácticas comprometidas y para solicitar el pago, el beneficiario deberá suscribir una declaración jurada simple de término de labores, que acredite el cumplimiento de la correspondiente etapa o de la totalidad del Plan de Manejo, según sea el caso, lo que será objeto de fiscalización por el SAG o INDAP, según corresponda, mediante un sistema de muestreo selectivo
ce638af_475	719	0.28335418638868215	En todo caso, deberán establecerse por resolución los niveles mínimos técnicos de las actividades o prácticas, según corresponda
e7414a8_915	720	0.28335418638868215	En todo caso, deberán establecerse por resolución los niveles mínimos técnicos de las actividades o prácticas, según corresponda
cd20008_3852	721	0.2832028415932568	Para tal efecto dicha empresa deberá entregarles un Plan escrito, a los usuarios, administrador y/o Comité de Administración, con el detalle de tales actividades, que contenga, al menos, el nuevo tipo de gas a abastecer, el tipo de artefactos a convertir y la fecha estimada de ejecución
e1eb393_13	722	0.2831634460337745	Para la siguiente recarga, los vehículos deberán aprobar una revisión técnica, en alguna de las Plantas de Revisión Técnica autorizadas de conformidad a lo dispuesto en el decreto supremo Nº 156 de 1990, del Ministerio de Transportes y Telecomunicaciones
aa75f37_148	723	0.28315201737591045	La prestación será exclusivamente para pagar asistencia técnica y cuya principal orientación será apoyar el proceso del restablecimiento del sistema productivo dañado, total o parcialmente
4f11af6_37	724	0.2831238519143249	"La ejecución de los proyectos de consultoría señalados, será realizada por Consultoras inscritas en el Registro de Consultores de la Dirección General de Obras Públicas, en alguna de las categorías de la Especialidad ""Estudios del uso del agua y del suelo"""
fbed789_23	725	0.28311506919697005	Para autorizar proyectos a emplazarse parcial o totalmente en un área de riesgo definida en un instrumento de planificación territorial, se deberá acompañar a la respectiva solicitud de permiso de edificación un estudio fundado elaborado por un profesional especialista, aprobado por el organismo competente, conforme lo indica el artículo 2,1
ce638af_15	726	0.28306182831872007	Dicho Registro contendrá información acerca de la identificación del beneficiario, del predio y de la superficie incorporada al Programa y toda otra información que en su conjunto permita a la Subsecretaría efectuar el seguimiento, la fiscalización, la verificación del cumplimiento de las acciones y la recomendación de mejoras a este Programa
c7255b0_643	727	0.2830165028398818	Calificar el terreno a través de la evaluación de su factibilidad legal, técnica y económica para la ejecución del proyecto de habitabilidad
1585c05_31	728	0.2830089226027709	A solicitud del importador o de la Contraparte Técnica autorizada por él, se podrá autorizar que la injertación de su material sea realizada por personal propio, siempre y cuando se cumpla con las condiciones fitosanitarias y de resguardo definidas por el Servicio, y esta labor sea realizada en presencia de algún profesional de la ECA
14b1c87_328	729	0.2829540055025872	La adecuación y cumplimiento del Plan de Cierre estará referido tanto a los contenidos técnicos como a los aspectos económicos pertinentes incluidos en el Plan
40d9b39_7	730	0.2829540055025872	La adecuación y cumplimiento del Plan de Cierre estará referido tanto a los contenidos técnicos como a los aspectos económicos pertinentes incluidos en el Plan
2bb5cf1_9	731	0.2828507791699063	"""Para dichos efectos, las empresas distribuidoras deberán mantener a disposición del público la información técnica de sus instalaciones incluyendo los planos de sus redes de distribución, a fin de entregarla cada vez que les sea requerida por estos últimos, para el adecuado diseño, ejecución y conexión de las instalaciones eléctricas, a fin de evitar peligro para las personas o daño en las cosas"
2bb3805_49	732	0.28280783968625567	Este servicio es de responsabilidad del SERVIU, podrá ejecutarlo de forma directa a través de sus profesionales, o bien a través de personas naturales o jurídicas inscritas en el Registro de Consultores del MINVU, DS N° 135 (V
b110551_14	733	0.28267907777480494	Adjuntar a la Solicitud de Autorización los documentos necesarios que permitan acreditar su experiencia en las actividades que le interesa desarrollar, relativas a la certificación y realización de ensayos de productos eléctricos de alumbrado, dispuestos en los protocolos correspondientes
3cd6688_36	734	0.28258514399803913	Para acceder a la bonificación por actividades de recuperación de suelos degradados, el beneficiario deberá acreditar obras de recuperación de suelos en el área, por un monto igual o superior a los costos que indica la tabla anterior (excluyendo cuando corresponda el costo de la asesoría profesional), para lo cual se fijan los siguientes valores por tipo de obra, en pesos ($)
9795dfb_86	735	0.2825684910229662	Los interesados deberán postular a los concursos presentando una solicitud de bonificación acompañada de un proyecto de plan de manejo de preservación, si se postula a las actividades bonificables señaladas en el artículo 2º de este reglamento, o un proyecto de plan de manejo forestal, en el caso de las actividades bonificables señaladas en los artículos 3º y 4º de este reglamento
f33e182_64	736	0.28241452774806175	Para instruir la ejecución de estas actividades, el Inspector Fiscal deberá calificar de manera fundada dicha situación, estableciendo las condiciones y plazos para su implementación y prestación
256a069_38	737	0.2824054479332144	- El Grupo Intersectorial estará encargado de asesorar el proceso de ejecución de las acciones definidas en la Estrategia de Implementación de la Agenda 2030, señalada en el literal d) del artículo 3º
d3b3f42_595	738	0.2823841958513482	- El operador de la instalación de distribución deberá contar con un empleado encargado de la carga de CL a un tanque o compartimiento en particular, de un camión-tanque, debidamente capacitado, el cual deberá velar por el cumplimiento de las medidas de seguridad y operacionales establecidas en el presente Reglamento
14b1c87_96	739	0.28237280326219705	El resumen ejecutivo deberá ser autosuficiente, estar redactado de manera comprensible para personas no expertas en materias técnicas, y en concordancia con los contenidos indicados en las secciones siguientes, no pudiendo exceder de 10 páginas tamaño oficio
8a779e6_43	740	0.2823092724694246	Se deja expresa constancia que los consejeros deberán dar estricto cumplimiento al principio de probidad en todas sus actuaciones y a las normas que lo regulan
5571de3_215	741	0.2822692796464945	Junto a lo anterior, el SAG a través del personal de la oficina sectorial que corresponda, supervisará la ejecución de los programas de trabajo adjudicados durante su realización
ce638af_379	742	0.28225753783549234	Sólo a aquellos que hayan sido aprobados positivamente, en cuanto a su pertinencia técnica, se les aplicará, un sistema de puntaje que definirá su orden de prioridad, determinado de conformidad a este Reglamento
3f5633c_40	743	0.282091339837681	Para acceder a la bonificación por actividades de recuperación de suelos degradados, el beneficiario deberá acreditar obras de recuperación de suelos en el área, por un monto igual o superior a los costos que indica la tabla anterior, (excluyendo cuando corresponda el costo de la asesoría profesional), para lo cual se fijan los siguientes valores por tipo de obra, en pesos ($)
6b555da_58	744	0.2820748243323936	Excepcionalmente, al momento de postular, los laboratorios podrán solicitar al Servicio operar únicamente con un responsable técnico, quien además asumirá las labores de analista, cuando se acompañen los antecedentes que lo justifiquen
2bb3805_330	745	0.28191251536286843	Cuando el servicio es ejecutado o contratado por una EGR externa, ésta deberá acreditar ante el SERVIU que el o los métodos utilizados, fueron recomendados por el profesional competente, la institución que lo ejecutó y el costo que tuvo el respectivo ensayo o medición
695f34c_92	746	0.28189131448594495	La Empresa Adjudicataria deberá otorgar libre acceso al personal encargado de la auditoría técnica y a la DP del CDEC-SIC, a las instalaciones del Proyecto y a los antecedentes que se requieran y consideren necesarios para el monitoreo, certificación y control del cumplimiento de las obligaciones establecidas en el presente decreto y las solicitadas en las Bases de Licitación y su proceso
fe29140_11	747	0.28184863952472117	g) Asistir técnicamente en la elaboración de planes de trabajo de los servicios para el fomento productivo de los pueblos indígenas, y
9795dfb_107	748	0.2817820662800061	En caso que el proyecto de plan de manejo seleccionado comprenda actividades bonificables que sean secuenciales o complementarias para una misma superficie, de otras previamente bonificadas y que se encuentren comprendidas en un plan de manejo aprobado, no se requerirá que el interesado presente un nuevo plan de manejo, bastando con que éste obtenga de la Corporación una certificación de la vigencia de dicho instrumento para la ejecución de las nuevas actividades bonificables
c7255b0_659	749	0.2817682461122679	Los pagos que el SERVIU deba efectuar por las actividades, trámites y gestiones que corresponda realizar con motivo de la Asistencia Técnica, Jurídica y Social, los derechos y obligaciones de las partes, los hitos de pago y las condiciones de contratación mínimas serán regulados por resolución del Ministro de Vivienda y Urbanismo, estando prohibido formular cobro alguno a los postulantes por las referidas actividades, trámites y gestiones
83fb209_8	750	0.281760641391378	Que, el establecimiento de ruteos de llegada y salida para las empresas que operan o circulen por la comuna de Lanco, permitirá optimizar la operatividad vial y las condiciones de tránsito en la mencionada comuna,
80f5263_88	751	0.28173409237378433	Se deberá adjuntar a la solicitud un Plan de manejo de riesgos y de emergencia para las actividades o programas ofrecidos, de acuerdo a lo establecido por Sernatur
ea67edc_45	752	0.28164732615227217	En los casos de incorporar recintos complementarios al destino de la vivienda, se deberá considerar lo que determine la OGUC, y en aquellos recintos no definidos en esta, los requerimientos técnicos y su aprobación, los determinará el Serviu respectivo, sobre la base de antecedentes técnicos, fundamentados y detallados
74d057e_309	753	0.28154681150752214	Tratándose de esta postulación, deberá acreditarse mediante informe técnico emitido por una entidad técnica validada por el Ministerio de Vivienda y Urbanismo, que las partidas que componen el proyecto de mejoramiento, son las necesarias para que, una vez ejecutadas, la vivienda a la cual se aplicará este beneficio obtenga la recepción municipal definitiva
3b813b0_18	754	0.2815087203170308	No obstante, previo informe favorable del Departamento de Asesoría Urbana y de la Dirección de Obras, se podrá autorizar la instalación de mesas cuando el propietario se comprometa a solventar las obras de habilitación de pavimentos a través del Fondo para Terceros, conforme a presupuesto del Departamento de Construcción dependiente de la Dirección de Obras Municipales
7584465_18	755	0.2815087203170308	No obstante, previo informe favorable del Departamento de Asesoría Urbana y de la Dirección de Obras, se podrá autorizar la instalación de mesas cuando el propietario se comprometa a solventar las obras de habilitación de pavimentos a través del Fondo para Terceros, conforme a presupuesto del Departamento de Construcción dependiente de la Dirección de Obras Municipales
93f3cbb_254	756	0.2814794221615716	Quienes renuncien al incentivo de un programa específico tendrán derecho a postular el mismo plan de manejo, con los ajustes técnicos indispensables, en un concurso del mismo programa específico que se efectúe en el año calendario inmediatamente siguiente al de la renuncia, siempre que ésta se fundamente en alguna de las siguientes causales:
14b1c87_212	757	0.2811244604552938	Sin perjuicio de lo señalado precedentemente, el Servicio podrá dictar guías metodológicas con el objeto de facilitar la evaluación y selección de medidas de cierre apropiadas por tipo de instalación
0d24286_21	758	0.28099639347416927	Desde su puesta en funcionamiento existe una cuadrilla específica de trabajadores dedicados a su mantención, un plan de mantenimiento y un plan de acción frente a distintos riesgos;
c4f27ad_56	759	0.28094860840769775	- El Consejo elaborará un plan de trabajo en el que se indicarán las acciones y objetivos prioritarios para los fines indicados en el Artículo 2º del presente decreto
c7255b0_664	760	0.28079172576139033	El monto máximo disponible para la contratación de las obras corresponderá al señalado en la aprobación del Proyecto, el que considerará el ahorro de los postulantes, los aportes adicionales en caso que existiesen, el crédito habitacional si corresponde y los subsidios que le sean aplicables al proyecto, teniendo como referencia los montos según tipología y/o clase de proyecto establecidos en los artículos 9 y 10 del presente reglamento, y la facultad conferida al Director del SERVIU para la aprobación de dicho proyecto en el inciso final de la letra a) del artículo 10, en los casos que corresponda
2799ee4_17	761	0.28076175009521787	Se prohíbe la permanencia de personas ajenas a las empresas que participan del uso del Terminal y que no acrediten la realización de una actividad debidamente autorizada por la autoridad competente
cd875ca_306	762	0.28067443160938665	A solicitud del beneficiario el SERVIU podrá autorizar el giro anticipado de los fondos acreditados como ahorro, incluidos sus reajustes y/o intereses, siempre que se verifique por el SERVIU, o se acredite por el Inspector Técnico de Obras, en su caso, avance de obras por un monto a lo menos equivalente al del giro respectivo, pudiendo autorizarse sólo un giro sin cargo para el beneficiario
6cef0d1_22	763	0.2806001390205294	Efectuada la evaluación y definidos los proyectos que se proponga financiar, éstos serán presentados al Consejo Consultivo del Bosque Nativo, para que ese Consejo formule sus observaciones
8e90d67_111	764	0.280473132281023	Será de responsabilidad del Importador, a través de la Contraparte Técnica, que el personal respete los protocolos y mantenga las condiciones de resguardo del material cuarentenado, durante todo el período de cuarentena
2bb3805_201	765	0.2804104419813189	Estos mismos porcentajes se mantendrán también para valorizar cada una de las áreas o actividades de la asistencia técnica
ce638af_26	766	0.2800831056537584	Especialidad: práctica o grupo de prácticas sobre las cuales un operador rinde satisfactoriamente una prueba de suficiencia que lo faculta para inscribirse en el Registro correspondiente
71753b7_6	767	0.279994252649733	Artículo primero: Fíjase la siguiente Tabla de Costos que establece, para el año 2017, los valores de las actividades que se bonificarán en el marco del Sistema de Incentivos para la Sustentabilidad Agroambiental de los Suelos Agropecuarios, las especificaciones técnicas generales y los niveles mínimos técnicos de aquellas prácticas que correspondan:
e7414a8_370	768	0.2798552730584728	certificado en el Informe Técnico por el operador, en cuyo caso
bdb5680_15	769	0.2797944534168695	Que de acuerdo a los requisitos y procedimientos contenidos en el referido Manual de Evaluación y Selección, se ha conformado una nómina de beneficiarios, de acuerdo a lo establecido en el artículo 10 del referido manual
ed1f15e_242	770	0.2797593705798973	Planos de construcción ('As built'); Memoria Descriptiva definitiva y Especificaciones Técnicas, y un certificado de conformidad emitido por un Organismo de Certificación, respecto de los aspectos de diseño y construcción referidos en el presente Reglamento, para su inscripción según los procedimientos que la Superintendencia establezca para tal efecto
ce638af_571	771	0.2797011485562091	Las características, especificaciones técnicas y costos de las prácticas señaladas y de sus variantes, según el uso y costumbre de cada Región, serán definidas en la Tabla Anual de Costos
ce638af_581	772	0.2797011485562091	Las características, especificaciones técnicas y costos de las prácticas señaladas y de sus variantes, según el uso y costumbre de cada Región, serán definidas en la Tabla Anual de Costos
e7414a8_924	773	0.2797011485562091	Las características, especificaciones técnicas y costos de las prácticas señaladas y de sus variantes, según el uso y costumbre de cada región, serán definidas en la Tabla Anual de Costos
ce2756d_13	774	0.279497787446336	Que, en consideración a lo anterior, tanto las empresas distribuidoras como los pequeños medios de generación distribuidos están sometidos a las condiciones técnicas de conexión y operación aplicables en el país, en ejecución de lo dispuesto en la ley y en el DS N°244, de 2007
ce638af_503	775	0.2794370138007307	Para ello, se deberá acordar con DIPRES los instrumentos que permitan recoger la información relevante, tales como formularios de postulación, formatos de planes de manejo, pautas de evaluación y seguimiento, entre otros
e7414a8_946	776	0.2794370138007307	Para ello, se deberá acordar con DIPRES los instrumentos que permitan recoger la información relevante, tales como formularios de postulación, formatos de planes de manejo, pautas de evaluación y seguimiento, entre otros
442e009_34	777	0.27936962032799484	Si la Corporación constatase diferencias entre lo estipulado en el proyecto de plan de manejo y el plan de manejo, excepcionalmente, podrá aprobarlo, en el caso de que el interesado las justificare a través de motivos fundados
0e2a9e9_38	778	0.27934497272833525	- Asimismo, encomiéndase a la Secretaría Comunal de Planificación, velar por el fiel cumplimiento de lo dispuesto en el presente instrumento y continuar con la tramitación total del proceso, de acuerdo a lo indicado en la parte expositiva del presente decreto
618ae2e_15	779	0.27934497272833525	- Asimismo, encomiéndase a la Secretaría Comunal de Planificación, velar por el fiel cumplimiento de lo dispuesto en el presente instrumento y continuar con la tramitación total del proceso, de acuerdo a lo indicado en la parte expositiva del presente decreto
a33f788_38	780	0.27932254136960455	- El procedimiento para solicitar la autorización para ejecutar las instalaciones de transmisión señaladas en el artículo 3º de la presente resolución, se iniciará con la presentación al Coordinador, con copia a la Comisión, por parte del Solicitante, de un informe fundado que justifique la necesidad y urgencia de la obra y su exclusión del proceso de planificación, a fin de que dicho informe sea aprobado por el Coordinador
2bb3805_415	781	0.27931870269662984	Participar del proceso de calificación a las EGR y los servicios de asistencia técnica prestados
552b85f_25	782	0.27925802370721386	El personal que realizará las funciones de inspección y ensayos de Estanques de Almacenamiento de GNL es competente, y los equipos a utilizar son los adecuados
2bb3805_41	783	0.2791480129389703	Este diagnóstico, como servicio de asistencia técnica, se realizará, evaluará, aprobará y pagará sólo una vez, siempre que a juicio del SERVIU, se encuentre vinculado al proyecto de habitabilidad correspondiente, teniendo una validez no superior a dos años
e7414a8_693	784	0.2791469246459485	Sólo a aquellos que hayan sido aprobados positivamente, en cuanto a su pertinencia técnica, se les aplicará un sistema de puntaje que definirá su orden de prioridad, determinado de conformidad a este Reglamento
ce638af_478	785	0.27913910952322274	No obstante, será responsabilidad del beneficiario el conservar y mantener boletas, facturas, recibos o documentos originales que permitan acreditar los volúmenes y/o cantidades de insumos y servicios que ha debido adquirir de terceros para la correcta ejecución de las labores especificadas en el correspondiente Plan de Manejo
12c0ba4_47	786	0.27898674258969125	El plan de manejo o plan de trabajo deberá contemplar una calendarización de las actividades y deberá señalar los criterios de marcación de los individuos, los que se utilizarán para orientar en terreno las actividades de corta, destrucción o descepado
a155bdf_33	787	0.2789744589479184	- Conocer de las reconsideraciones que se soliciten de las Actas de Recepción Técnica de Obras que denieguen la recepción técnica y de las resoluciones que declaren el abandono del proyecto (artículo 25, inciso final del Reglamento), informando a quien corresponda, de la resolución que en definitiva se adopte
e7414a8_158	788	0.2788845246227908	En las prácticas que técnicamente deban desarrollarse por un período superior a un año, aprobadas por INDAP y SAG, y que requieran la presentación de análisis de suelos, éste se solicitará sólo la primera vez, considerándose para las etapas siguientes el valor que se esperaba alcanzar en el Plan de Manejo de la etapa anterior
1edabde_24	789	0.27884790747218546	De esta manera, los asistentes podrán conocer los canales de participación, interactuar con personal calificado para aclarar dudas y recibir información sobre los alcances de las Normas
2bb3805_161	790	0.27881292132576885	Asimismo, respecto a la experiencia o inscripción en los Registros que deberá acreditar el fiscalizador técnico de obras, éste deberá cumplir con la exigencia impuesta por el régimen de fiscalización de obras más riguroso asociado a alguna de las tipologías del proyecto
a747fa1_24	791	0.2787855156415311	La persona certificada en conformidad con el artículo 3° del presente decreto, previo al inicio de la cosecha correspondiente, deberá presentar un plan de cosecha ante el Servicio Agrícola y Ganadero
c3e1746_83	792	0.27870786752214816	Coherencia entre las actividades descritas y los resultados planteados en la propuesta técnica del proyecto;
5058cc5_285	793	0.2785877568604407	Los puntajes mínimos para seleccionar los planes de manejo en cada uno de los concursos serán fijados por el Director Regional del SAG, a proposición del respectivo Comité Técnico Regional
3434b51_480	794	0.2785862448076529	Los antecedentes legales, financieros, tributarios, laborales y técnicos que deben presentar los consultores;
