ecf5ff3_113	1	0.5793146442796185	En las zonas abastecidas por sistemas de producción
ecf5ff3_134	2	0.5793146442796185	En las zonas abastecidas por sistemas de producción
e7414a8_548	3	0.5286422253229169	Que la bonificación será utilizada con fines productivos tratándose
eab951b_78	4	0.49937019358167767	Aportes de financiamiento reembolsables por capacidad de producción de
aa8d473_39	5	0.4922531087256654	Sistema Red de Centros Poblados de Interés Patrimonial-Productivo
eab951b_65	6	0.4772582603967668	Aportes de financiamiento reembolsables por capacidad de producción
e7414a8_49	7	0.42518096389315163	a fin de que éstos mantengan su capacidad productiva sin sufrir
aa8d473_83	8	0.42064674780711075	Sistema Red Quebrada de Ticnamar, para promover su carácter patrimonial productivo a favor del desarrollo del territorio interior de la región
bb63cef_20	9	0.42020953017600426	a) Centros de cultivo con sistemas de producción extensivos de fondo y,
12a91a7_153	10	0.4053815685986616	"- Sustitúyese la expresión ""Programa de"" por la frase ""Sistema de Incentivos para la"""
dfe46c7_538	11	0.4021196945411356	Se debe establecer un sistema que asegure la trazabilidad del producto, desde su inicio y hasta el producto final;
eab951b_81	12	0.40024234916229373	En caso que los sistemas de producción incorporen la fluoruración del agua potable
a577c52_29	13	0.3990619626973877	El desagüe debe contar con sistema de recuperación de sólidos
a577c52_33	14	0.3990619626973877	El desagüe debe contar con sistema de recuperación de sólidos
dfe46c7_153	15	0.39702031706977947	Sin embargo, excepcionalmente y durante un plazo de 3 años a partir del ingreso de la unidad productiva al Sistema, se permitirá la producción paralela
131f13b_47	16	0.39238103661212753	Demostrar una capacidad de pago suficiente para cumplir con éxito las obligaciones que emanen de la deuda
e7414a8_293	17	0.3912815866355912	La pauta para determinar el sistema de evaluación de desempeño
3434b51_785	18	0.38979264310053696	Las facturas emitidas por las Empresas de Transmisión para el cobro de la remuneración del Sistema de Transmisión tendrán mérito ejecutivo
15df6c5_175	19	0.38889991810413216	instalaciones que sean destinadas al uso de sus beneficiarios, quedando
e7414a8_352	20	0.38750546999746494	de sus respectivos deslindes, determinadas conforme al sistema de
c3e1746_86	21	0.38658765501319836	Incremento de la producción en relación al ingreso esperado justificado técnicamente
c3e1746_110	22	0.3856268171188917	Pago anticipado de la bonificación para el primer ciclo productivo y garantía
f30304d_12	23	0.38198216816451924	f) Favorecer la generación de sistemas de información y soporte de decisiones
d2f9b79_610	24	0.38137524340623874	"""a) Que el sistema de producción orgánica es válido y"
e7414a8_854	25	0.37916492675648106	acceso anterior, reiterado y sistemático a los incentivos que establece
3434b51_411	26	0.377177607280918	La tasa de descuento será la tasa de rentabilidad libre de riesgo más el premio por riesgo multiplicado por el valor del riesgo sistemático
dfe46c7_37	27	0.37482740156076977	Agricultura convencional: Sistema de producción distinto al establecido en esta Norma
12a91a7_159	28	0.3732886556616013	- Focalizar, en mejor forma, los incentivos especiales a favor de los pequeños productores beneficiarios de INDAP
e7508a5_97	29	0.3721369996511217	La activación de la marcación en el caso del productor nacional, deberá efectuarse por parte de la empresa proveedora del sistema, mediante sistemas instalados en la misma línea de producción
dfe46c7_388	30	0.37153331896724673	El operador/a deberá garantizar la trazabilidad y el control diferenciado de ambos sistemas de producción
3434b51_130	31	0.3693271332092385	Inyectar la producción de centrales generadoras al Sistema Eléctrico Nacional
e7414a8_507	32	0.36532358693785416	determinadas conforme al sistema establecido por la Subsecretaría de
ea67edc_570	33	0.3650601343869392	Estos sistemas deberán contar con la aprobación del Serviu respectivo
aa8d473_120	34	0.36386658110375336	- Promover la concentración de equipamientos combinados con un sistema eficiente de accesibilidad de carácter local
656570b_80	35	0.36339182910029355	Incorporar un sistema de pediluvio activo para el ingreso, salida y tránsito de las personas
418ca89_62	36	0.3579889546028888	acreditadas, se podrá otorgar al afiliado un subsidio económico
aa8d473_109	37	0.35685098021643546	Estos ejes se proponen para mejorar la conectividad local, con fines de potenciar preferentemente encadenamientos productivos del sistema Red de centros poblados de interés patrimonial y productivo
52ef3c0_487	38	0.353444280966863	Debe existir un sistema ordenado de ingreso y almacenaje de las contramuestras;
5faa2a1_130	39	0.353444280966863	Debe existir un sistema ordenado de ingreso y almacenaje de las contramuestras;
d287606_52	40	0.353444280966863	Debe existir un sistema ordenado de ingreso y almacenaje de las contramuestras;
e7414a8_606	41	0.35229249859295186	una autorización del cedente para acogerse al beneficio que se establece
a8ac695_59	42	0.3521689229616586	i) Centros de cultivo de macroalgas con sistemas de producción de fondo, independiente del nivel de producción;
3434b51_654	43	0.35192728271846874	de las instalaciones de servicio público y pago por uso de los sistemas dedicados
fb4effe_67	44	0.35018461266240775	Una reducción en la calidad del recurso, genera efectos negativos sobre dichos ecosistemas
6f2b6cb_72	45	0.349684795977788	i) Centros de cultivo de macroalgas con sistemas de producción suspendidos, independiente del nivel de producción; y
eab951b_96	46	0.34907231275159456	el costo de capacidad del sistema de disposición CCT se incrementará en
eab951b_102	47	0.34907231275159456	el costo de capacidad del sistema de disposición CCT se incrementará en
12a91a7_160	48	0.3481172652240734	- Establecer una incompatibilidad de los funcionarios del SAG - INDAP y Ministerio de Agricultura para postular a los beneficios del Sistema
12a91a7_162	49	0.34767896620651395	- Excluir a las personas jurídicas que forman parte del sector público de los beneficios del Sistema
01e1622_44	50	0.34672417512395926	e) Los intereses que generen los préstamos que se otorgue a los afiliados;
dfe46c7_11	51	0.34571115591157475	Los crecientes niveles de deterioro de los ecosistemas determinan la necesidad de buscar alternativas de producción más amigables con el medio ambiente
5500459_189	52	0.3435058369256525	Presentar las especificaciones técnicas de fabricación del producto para su aprobación por la Superintendencia
a33f788_34	53	0.34216308268085305	c) Obras destinadas a prestar servicios complementarios al sistema
708ed9d_208	54	0.3408346921269798	Se dará por cumplida esta exigencia de acuerdo con un sistema de créditos que establecerá la Academia, el cual considerará:
e7414a8_870	55	0.34068958703097474	incentivos queden totalmente cubiertas con los fondos disponibles para el
e7414a8_599	56	0.3386094732370013	renuncia del mismo a los beneficios del Programa, para ese predio,
dfe46c7_102	57	0.33776887137849787	Producción animal extensiva: Sistema de producción animal, que permite satisfacer los requerimientos del ganado, piño u otro, a partir de los recursos de la misma unidad productiva, sin depender de fuentes externas
b9ec777_36	58	0.33769750808640464	b) No mantener obligaciones incumplidas con fondos del Estado por recursos entregados para fomento productivo
dfe46c7_124	59	0.3365615084661746	Sistema: Sistema Nacional de Certifi de Productos Orgánicos Agrícolas
cb01d51_14	60	0.334525619590869	a) Incompatibilidad de la bonificación renunciada con la de otro programa específico del sistema de la cual el renunciante sea también beneficiario
e7414a8_589	61	0.33435283395524285	mismo a los beneficios del Programa, para ese predio, respecto al
28477ef_26	62	0.3333544104493975	d) Con los intereses de los préstamos que otorga el Servicio de Bienestar a las personas afiliadas;
f39efc4_32	63	0.33158314939740174	El Sistema comprende la información remitida por los sujetos obligados, y la recopilada y generada por la Superintendencia
12bff34_40	64	0.3313950332557495	Asimismo, se deberá indicar la actividad productiva a la cual se destina su calor útil
cb1ceff_166	65	0.3308334409774065	g) Conducto o sistema de comunicación con las salas de subproductos
52a3a10_213	66	0.3284507803591584	Los interesados que hayan obtenido incentivos del sistema, sólo podrán postular nuevamente al beneficio por el mismo predio una vez que hayan cumplido totalmente el plan de manejo anteriormente aprobado
93f3cbb_271	67	0.3284507803591584	Los interesados que hayan obtenido incentivos del sistema, sólo podrán postular nuevamente al beneficio por el mismo predio una vez que hayan cumplido totalmente el plan de manejo anteriormente aprobado
ea67edc_239	68	0.3264063673721016	Sistemas constructivos con espesores distintos a los mínimos detallados, deberán ser autorizados por Serviu
15df6c5_67	69	0.32553171575810025	f) Los intereses de los préstamos que otorgue el Servicio a sus afiliados
d590ecf_6	70	0.32440575460768906	)) con el objetivo de poder garantizar el proceso de producción
fcefde2_209	71	0.324288543419999	En caso que los sistemas de producción incorporen la fluoruración del agua potable el costo de capacidad del sistema de producción se incrementará en 16,61 pesos por metro cúbico
7e10306_76	72	0.323526037503864	Procedimiento operativo para la utilización del sistema disuasivo de seguridad de entintado de billetes
9d97f9c_38	73	0.32301679824236107	a) Area de recepción de la fruta del lugar de producción, con sistema de doble puerta
eab951b_82	74	0.32225796785859306	el costo de capacidad del sistema de producción se incrementará en 445,10
ecf5ff3_247	75	0.3219625950603111	En caso que los sistemas de producción incorporen la fluoruración del agua potable el costo de capacidad del sistema de producción se incrementará en 5,67 pesos por metro cúbico
d2ba7b9_12	76	0.3208343645145215	La adopción de cualquier sistema deberá contar con la aprobación del Servicio de Salud
3434b51_194	77	0.3202352190909179	Impacto en los perfiles de tensión observados en el sistema, según lo establecido en el Artículo 32
bb63cef_27	78	0.3188894969079683	Centros de cultivo con sistemas de producción intensivo que se encuentren en sectores de fondos duros o semiduros y cuyas profundidades sean iguales o inferiores a 60 metros
96193f8_51	79	0.31830199386763947	profundidades, de modo de asegurar la representatividad del producto,
93f3cbb_139	80	0.31785243539785824	La autorización que para estos efectos otorgue el propietario, importará la renuncia del mismo a los beneficios del Sistema, para ese predio, respecto al concurso en el cual incide la autorización
eab951b_71	81	0.31777273826781327	Aportes de financiamiento reembolsables por capacidad de disposición
eab951b_91	82	0.31777273826781327	Aportes de financiamiento reembolsables por capacidad de disposición
8aa3262_11	83	0.3175220644992942	Sistema Escalonado de Mejora Continua (SEMC), en su Nivel Avanzado de Gestión
eab951b_84	84	0.31734498512037	Aportes de financiamiento reembolsables por capacidad de distribución de
75ffb09_29	85	0.317196081471379	d) Sistemas de desagüe adecuados para los objetivos previstos
74d057e_48	86	0.31451086793017824	c) Si habiendo resultado beneficiado, renunciare voluntariamente al subsidio
cd875ca_191	87	0.31451086793017824	c) Si habiendo resultado beneficiado, renunciare voluntariamente al subsidio
3d181ac_96	88	0.3137391134024937	El usuario pagará según las tarifas establecidas y la recaudación tendrá objeto mejorar el sistema
e7414a8_289	89	0.3134427952767467	d) Aceptar un sistema de evaluación de desempeño anual, basado en los
2b66493_6	90	0.3129166170765201	Para efecto del Sistema de Inscripción que se crea por esta resolución, se entenderá por:
e7548c2_108	91	0.3128756997413964	En caso que los sistemas de producción incorporen la fluoruración del agua potable, el costo de capacidad del sistema de producción se incrementará en 116,83 pesos por metro cúbico
e7414a8_515	92	0.31235554871555293	condición de pequeño productor agrícola y el régimen de tenencia de la
eab951b_69	93	0.3118034915318971	Aportes de financiamiento reembolsables por capacidad de recolección
eab951b_87	94	0.3118034915318971	Aportes de financiamiento reembolsables por capacidad de recolección
f84b563_47	95	0.3112864303129582	"""Los interesados que hayan obtenido incentivos del sistema, sólo podrán postular nuevamente al beneficio, respecto del mismo predio, una vez que hayan cumplido totalmente el plan de manejo anteriormente aprobado"
aa75f37_148	96	0.3110635946813075	La prestación será exclusivamente para pagar asistencia técnica y cuya principal orientación será apoyar el proceso del restablecimiento del sistema productivo dañado, total o parcialmente
418ca89_145	97	0.31009529494321453	f) Con los intereses que devenguen los préstamos en dinero;
a8ac695_62	98	0.3100030854993092	i) Centros de cultivo de macroalgas con sistemas de producción suspendidos, independiente del nivel de producción, sustrato y profundidad;
e7508a5_104	99	0.30983199523064553	Para esto deberán comprar al proveedor del sistema, las correspondientes marcaciones a través del sistema que se defina para tal efecto
e7508a5_111	100	0.30983199523064553	Para esto deberán comprar al proveedor del sistema, las correspondientes marcaciones a través del sistema que se defina para tal efecto
93f3cbb_23	101	0.3089345445946632	La fertilización necesaria para cubrir las pérdidas por la extracción de los cultivos y para obtener un rendimiento óptimo económico, será de cargo del productor
bb63cef_28	102	0.3074679275292155	Centros de cultivo que, independientemente del sistema de producción y de las producciones máximas proyectadas, se encuentren en sectores con profundidades superiores a 60 metros
3c9db32_134	103	0.3074325855972533	Facilidades necesarias para establecer y operar el Sistema Multiportador
e7414a8_860	104	0.3074078262331219	planes de manejo de predios que hayan obtenido el incentivo por más de
565565e_38	105	0.30721745554216917	Este sistema de mantención debe ser reconocido por el SAG
e7414a8_14	106	0.3053452116813957	le permite solicitar un monto de incentivo inferior al máximo posible de
a2e2301_13	107	0.3045352360544402	La adopción de cualquier sistema deberá contar con la aprobación del Servicio de Salud Iquique
8c43822_7	108	0.3045191221223731	412 establece un Sistema de Incentivos para la Sustentabilidad Agroambiental de los Suelos Agropecuarios
c970b46_18	109	0.3040066045207055	La adopción de cualquier sistema deberá contar con la aprobación del Servicio de Salud de Iquique
e7508a5_39	110	0.3037287374849993	El proveedor del sistema estará obligado a ajustar sus sistemas para estos efectos, previa notificación de resolución que haga este Servicio
0984111_135	111	0.30349392023107435	En caso que los sistemas de producción incorporen la fluoruración del agua potable el costo de capacidad del sistema de producción se incrementará en 20,97 pesos por metro cúbico
7d429ac_16	112	0.302625437929704	El Fondo operará una vez recepcionada por el afiliado la cuenta final del prestador de salud y una vez descontados los aportes económicos que debe realizar su sistema de salud particular
15df6c5_141	113	0.30231589726439256	automáticamente las deudas que tuviere pendiente con el Servicio por
fe9c066_112	114	0.3017927942222023	Obligaciones de los plantas Lecheras que adjudican fondos
cd20008_2717	115	0.301656744114963	Sistema de Reducción del Espacio Libre de Mampostería
92827d2_14	116	0.30132480191273214	Disponer de los equipos de forma tal que su distribución sea de acuerdo al flujo lógico de producción
244ed62_211	117	0.3012285001076347	En caso que los sistemas de producción incorporen la fluoruración del agua potable el costo de capacidad del sistema de producción se incrementará en 0,69 pesos por metro cúbico
dfe46c7_367	118	0.3011216314580385	Sólo se permite la cría de animales orgánicos en sistema extensivo
e7414a8_857	119	0.30093536716642055	los planes de manejo de predios que hayan obtenido incentivos desde una
fb9f67e_31	120	0.3008503302804908	En caso de existir más de un régimen tributario, se considerará aquel régimen que resulte más conveniente económicamente para la empresa eficiente
a577c52_19	121	0.30082348275864423	Canaletas en piso para recolección de líquidos, con sus respectivos sistemas de recuperación de sólidos
86f7862_67	122	0.3007549501559619	Para dar cumplimiento a lo señalado, el encargado SIAC deberá velar por el correcto funcionamiento del Sistema
586f4e7_230	123	0.30042814670013995	g) Concurrir, a solicitud de INDAP, a certificar sus competencias a través del sistema que el Instituto indique
1739c19_33	124	0.30038341497923604	Empresas, Beneficiarios Finales e Instrumentos elegibles para efectuar los aportes de capital o las operaciones de crédito
131f13b_10	125	0.29939543286861925	Ello hace imperativo reglamentar las condiciones en que se otorgarán tales beneficios
aa8d473_47	126	0.29813132109405815	Un tercer sistema compuesto por las entidades de Camarones, Esquina, Illapata, Parcohaylla, con potencialidad productiva que se desarrolla en torno a la quebrada de Camarones
7e10306_49	127	0.29734474106570496	Las entidades obligadas serán responsables del correcto funcionamiento del sistema de alarma a que hace referencia este artículo
91cea82_51	128	0.2971978861815645	Es de responsabilidad del importador informarse sobre la factibilidad de aplicación de tratamiento en el punto de ingreso habilitado para el producto
eab951b_67	129	0.2964850469976372	Aportes de financiamiento reembolsables por capacidad de distribución
75ffb09_55	130	0.2964688433306234	o) Sistemas o carros exclusivamente destinados a recibir los productos declarados no aptos para el consumo humano
37663ef_150	131	0.2964342497832111	c) Reglamento para el manejo de lodos generados en sistemas de tratamiento de efluentes de pisciculturas
b26e5ef_114	132	0.2964342497832111	c) Reglamento para el manejo de lodos generados en sistemas de tratamiento de efluentes de pisciculturas
cb1ceff_98	133	0.2952596254506312	m) Los sistemas de desagüe deberán contar con sifón y estar adecuados para los objetivos previstos
bb63cef_22	134	0.29523540142007487	a) Centros de cultivo con sistemas de producción extensivo suspendidos, cuyas producciones máximas proyectadas estén entre 301 y 750 toneladas por año y que se encuentren sobre fondos blandos iguales o inferiores de 60 metros y;
cbb7f1e_33	135	0.29499017052769905	El material procede de un programa de producción bajo
d524e1e_18	136	0.29499017052769905	El material procede de un programa de producción bajo
f1fe763_62	137	0.29424687885870515	En caso que los sistemas de producción incorporen la fluoruración del agua potable el costo de capacidad del sistema de producción se incrementará en 117,48 pesos por metro cúbico
aa75f37_121	138	0.29405985134479595	Condiciones para el otorgamiento de los créditos por las
fb9f67e_43	139	0.29356457009871373	De la Calificación de las Instalaciones de los Sistemas de Transmisión
85681fe_91	140	0.2924191717046992	d) Reglamento para el manejo de lodos generados en sistemas de tratamiento de efluentes de pisciculturas
a8ac695_55	141	0.29229767016474195	En el caso de proyectos técnicos que involucren distintos sistemas de producción (extensivo e intensivo), el sector se clasificará en las categorías correspondientes a aquéllas
f39efc4_33	142	0.2921140917319518	La Superintendencia para efectos de conformar el Sistema deberá incorporar y sistematizar la información proporcionada por los sujetos obligados, como aquella generada y recopilada por ella, de acuerdo a lo dispuesto en el siguiente párrafo
1739c19_329	143	0.2907659262623232	- Acreditación de elegibilidad de beneficiarios finales, respecto a su calidad de pequeños
e7414a8_98	144	0.29061157148259975	producción agropecuaria respetuosos con el medio ambiente, las cuales
cb1ceff_185	145	0.2901100982572613	j) Sistemas o carros exclusivamente destinados a recibir los productos declarados no aptos para el consumo humano
c3d6c2f_13	146	0.2899454642880983	La adopción de cualquier sistema deberá ser aprobado por esta Seremi de Salud
cd20008_318	147	0.28993967509253393	Aquel en donde se fabrican o elaboran productos industriales
93f3cbb_167	148	0.28993438879821887	a) Aporte: Porcentaje del costo total de ejecución de las prácticas objeto de incentivos del Sistema que serán de cargo del interesado
bd2e63d_167	149	0.28976405013182094	Los envases de semillas destinadas a la exportación, deberán llevar las menciones contempladas en las reglas del sistema bajo el cual han sido producidas
3434b51_191	150	0.2896043996845272	Aumento significativo en los costos marginales del sistema respecto de un caso base;
cb1ceff_120	151	0.2895885760078155	Se podrán utilizar sistemas de estimulación eléctrica u otros que permitan optimizar el proceso de desangrado
e7508a5_22	152	0.28955795831400977	Sistema de gestión de la información: Sistema que recopila los datos generales de los fabricantes, de los productos, producción, fabricación, importación, elaboración, envasado, distribución, comercialización, del impuesto devengado y pagado, entre otros datos que sean de interés fiscal; información que posibilitará realizar gestiones de control preventivas y correctivas
58820aa_7	153	0.28796738115074827	Que la ley Nº 20,412 estableció un sistema de incentivos para la sustentabilidad agroambiental de los suelos agropecuarios
aa8d473_116	154	0.28794066747715097	El sistema de equipamientos considera un acceso equitativo y expedito a la red de equipamientos dispersos, soporte de actividades económicas
c697d79_11	155	0.28779642498126246	Establécese las exigencias al sistema de aseguramiento de calidad de los establecimientos en la cadena alimentaria
74d057e_228	156	0.2868693111752493	Los préstamos que se financien mediante la emisión de letras de crédito tendrán derecho a la obtención de subsidio implícito, aplicándose al efecto lo dispuesto en el artículo 21 del D
c7255b0_280	157	0.2859635836249348	El beneficio que regula este artículo, podrá ser impetrado por el deudor o su cónyuge, conforme a lo dispuesto en la ley Nº 20,340, siempre que el deudor cumpla con los requisitos para acceder a dicho beneficio
83fb6c7_8	158	0.2856901964422869	Que la Ley N° 20,412 establece un Sistema de Incentivos para la Sustentabilidad Agroambiental de los Suelos Agropecuarios
ce638af_4	159	0.2856901964422869	Que la Ley N° 20,412 establece un Sistema de Incentivos para la Sustentabilidad Agroambiental de los Suelos Agropecuarios
aa75f37_10	160	0.2855994464733461	Ello hace imperativo reglamentar las condiciones en que se otorgarán tales beneficios,
1d447d5_6	161	0.2855185354258243	Que muchas de las especies cumplen un importante rol ecológico en el sistema humedal, como especies beneficiosas para la actividad silvoagropecuaria y/o benéficas para la mantención del ecosistema
83388fc_12	162	0.2855185354258243	Que muchas de las especies cumplen un importante rol ecológico en el sistema humedal, como especies beneficiosas para la actividad silvoagropecuaria y/o benéficas para la mantención del ecosistema
b9c811f_12	163	0.28530760644701214	Actualízase el Sistema Nacional de Inscripción de establecimientos Exportadores de Productos de Origen Pecuario para Consumo Humano
52ef3c0_185	164	0.2852311582398288	del producto obtenido de la molienda realizada de acuerdo
3b5033a_19	165	0.2844578558857256	Su sistema constructivo fue concebido para poder resguardar una amplia zona de trabajo de la intemperie y para poder soportar cargas considerables, propias de las necesidades de las labores del taller mecánico
6f2b6cb_54	166	0.28426079949810323	En el caso de proyectos técnicos que involucren distintos sistemas de producción (extensivo e intensivo), el sector se clasificará en las categorías correspondientes a aquellas
047b8c5_37	167	0.28345584655321976	Esta práctica sólo considera la bonificación del valor del producto
047b8c5_40	168	0.28345584655321976	Esta práctica sólo considera la bonificación del valor del producto
71753b7_39	169	0.28345584655321976	Esta práctica sólo considera la bonificación del valor del producto
71753b7_45	170	0.28345584655321976	Esta práctica sólo considera la bonificación del valor del producto
7ba47f4_38	171	0.28345584655321976	Esta práctica sólo considera la bonificación del valor del producto
7ba47f4_42	172	0.28345584655321976	Esta práctica sólo considera la bonificación del valor del producto
83fb6c7_20	173	0.28345584655321976	Esta práctica sólo considera la bonificación del valor del producto
83fb6c7_23	174	0.28345584655321976	Esta práctica sólo considera la bonificación del valor del producto
8c2c48c_39	175	0.28345584655321976	Esta práctica sólo considera la bonificación del valor del producto
8c2c48c_43	176	0.28345584655321976	Esta práctica sólo considera la bonificación del valor del producto
bad8297_38	177	0.28345584655321976	Esta práctica sólo considera la bonificación del valor del producto
bad8297_42	178	0.28345584655321976	Esta práctica sólo considera la bonificación del valor del producto
c1487d7_37	179	0.28345584655321976	Esta práctica sólo considera la bonificación del valor del producto
c1487d7_41	180	0.28345584655321976	Esta práctica sólo considera la bonificación del valor del producto
