08645ac_23	248	0.3029122382622105	Puerto Habilitado Ingreso (PHI): punto habilitado para la importación de mercancías sujetas a revisión del Servicio Agrícola y Ganadero, autorizados por decreto del Ministerio de Agricultura
6c3cb89_91	249	0.30291222942605267	Artículo 30º: Quedarán exentos en forma automática del pago del derecho de aseo los usuarios cuya vivienda o unidad habitacional a la que se otorga el servicio se encuentre exenta del impuesto territorial
55970f8_15	250	0.3028018291698714	Contenido del programa de fiscalización ambiental para la aplicación del impuesto que grava las emisiones al aire de material particulado, óxidos de nitrógeno, dióxido de azufre y dióxido de carbono conforme a lo dispuesto en el artículo N° 8 de la ley 20,780
a747fa1_37	251	0.3027286427617728	Los intermediarios, exportadores, y comercializadores que envasen y/o distribuyan el musgo Sphagnum magellanicum para su venta al por mayor o al consumidor, deberán acreditar ante fiscalización del Servicio que el musgo que comercializan, exportan, o que se encuentre en su posesión, provenga de predios que cuenten con un plan de cosecha registrado en el Servicio
25e8965_17	252	0.3024292908407249	- Habilítanse los siguientes puertos a través de los cuales deberá efectuarse la importación de mercancías cuya revisión es de competencia del Servicio Agrícola y Ganadero:
2799ee4_99	253	0.3019530808463946	Toda la información que la Administración del Terminal o sus dependientes reciba de parte de las empresas de servicio de transporte de pasajeros tendrá el carácter de confidencial, sin que pueda ser entregada o transferida a terceras personas, con la sola excepción de la Dirección de Tránsito, el Ministerio de Transportes y Telecomunicaciones y los Inspectores Fiscales y Municipales para efectos de fiscalización y control
d3123a5_215	254	0.30192655044698635	3 Mantenimiento de Instalaciones y Equipamiento del Sistema de Transporte Vertical, de acuerdo a lo establecido en los artículos 2,6
630f624_31	255	0.3019225334660005	e) Planos de ubicación y emplazamiento de el o los predio(s) declarado(s) para la extracción indicando las curvas de nivel, delimitación del área que se utilizará para pozo lastrero, vías de acceso y salida de vehículos que transporten áridos, ubicación de maquinarias, construcciones, fajas de protección, caracterización vegetal del área (herbáceo, arbustivo, arbóreo), cursos de agua superficiales, pozos y norias de captación de aguas
f1ebd15_62	256	0.30159040050519526	"""La Corporación"" tendrá la obligación de llevar un registro permanentemente actualizado de los movimientos de los bienes muebles y variaciones físicas y valor monetario de los bienes corporales de uso incluidos en el inventario y deberá efectuar la restitución de las especies o bienes aludidos precedentemente, conforme al último inventario que ""el Ministerio"" hubiere autorizado"
e81f419_26	257	0.30152708546827056	- Establécese que para aquellos derechos de aprovechamientos de aguas subterráneas que no tengan obras de captación habilitadas, es decir, no cuenten con las instalaciones que hacen posible la efectiva extracción de aguas a que se tiene derecho, tales como: bombas de extracción, ya sea móviles o fijas, instalaciones mecánicas, eléctricas, tuberías, u otros, no les será obligatorio instalar un Sistema de Medición ni de Transmisión, hasta que habilite la obra
75ffb09_98	258	0.3013181479048431	"""Asimismo, le corresponderá a la autoridad sanitaria competente aprobar, mediante resoluciones de autorización, la instalación y funcionamiento de los mataderos, unidades de faena móvil, lugar de emplazamiento de unidades de faena móvil, faenamientos de autoconsumo, cámaras frigoríficas, establecimientos frigoríficos y plantas despostadoras"
c586e8a_32	259	0.3011726226452557	- Gasto de equipamiento del personal, tales como uniformes, guantes y herramientas de trabajo, así como gastos de equipamiento de las instalaciones destinadas a la operación del servicio
255f43a_13	260	0.3005950697129388	Que, el Director Regional de Arica y Parinacota del SAG, ha informado mediante circular Nº 3/2019 el detalle actualizado de los vehículos que se encuentran vigentes en la flota fiscal de la Región de Arica y Parinacota, para los que se requiere el permiso de circulación en horarios inhábiles y en días sábados, domingos y festivos
e7508a5_22	261	0.30055386525155525	Sistema de gestión de la información: Sistema que recopila los datos generales de los fabricantes, de los productos, producción, fabricación, importación, elaboración, envasado, distribución, comercialización, del impuesto devengado y pagado, entre otros datos que sean de interés fiscal; información que posibilitará realizar gestiones de control preventivas y correctivas
3a803a7_9	262	0.30052893714965945	La presente ordenanza tiene por objeto establecer un marco normativo respecto de los derechos y deberes vinculados con la protección del medio ambiente comunal, en relación con la extracción, procesamiento, comercialización y transporte de áridos en o desde pozos lastreros de propiedad particular y fiscal, con miras a contribuir a la debida protección de la calidad de vida de los ciudadanos, y a una correcta gestión ambiental en la comuna
e7508a5_8	263	0.3004927837371807	Por ello, resulta indispensable establecer un sistema de identificación, marcación y seguimiento a los productos del tabaco, fabricados a nivel nacional e importados, con el fin de reconocer aquellos bienes de origen lícito y que han cumplido con sus obligaciones tributarias, de aquellos que no lo son
c349ac5_41	264	0.30039629655570477	Quinto: Las personas que realicen actividades de transformación, almacenamiento, comercialización, importación o exportación respecto del recurso Huiro negro (Lessonia berteroana) y/o sus productos derivados, en el marco del Plan de Manejo de la Región Tarapacá y Antofagasta, deberán al término del período de veda, de conformidad a las facultades generales de fiscalización contenidas en la Ley General de Pesca y Acuicultura, presentar en la oficina de su jurisdicción, una Declaración Jurada ante notario de sus stock, a lo menos con 48 horas posteriores al término de la veda o de la solicitud del Servicio
565565e_64	265	0.3001109744404741	Disponer de maquinaria, terreno, insumos, equipos e instalaciones apropiadas para cumplir con todas las actividades asociadas con el proceso de certificación
565565e_179	266	0.3001109744404741	Disponer de maquinaria, terreno, insumos, equipos e instalaciones apropiadas para cumplir con todas las actividades asociadas con el proceso de certificación
42a028e_14	267	0.2999832348939152	Para la realización de todas las actividades anteriormente descritas, es necesario contar con la exención del uso del disco fiscal, tanto para la seguridad del vehículo como para los funcionarios y personal que traslada, ya que su uso en días y horas inhábiles, por tránsitos en general rurales lo puede hacer blanco de elementos antisociales que pueden canalizar su agresión sobre bienes del Estado
e7508a5_68	268	0.2997039878591048	Dicha marcación deberá permitir, visualmente o mediante elementos tecnológicos, como tinta termovirante, microtextos, tinta invisible, banda holográfica, hologramas o mecanismos semejantes, la comprobación de la validez del elemento distintivo y, a través de la utilización de dispositivos electrónicos genéricos o específicos, de manera remota o electrónica, tanto a consumidores como fiscalizadores, contar con información sobre el productor o importador así como también datos del origen del producto, impuesto pagado u otros que sean de interés fiscal o público que se definan por el Servicio de Impuestos Internos mediante resolución
c765fa4_48	269	0.29969692093984235	Téngase presente que para aquellos derechos de aprovechamientos de aguas subterráneas que no tengan obras de captación habilitadas, es decir, no cuenten con las instalaciones que hacen posible la efectiva extracción de aguas a que se tiene derecho, tales como: bombas de extracción, ya sea móviles o fijas, instalaciones mecánicas, eléctricas, tuberías, u otros, no les será obligatorio instalar un Sistema de medición ni de Transmisión, hasta que habilite la obra
039722d_15	270	0.2996564536929074	Contenido del programa de fiscalización ambiental para la aplicación del impuesto que grava las emisiones al aire de material particulado, óxidos de nitrógeno, dióxido de azufre y dióxido de carbono conforme a lo dispuesto en el artículo Nº 8 de la ley 20,780
49b8dde_33	271	0.29935111874356846	Téngase presente que para aquellos derechos de aprovechamientos de aguas subterráneas que no tengan obras de captación habilitadas, es decir, no cuenten con las instalaciones que hacen posible la efectiva extracción de aguas a que se tiene derecho, tales como: bombas de extracción, ya sea móviles o fijas, instalaciones mecánicas, eléctricas, tuberías, u otros, no le será obligatorio instalar un Sistema de Medición ni de Transmisión, hasta que habilite la obra
5d6b122_38	272	0.29935111874356846	Téngase presente que para aquellos derechos de aprovechamientos de aguas subterráneas que no tengan obras de captación habilitadas, es decir, no cuenten con las instalaciones que hacen posible la efectiva extracción de aguas a que se tiene derecho, tales como: bombas de extracción, ya sea móviles o fijas, instalaciones mecánicas, eléctricas, tuberías, u otros, no le será obligatorio instalar un Sistema de Medición ni de Transmisión, hasta que habilite la obra
76f84f4_35	273	0.29935111874356846	Téngase presente que para aquellos derechos de aprovechamientos de aguas subterráneas que no tengan obras de captación habilitadas, es decir, no cuenten con las instalaciones que hacen posible la efectiva extracción de aguas a que se tiene derecho, tales como: bombas de extracción, ya sea móviles o fijas, instalaciones mecánicas, eléctricas, tuberías, u otros, no le será obligatorio instalar un Sistema de Medición ni de Transmisión, hasta que habilite la obra
7fb8004_33	274	0.29935111874356846	Téngase presente que para aquellos derechos de aprovechamientos de aguas subterráneas que no tengan obras de captación habilitadas, es decir, no cuenten con las instalaciones que hacen posible la efectiva extracción de aguas a que se tiene derecho, tales como: bombas de extracción, ya sea móviles o fijas, instalaciones mecánicas, eléctricas, tuberías, u otros, no le será obligatorio instalar un Sistema de Medición ni de Transmisión, hasta que habilite la obra
9831195_56	275	0.29935111874356846	Téngase presente que para aquellos derechos de aprovechamientos de aguas subterráneas que no tengan obras de captación habilitadas, es decir, no cuenten con las instalaciones que hacen posible la efectiva extracción de aguas a que se tiene derecho, tales como: bombas de extracción, ya sea móviles o fijas, instalaciones mecánicas, eléctricas, tuberías, u otros, no le será obligatorio instalar un Sistema de Medición ni de Transmisión, hasta que habilite la obra
ab28122_37	276	0.29935111874356846	Téngase presente que para aquellos derechos de aprovechamientos de aguas subterráneas que no tengan obras de captación habilitadas, es decir, no cuenten con las instalaciones que hacen posible la efectiva extracción de aguas a que se tiene derecho, tales como: bombas de extracción, ya sea móviles o fijas, instalaciones mecánicas, eléctricas, tuberías, u otros, no le será obligatorio instalar un Sistema de Medición ni de Transmisión, hasta que habilite la obra
dde82aa_49	277	0.29935111874356846	Téngase presente que para aquellos derechos de aprovechamientos de aguas subterráneas que no tengan obras de captación habilitadas, es decir, no cuenten con las instalaciones que hacen posible la efectiva extracción de aguas a que se tiene derecho, tales como: bombas de extracción, ya sea móviles o fijas, instalaciones mecánicas, eléctricas, tuberías, u otros, no le será obligatorio instalar un Sistema de Medición ni de Transmisión, hasta que habilite la obra
ece24ea_62	278	0.29935111874356846	Téngase presente que para aquellos derechos de aprovechamientos de aguas subterráneas que no tengan obras de captación habilitadas, es decir, no cuenten con las instalaciones que hacen posible la efectiva extracción de aguas a que se tiene derecho, tales como: bombas de extracción, ya sea móviles o fijas, instalaciones mecánicas, eléctricas, tuberías, u otros, no le será obligatorio instalar un Sistema de Medición ni de Transmisión, hasta que habilite la obra
bf84235_25	279	0.29924205938200243	Asimismo, queda prohibida la circulación de vehículos de carga transportando leña, sin contar con la documentación respectiva (Conaf, SII), además, podrá exigírsele al conductor de todo vehículo que transporte leña, copia de la patente municipal del establecimiento al cual pertenece la leña
b56d07e_15	280	0.29922852395639277	3,4 Disponer de áreas con medidas de resguardo fitosanitario, conectadas a las cámaras de acopio, para el carguío y despacho de productos aprobados, como también con los medios mecánicos para el movimiento de los productos
d739811_39	281	0.29917627106471245	Artículo 16º: Quedarán exentos automáticamente del pago por el servicio de extracción usual y ordinario de residuos domiciliarios aquellos usuarios cuya vivienda o unidad habitacional a la que se otorga el servicio, tenga un avalúo fiscal igual o inferior a 225 unidades tributarias mensuales
d3b3f42_12	282	0.2991045255454463	Este reglamento no será aplicable a las instalaciones en campos de producción de petróleo, al suministro directo de aeronave ni al transporte marítimo de CL
7546484_12	283	0.2990328211976754	- La presente ordenanza tiene por objeto establecer un marco normativo respecto de los derechos y deberes vinculados con la protección del medio ambiente comunal, en relación con la extracción, procesamiento, comercialización, y transporte de áridos en o desde pozos lastreros de propiedad particular y fiscal, con miras a contribuir a la debida protección de la calidad de vida de los ciudadanos, y a una correcta gestión ambiental en la comuna
75f87e8_35	284	0.2988580222357906	Comprende los servicios de generación, transmisión y distribución eléctrica y al Centro de Despacho Económico de Carga, CDEC
e7508a5_19	285	0.298749577844007	El Sistema tiene como finalidad la identificación, marcación y seguimiento de los bienes gravados con el impuesto específico al tabaco y la conciliación de éste con los volúmenes transados
80f5263_63	286	0.2987277907306791	a) Contar con una embarcación autorizada por este Servicio para el traslado de buzos recreativos autónomos de conformidad al título primero del presente acto administrativo y que adicionalmente dicha embarcación se encuentre autorizada por la Autoridad Marítima para realizar la actividad de buceo recreativo autónomo y tener las dotaciones al día con su matrícula de patrón o de tripulante de nave menor
dfe46c7_30	287	0.29872557798048915	e) productos vegetales, pecuarios, apícolas, vinícolas y fúngicos procesados
844cd66_27	288	0.2985491657967062	Los fabricantes, importadores, exportadores, distribuidores, vendedores, almacenadores y tenedores, que por cualquier circunstancia, mantengan o hayan mantenido existencias de plaguicidas caducados, deberán declarar al Servicio Agrícola y Ganadero las existencias que mantienen, hayan mantenido o que hayan sido retiradas o eliminadas
8afae49_10	289	0.29836245300526754	Que debido a esta intercepción, el Servicio tomó medidas fitosanitarias tendientes a evitar el ingreso y dispersión de la plaga en el país, para efectos de su eliminación del material importado, lo que fue corroborado mediante actividades de fiscalización
3434b51_480	290	0.2980232418874569	Los antecedentes legales, financieros, tributarios, laborales y técnicos que deben presentar los consultores;
039722d_14	291	0.2980012156865177	Fija programa de fiscalización ambiental para la aplicación del impuesto que grava las emisiones al aire de material particulado, óxidos de nitrógeno, dióxido de azufre y dióxido de carbono conforme a lo dispuesto en el artículo Nº 8 de la ley 20,780
89055a1_9	292	0.2979424009161833	Los taxímetros que instalen los servicios de transporte de pasajeros en la modalidad de taxi turismo, deberán cumplir con las características fijadas en la resolución 46, de 1993, del Ministerio de Transportes y Telecomunicaciones y sus modificaciones, citada en el visto y a las condiciones establecidas en los artículos 79° y 80° del DS N° 212, de 1992, del Ministerio de Transportes y Telecomunicaciones
c70ae3a_48	293	0.29793776194924004	Téngase presente que, para aquellos derechos de aprovechamiento de aguas subterráneas que no dispongan de obras de captación habilitadas, es decir, no cuenten con las instalaciones que hacen posible la extracción efectiva de aguas a que se tiene derecho, tales como: bombas de extracción; móviles o fijas, instalaciones mecánicas, eléctricas, tuberías, u otras, no le será obligatorio instalar un Sistema de Medición ni de Transmisión, hasta que habilite la obra
fe9c066_117	294	0.29788761813327125	La planta lechera será la responsable de todas las obligaciones laborales, sociales, previsionales, tributarias y de aseguramiento de las personas o servicios que deba contratar para la ejecución del programa de trabajo
d7726f7_43	295	0.29702517942204376	"""La designación de los veedores por los productores de conformidad con lo establecido en el artículo 10 de la ley, se realizará por escrito en la guía de despacho, factura o cualquier otro documento similar que el Servicio de Impuestos Internos acepte para el transporte de carga, o mediante instrumento privado autorizado ante Notario Público u Oficial del Registro Civil en aquellas comunas en que no exista Notario Público"
a4ac0fd_51	296	0.2969626019394629	La misma sanción se aplicará al propietario del vehículo motorizado con el cual se realice el transporte, traslado o depósito, salvo que acredite que el vehículo fue tomado sin su conocimiento o sin su autorización expresa o tácita;
e7508a5_38	297	0.29674095258823174	Integrar o complementar el SITRAF (TAB) con otros mecanismos o sistemas de control del impuesto específico al tabaco, de acuerdo a las normas del Código Tributario o leyes especiales
8b2bfad_4	298	0.29646656350804335	Que, se han adoptado las medidas pertinentes para el embalaje, transporte y seguros de las piezas cuya salida se autoriza y que son de cargo de la Dirección de Bibliotecas, Archivos y Museos; y
b1855c7_54	299	0.2964600117906183	Número de predios exentos de contribuciones de bienes raíces, información que se obtendrá del rol de contribuciones que emite el Servicio de Impuestos Internos, del semestre anterior a la entrada en vigencia de la nueva tarifa
2bfbda9_11	300	0.2963445146771533	- La tarifa fijada por el presente decreto no incluye los impuestos correspondientes
d4157b2_7	301	0.29617446678391146	Autorízase la instalación de taxímetro para la prestación de servicios de transporte público de pasajeros en la modalidad de taxi turismo en la Región de Ñuble
35d6c99_37	302	0.29496758602043127	- Planos de ubicación y emplazamiento del predio indicando en este último las curvas de nivel, ubicación del área que se utilizarán para pozo lastrero, vías de acceso y salida de vehículos que transporten áridos, maquinarias, construcciones, arborización, fajas de protección y cualquier otro elemento solicitado por las autoridades competentes
72885ab_3	303	0.29477724546512996	1988, corresponde al Servicio Nacional de Aduanas determinar si la prestación de un servicio puede ser calificado como exportación, para efecto de la exención del Impuesto al Valor Agregado a los ingresos percibidos por dicha prestación
0f8f27c_12	304	0.29476445452583966	b) Efectuar la adquisición directa de bienes, servicios o equipamientos que sean necesarios para el manejo de la urgencia, quedando liberada de los procedimientos de licitación, sin perjuicio de su publicación posterior en el portal www
be85dc1_11	305	0.29476445452583966	b) Efectuar la adquisición directa de bienes, servicios o equipamientos que sean necesarios para el manejo de la urgencia, quedando liberada de los procedimientos de licitación, sin perjuicio de su publicación posterior en el portal www
bb30847_15	306	0.2945890219716001	Contenido del programa de fiscalización ambiental para la aplicación del impuesto que grava las emisiones al aire de material particulado, óxidos de nitrógeno, dióxido de azufre y dióxido de carbono conforme a lo dispuesto en el artículo 8 de la ley N° 20,780
7b3d458_10	307	0.29445046092295935	Que el Puerto de Angamos, en la Región de Antofagasta y el Aeropuerto de Mataveri, en la Región de Valparaíso, no se encuentran habilitados por dicho decreto, para la importación de carga atingente al Servicio Agrícola y Ganadero
2d89d00_15	308	0.2944470447921165	"Artículo 4º: Además de la concesión o permiso municipal, se deberá obtener la patente comercial cuando corresponda, según lo estipulado en la Ley de Rentas Municipales en su título IV ""De los Impuestos Municipales"" que establece que quedan gravados con tributación municipal: ""El ejercicio de toda profesión, oficio, industria, comercio, arte o cualquier otra actividad lucrativa secundaria o terciaria"
fc4d648_12	309	0.2944054679700603	"La Corporación, a través de sus plataformas de servicios compartidos y bajo las facultades determinadas para la propia operación interna, proporcionará al ""Comité de Minería No Metálica"", conforme a sus requerimientos, los servicios de contabilidad, tesorería, control presupuestario, Oficina de Partes, bienes de consumo e inventariables, servicios operacionales u otros, incluida la facultad de representar al Comité ante cualquier autoridad o servicio político o administrativo, especialmente ante el Banco Central, las Municipalidades, el Servicio de Impuestos Internos, la Tesorería, Aduanas, Institutos de Previsión, Isapres, Organismos e Inspecciones del Trabajo y, en general, ante toda clase de empresas, entidades y personas fiscales, semifiscales y otras, pudiendo al efecto elevar solicitudes, efectuar presentaciones o reclamos, celebrar y suscribir convenios y declaraciones, declarar, pagar o reclamar impuestos, patentes, giros e imposiciones, modificarlos o desistirse de ellos"
b7a401e_19	310	0.29400492855457716	Establécese que para aquellos derechos de aprovechamiento de aguas subterráneas que no tengan obras de captación habilitadas, es decir, no cuenten con las instalaciones que hacen posible la efectiva extracción de aguas a que se tiene derecho, tales como: bombas de extracción, ya sean móviles o fijas, instalaciones mecánicas, eléctricas, tuberías, u otros, no le será obligatorio instalar un Sistema de Medición ni de Transmisión, hasta que habilite la obra
f7d9b0b_2	311	0.2940040664925401	1° Que de acuerdo a lo establecido en el DFL Nº 1, de 1979, del Ministerio de Minería, y su modificación mediante la ley 20,999, en su artículo 2º se establece la obligatoriedad de la inscripción de las instalaciones, por parte de su propietario, que sirvan para producción, importación, refinación, transporte, distribución, almacenamiento, abastecimiento, regasificación o comercialicen biogás
ca327ce_113	312	0.2937770241657789	* Rol del Servicio de Impuestos Internos de la(s) propiedad(es) del proyecto y de la(s) propiedad(es) colindantes
386ceb7_29	313	0.29365715514504	- Las tarifas fijadas en el presente decreto no incluyen los impuestos correspondientes
1387115_33	314	0.2936529046634464	- Aplíquese la medida sanitaria de prohibición de extracción, recolección y captura, transporte, comercialización, elaboración, traslado, procesamiento y tenencia de todos los mariscos bivalvos, esto es, cholga, chorito, choro, almejas, ostras, huepo o navaja de mar, navajuela, ostión y otras especies como piure, picoroco y loco, además de algas como luche, cochayuyo y ulte provenientes de la totalidad del área geográfica definidas en numeral I a IV de la presente resolución
4d94c6b_27	315	0.2936529046634464	- Aplíquese la medida sanitaria de prohibición de extracción, recolección y captura, transporte, comercialización, elaboración, traslado, procesamiento y tenencia de todos los mariscos bivalvos, esto es, cholga, chorito, choro, almejas, ostras, huepo o navaja de mar, navajuela, ostión y otras especies como piure, picoroco y loco, además de algas como luche, cochayuyo y ulte provenientes de la totalidad del área geográfica definidas en numeral I a IV de la presente resolución
ceb44f1_23	316	0.2936529046634464	- Aplíquese la medida sanitaria de prohibición de extracción, recolección y captura, transporte, comercialización, elaboración, traslado, procesamiento y tenencia de todos los mariscos bivalvos, esto es, cholga, chorito, choro, almejas, ostras, huepo o navaja de mar, navajuela, ostión y otras especies como piure, picoroco y loco, además de algas como luche, cochayuyo y ulte provenientes de la totalidad del área geográfica definidas en numeral I a IV de la presente resolución
7546484_75	317	0.2933303557532534	Al igual que se deberá considerar la mantención de dichas vías o caminos públicos, para el libre y expedito tránsito de vehículos particulares o de organismos públicos de fiscalización
