93f3cbb_52	779	0.5651264967409565	Este informe técnico deberá justificar la labor propuesta y su pertinencia técnica respecto al logro de los objetivos del programa a desarrollar
f6e00c3_24	780	0.5651264967409565	Este informe técnico deberá justificar la labor propuesta y su pertinencia técnica respecto al logro de los objetivos del programa a desarrollar
ee4c230_11	781	0.564945998411654	Que de acuerdo a los resultados obtenidos en el proceso de postulación para acreditarse como Entidad de Certificación de Instalaciones Interiores de Gas, existe la necesidad de prorrogar los respectivos plazos, para la acreditación inicial y autorización de éstas,
39b57ed_12	782	0.564850219166342	Artículo segundo: Por razones de impostergable buen servicio, el presente decreto surtirá sus efectos a contar desde esta fecha, sin esperar su total tramitación, y será habilitante respecto del cargo que se subroga, para las personas que se indica
a6ba1c5_119	783	0.564779068687073	Esta póliza de garantía deberá mantenerse vigente desde la fecha de celebración de la compraventa y por todo el plazo de ejecución del proyecto, aprobado por Serviu, aumentado en seis meses
ae6dc4d_117	784	0.564779068687073	Esta póliza de garantía deberá mantenerse vigente desde la fecha de celebración de la compraventa y por todo el plazo de ejecución del proyecto, aprobado por Serviu, aumentado en seis meses
15df6c5_112	785	0.5646459522645199	los afiliados, que se encuentren cursando estudios regulares en los
5058cc5_262	786	0.5646266499685125	- Podrán establecerse puntajes adicionales, que deberán quedar consignados en las bases de los concursos de que se trate, a los planes de manejo de predios que se encuentren en casos tales como:
74d057e_300	787	0.5645464543909178	También se deberán ejecutar las construcciones o instalaciones para su adecuado uso en la vivienda, así como las obras que permitan que las viviendas objeto de estas acciones, cumplan con lo que señalan los artículos 6,3
dc32057_41	788	0.564327689104591	Trabajo en Equipo: Habilidad para colaborar, desarrollar y aportar a otros en el cumplimiento de objetivos y metas
3434b51_402	789	0.5643060557825688	Asimismo, deberá establecer un conjunto de vidas útiles estándares y representativas para instalaciones económicamente identificables, eficientemente mantenidas y operadas, de modo de prestar el servicio de transporte bajo los estándares establecidos en la normativa vigente
3a803a7_102	790	0.5642459098281893	En caso de una explotación más profunda se deberá adjuntar un proyecto de ingeniería para justificar la viabilidad de la explotación de material del proyecto a profundidades mayores a la establecida en esta ordenanza
630f624_69	791	0.5642459098281893	En caso de una explotación más profunda se deberá adjuntar un proyecto de ingeniería para justificar la viabilidad de la explotación de material del proyecto a profundidades mayores a la establecida en esta ordenanza
7546484_69	792	0.5642459098281893	En caso de una explotación más profunda se deberá adjuntar un proyecto de ingeniería para justificar la viabilidad de la explotación de material del proyecto a profundidades mayores a la establecida en esta ordenanza
93daad2_12	793	0.5641396950012016	e) El desarrollo de iniciativas complementarias a las indicadas, que permitan aportar antecedentes, información, difusión, conocimiento o recursos tendientes al cumplimiento del objetivo de la Ley
4e83264_30	794	0.5640734658910422	Que, se debe dar curso progresivo al proceso de fijación de las instalaciones que integran los sistemas de transmisión troncal, el área de influencia común, el valor anual de transmisión por tramo, la anualidad del valor de inversión del tramo y el costo anual de operación, mantenimiento y administración de las respectivas instalaciones
4df017a_8	795	0.5638719883975113	Que, esta autoridad debe en forma permanente reestudiar las disposiciones legales para perfeccionar y actualizar la Norma Específica de Certificación de Semillas de Remolacha Azucarera para, entre otros objetivos, armonizarla con las normas internacionales en la materia
92bfebc_17	796	0.5638092216995474	c) Evaluabilidad: Se considerarán las metas propuestas en relación a la asistencia de los alumnos beneficiarios y evaluación del logro de sus objetivos y el cumplimiento de las actividades que el proyecto se haya propuesto, indicando las formas, metodologías y/o instrumentos a través de los cuales éstas se monitorearán y evaluarán
8dbb961_122	797	0.5637889367706593	- La entidad concesionaria estará obligada a mantener y preservar en buenas condiciones el inmueble a su cargo, debiendo efectuar en casos necesarios y a su costa, todos los trabajos de reparación, conservación y ejecución de obras
4861b11_100	798	0.5637826984881921	La vida útil será medida en años y se podrá determinar para cada grupo de instalaciones de similares características
3297093_33	799	0.563760309265288	Las personas naturales y jurídicas que ejerzan las labores de instalación, mantención y certificación de ascensores, tanto verticales como inclinados o funiculares, montacargas y escaleras o rampas mecánicas, para inscribirse en este Registro deberán declarar la nómina del personal que realice directamente labores de instalación, mantención o certificación, en adelante el personal, y acreditar las competencias laborales de éstos de la siguiente manera:
8e90d67_108	800	0.5637365627213776	El Servicio autorizará la multiplicación para reponer el material inicialmente establecido y cualquier otro incremento solicitado será efectivo una vez que se complete la captación de muestras requeridas para la verificación fitosanitaria de todas las declaraciones adicionales establecidas para la especie
9795dfb_169	801	0.5637242680961837	Excepcionalmente, y por el período de dos años desde la publicación de la Ley N° 20,283, los proyectos de planes de manejo que se adjudiquen las bonificaciones a través de concursos, y cuyos interesados cuenten con planes de manejo de bosque nativo aprobados con anterioridad a la vigencia de la Ley, podrán adaptarlos a las nuevas normas y prescripciones técnicas actualmente vigentes de la Ley, siempre que consideren las mismas actividades por las que se adjudicó el concurso
556049f_8	802	0.5637091162993108	- Por razones de buen servicio, la referida subrogación se hará efectiva si las circunstancias lo requieren, sin esperar la total tramitación del presente decreto
5e37fc7_7	803	0.5637091162993108	- Por razones de buen servicio, la referida subrogación se hará efectiva si las circunstancias lo requieren, sin esperar la total tramitación del presente decreto
5f0e020_8	804	0.5637091162993108	- Por razones de buen servicio, la referida subrogación se hará efectiva si las circunstancias lo requieren, sin esperar la total tramitación del presente decreto
be067da_7	805	0.5637091162993108	- Por razones de buen servicio, la referida subrogación se hará efectiva si las circunstancias lo requieren, sin esperar la total tramitación del presente decreto
d93a069_5	806	0.5636978183828023	Que en cumplimiento de las nuevas directrices y estándares se ha requerido regular, conforme a éstas, el proceso de certificación varietal de semillas, específicamente en lo referido a la necesidad de establecer sistemas claros en la mantención y trazabilidad del material parental
91b657f_25	807	0.5636774802319086	De la revisión de los antecedentes ha podido verificarse el cumplimiento del programa de avance del estudio, en conformidad a Carta Gantt propuesta, habiéndose progresado principalmente en aspectos tales como: estudios urbanos, ambientales y diagnóstico, entre otros
5de4585_11	808	0.5635734550464625	El instrumento Fomento a la Calidad opera a través de diversas tipologías de intervención, cofinanciando a las empresas la incorporación y certificación de los siguientes sistemas o estándares de gestión:
8aa3262_13	809	0.5635734550464625	El instrumento Fomento a la Calidad opera a través de diversas tipologías de intervención, cofinanciando a las empresas la incorporación y certificación de los siguientes sistemas o estándares de gestión:
fb9f67e_173	810	0.5635318522455686	Identificadas las instalaciones islas, éstas cambiarán su calificación a aquella que presentan las instalaciones a las cuales se encuentra interconectada, de manera de asegurar la continuidad del respectivo conjunto de instalaciones adyacente
7cffd6b_126	811	0.5634992538693968	- El OAP deberá contar con la dotación profesional y técnica suficiente e idónea que permita entregar soporte técnico a las Proveedoras, para solucionar los problemas que se puedan presentar en la operación del sistema
5c270a3_13	812	0.5634139136241212	"La implementación práctica del proyecto denominado ""Plan de Gestión de Taxis Colectivos, Taxibuses y Buses, Urbanos y Rurales, de la Provincia de San Antonio"", será sometido a evaluaciones técnicas periódicas que permitan su mejor y más eficaz control a fin de efectuarse, si fuere pertinente, las correcciones que eventualmente resulten necesarias"
a33c8d5_8	813	0.5632595670291799	- Por razones de buen servicio, la referida subrogación se hará efectiva, si las circunstancias lo requieren, sin esperar la total tramitación del presente decreto
c3e1746_123	814	0.5631789058803423	De conformidad a lo dispuesto en el artículo 15 de la ley, la Subsecretaría llevará el Registro Certificadores, el cual tiene por objeto acreditar el cumplimiento de los requisitos técnicos que permitan velar por la calidad, confiabilidad e idoneidad de los certificadores en el ejercicio de sus funciones
55ecbc4_19	815	0.5630685674003759	Dicho reglamento contiene mejoras respecto del procedimiento anterior (establecido en el DS Nº 93 de 1995, del Ministerio Secretaría General de la Presidencia), entre las cuales destaca la necesidad de contar con un AGIES previo a la elaboración del anteproyecto
d8674f5_11	816	0.5630279275831058	Dicho documento contiene los requisitos que deben cumplir las personas jurídicas interesadas en ser autorizadas como entidades técnicas de fiscalización ambiental, para las actividades de muestreo, medición y/o análisis, en el componente Suelo; para la renovación de la autorización y para la ampliación de alcances por régimen normal, así como también, para el traspaso de las ETFA autorizadas bajo régimen provisorio al régimen normal, cuando corresponda
33c40e6_287	817	0.5629970339439843	Las bases de los concursos internos a que se refiere el inciso anterior, deberán considerar, a lo menos, los siguientes factores: evaluación de desempeño, experiencia calificada, aptitud para el cargo y antigüedad en el servicio
33c40e6_291	818	0.5629970339439843	Las bases de los concursos internos a que se refiere el inciso anterior, deberán considerar, a lo menos, los siguientes factores: evaluación de desempeño, experiencia calificada, aptitud para el cargo y antigüedad en el servicio
bd52956_88	819	0.5629639126309491	En caso de modificaciones de capital, deberá acompañarse un nuevo certificado que cumpla con lo señalado en este inciso
3434b51_382	820	0.5629571501406592	Sin perjuicio de lo anterior, durante el periodo que medie entre su calificación y el siguiente proceso de valorización de la transmisión, la Comisión valorizará dichas obras sobre la base y metodología contenidas en el informe técnico definitivo relativo al Decreto de Valorización, que se encuentre vigente al momento de su calificación
92888bd_423	821	0.5629500103320122	El proyecto incluye todas las adecuaciones necesarias en la subestación como protecciones, control, puesta a tierra, adecuaciones en el patio de media tensión, entre otras
442e009_20	822	0.5629048339846859	De conformidad con lo dispuesto en el inciso primero del artículo 16 de este Reglamento, podrá habilitarse un sistema web de postulación, debiendo la Corporación garantizar el adecuado y normal funcionamiento de este sistema Web durante todo el período de postulación, y en la eventualidad de producirse fallas en el mismo, deberá tomar las medidas necesarias para subsanarlas, tales como la ampliación del plazo de postulación, el que en caso alguno podrá ser inferior al período de tiempo por el que se haya extendido la deficiencia en el funcionamiento en el referido sistema
3148bfd_54	823	0.5628237020122286	) salvo que legalmente se disponga de un modo diverso-, los actos administrativos producirán los efectos que le son propios desde su notificación (o publicación), diligencia que deberá practicarse una vez que se haya verificado su total tramitación, esto es, el cumplimiento de todas las exigencias que el ordenamiento aplicable prevé en tal sentido, entre las cuales se encuentra, en la especie, el trámite de toma de razón
1b64477_19	824	0.5628194246269784	Ello permitirá contar con la información completa y útil que permitirá una vigilancia y fiscalización efectiva y completa del contenido de los planes asociados
58822ff_12	825	0.5628138603707854	"4º La implementación práctica del proyecto denominado ""Plan de Gestión de Taxis Colectivos, Taxibuses y Buses, Urbanos y Rurales, de San Antonio'' será sometido a evaluaciones técnicas periódicas que permitan su mejor y más eficaz control a fin de efectuarse, si fuere pertinente, las correcciones que eventualmente resulten necesarias"
7898da5_36	826	0.5627351478189141	el resguardo de posibles reinfestaciones en todo momento hasta su
11d5c79_504	827	0.5627155242707664	por el personal debidamente capacitado y certificado,
e7508a5_65	828	0.5627093345630949	No obstante, todos los socios serán responsables mancomunada y solidariamente en el cumplimiento de las obligaciones que surjan de la implementación y ejecución del sistema
fd6d180_96	829	0.562651823597477	Planificaciones completas, necesarias para explicitar los procedimientos de desarrollo de la experiencia
08645ac_31	830	0.5626170668891965	Unidad Básica Replicable (UBR): número de veces que un módulo será replicado para resolver en forma ágil las cargas de importación presentadas al SAG para su pronunciamiento, considerando el volumen y estacionalidad de las prestaciones, el nivel de identificación o inspección física y el personal requerido que hará uso de sus instalaciones
3ef9359_98	831	0.5625578164165332	Serán titulares aquellos que ejercen la cátedra con el correspondiente nombramiento en tal calidad
708ed9d_95	832	0.5625578164165332	Serán titulares aquellos que ejercen la cátedra con el correspondiente nombramiento en tal calidad
f33e182_71	833	0.5625505543583913	Respecto del mantenimiento preventivo, correctivo y reposición de las Nuevas Inversiones de Carácter Menor en los Programas Anuales respectivos, éstos deberán incorporarse anualmente, en el mismo plazo establecido en el artículo 1,10
93daad2_33	834	0.5625226030519395	e) Capacidades y competencias del proponente y su equipo de trabajo, y
e7508a5_58	835	0.5623460024283186	En caso que la empresa no cuente con un equipo técnico instalado en el país, deberá asegurar la disponibilidad de personal especializado en el país que garantice la continuidad operacional del sistema, sin perjuicio de la asistencia extranjera que sea necesaria en casos especiales
60cd142_107	836	0.5623091119681107	Excepcionalmente, los nuevos elementos por avances tecnológicos o nuevos desarrollos, que no hayan sido considerados en la resolución señalada, deberán ser incorporados, para efectos de fijar su vida útil, en las bases preliminares a que hace referencia el artículo 107º de la ley
1adf9ce_3	837	0.5622166463830695	Que, esta autoridad debe en forma permanente estudiar las disposiciones legales para perfeccionar, actualizar y crear Normas de Certificación de Semillas que permitan regular el proceso de certificación de semillas
2bb3805_409	838	0.5621993940036072	Toda otra labor o actividad que la reglamentación vigente disponga
2bb3805_420	839	0.5621993940036072	Toda otra labor o actividad que la reglamentación vigente disponga
6f6307e_85	840	0.5621763833950678	La continuidad tendrá relación directa con la duración del respectivo proceso o actividad, según sea el caso
cbdeaf1_58	841	0.5621587444610908	Los menores deben ser acompañados en forma permanente y durante toda la visita por las personas antes referidas
0df2ca7_86	842	0.562116780544264	a) Mantener los registros mencionados en el presente Reglamento en forma actualizada y de uso conjunto a través de todas sus Direcciones u Oficinas
1575906_307	843	0.5619267108992674	Los Antecedentes Técnicos forman parte de las propuestas y deben ser acompañados de los Antecedentes Administrativos y de los Antecedentes de Identificación de los Concursantes especificados en las Bases Administrativas
3434b51_488	844	0.561906063062652	La obligación para el o los consultores de que todos sus cálculos y resultados sean reproducibles y verificables;
2c8b0e2_81	845	0.5618567861447223	Dentro del tiempo que medie entre la entrada en vigencia de esta ordenanza y el día 1º de septiembre del año 2010, el municipio fomentará y desarrollará medidas de educación y difusión de la misma, para facilitar la adecuación de todos los actores sociales involucrados en esta materia
2bb3805_191	846	0.5615546199293378	Construcción y Mejoramiento del Equipamiento y Entorno Comunitario
2bb3805_367	847	0.5615546199293378	Construcción y Mejoramiento del Equipamiento y Entorno Comunitario
2bb3805_85	848	0.5615540453762223	- Declaración Jurada de compromiso de tales profesionales, que asegure su participación y responsabilidad en las actividades que involucra la Asistencia Técnica
c3e1746_39	849	0.5615114471058855	De los requisitos adicionales en el caso de concursos
92888bd_1091	850	0.5614852824563619	Para estos efectos, la Comisión valorizará las instalaciones en base a la metodología y antecedentes contenidos en el informe técnico definitivo relativo al decreto de valorización de subtransmisión o zonal que se encuentre vigente al momento de entrada en operación de la obra respectiva
3e1e27a_22	851	0.5614684452066236	Respecto de estos requerimientos, la Superintendencia dictará los protocolos adicionales necesarios para su adecuada implementación
92888bd_821	852	0.5613107652327748	El proyecto considera además dejar espacio disponible para futuras ampliaciones de las edificaciones y patios de la S/E
43dd633_31	853	0.5611614451069393	"Finalizados los trabajos antes señalados en las instalaciones de CL, las empresas deberán elaborar un ""Informe Final"" que dé cuenta de las correcciones ejecutadas, así como de las medidas de seguridad adicionales implementadas"
3434b51_660	854	0.5610993979184341	Igualmente, las empresas propietarias o que exploten a cualquier título las instalaciones de interconexión internacional que sean definidas como de servicio público, así como la nueva infraestructura para la prestación de servicios complementarios, deberán percibir anualmente el valor anual correspondiente
c70ae3a_51	855	0.5610805338734938	Déjase constancia que, las presentes condiciones técnicas y los plazos a nivel nacional para cumplir con la obligación de instalar y mantener un Sistema de Monitoreo y Transmisión de Extracciones Efectivas en las obras de captación de aguas subterráneas, podrán ser objeto de actuaciones y modificaciones, según lo requieran las necesidades del Servicio
08645ac_22	856	0.5609701600915561	La superficie de cada módulo debe permitir y facilitar las funciones del personal que se desempeña en los recintos, y dar las condiciones para la descarga, carga, movimiento e inspección de las mercancías sometidas a revisión por parte del SAG, definiéndose en cada caso o proyecto en particular
664379c_204	857	0.5609528945030615	"""La Entidad de Certificación podrá ofrecer conjuntamente, en un mismo contrato, sus servicios de inspección periódica y de reinspección post-reparación"
b1855c7_126	858	0.5608994794260521	En el caso de contribuyentes que, una vez cumplido el año de rebaja, quieren renovar dicho beneficio, además de cumplir los requisitos indicados en el Artículo 29 de la presente ordenanza, deberán tener regularizada las deudas anteriores por el concepto de aseo domiciliario, en la propiedad en la cual es renovado el beneficio
632b91b_15	859	0.5607951423334413	intercambiar experiencias pedagógicas, estimando sus aportes para enriquecer la enseñanza;
5500459_195	860	0.5607737156533353	Artículo 46º: Por razones técnicas, económicas o geográficas, la Superintendencia podrá resolver fundadamente la aplicación gradual de las normas técnicas relativas a la prestación de los servicios y las instalaciones domiciliarias
0e2a9e9_38	861	0.560761783441388	- Asimismo, encomiéndase a la Secretaría Comunal de Planificación, velar por el fiel cumplimiento de lo dispuesto en el presente instrumento y continuar con la tramitación total del proceso, de acuerdo a lo indicado en la parte expositiva del presente decreto
618ae2e_15	862	0.560761783441388	- Asimismo, encomiéndase a la Secretaría Comunal de Planificación, velar por el fiel cumplimiento de lo dispuesto en el presente instrumento y continuar con la tramitación total del proceso, de acuerdo a lo indicado en la parte expositiva del presente decreto
2bb3805_162	863	0.5607589220778831	Finalmente, la Fiscalización Técnica de Obras deberá constatar la buena ejecución de las obras y su correspondencia con los planos, especificaciones técnicas aprobadas, normas legales y reglamentos vigentes
bf25048_139	864	0.5607098299343463	No obstante, tales avances podrían ser mayores y más efectivos de contar -nuestra institucionalidad- con un marco explícito de principios, objetivos y lineamientos contenidos en una Política Nacional de Desarrollo Urbano, que sirva de orientación e integración de las iniciativas en materia de urbanismo, desarrollo territorial - obras urbanas, vivienda, y edificación pública
8ae5077_29	865	0.5605987410105008	e) Las inspecciones, muestreos y análisis deberán ser desarrollados en las oportunidades y de acuerdo a los procedimientos descritos en el presente Programa
ed1f15e_152	866	0.5605876794110826	Los operadores de las Plantas de GNL, deberán velar por su correcta operación, mantenimiento e inspección posterior a puesta en servicio, a objeto de desarrollar las actividades en forma segura, disminuyendo al máximo los eventuales riesgos que la operación presente para las personas y cosas
bd52956_24	867	0.5604731301146337	Podrán inscribirse en el Registro y permanecer inscritas en él, las personas naturales o jurídicas que cumplan con los requisitos exigidos por el presente Reglamento y que no estén afectas a las inhabilidades o incompatibilidades que éste contempla
b425830_9	868	0.5604525405943758	Que los estudios y diseños que componen el referido proyecto, fueron analizados por el área técnica del Programa de Campamentos del nivel central, verificándose que por la naturaleza estratégica del mismo, se requiere una gestión especializada acorde a las necesidades y características propias del sector dentro de un marco técnico riguroso, por una institución con vasta experiencia en la materia, como lo constituye el Servicio de Vivienda y Urbanización, para asegurar el cumplimiento efectivo de los fines públicos, el bienestar de la comunidad y de las familias beneficiarias
1354f34_13	869	0.5604478886160061	Artículo 2º: Sustitúyense los requisitos para el ingreso y promoción en las plantas de Directivos, Profesionales, Técnicos, Administrativos y Auxiliares establecidos en el D
bd2e63d_11	870	0.5604389561687432	Las Normas Específicas incluirán las demás definiciones que sean necesarias para los efectos de la certificación
5626830_78	871	0.5603667336157616	Asimismo, deberán mantener actualizada la información en caso de modificaciones en el Sistema de Medición y/o en el Sistema de Transmisión
93f3cbb_264	872	0.5602458131073581	Se entenderá que una etapa o un plan de manejo, según corresponda, se encuentra cumplido en su totalidad, cuando se han efectuado las labores y prácticas indicadas en el plan de manejo
26b00aa_195	873	0.5602011858683539	Se trata de un conjunto de lineamientos orientadores que buscan dar mayor pertinencia al accionar público, y que junto a la PNOT y la PNDU tienen como objetivo avanzar hacia un desarrollo territorial armónico del país, promoviendo el desarrollo integral de todos sus habitantes
d9f2601_6	874	0.5602002700971335	2º Que para cumplir con dicho protocolo de ensayo y poder certificar el producto eléctrico indicado, los fabricantes nacionales requieren implementar modificaciones, ya sea en su línea de producción, matrices y/o especificación de materias primas, lo que naturalmente implica otorgar un período de tiempo suficiente para que el desarrollo del producto cumpla con las especificaciones del protocolo exigido
dab85da_70	875	0.5601996216095303	Sin embargo, para casos en que se ha ejecutado un proyecto por etapas, si a juicio del Municipio la obra se ha desarrollado con regularidad, no será necesario renovar las invitaciones para las etapas siguientes
dfe46c7_614	876	0.560101596036254	Los archivos se deben adaptar de acuerdo al sistema productivo que se quiere certificar, deben mostrar todas las actividades de campo y transacciones con suficiente detalle para que puedan ser revisados y auditados y ser mantenidos por lo menos 5 años desde su creación
