dfe46c7_197	181	0.28309600490747855	Se deberán utilizar los recursos hídricos de manera eficiente sin afectar la sustentabilidad del ecosistema
f39efc4_75	182	0.28240006265613926	g) Vía de ingreso al Sistema de Evaluación de Impacto Ambiental
047b8c5_6	183	0.2823650813624632	Que la ley N°20,412 establece un Sistema de Incentivos para la Sustentabilidad Agroambiental de los Suelos Agropecuarios
dfe46c7_555	184	0.2817222939253141	La extracción del jugo se debe hacer por sistemas mecánicos
522fea8_35	185	0.2813547436365108	La Programación Estratégica corresponde a un documento en el que se consignan áreas estratégicas, cuya implementación se realiza a través de sistemas esenciales para la productividad de los servicios, los que estarán compuestos por objetivos
71753b7_2	186	0.28128319342060226	Que la Ley Nº 20,412 establece un Sistema de Incentivos para la Sustentabilidad Agroambiental de los Suelos Agropecuarios
7ba47f4_2	187	0.28128319342060226	Que la ley Nº 20,412 establece un Sistema de Incentivos para la Sustentabilidad Agroambiental de los Suelos Agropecuarios
c1487d7_2	188	0.28128319342060226	Que la Ley Nº 20,412 establece un Sistema de Incentivos para la Sustentabilidad Agroambiental de los Suelos Agropecuarios
e7414a8_4	189	0.28128319342060226	Que la ley Nº 20,412 establece un Sistema de Incentivos para la Sustentabilidad Agroambiental de los Suelos Agropecuarios
0984111_130	190	0.28103663112368926	Cobro de los Aportes de Financiamiento Reembolsables
e7548c2_103	191	0.28103663112368926	Cobro de los aportes de financiamiento reembolsables
75ffb09_52	192	0.28042417833807387	l) Sistema o carros para el traslado adecuado de los subproductos aptos para el consumo humano a la cámara de refrigeración
8aa3262_17	193	0.28030096238788715	d) Sistema Escalonado de Mejora Continua (SEMC), en su Nivel Avanzado de Gestión
01e1622_107	194	0.2801036398217862	De los Bienes Administrados por el Servicio de Bienestar
e2b0939_9	195	0.2800179511725309	Lo anterior con la finalidad de obtener mayores recursos que permitan aumentar los fondos en beneficios de los afiliados
ac08984_23	196	0.2799947612514011	b) El cobro de un porcentaje menor al total de la inversión, es también un incentivo para que los potenciales beneficiarios de mayores ingresos, se incorporen al sistema y no opten por una solución particular
042f3d7_35	197	0.27966364448902203	deseadas, en el marco de las actividades productivas agrícolas y
dfe46c7_268	198	0.27925606943535186	Los animales deben provenir de un sistema de producción orgánica, el que deberá mantenerse durante toda la vida del animal
1739c19_271	199	0.2791250245265203	Sistemas y políticas de información a los aportantes del fondo;
0058c31_16	200	0.2788623946910511	Sistema de producción de las plantas de portainjertos clonales de nogal paradox en el Centro de Producción, el cual comprende 3 etapas:
58820aa_50	201	0.2786910571401515	No tienen posibilidad de que sea económico introducir prácticas que mejoren la producción de pasto natural
e7414a8_609	202	0.27859505053165934	importará la renuncia del mismo a los beneficios del Programa, para ese
93f3cbb_85	203	0.27858396203085023	* Las bonificaciones del Sistema que el predio ha recibido, ya sea por el SAG o el INDAP, señalando las fechas correspondientes
9bb5e43_16	204	0.27847724209988245	Certificados de aprobación de funcionamiento de los lugares de producción
aa75f37_150	205	0.2784290150048553	Las condiciones de entrega serán: Tener su sistema productivo en una de las comunas declaradas como zona de catástrofe, declarar que cumple con los requisitos para ser beneficiario de esta modalidad y que pondrá a disposición de los organismos pertinentes la documentación de respaldo cuando sea requerida
cd20008_584	206	0.27841097676278925	Sistema en que el tiro es producido por la diferencia de densidades entre el aire y los gases producto de la combustión, por efecto del calor
12bff34_23	207	0.27810786700648726	Requisitos de las instalaciones de cogeneración eficiente
67240be_222	208	0.27746520857350265	Déjase Constancia que no existen acreedores prendarios
c341ec7_142	209	0.2770195282312171	agrícolas para la producción de plantas de óptimo estado sanitario
bb63cef_21	210	0.2761432831777222	b) Centros de cultivo con sistemas de producción extensivo suspendidos, cuyas producciones máximas proyectadas sean iguales o inferiores a 300 toneladas por año y que se encuentren sobre fondos blandos iguales o inferiores de 60 metros
418ca89_161	211	0.2758189317778592	Los afiliados deberán estar al día en el cumplimiento de las obligaciones contraídas con el Servicio de Bienestar para tener derecho a los beneficios que éste les otorgue
7cffd6b_179	212	0.2748481902485168	- Para efectos del respaldo de hardware, software y sistemas, el OAP deberá observar lo siguiente:
e7508a5_107	213	0.2746855388750593	Los productores deberán controlar, a través de sus sistemas operativos, la información de los productos facturados y a quién han sido distribuidos o vendidos, de tal forma que dicha información pueda ser entregada al sistema de trazabilidad de los productos
c7255b0_542	214	0.2742216380478043	c) Monto del ahorro acreditado y de el o los subsidios susceptibles de obtener
e7414a8_184	215	0.2736357152652946	beneficiada por más de una vez hasta que se haya cumplido el Plan de
656570b_51	216	0.27363386026914205	Plantas procedentes de otro sistema, previa evaluación de los casos por parte del SAG
656570b_104	217	0.27363386026914205	Plantas procedentes de otro sistema, previa evaluación de los casos por parte del SAG
dfe46c7_22	218	0.27325756898471953	Esto reduce la necesidad de uso de insumos externos, permitiendo recuperar el equilibrio natural de los ecosistemas agrícolas
cd20008_429	219	0.2727523944913348	Es aquella instalación de gas que sirve a una edificación destinada a procesos productivos o manufactureros
5674747_21	220	0.27214175887418235	El material procede de un programa de producción bajo Certificación
15df6c5_69	221	0.27183815107488785	terceros para el otorgamiento de beneficios a los afiliados
ea67edc_267	222	0.27179390673523285	En particular se debe demostrar la efectividad del sistema de losas en su comportamiento como diafragma rígido
3fa42ac_62	223	0.27177572613547074	El contratista comercializará la totalidad del volumen de productos de litio producidos
042f3d7_32	224	0.2713738123281745	sometidas a control oficial tanto para la producción como
aa89ab6_26	225	0.2711813672445096	El envío procede de un lugar de producción registrado, que fue
dfe46c7_661	226	0.2709524603922707	"e) Sello del ""Sistema Nacional de Certificación de Productos Orgánicos"""
6f2b6cb_85	227	0.2709376935710397	ii) Centros de cultivo con sistemas de producción intensivo, en lagos o lagunas, independiente de su nivel de producción, siempre que se encuentren en sitios con sustrato blando y profundidades iguales o inferiores a 60 metros
ecf5ff3_219	228	0.2708632710652592	de financiamiento reembolsables por capacidad serán
1397e30_13	229	0.2707022351131838	Las utilidades, producto de esta colecta, serán destinadas para apoyar a los pacientes con Insuficiencia Renal Crónica
cca4710_13	230	0.2707022351131838	Las utilidades, producto de esta colecta, serán destinadas para apoyar a los pacientes con Insuficiencia Renal Crónica
2667168_128	231	0.270404868452055	establecer y operar el sistema multiportador discado y contratado
a714dae_14	232	0.2702799904992004	Que resulta necesario velar por la eficiencia en el uso de los recursos fiscales
5058cc5_34	233	0.2701334632282031	La fertilización de mantención, esto es, aquella necesaria para cubrir las pérdidas por la extracción de los cultivos y para obtener un rendimiento óptimo económico, será de cargo del productor
3996e2e_68	234	0.27010016656967306	- Distinguir los beneficios o prestaciones a los cuales tiene derecho el trabajador
a8ac695_75	235	0.27009011988049314	ii) Centros de cultivo con sistemas de producción intensivo, en lagos o lagunas, independiente de su nivel de producción; siempre que se encuentren en sitios con sustrato blando y profundidades iguales o inferiores a 60 metros
3499081_330	236	0.2699992387611241	Luego, la sumatoria de estos aportes monetarios será dividida por toda la energía consumida hasta esta potencia en el sistema
4e83264_177	237	0.2699992387611241	Luego, la sumatoria de estos aportes monetarios será dividida por toda la energía consumida hasta esta potencia en el sistema
f8ad8d0_220	238	0.2699992387611241	Luego, la sumatoria de estos aportes monetarios será dividida por toda la energía consumida hasta esta potencia en el sistema
3fa42ac_68	239	0.2695334010434083	Con todo, los productos de litio de la empresa relacionada igualmente estarán afectos al pago específico
aa75f37_153	240	0.26941595604073965	2) La prestación será exclusivamente para pagar asistencia técnica y su principal orientación será apoyar el proceso de restablecimiento del sistema productivo dañado, total o parcialmente
01203a9_34	241	0.26940690395777456	En el diseño del sistema se ha tomado en cuenta la profundidad de descarga, de modo que se garantice su operación con un mínimo de mantenimiento
fcefde2_207	242	0.26935102644444453	Aporte de financiamiento reembolsable por capacidad de producción de agua potable ($/m3)
d3b3f42_839	243	0.26792146007497375	Este sistema deberá ser instalado al momento de su construcción
9276e7e_11	244	0.26791175471682993	Descripción del sistema de producción y de manejo del material vegetal de propagación a exportar a Chile, en el Centro de Producción
b9b7f6b_31	245	0.267719046536965	territorialmente o se alinea a los sectores productivos priorizados
3c11c3f_61	246	0.2675189306013048	p) Definición de los plazos de ejecución de las prácticas en consideración a que la vigencia del sistema de incentivos para la recuperación de suelos degradados que establece el DFL
e7508a5_21	247	0.2674432054655165	El Sistema de Trazabilidad Fiscal deberá incorporarse en las líneas de producción o en los procesos productivos utilizados por los fabricantes e importadores de los bienes sujetos a control y contará con los siguientes componentes:
418ca89_68	248	0.2674303952399514	- El Servicio de Bienestar concederá los préstamos no reajustables que a continuación se señalan:
2bb3805_284	249	0.26734706242433226	Sistema de Pago por Servicios de Asistencia Técnica y Fiscalización Técnica de Obras
c7255b0_48	250	0.26734291133573296	Subsidio a la originación: Pago que efectúa el SERVIU o el MINVU destinado a solventar los costos de originación y administración del crédito o mutuo
3434b51_697	251	0.2672263338728206	- El pago de los Sistemas de Transmisión para Polos de Desarrollo de cargo de las centrales generadoras conectadas a éstos, se determinará a prorrata de la capacidad instalada de generación y su ubicación
aa75f37_101	252	0.26720766445185384	- Tasa de interés para la operación de crédito o refinanciamiento
0984111_133	253	0.26720646776192636	Aportes de financiamiento reembolsables por capacidad de producción de agua potable ($/m3)
244ed62_209	254	0.26720646776192636	Aportes de financiamiento reembolsables por capacidad de producción de agua potable ($/m3)
e7548c2_106	255	0.26720646776192636	Aportes de financiamiento reembolsables por capacidad de producción de agua potable ($/m3)
f1fe763_60	256	0.26720646776192636	Aportes de financiamiento reembolsables por capacidad de producción de agua potable ($/m3)
0058c31_35	257	0.2669318603058122	, es la misma autorizada por el SAG para la producción de plantas de Paradox (Juglans regia x Juglans hindsii), al igual que la infraestructura y sistemas de resguardo y trazabilidad
131f13b_14	258	0.26637354342701125	Que el mecanismo establecido en el decreto citado precedentemente, que operaría sobre la base de la administración de recursos a través de contratos que el Indap suscribiría con instituciones financieras para el refinanciamiento u otorgamiento de créditos no ha sido eficaz, en razón del desinterés de las instituciones del Sistema Financiero Nacional por participar en su operatoria, lo que hace necesario buscar un mecanismo alternativo para atender los requerimientos crediticios de aquellos afectados que son medianos productores
cbfe7a8_51	259	0.2663395133913946	Respecto a las Normas de Emisión la estrategia a implementar se construye desde un enfoque sistémico
b110551_35	260	0.26622058643512636	Acreditar competencias que demuestren conocimiento en la aplicación de los Sistemas de Certificación establecidos en los protocolos de ensayos
e7414a8_650	261	0.26516917392784145	respecto del predio objeto del incentivo emitido por el Conservador de
e7508a5_96	262	0.26505470755968985	El resto de la información se incluirá en el sistema al momento de la instalación o incorporación en el producto
cd20008_2710	263	0.26505123956554777	Sistema de Reducción del Espacio Libre con Protector de Pared
244ed62_102	264	0.26499043128910094	En las zonas abastecidas por sistemas de producción que incorporen la fluoruración del agua potable, el cargo CV1 se incrementará en 14,85 pesos por metro cúbico
0c00321_56	265	0.2647348263889533	Este sistema tratará los datos de forma confidencial
59574d6_67	266	0.2645939876586443	b) Obligación de producir y comercializar productos de litio, de conformidad con la cuota máxima autorizada
59574d6_75	267	0.2645939876586443	b) Obligación de producir y comercializar productos de litio, de conformidad con la cuota máxima autorizada
721cb00_28	268	0.2645939876586443	b) Obligación de producir y comercializar productos de litio, de conformidad con la cuota máxima autorizada
721cb00_36	269	0.2645939876586443	b) Obligación de producir y comercializar productos de litio, de conformidad con la cuota máxima autorizada
c7255b0_207	270	0.2644172369433513	Para acceder a los beneficios que se establecen en este párrafo, los créditos complementarios deberán cumplir con las condiciones que se señalan en los artículos siguientes
eab951b_110	271	0.264383241300745	reembolsable por capacidad, será igual al producto de los metros
244ed62_106	272	0.26429484396139946	En las zonas abastecidas por sistemas de producción que incorporen la fluoruración del agua potable, el cargo CV2 se incrementará en 14,69 pesos por metro cúbico
f1ebd15_54	273	0.26360439995901475	"Los ingresos que perciba ""la Corporación"" por el pago correspondiente a dichos servicios serán destinados a incrementar los ingresos propios del liceo"
515929a_11	274	0.26349540867037846	, es la misma autorizada por el SAG para la producción de plantas de Paradox (Juglans regia x Juglans hindsii), al igual que la infraestructura y sistemas de resguardo y trazabilidad,
3499081_318	275	0.2634481578326493	Los montos en exceso que resulten de dichos balances serán asignados a las empresas generadoras para las cuales este balance resulte deficitario
bf25048_199	276	0.2634335317467993	Sistemas expeditos de aprobación de iniciativas públicas y privadas
8141ab2_11	277	0.2631514959143816	Las utilidades producto de esta colecta serán destinadas para apoyar a los pacientes con insuficiencia Renal Crónica
8eb0520_11	278	0.2631514959143816	Las utilidades producto de esta colecta serán destinadas para apoyar a los pacientes con Insuficiencia Renal Crónica
c450666_13	279	0.2631514959143816	Las utilidades producto de esta colecta serán destinadas para apoyar a los pacientes con insuficiencia renal crónica
bb63cef_25	280	0.2623717740297611	b) Centros de cultivo con sistemas de producción extensivo suspendidos, cuyas producciones máximas proyectadas sean superiores a 750 toneladas por año y estén ubicados en sitios con profundidades iguales o inferiores a 60 metros y;
b1855c7_112	281	0.2622929345931303	Orden de ingresos municipales para respaldar el pago al día de periodos anteriores
60cd142_44	282	0.26196354991200144	del respectivo tramo, ajustados por los efectos de impuestos a la renta
131f13b_3	283	0.2618874706803558	Que el Gobierno se comprometió a apoyar la recuperación de los activos dañados de los productores agrícolas afectados por las heladas
12a91a7_158	284	0.26187079932377677	- Ampliar la cobertura y contenido de los programas del Sistema
dfe46c7_152	285	0.2616211789167071	Se prohíbe la producción paralela de productos orgánicos y convencionales
e7508a5_54	286	0.26155275138238676	El sistema de la empresa proveedora deberá ser capaz de integrar o trasladar información del sistema de trazabilidad con información de los sistemas productivos del productor o importador, de manera tal de tener la trazabilidad completa del empaquetado de los productos (Cajetilla - Cartón - Caja - Pallet - u otros)
9276e7e_10	287	0.26119567710821756	Descripción del sistema oficial de inspección y certificación fitosanitaria a la que está sometido el Centro de Producción
3e9b8f6_26	288	0.26114550180765184	El plazo para la instalación de los dispositivos correspondientes a ambos sistemas (a
3e9b8f6_33	289	0.26114550180765184	El plazo para la instalación de los dispositivos correspondientes a ambos sistemas (a
e7508a5_80	290	0.26087588987060295	Para el caso de los productores nacionales, el sistema de instalación o incorporación debe ser ubicado en las líneas de producción por el mismo productor, permitiendo la aplicación de las marcaciones, de manera automática
5599506_13	291	0.260533372362002	Las utilidades producto de esta colecta, serán destinadas para apoyar a los pacientes con Insuficiencia Renal Crónica
5b3b56e_14	292	0.260533372362002	Las utilidades producto de esta colecta, serán destinadas para apoyar a los pacientes con Insuficiencia Renal Crónica
74f7c21_11	293	0.260533372362002	Las utilidades producto de esta colecta, serán destinadas para apoyar a los pacientes con Insuficiencia Renal Crónica
e566529_11	294	0.260533372362002	Las utilidades producto de esta colecta, serán destinadas para apoyar a los pacientes con Insuficiencia Renal Crónica
cb1ceff_204	295	0.2602641356803701	c) Estanque de decantación y refinamiento u otro sistema que cumpla con el mismo objetivo
d590ecf_16	296	0.2601759552720466	Esta declaración deberá realizarse a través del sistema informático disponibles lo cual será de exclusiva responsabilidad del mantenedor de la variedad
3434b51_172	297	0.2598797811003658	Impactos o modificaciones que la prescindencia del Tramo de Transporte generan en la operación del resto del sistema
837ed32_36	298	0.25979694969793377	Este asentamiento se emplazó en las cercanías de las faenas guaneras y salinas, y se adecuó a la topografía del lugar mediante la generación de aterrazamientos que relacionaron el sistema productivo con el habitacional
dfe46c7_59	299	0.25969276012299125	Cosecha: Operaciones de recolección de productos generados por una explotación agrícola
dfe46c7_103	300	0.25966532828325684	Producción orgánica: Sistema holístico de gestión de la producción en el ámbito silvoagropecuario, que fomenta y mejora la salud del agro ecosistema y, en particular, la biodiversidad, los ciclos biológicos y la actividad biológica del suelo
15df6c5_151	301	0.25957805428342007	c) Préstamos habitacionales: Se podrán otorgar préstamos para fines
418ca89_69	302	0.25937827852811024	a) Préstamo asistencial: Se otorgará como ayuda a los
9b07f76_133	303	0.2590348490204236	Sistema de riego tecnificado: Que evite el escurrimiento del
5058cc5_64	304	0.25900189053756695	Esta información deberá estar disponible para los usuarios del Sistema
93f3cbb_45	305	0.25900189053756695	Esta información deberá estar disponible para los usuarios del Sistema
8a779e6_83	306	0.2585254561864281	m) Difundir, cuando se estime conveniente, los resultados obtenidos en la ejecución de los proyectos apoyados
e7508a5_70	307	0.25788087969537854	Respecto de la producción, entrega y distribución de marcaciones
e7414a8_512	308	0.257730149072566	productor agrícola, según lo dispuesto en el presente Reglamento
b726b57_144	309	0.2575538940870019	4,1 Aporte de financiamiento reembolsable por capacidad de producción de agua potable
ecf5ff3_245	310	0.2575538940870019	4,1 Aporte de financiamiento reembolsable por capacidad de producción de agua potable
71753b7_171	311	0.2570698759121359	Se debe asociar además un sistema de distribución del agua
7ba47f4_161	312	0.2570698759121359	Se debe asociar además un sistema de distribución del agua
83fb6c7_150	313	0.2570698759121359	Se debe asociar además un sistema de distribución del agua
8c2c48c_166	314	0.2570698759121359	Se debe asociar además un sistema de distribución del agua
bad8297_167	315	0.2570698759121359	Se debe asociar además un sistema de distribución del agua
c1487d7_162	316	0.2570698759121359	Se debe asociar además un sistema de distribución del agua
9276e7e_5	317	0.25687281843147425	Es requisito para que un Centro de Producción opte por este sistema de reconocimiento, que esté bajo el control de la autoridad fitosanitaria del país exportador
bb63cef_24	318	0.25683584075866006	a) Centros de cultivo ubicados en cuerpos de agua terrestres, cualquiera sea su sistema de producción y sus producciones máximas proyectadas y que se encuentren sobre fondos blandos iguales o inferiores de 60 metros;
8867a3d_15	319	0.25668721818529816	b) Coordinar y lograr acuerdos conjuntos que permitan mejoras en el actual sistema de innovación en la minería
e7414a8_873	320	0.2563566106640529	alcanzare a ser totalmente financiado con los fondos disponibles en el
0984111_37	321	0.2562505668307503	Índice de Precios de Productor Sector Industria Manufacturera, publicado
9795dfb_97	322	0.2562339778114604	j) Aporte de financiamiento de cargo del interesado;
0058c31_25	323	0.25588291889989934	Ofrece un nivel de seguridad aceptable en su sistema de producción de plantas de portainjertos clonales de nogal paradox, considerado como equivalente a la Cuarentena Posentrada en Chile
5198b3a_21	324	0.25588291889989934	Ofrece un nivel de seguridad aceptable en su sistema de producción de plantas de portainjertos clonales de nogal paradox, considerado como equivalente a la Cuarentena Posentrada en Chile
bd2e63d_65	325	0.25542365984466797	Sólo se autorizará su inscripción si han sido producidas según uno de los siguientes sistemas o modalidades:
58820aa_38	326	0.2552960903376915	La fertilidad natural de estos suelos hace indispensable el empleo de fertilizantes para asegurar rendimientos medios
3434b51_731	327	0.2551872452611378	- Para los efectos de determinar la proporción de ingresos tarifarios de los Sistemas de Transmisión Dedicado utilizada por parte de consumidores finales regulados se deberá emplear el porcentaje de uso considerado en el decreto de valorización vigente
3434b51_233	328	0.25509074700944345	Producto del análisis a que se refiere el presente artículo se obtendrá la calificación definitiva de las instalaciones pertenecientes al Sistema de Transmisión Nacional
12c0ba4_161	329	0.2550537465262974	Además, se mantendrá un sistema de información consolidado por provincias
e7508a5_33	330	0.25505139266827137	Definir la información mínima que debe mantener y disponer el sistema de trazabilidad, lo que será informado al proveedor del sistema, así como a los productores e importadores mediante resolución
c7255b0_294	331	0.2550066564772613	Esta inscripción podrá verificarse por medio del Sistema Informático de Postulación
8c2c48c_2	332	0.2549180012104775	Que la Ley Nº 20,412 establece un Sistema de Incentivos para la Sustentabilidad Agroambiental de los Suelos Agropecuarios, cuyos objetivos son la recuperación del potencial productivo de los suelos agropecuarios degradados y la mantención de los niveles de mejoramiento alcanzados
bad8297_2	333	0.2549180012104775	Que la Ley Nº 20,412 establece un Sistema de Incentivos para la Sustentabilidad Agroambiental de los Suelos Agropecuarios, cuyos objetivos son la recuperación del potencial productivo de los suelos agropecuarios degradados y la mantención de los niveles de mejoramiento alcanzados
c7255b0_208	334	0.25490606305066277	Los créditos hipotecarios que se otorguen al amparo de este reglamento, se caucionarán con primera hipoteca sobre el bien raíz a cuya construcción se destine el crédito
bd2e63d_106	335	0.25481380339286863	El Servicio podrá aceptar a solicitud del productor, en forma excepcional, la producción de una generación adicional de la categoría Certificada
3e1e27a_20	336	0.2546377971576328	Requerimientos posteriores a la aprobación inicial del Sistema de Monitoreo Continuo de Emesiones
04d9c6d_15	337	0.25451690997107734	Podrán ser de plantas procedentes de otro sistema, previa evaluación de los casos por parte del SAG
fb9f67e_129	338	0.25422880245040247	a) Aumento significativo en los costos marginales del sistema, respecto de un caso base;
f265ceb_20	339	0.25419930048357053	2015, del Proyecto Código: FDT-2015-02-03, para el Área Atacama, presentado por ingreso Subtel Nº 152,623 de 14,09
eab951b_33	340	0.25419511105373505	En las zonas abastecidas por sistemas de producción que incorporen la fluoruración del agua potable, el cargo CV3 se incrementará en 66,05 pesos por metro cúbico
3434b51_307	341	0.2540208875277108	de las empresas eficientes de dichos sistemas deberá considerar las instalaciones de transmisión dedicada utilizadas por usuarios sometidos a regulación de precios asignadas a cada uno de ellos
cd20008_585	342	0.253667188906497	Sistema para evacuar los gases producto de la combustión, que utiliza un ventilador o extractor de aire
