e7414a8_355	1	0.6789871053455274	de la asistencia técnica destinada a apoyarlos en la elaboración y
2bb3805_379	2	0.616067662409352	- Acerca de Proyectos que Contemplen Servicios Combinados de Asistencia Técnica
c7255b0_636	3	0.6021161914387406	De la Asistencia Técnica, Jurídica y Social para Proyectos de Habitabilidad
2bb3805_288	4	0.5954894800882301	Elaboración y Presentación de el o los Proyectos Técnicos, y Contratación de Obras
e7414a8_252	5	0.5915109087948286	prácticas que requieran asistencia técnica en la elaboración y ejecución
2bb3805_199	6	0.5797445665770684	Acerca del Tratamiento Particular de Servicios o de Proyectos que Contemplen Servicios Combinados de Asistencia Técnica y Fiscalización Técnica de Obras
e7414a8_20	7	0.5772020978974245	acompañar y apoyar la adecuada ejecución técnica en terreno de aquellas
2bb3805_56	8	0.571654924010535	Actividades y Productos de Asistencia Técnica según Modalidad, Tipología y/o Clase de Proyectos
2bb3805_26	9	0.5482432813263877	- Elaboración y Presentación del Proyecto Técnico y Contratación de Obras
2bb3805_31	10	0.5482432813263877	- Elaboración y Presentación del Proyecto Técnico y Contratación de Obras
2bb3805_220	11	0.5204484217674864	Incremento en Asistencia Técnica y Fiscalización Técnica de Obras (FTO)
2bb3805_226	12	0.5204484217674864	Incremento en Asistencia Técnica y Fiscalización Técnica de Obras (FTO)
2bb3805_232	13	0.5204484217674864	Incremento en Asistencia Técnica y Fiscalización Técnica de Obras (FTO)
2bb3805_415	14	0.4957376578378039	Participar del proceso de calificación a las EGR y los servicios de asistencia técnica prestados
2bb3805_281	15	0.48949314448668413	Cuando corresponda, se aplicarán los incrementos de Asistencia Técnica y Fiscalización Técnica de Obras establecidos
c3e1746_83	16	0.4870272144162998	Coherencia entre las actividades descritas y los resultados planteados en la propuesta técnica del proyecto;
cd875ca_395	17	0.48155569609472615	Especificaciones técnicas de los proyectos, suscritas por el PSAT, el profesional proyectista y el propietario
2bb3805_34	18	0.4775251228802567	Descripción de los Servicios de Asistencia Técnica y Fiscalización Técnica de Obras (FTO)
cd875ca_235	19	0.4703884976482624	El proyecto deberá haber sido elaborado por un Prestador de Servicios de Asistencia Técnica a que se refiere el artículo 9° del presente reglamento y contar con aprobación del postulante y del SERVIU
2bb3805_271	20	0.46941029506483845	Diagnóstico Técnico y Social del Territorio en Proyectos del Título I
a681cdb_23	21	0.4656615362294211	Apruébase el proyecto técnico, base de la solicitud, presentado por la concesionaria
bb9f7e1_19	22	0.4656615362294211	Apruébase el proyecto técnico, base de la solicitud, presentado por la concesionaria
f0264b9_18	23	0.4656615362294211	Apruébase el proyecto técnico, base de la solicitud, presentado por la concesionaria
2bb3805_284	24	0.4652736400473765	Sistema de Pago por Servicios de Asistencia Técnica y Fiscalización Técnica de Obras
2bb3805_214	25	0.4642240516764585	De los Pagos Complementarios vía Asistencia Técnica
cd875ca_222	26	0.46028890356011387	La elaboración y ejecución de este Proyecto deberá realizarse por un Prestador de Servicios de Asistencia Técnica, en conformidad con la Resolución N°533 (V
b9b7f6b_26	27	0.45959133523363227	participar en el mercado, apoyando la mejora de sus planes de trabajo para
7cffd6b_317	28	0.45930521653075496	a) Inversión propuesta, asociada a la implementación de la Oferta Técnica
2bb3805_196	29	0.44828286991236155	Factores de Incremento en Asistencia Técnica y FTO, según grado de Aislamiento
2bb3805_371	30	0.44828286991236155	Factores de Incremento en Asistencia Técnica y FTO, según grado de Aislamiento
ac1a931_44	31	0.44173703072404913	- Apruébase el proyecto técnico, contenido en la solicitud de concesión presentada por la concesionaria
f3e8d33_48	32	0.4387505361752013	Generar propuestas técnicas de actividades y planes de trabajo
2aa245f_23	33	0.43817254641794445	- Apruébase el proyecto técnico, base de la solicitud, presentado por la concesionaria
2eec4ae_18	34	0.43817254641794445	- Apruébase el proyecto técnico, base de la solicitud, presentado por la concesionaria
43bab4b_18	35	0.43817254641794445	- Apruébase el proyecto técnico, base de la solicitud, presentado por la concesionaria
444611e_20	36	0.43817254641794445	- Apruébase el proyecto técnico, base de la solicitud, presentado por la concesionaria
5d3f46c_17	37	0.43817254641794445	- Apruébase el proyecto técnico, base de la solicitud, presentado por la concesionaria
6d68f92_17	38	0.43817254641794445	- Apruébase el proyecto técnico, base de la solicitud, presentado por la concesionaria
9ebf6b0_23	39	0.43817254641794445	- Apruébase el proyecto técnico, base de la solicitud, presentado por la concesionaria
ad0886c_19	40	0.43817254641794445	- Apruébase el proyecto técnico, base de la solicitud, presentado por la concesionaria
baab1cb_22	41	0.43817254641794445	- Apruébase el proyecto técnico, base de la solicitud, presentado por la concesionaria
d54659b_22	42	0.43817254641794445	- Apruébase el proyecto técnico, base de la solicitud, presentado por la concesionaria
f6284a5_17	43	0.43817254641794445	- Apruébase el proyecto técnico, base de la solicitud, presentado por la concesionaria
c7255b0_95	44	0.4376300049010824	Compatibilidades e incompatibilidades entre tipologías y/o clases de proyectos
c7255b0_549	45	0.43593230459950605	Capítulo V: Del Estándar Técnico de los Proyectos, su Desarrollo y Presentación
2bb3805_23	46	0.4305955765235765	Para Proyectos correspondientes a los Títulos I y II del Programa de Habitabilidad Rural, la Asistencia Técnica comprende los siguientes servicios y actividades, según corresponda:
b726b57_114	47	0.43059417015108403	b) Cobro por revisión de proyectos y emisión de informe técnico
2bb3805_401	48	0.4264632456811803	Desarrollar directamente las actividades vinculadas a la Asistencia Técnica y Fiscalización Técnica de Obras (FTO), establecidas en el marco de operación del DS N° 10 (V
2bb3805_374	49	0.4212047644698784	- Fiscalización Técnica de Obras en proyectos de Autoconstrucción Asistida
ea67edc_52	50	0.4190033341635462	La propuesta de partidas y sus requerimientos técnicos, que se deberá formular en el mismo formato y correlación
e7414a8_18	51	0.4185693313550243	Asistencia técnica para la ejecución del Plan de Manejo: asesoría
2bb3805_278	52	0.4175416167441852	Procedimiento de Pago del Subsidio de Asistencia Técnica
c7255b0_587	53	0.4164652176577708	Estándar Técnico para proyectos de Entorno y Equipamiento Comunitario
2bb3805_397	54	0.41091034260201953	- De las labores del SERVIU y la SEREMI asociadas a los Servicios de Asistencia Técnica, Jurídica y Social
14b1c87_132	55	0.4102646559628782	Aspectos Técnicos para el Cierre de Proyectos Mineros
f6e00c3_130	56	0.40845248052823546	los responsables técnicos del SAG e Indap del Programa
34f5b99_29	57	0.4080437366985815	Los subsidios habitacionales y de asistencia técnica asignados a través de la presente resolución, se encuentran regidos por el DS 10 (V
859551e_26	58	0.4080437366985815	Los subsidios habitacionales y de asistencia técnica asignados a través de la presente resolución, se encuentran regidos por el DS 10 (V
131f13b_37	59	0.40759387828133886	créditos, asistencia técnica y otros incentivos establecidos en su Ley Orgánica
d3b3f42_197	60	0.40513217544168323	El diseño y cálculo de dicha ventilación deberá estar técnicamente respaldada
3434b51_621	61	0.4035188410674362	Informe técnico de valorización y decreto de valorización
2bb3805_381	62	0.4032057241116611	- Acerca del Procedimiento y Sistema de Pago de los Servicios de Asistencia Técnica y Pagos Complementarios
2bb3805_85	63	0.4009681802448162	- Declaración Jurada de compromiso de tales profesionales, que asegure su participación y responsabilidad en las actividades que involucra la Asistencia Técnica
2bb3805_168	64	0.399622843198032	- Del pago del Subsidio de Asistencia Técnica, Jurídica y Social
c7255b0_643	65	0.398879738326803	Calificar el terreno a través de la evaluación de su factibilidad legal, técnica y económica para la ejecución del proyecto de habitabilidad
89846ec_20	66	0.3982682774809201	- Los subsidios habitacionales y de asistencia técnica complementarios asignados a través de la presente resolución, se encuentran regidos por el DS 10 (V
b9b7f6b_23	67	0.3981196573633434	Calidad de la formulación y coherencia del proyecto:
2bb3805_350	68	0.39720964416795845	- Del pago del Subsidio de Asistencia Técnica, Jurídica y Social para la Modalidad de Autoconstrucción Asistida
2bb3805_351	69	0.3962748306761943	- El pago de Asistencia Técnica, Jurídica y Social a la EGR, según tipología y tamaño de los proyectos, se efectuará conforme a los siguientes valores:
2bb3805_75	70	0.3962277710017129	Otros aspectos a considerar respecto de la ejecución de los Servicios de Asistencia Técnica, Jurídica y Social
2bb3805_332	71	0.39369067960477633	Artículo 4°: De los servicios de Asistencia Técnica para la Modalidad de Autoconstrucción Asistida para proyectos del Programa de Habitabilidad Rural
74d057e_117	72	0.39144052067877366	Esta asistencia técnica es obligatoria para el beneficiario de este subsidio
2bb3805_215	73	0.3875816395189722	Tratándose de la Asistencia Técnica y Fiscalización Técnica de Obras, el incremento en el valor de las prestaciones aplicará en los siguientes casos:
c3e1746_112	74	0.387144660016535	a) Ser beneficiario conforme a la resolución de la Subsecretaría que establece la nómina de beneficiarios y que aprueba los proyectos técnicos respectivos;
b9b7f6b_32	75	0.3850801488021267	Se evaluará la coherencia entre el presupuesto y el Proyecto presentado
2bb3805_244	76	0.38450232342357427	En aquellos proyectos en los que aplique el subsidio para la discapacidad, sólo para los casos en que el beneficiario califique bajo esta condición, el monto adicional de Asistencia Técnica para el servicio de Elaboración y Presentación de Proyectos Técnicos y Contratación de Obras ascenderá a 3 UF por familia
c3e1746_104	77	0.38206422859407274	La nómina de beneficiarios deberá ser establecida por resolución de la Subsecretaría, la que aprobará la ejecución de los proyectos técnicos respectivos
bf25048_182	78	0.38082913415914166	Considerar los sistemas naturales como soporte fundamental en la planificación y diseño de las intervenciones en el territorio
348cb25_27	79	0.37932824084061445	f) Contratar servicios para el diseño e implementación del soporte web necesario para dar a conocer y operar el Programa
b726b57_115	80	0.3773612777039079	El cobro a realizar por cada proyecto revisado por el prestador y su correspondiente informe técnico, corresponderá a:
440c622_24	81	0.37502616157368573	h) Participar en comisiones y comités técnicos intersectoriales
2bb3805_192	82	0.3744686253314755	El valor de la Asistencia Técnica a pagar en proyectos de construcción y mejoramiento del equipamiento y entorno comunitario, parte de un monto base de 60 UF y se incrementará en 1,5 UF por cada familia asociada al proyecto
c7255b0_401	83	0.3735701860232108	Título I: Postulación con Proyectos de Asociación Territorial
548c001_48	84	0.3730926724216428	b) Contribuir a la coherencia de la acción climática en Chile, a través de sus opiniones técnicas y de la revisión de los distintos instrumentos de política, instrumentos de mercado y de otros que estén vinculados a la materia, asesorando en su seguimiento periódico e implementación
ea67edc_578	85	0.37280011141862945	Las especificaciones técnicas y medidas de seguridad para los usuarios, deberán venir en el proyecto que será revisado y aprobado por Serviu
ce638af_21	86	0.37154504352119666	Asistencia técnica para la ejecución del Plan de Manejo: asesoría prestada al usuario por un operador acreditado, conducente a acompañar y apoyar la adecuada ejecución técnica en terreno de aquellas prácticas comprometidas en el Plan de Manejo
2bb3805_416	87	0.37103076791988243	Participar, cuando corresponda y sea pertinente, de la coordinación con las EGR, constructoras o contratistas y fiscalizador técnico de obras, para reforzar el adecuado desarrollo de sus funciones en cada proyecto
fdaadad_22	88	0.37056132768541117	a) Apoyar con su infraestructura y asesoría técnica al cuidado de los árboles y demás especies vegetales
6301044_6	89	0.37038184753950687	En concordancia con lo dispuesto en el artículo 42º de la LGUC y artículo 2,1
74d057e_182	90	0.3702082249343004	c) Informe emitido por el prestador de servicios de asistencia técnica a que se refiere el inciso segundo del artículo 17, de que el proyecto de arquitectura es técnica y económicamente factible;
2bb3805_368	91	0.3696482131248031	El valor de la Asistencia Técnica a pagar en proyectos de construcción y mejoramiento del equipamiento y entorno comunitario, parte de un monto base de 60 UF y se incrementará en 2 UF por familia asociada al proyecto
55b1fd6_26	92	0.3692510267049234	El apoyo técnico será prestado tanto por dicha cartera como por los Ministerios de Salud, de Economía, y de Relaciones Exteriores
2bb3805_252	93	0.3692360918189228	Asistencia Técnica a la Exploración Geotécnica para la Clasificación Sísmica de Suelos en proyectos de CCH
c7255b0_637	94	0.36829362354999917	La prestación de servicios que comprende la Asistencia Técnica, Jurídica y Social incluye la organización de la demanda, cuando corresponda, la elaboración del proyecto de habitabilidad, el acompañamiento social relacionado con el diseño y ejecución del proyecto, la asesoría jurídica e inspección técnica durante la ejecución de las obras, la recepción de las mismas y su entrega a los beneficiarios
2bb3805_175	95	0.36821869565341747	- El pago de Asistencia Técnica, Jurídica y Social, según tipología y/o clase, y tamaño de los proyectos, se efectuará conforme a los siguientes valores:
08645ac_48	96	0.36677030910626396	Especificaciones técnicas y descripciones de los términos de referencia, programas de mantención de las instalaciones, entre otros
2bb3805_372	97	0.362450718992819	Los Servicios de Asistencia Técnica y la Fiscalización Técnica de Obras para cada una de las tipologías y/o clases de proyectos descritos con anterioridad, verán incrementados los valores señalados en este artículo, de acuerdo al grado de aislamiento que presenta el territorio en el cual se desarrollará el o los proyectos
08645ac_49	98	0.36208180219475894	Especificaciones técnicas de mesones de inspección y accesorios, de acuerdo a lo dispuesto por el Servicio
2bb3805_197	99	0.36182610234712786	Los Servicios de Asistencia Técnica y la Fiscalización Técnica de Obras para cada una de las tipologías y/o clases de proyectos descritos con anterioridad, verán incrementados los valores señalados en este artículo, de acuerdo al grado de aislamiento que presenta el territorio en el cual se desarrollará el proyecto
256a069_36	100	0.36124780363194964	- El Ministerio de Relaciones Exteriores prestará el apoyo técnico y administrativo que sea necesario para el adecuado funcionamiento del Consejo
a5558fe_19	101	0.36124780363194964	- El Ministerio de Relaciones Exteriores prestará el apoyo técnico y administrativo que sea necesario para el adecuado funcionamiento del Consejo
e7414a8_403	102	0.3591286623075798	atendiendo a lo indicado en las pautas técnicas que para este
e63f2d7_26	103	0.3554551721867636	b) Proponer la realización de estudios y proyectos conducentes al uso racional y técnico de los fertilizantes
a6ba1c5_100	104	0.35499243075014575	Especificaciones técnicas del proyecto que incluyan el detalle exigido en el DS Nº 19 para viviendas, equipamiento, cierros y áreas verdes
cd875ca_221	105	0.3549332685486628	- Para el ingreso del Proyecto al Banco, se deberá acompañar un Proyecto de Asistencia Técnica y Social el cual comprende la habilitación del postulante, la elaboración del Proyecto Habitacional, el Plan de Habilitación Social y la gestión para la ejecución de las obras
f33fed1_94	106	0.35387951954365215	- Identificación de las fuentes de financiamiento para el desarrollo del proyecto, y
ccc84ca_24	107	0.35218859333125363	El valor de la asesoría profesional está desagregada en $19,805/ha por concepto de asistencia técnica en terreno y $11,631/ha por concepto de elaboración de estudios técnicos
ccc84ca_132	108	0.35218859333125363	El valor de la asesoría profesional está desagregada en $19,805/ha por concepto de asistencia técnica en terreno y $11,631/ha por concepto de elaboración de estudios técnicos
ccc84ca_134	109	0.35218859333125363	El valor de la asesoría profesional está desagregada en $ 19,805/ha por concepto de asistencia técnica en terreno y $11,631/ha por concepto de elaboración de estudios técnicos
2bb3805_4	110	0.35203978098606215	La necesidad de establecer procedimientos para la prestación de los Servicios de Asistencia Técnica, Jurídica y Social y la Fiscalización Técnica de Obras al Programa de Habitabilidad Rural, regulado por el DS N° 10 (V
5960769_17	111	0.3519755358570654	Apruébase el proyecto técnico base de la solicitud presentado por la concesionaria, conforme a las disposiciones técnico-legales que rigen el servicio de telecomunicaciones concedido
e25711d_5	112	0.35185329943098775	"- Convenio Marco Relativo a la Ejecución de la Ayuda Financiera y Técnica y de la Cooperación Económica en Chile en virtud del Reglamento ""ALA"", sus Anexos y Protocolos, suscrito en Bruselas, Bélgica, el 24 de noviembre de 1998 y publicado en el Diario Oficial de 12 de junio de 2001"
2bb3805_51	113	0.35152004979478857	En ningún caso la EGR puede realizar la fiscalización técnica de las obras correspondientes al proyecto en el que se desempeña como tal
c7255b0_108	114	0.35089326335664195	Capítulo II: Del Subsidio y Financiamiento del Proyecto de Habitabilidad Rural
2bb3805_52	115	0.3506064909933351	La pormenorización de los Servicios de Asistencia Técnica y los productos asociados, comprendidos en las actividades que debe desarrollar la Entidad de Gestión Rural en el marco del Programa de Asistencia Técnica al DS N° 10 (V
67240be_89	116	0.34999398326315645	En el caso que, en las RCA del proyecto a que se hace referencia en los párrafos segundo y tercero del artículo 1,8
2bb3805_16	117	0.34927456150555725	Artículo 1°: Las siguientes disposiciones serán aplicables al desarrollo de los servicios de Asistencia Técnica, Jurídica y Social, para proyectos de construcción del Programa de Habitabilidad Rural, conforme a lo establecido en el DS N°10 (V
2e22c13_23	118	0.3490505466656493	Apruébase el proyecto técnico base de la solicitud presentada por la concesionaria, conforme a las disposiciones técnico legales que rigen el servicio de telecomunicaciones concedido
c18bb13_21	119	0.3490505466656493	Apruébase el proyecto técnico base de la solicitud presentada por la concesionaria, conforme a las disposiciones técnico legales que rigen el servicio de telecomunicaciones concedido
abae644_73	120	0.34893483211617826	Especificaciones técnicas del proyecto que incluyan el detalle exigido en el DS N° 19 para viviendas, equipamiento, cierros y áreas verdes
ae6dc4d_98	121	0.34893483211617826	Especificaciones técnicas del proyecto que incluyan el detalle exigido en el DS N° 19 para viviendas, equipamiento, cierros y áreas verdes
c7255b0_574	122	0.34877581458307605	Estándar Técnico para Proyectos de Construcción de Conjuntos Habitacionales
ad74b3f_5	123	0.3485156002403038	"- Convenio Marco Relativo a la Ejecución de la Ayuda Financiera y Técnica y de la Cooperación Económica en Chile en virtud del Reglamento ""ALA"", sus Anexos y Protocolos, suscrito, en Bruselas, Bélgica, el 24 de noviembre de 1998 y publicado en el Diario Oficial de 12 de junio de 2001"
cd875ca_224	124	0.3478540580364813	Este Proyecto deberá contemplar, entre otras, las áreas a desarrollar, los servicios que se prestarán, los profesionales que desempeñarán funciones en el desarrollo del Proyecto y los recursos involucrados en él, ciñéndose a la normativa que regula la Asistencia Técnica para este programa
10f42d8_11	125	0.3466215036985053	Asimismo, el plan de trabajo para implementar un negocio deberá contemplar obligatoriamente Acciones de Gestión Empresarial, esto es, de asistencia técnica, asesorías en gestión, capacitación, acciones de marketing y/o formalización
c8b1297_15	126	0.346277498908773	a) Asistencia técnica en terreno, que comprende la capacitación y supervisión para la ejecución de las actividades bonificables aprobadas en el plan de manejo que corresponda
8dbb961_125	127	0.3460894984400351	Cuando las leyes o reglamentos exijan como requisito ser propietario del terreno en que recae la concesión, los beneficiarios podrán solicitar los permisos, la aprobación de los planes de manejo y la asistencia técnica y crediticia que se requieran para construir o realizar en el bien concesionado las inversiones necesarias para el cumplimiento del proyecto aprobado
cd875ca_18	128	0.34605303483997807	Proyecto Habitacional: conjunto de antecedentes técnicos, económicos, legales y de la familia para la cual se desarrolla el proyecto, que considera la vivienda a construir
ea67edc_53	129	0.34578458527666767	El Informe técnico y presupuestario de las partidas propuestas, ajustándose a los montos indicados en el DS N° 10 (V
c7255b0_511	130	0.34476819468914766	La Comisión Técnica Evaluadora deberá verificar la coherencia entre el Proyecto de Asociación Territorial presentado y las características del déficit de habitabilidad del postulante
2bb3805_369	131	0.3443007735225593	El monto total a pagar por concepto de asistencia técnica, se desglosa de la siguiente forma:
7cffd6b_126	132	0.343947677785984	- El OAP deberá contar con la dotación profesional y técnica suficiente e idónea que permita entregar soporte técnico a las Proveedoras, para solucionar los problemas que se puedan presentar en la operación del sistema
9b07f76_107	133	0.3439391848503832	Otras evaluadas y autorizadas por la División técnica del Servicio
92888bd_897	134	0.34375235664728576	El proyecto considera los paños de línea en las S/E señaladas
92888bd_966	135	0.34375235664728576	El proyecto considera los paños de línea en las S/E señaladas
92888bd_974	136	0.34375235664728576	El proyecto considera los paños de línea en las S/E señaladas
92888bd_990	137	0.34375235664728576	El proyecto considera los paños de línea en las S/E señaladas
92888bd_1019	138	0.34375235664728576	El proyecto considera los paños de línea en las S/E señaladas
6d8b3ba_118	139	0.3436337946911314	El número de postulantes seleccionados en cada región, alcanzará hasta el número de subsidios susceptibles de financiar, incluidos los respectivos servicios de asistencia técnica y fiscalización técnica de obras
181e276_25	140	0.3432731183878903	"Anexo Técnico ""Información Técnica de Instalaciones y Equipamiento"""
5500459_269	141	0.3430097823344901	Las Especificaciones Técnicas representarán la expresión escrita de las condiciones del proyecto
8c20f47_48	142	0.34282032132498075	Apruébese proyecto técnico presentado por la concesionaria, en lo relacionado con los sistemas y equipos de telecomunicaciones autorizados en el presente decreto, conforme a las disposiciones técnico legales que rigen el servicio de telecomunicaciones concedido
ea67edc_384	143	0.3422067308042519	Todos los proyectos deben considerar cielo, para el caso de entretechos y entrepisos
faf0b7e_76	144	0.3417582666586053	c) Apoyar con su infraestructura y asesoría técnica el cuidado de los árboles y demás especies vegetales
2bb3805_423	145	0.34141969818412377	), 2015, pudiendo hacer uso de los recursos de Asistencia Técnica correspondientes a los servicios y montos que se describen en el artículo 3° de la presente resolución
ce638af_467	146	0.34087216645607366	- Tratándose de los pequeños productores agrícolas, se podrá bonificar los costos de la asistencia técnica destinada a apoyarlos en la elaboración y ejecución de sus Planes de Manejo
e7414a8_906	147	0.34087216645607366	- Tratándose de los pequeños productores agrícolas, se podrá bonificar los costos de la asistencia técnica destinada a apoyarlos en la elaboración y ejecución de sus planes de manejo
2bb3805_266	148	0.3384674027481973	Tratándose de proyectos colectivos CCH que presenten alguna de las clases de suelo señalados, los valores de la Asistencia Técnica se incrementarán hasta por un monto de 50 UF por proyecto, con el fin de financiar parte o la totalidad de los estudios señalados
c7255b0_31	149	0.33844803037091764	Convenio Marco: Convenio que deben suscribir las Entidades de Gestión Rural con la Secretaría Regional Ministerial de Vivienda y Urbanismo, en adelante también SEREMI MINVU, de la región correspondiente, con el objeto de realizar las respectivas labores de asistencia técnica, desarrollo y presentación de proyectos en el contexto del presente Programa
1575906_45	150	0.3377437206622679	Los proyectos universitarios competirán en una categoría diferente a los proyectos profesionales, presentando los productos señalados en las bases técnicas de este concurso
2bb3805_209	151	0.3374435398040938	B) Tratándose de proyectos de Construcción y Mejoramiento del Equipamiento y Entorno Comunitario, la Asistencia Técnica y Fiscalización Técnica de Obras siempre se pagará en un 100%
