2bb3805_94	656	0.25735193030608383	No obstante lo anterior, conforme a los antecedentes presentados y a la situación particular del proyecto, el SERVIU podrá, fundadamente, realizar un pago proporcional de acuerdo al avance realizado por la Entidad de Gestión Rural, respecto a uno o más Servicios de Asistencia Técnica desarrollados, ello cuando se determine que existen factores ajenos al trabajo de la EGR que impiden la ejecución del Servicio de Asistencia Técnica completo
fe29140_11	657	0.2573021704080697	g) Asistir técnicamente en la elaboración de planes de trabajo de los servicios para el fomento productivo de los pueblos indígenas, y
5674747_34	658	0.25723720218680246	manipulación, factibles de sellar y etiquetados o rotulados de acuerdo a
e7414a8_244	659	0.2569638632882758	Programa y que contribuyan a la sustentabilidad de los suelos
4e83264_127	660	0.25688755886158743	k) VATT para proyectos de expansión, conforme los valores referenciales de V
f8ad8d0_169	661	0.25688755886158743	k) VATT para proyectos de expansión, conforme los valores referenciales de V
5500459_213	662	0.2568729844140738	Artículo 49º: La presentación y contenido del proyecto de Instalaciones Domiciliarias deberá cumplir con lo siguiente:
61c0077_34	663	0.2566223166074867	En ambos casos, se deberá incorporar las memorias de cálculos y estudios que sustenten técnicamente la instalación de la estación, como las medidas adicionales de seguridad, siempre que éstas no se contrapongan a las de la norma referida y sean técnicamente respaldadas en normas extranjeras autorizadas por la Superintendencia, la cual se debe acompañar al proyecto
131f13b_105	664	0.2564856725984299	En el Nivel Regional, le corresponderá al Departamento de Asistencia Financiera Regional revisar y completar la documentación y antecedentes que se estime necesarios, emitir un informe técnico, entregar una recomendación de aprobación o rechazo y coordinar su presentación ante el Comité de Financiamiento Regional
5500459_672	665	0.2562485589379322	En éstas, se incluirán los ramales auxiliares que se consulten en el plano
2bb3805_162	666	0.25621807511637185	Finalmente, la Fiscalización Técnica de Obras deberá constatar la buena ejecución de las obras y su correspondencia con los planos, especificaciones técnicas aprobadas, normas legales y reglamentos vigentes
92888bd_844	667	0.25616488189853337	El proyecto deberá ser licitado y adjudicado para su construcción, coordinadamente y en conjunto con las obras descritas en los numerales 3,2
92888bd_855	668	0.25616488189853337	El proyecto deberá ser licitado y adjudicado para su construcción, coordinadamente y en conjunto con las obras descritas en los numerales 3,2
92888bd_863	669	0.25616488189853337	El proyecto deberá ser licitado y adjudicado para su construcción, coordinadamente y en conjunto con las obras descritas en los numerales 3,2
5500459_471	670	0.25608703608878813	Diseño y Cálculo de Instalaciones Domiciliarias de Alcantarillado
d3123a5_456	671	0.25595929293824815	3 de las Bases de Licitación, mediante la correspondiente declaración de avance prevista en el artículo 1,9
d3123a5_460	672	0.25595929293824815	3 de las Bases de Licitación, mediante la correspondiente declaración de avance prevista en el artículo 1,9
d3123a5_464	673	0.25595929293824815	3 de las Bases de Licitación, mediante la correspondiente declaración de avance prevista en el artículo 1,9
d3123a5_468	674	0.25595929293824815	3 de las Bases de Licitación, mediante la correspondiente declaración de avance prevista en el artículo 1,9
1af4f43_8	675	0.2558254367274515	- Viajar constantemente a las Direcciones Regionales, acompañando a las delegaciones nacionales o internacionales, en visitas a terreno, para inspeccionar programas financiados con fondos externos o para contribuir a la captura tecnológica
fc50484_14	676	0.2558254367274515	- Viajar constantemente a las Direcciones Regionales, acompañando a las delegaciones nacionales o internacionales, en visitas a terreno, para inspeccionar programas financiados con fondos externos o para contribuir a la captura tecnológica
f9c22d5_8	677	0.2557944409871983	"4) Que el inciso 8°, del artículo Tercero Transitorio de la Ley N° 20,469, define proyecto minero conexo como ""("
d3b3f42_624	678	0.25569274070361336	- El diseño del tanque, sus tuberías y conexiones deberá cumplir con lo siguiente:
4d73d11_71	679	0.2556069062426827	Artículo 10º: Diseño del área con Circulaciones peatonales y mobiliario
ed1f15e_157	680	0.2555850762567762	La Superintendencia podrá aceptar proyectos que utilicen tecnologías diferentes a las establecidas en el presente reglamento, siempre que se mantenga el nivel de seguridad contemplado en éste
ed1f15e_181	681	0.2555850762567762	La Superintendencia podrá aceptar proyectos que utilicen tecnologías diferentes a las establecidas en el presente reglamento, siempre que se mantenga el nivel de seguridad contemplado en éste
74d057e_179	682	0.2554780317704902	a) Copia del respectivo contrato de construcción firmado entre el beneficiario y el constructor, visado por el prestador de servicios de asistencia técnica a que se refiere el inciso segundo del artículo 17, que incluya, a lo menos, las estipulaciones contempladas en el contrato tipo que para tal efecto proporcionará el Serviu respectivo y que no contenga cláusulas que sean incompatibles o contradictorias con aquéllas
9ae6c1c_208	683	0.25530737932847525	Todos los proyectos deberán cumplir con las condiciones, exigencias y requisitos, establecidos en el DS N° 19
c7255b0_748	684	0.2552146299823814	b) Para la evaluación y calificación del Proyecto o el expediente de postulación
0be5366_100	685	0.2550467495422082	Asignación de estímulo por competencias profesionales establecida en el inciso segundo del artículo 5
92888bd_876	686	0.254968829681092	El proyecto deberá ser licitado y adjudicado para su construcción, coordinadamente y en conjunto con la obra descrita en el numeral 3,2
92888bd_883	687	0.254968829681092	El proyecto deberá ser licitado y adjudicado para su construcción, coordinadamente y en conjunto con la obra descrita en el numeral 3,2
14b1c87_338	688	0.2549079433884598	Post Auditoría, etapa en la que se deberá consolidar y contrastar la información y antecedentes técnicos y económicos a objeto de elaborar el informe de auditoría
a155bdf_21	689	0.25482553586263734	- Dictar, en cada concurso, una resolución que indique la nómina definitiva de las personas cuyos proyectos se aprueban y a las cuales se les adjudica la correspondiente bonificación (artículo 19 del Reglamento)
5571de3_219	690	0.2546629154787964	El informe final técnico y financiero que es presentado por el coordinador del adjudicado, será evaluado por el SAG de acuerdo a lo descrito en el punto 12
b9b7f6b_24	691	0.2545542487048277	Se evaluará la congruencia y calidad en la formulación del Proyecto, en 40%
3434b51_291	692	0.2545117748323933	de las instalaciones de transmisión señaladas en los incisos segundo y tercero del Artículo 46
adf1097_16	693	0.25447799445241803	del Mercado - Pedro Aguirre Cerda - Autopista del Sol
2bb3805_208	694	0.25446705125240165	En este caso el valor a pagar en asistencia técnica, también ascenderá al 10% del valor total de este servicio
013a174_71	695	0.25444876790260373	Las decisiones sobre aprobación de los proyectos y asignación de recursos, será formalizada mediante actos administrativos de la DIRECON
e7414a8_382	696	0.2541776143385467	de fósforo hasta el nivel mínimo técnico de hasta 20 mg de
ce638af_138	697	0.25392964867282775	r) Proponer, para el caso de los pequeños productores agrícolas, las prácticas que requieran asistencia técnica en la elaboración y ejecución de sus Planes de Manejo, así como los montos máximos posibles a pagar por este concepto, dentro de los máximos establecidos en el artículo 32 de este Reglamento
19f0b36_29	698	0.2538992576964938	Así mismo, postergar los usos de suelo asociados al art
19f0b36_40	699	0.2538992576964938	Así mismo, postergar los usos de suelo asociados al art
fdaadad_27	700	0.25383902321066565	f) Definir los protocolos para proyectos de arborización, en cuanto a especies a introducir, métodos de plantación y exigencias relacionadas con garantías presentadas por quienes realizan las obras
db0c1a5_21	701	0.2538383906765559	""", de las cuales, las propuestas presentadas por las empresas ""Revisora Técnica de Vehículos Ltda"
42efad5_11	702	0.25375670314325716	711 proyectos de explotación aprobados v/s 500 proyectos de explotación comprometidos originalmente
3297093_84	703	0.25371830903603354	En todo proyecto u obra en que intervenga el Mantenedor, mientras no cumpla con este requisito, deberá contar con la aprobación de un profesional o técnico de aquellos a que se refiere dicho artículo, quien deberá suscribir el informe respectivo
271c207_47	704	0.25349347440962045	"""Sercotec podrá autorizar anticipos a los Agentes Operadores Intermediarios para la ejecución y administración de los Proyectos"
b9b7f6b_63	705	0.25349347440962045	"""Sercotec podrá autorizar anticipos a los Agentes Operadores Intermediarios para la ejecución y administración de los Proyectos"
c7255b0_672	706	0.2534385512596661	b) Identificación del emplazamiento del o los proyectos
f1ebd15_22	707	0.2533585362724189	"- ""El Ministerio"" y ""la Corporación"" en cumplimiento de lo dispuesto en el artículo 3º del D"
5626830_22	708	0.2533119640806514	La Dirección General, por resolución fundada, determinará los plazos y las condiciones técnicas para cumplir la obligación dispuesta en este artículo
a7a452e_20	709	0.2533119640806514	La Dirección General, por resolución fundada, determinará los plazos y las condiciones técnicas para cumplir la obligación dispuesta en este artículo
b131f6c_22	710	0.2533119640806514	La Dirección General, por resolución fundada, determinará los plazos y las condiciones técnicas para cumplir la obligación dispuesta en este artículo
f33fed1_85	711	0.2532707024034351	- La Mesa Técnica deberá, para estos casos, analizar el proyecto y proponer las condiciones y exigencias mínimas, elaborando una propuesta con los respectivos Términos de Referencia, incluyendo una proposición de renta mínima concesional
c7255b0_648	712	0.25317811710348437	Los proyectos deberán ser conocidos y aprobados por las familias mediante un proceso participativo debidamente acreditado
92888bd_879	713	0.25310534334745594	El proyecto incluye los paños de conexión en la nueva S/E San Rafael 110 kV
c5cf358_51	714	0.2530603609446991	Calendario y plan de trabajo para el desarrollo de los principales hitos del Procedimiento Normativo, el que deberá contener la fecha de constitución del Comité Consultivo, fecha preliminar para que el proyecto de Anexo Técnico sea sometido a consulta pública, plazo para la elaboración del informe consolidado de respuestas y fecha de publicación del Anexo Técnico definitivo
7cffd6b_191	715	0.2529416692911104	De la Inversión, los Costos y el Financiamiento del OAP
1f6ae9d_23	716	0.2529333088862933	-Repetitividad de las acciones técnicas involucradas en la tarea realizada en el puesto de trabajo
f9c22d5_17	717	0.2528155012127724	Que el Proyecto Original y el Proyecto Nuevo constituyan una misma Unidad Económica de Explotación Minera
2ef7a2d_90	718	0.25277015008136594	f) Difundir y publicar los beneficios de la ley Nº 18,450 para facilitar la oportuna postulación de proyectos, de acuerdo a las instrucciones de la Comisión Nacional de Riego (artículo 3º del Reglamento)
4d73d11_79	719	0.252668921058924	Las circulaciones peatonales deberán cumplir con lo que dispone el Art
92888bd_258	720	0.2524086017711529	El proyecto incluye las adecuaciones de los equipos para las nuevas capacidades y las adecuaciones a las respectivas barras
f33fed1_77	721	0.2523285716971766	- Señalar cómo el proyecto propuesto es compatible con el Plan de Manejo respectivo y su correspondiente Área de Uso Público;
3297093_26	722	0.25225733405738426	Características Técnicas que determinan las Categorías de los Certificadores
ccfd9bf_32	723	0.2522373039852881	- Las condiciones de prestación de los servicios otorgados en concesión, son las establecidas en la Ficha de Antecedentes Técnicos (F
e5e714a_4	724	0.2522145287666999	Que, en conformidad a lo dispuesto en el Artículo 47 del Protocolo Adicional Específico y el Artículo 3 del Protocolo de Enmienda, éstos entraron en vigor en la fecha de su firma,
1adb72b_2017	725	0.2521759040013808	c) Memoria técnica de los procesos productivos y su respectivo flujograma;
1702d37_6	726	0.25207821440593614	- Que se requiere disponer de plaguicidas que permitan dar cumplimiento a las necesidades y a los requerimientos fitosanitarios tanto del mercado interno como externo
51d334e_15	727	0.2520556789893674	P-IC-001 Procedimiento Emisión y Aceptación de Propuestas
9ae6c1c_169	728	0.2520310182777006	Se efectuará de acuerdo a lo señalado en los artículos 12° y 13° del DS N° 19
418ca89_62	729	0.25177382661875236	acreditadas, se podrá otorgar al afiliado un subsidio económico
93f3cbb_83	730	0.2513798845359061	a) El Plan de Manejo y los antecedentes señalados en los artículos 9° y 10
1ca8b54_6	731	0.2512306814893914	- Promúlganse el ''Convenio del Programa Cooperativo para el Fondo Regional de Tecnología Agropecuaria''; su anexo I, relativo a participantes y contribuciones; su anexo II, que contiene el ''Convenio de Administración del Programa Cooperativo para el Fondo Regional de Tecnología Agropecuaria'', y los apéndices ''A'' y ''B'' de este Convenio, suscritos el 15 de marzo de 1998, en la ciudad de Cartagena de Indias, Colombia, por Chile, Argentina, Colombia, Costa Rica, Ecuador, Nicaragua, Panamá, Paraguay, República Dominicana, Uruguay, Venezuela, el Centro Internacional de Investigaciones para el Desarrollo (CIID) - Canadá y el Banco Interamericano de Desarrollo; cúmplanse y llévense a efecto como ley y publíquense en la forma establecida en la ley Nº 18,158
c9ad1a0_17	732	0.25115002219505767	Una descripción técnica de los equipos y materiales constituyentes de las instalaciones de subtransmisión;
7dd27cb_2	733	0.25104717083489425	"Que con fechas 17 de octubre y 5 de diciembre de 2017, se suscribió, en Santiago, entre el Gobierno de la República de Chile y la Organización de las Naciones Unidas para la Alimentación y la Agricultura (FAO) el Acuerdo relativo al Proyecto de Cooperación Técnica: ""Asistencia de Emergencia a los Pequeños Productores Afectados por Incendios Forestales en las Regiones de Biobío y Maule"""
d3123a5_220	734	0.2509206374578612	4,1 Mantenimiento de Instalaciones y Equipamiento del Cableado Estructurado, de acuerdo a lo establecido en el artículo 2,6
6d8b3ba_74	735	0.25077616012229	Para efectos del subsidio complementario mencionado en la letra a) y c) del artículo 10 del DS Nº 10 (V
a907a76_25	736	0.25072947916906774	Asimismo, se considera justificada la reprogramación de las actividades participativas del proceso de aprobación del proyecto, reguladas por el artículo 2,1
1dd7e96_14	737	0.25044234096856943	- Ámbito Logro de Metas para Estamento Directivo, Profesional, Técnico, Administrativo y Auxiliar 40%:
c5cf358_17	738	0.25041057010100554	Artículo primero: Apruébase la siguiente resolución de inicio correspondiente al procedimiento de elaboración y desarrollo del Anexo Técnico Diseño de Instalaciones de Transmisión de la Norma Técnica Seguridad y Calidad de Servicio
e7414a8_413	739	0.25028628847456313	mínimo técnico alcanzado, equivalente a la tasa de extracción del
e7414a8_423	740	0.25028628847456313	mínimo técnico alcanzado, equivalente a la tasa de extracción del
d590ecf_7	741	0.2502687416240241	Que, el proyecto de la Norma Especifica de Certificación de Semilla de Mijo común, ha sido sometido a consideración del Comité Técnico Normativo, reunido con fecha 18 de junio de 2019
1bedf73_42	742	0.25020642417446304	113-5, encargado de inspección técnica, Ensayos No Destructivos y certificaciones
2bb3805_228	743	0.2500699793759016	Proyectos de Eficiencia Energética e Hídrica y/o que incorporen criterios de Sustentabilidad
c7255b0_780	744	0.24989156294510995	De acuerdo al tipo de proyecto, el SERVIU respectivo deberá solicitar la documentación señalada en los artículos 68 y 69 del presente reglamento, con lo que podrá dar curso al pago del subsidio
cd875ca_238	745	0.24976936664242344	), de 2005, en lo corresponda y siempre que no se contraponga con las normas del presente reglamento, para lo cual las menciones que en todas esas disposiciones se hacen a las EGIS, deben entenderse referidas al Prestador de Servicios de Asistencia Técnica a que alude el artículo 9° de este reglamento
59eda36_79	746	0.2495455288998747	Artículo 20º: Se prohíbe el baño en mar, río y lagunas del sector
1880295_32	747	0.24940281780996398	"Las propuestas de experiencias deberán entregarse en el formato ""Formulario de Presentación"" respectivo, adecuándose a los objetivos y exigencias técnicas descritas en las bases técnicas y sus documentos anexos"
fd6d180_30	748	0.24940281780996398	"Las propuestas de experiencias deberán entregarse en el formato ""Formulario de Presentación"" respectivo, adecuándose a los objetivos y exigencias técnicas descritas en las bases técnicas y sus documentos anexos"
93f3cbb_147	749	0.24935291561381678	- Le corresponderá a los Comités Técnicos Regionales efectuar proposiciones sobre las siguientes materias:
92bfebc_27	750	0.2493462151139989	cl, las que indicarán la jerarquización y ponderación de los criterios señalados en el artículo 6º, así como también contemplarán los tramos de los montos que se destinarán para los proyectos, en función de los criterios señalados en el artículo 12 de este decreto
eab951b_114	751	0.2491785436902365	Para determinar dichos metros cúbicos se considerará el proyecto
2bb3805_53	752	0.2491530592390594	), de 2015, según la Modalidad, Tipología y/o Clase de Proyecto de Aplicación de Subsidios, se describen en la tabla a continuación
d3b3f42_1046	753	0.24895061987594636	f) De las visitas técnicas a las Instalaciones de Abastecimiento Vehicular de CL, entre otras, EPPR, ETPR
5500459_240	754	0.24885039481207116	Se entenderá por Memoria, la exposición de los antecedentes, recursos, requerimientos, métodos de estudio y cálculo de las soluciones propuestas, la que deberá contener las bases técnicas que correspondan para el diseño de los proyectos de conformidad a lo establecido en este Manual:
88b7941_11	755	0.24882720973661154	Se aprueba Guía de certificación oficial de paratuberculosis bovina y documento de Especificaciones Técnicas
1adb72b_2032	756	0.24879012475318762	Nº 458/75 del Ministerio de Vivienda y Urbanismo, los requisitos para su otorgamiento y los contenidos técnicos y formales necesarios para acreditar su cumplimiento, serán los que se señalan en el presente artículo
89fee2b_3	757	0.2487412583660512	Que dicho Acuerdo fue adoptado en el marco del Acuerdo Básico sobre Asistencia Técnica, suscrito con las Naciones Unidas y diversas Agencias Especializadas de esa Organización, y del Acuerdo suscrito con el Fondo Especial de las Naciones Unidas sobre Asistencia del Fondo Especial, ambos publicados en el Diario Oficial de 24 de octubre de 1960,
9621394_3	758	0.2487412583660512	Que dicho acuerdo fue adoptado en el marco del Acuerdo Básico sobre Asistencia Técnica, suscrito con las Naciones Unidas y diversas Agencias Especializadas de esa Organización, y del Acuerdo suscrito con el Fondo Especial de las Naciones Unidas sobre Asistencia del Fondo Especial, ambos publicados en el Diario Oficial de 24 de octubre de 1960,
ca55203_3	759	0.2487412583660512	Que dicho Acuerdo fue adoptado en el marco del Acuerdo Básico sobre Asistencia Técnica, suscrito con las Naciones Unidas y diversas Agencias Especializadas de esa Organización, y del Acuerdo suscrito con el Fondo Especial de las Naciones Unidas sobre Asistencia del Fondo Especial, ambos publicados en el Diario Oficial de 24 de octubre de 1960,
5500459_2	760	0.24867357213357966	Que es necesario actualizar y regular de manera general las normas aplicables a los proyectos, construcción y puesta en servicio de las instalaciones domiciliarias de agua potable y de alcantarillado, estableciendo además sus disposiciones técnicas
8658e37_55	761	0.24864548382679663	Artículo 12º: Las condiciones técnicas a cumplir en el diseño de los elementos publicitarios según su tipología serán las siguientes:
0982088_157	762	0.24842132080141444	Cuando se trate de faenas de primera poda y raleo realizadas en forma separada, el valor de la asistencia técnica en terreno, se pagará en $11,452/ha por concepto de primera poda y $6,493/ha por concepto de raleo
92888bd_515	763	0.2483062479513729	El proyecto deberá ser licitado y adjudicado para su construcción, coordinadamente y en conjunto con la obra descrita en el numeral 2,4
2bb3805_376	764	0.24829396242452784	Dependiendo de la tipología y/o clase de proyecto en que se aplicará el subsidio, la FTO deberá cumplir con los siguientes requisitos:
a155bdf_33	765	0.24811556516625366	- Conocer de las reconsideraciones que se soliciten de las Actas de Recepción Técnica de Obras que denieguen la recepción técnica y de las resoluciones que declaren el abandono del proyecto (artículo 25, inciso final del Reglamento), informando a quien corresponda, de la resolución que en definitiva se adopte
d3123a5_218	766	0.24807321967616913	4 Mantenimiento de Instalaciones y Equipamiento del Sistema de Corrientes Débiles, de acuerdo a lo establecido en el artículo 2,6
9ae6c1c_119	767	0.24787450898587926	El proyecto de equipamiento y áreas verdes deberá considerar el diseño y ejecución de la totalidad de la superficie destinada a ello
a6ba1c5_76	768	0.24787450898587926	El proyecto de equipamiento y áreas verdes deberá considerar el diseño y ejecución de la totalidad de la superficie destinada a ello
a6ba1c5_82	769	0.24787450898587926	El proyecto de equipamiento y áreas verdes deberá considerar el diseño y ejecución de la totalidad de la superficie destinada a ello
abae644_56	770	0.24787450898587926	El proyecto de equipamiento y áreas verdes deberá considerar el diseño y ejecución de la totalidad de la superficie destinada a ello
ae6dc4d_74	771	0.24787450898587926	El proyecto de equipamiento y áreas verdes deberá considerar el diseño y ejecución de la totalidad de la superficie destinada a ello
ae6dc4d_80	772	0.24787450898587926	El proyecto de equipamiento y áreas verdes deberá considerar el diseño y ejecución de la totalidad de la superficie destinada a ello
4b668fc_148	773	0.24785897438020876	De conformidad a lo dispuesto en el artículo 16º del Reglamento de la ley 21,020, debiendo cumplir con los requisitos estipulados en los artículos 49º y 50º del reglamento de la misma
12a91a7_121	774	0.24779601189798695	Para estos efectos el postulante deberá presentar la documentación que respalde la aprobación, ejecución y recepción de dicho proyecto
52a3a10_183	775	0.24779601189798695	Para estos efectos el postulante deberá presentar la documentación que respalde la aprobación, ejecución y recepción de dicho proyecto
93f3cbb_210	776	0.24779601189798695	Para estos efectos el postulante deberá presentar la documentación que respalde la aprobación, ejecución y recepción de dicho proyecto
2bb3805_204	777	0.24773288569468066	Sólo en el caso que postulen simultáneamente en un mismo proyecto vivienda nueva más ampliación, se pagará el 100% de la asistencia técnica correspondiente a vivienda nueva y, tratándose de la ampliación, sólo un 25% de los servicios organización de la demanda, acreditación del terreno y/o propiedad y presentación del expediente de postulación; y elaboración y presentación del proyecto técnico y contratación de obras
1adb72b_2015	778	0.2476315325409082	a) Memoria técnica de características de construcción y ampliación;
93daad2_9	779	0.24744664995814625	b) La investigación y los proyectos de desarrollo tecnológico que propendan a la protección del suelo, de los recursos hídricos, de flora y fauna, y de los ecosistemas asociados al bosque nativo;
93daad2_22	780	0.24740731725830667	a) Las formalidades para la presentación de los proyectos;
695f34c_85	781	0.24738393094204225	e) Hito Relevante Nº 5: Entrada en Operación del Proyecto
59eda36_71	782	0.24735021693818426	Artículo 14º: Queda prohibida la extracción, captura, caza y comercialización de la avifauna que se encuentre en la reserva
d3123a5_267	783	0.24734350651742498	Seguridad y Vigilancia, de acuerdo a lo establecido en los artículos 1,10
37ca8b7_24	784	0.24693923092822723	c) La proposición de Bases Técnico Económicas presentada por la Concesionaria, recibida en la casilla electrónica tarifas@subtel
92888bd_1056	785	0.24686282008386606	El proyecto deberá ser licitado y adjudicado para su construcción, coordinadamente, y en conjunto con las obras descritas en los numerales 3,3
92888bd_1065	786	0.24686282008386606	El proyecto deberá ser licitado y adjudicado para su construcción, coordinadamente, y en conjunto con las obras descritas en los numerales 3,3
92888bd_1072	787	0.24686282008386606	El proyecto deberá ser licitado y adjudicado para su construcción, coordinadamente, y en conjunto con las obras descritas en los numerales 3,3
79859b9_46	788	0.2468356108340416	* Incluir un Estudio de Impacto Urbano y Ambiental del Proyecto
fa3143f_16	789	0.2467878356956803	- Que, el informe técnico agrega, que de la misma manera, mediante la resolución D
