b6866a3_6	731	0.25879015418274476	Que el Servicio Agrícola y Ganadero está facultado para establecer los requisitos fitosanitarios para la importación al país de artículos reglamentados, a fin de prevenir la introducción y dispersión de plagas reglamentadas
b7fba47_5	732	0.25879015418274476	Que el Servicio Agrícola y Ganadero está facultado para establecer los requisitos fitosanitarios para la importación al país de artículos reglamentados, a fin de prevenir la introducción y dispersión de plagas reglamentadas
cbb7f1e_16	733	0.25879015418274476	Que el Servicio Agrícola y Ganadero está facultado para establecer los requisitos fitosanitarios para la importación al país de artículos reglamentados, a fin de prevenir la introducción y dispersión de plagas reglamentadas
d117eab_13	734	0.25879015418274476	Que el Servicio Agrícola y Ganadero está facultado para establecer los requisitos fitosanitarios para la importación al país de artículos reglamentados, a fin de prevenir la introducción y dispersión de plagas reglamentadas
d8f2126_6	735	0.25879015418274476	Que el Servicio Agrícola y Ganadero está facultado para establecer los requisitos fitosanitarios para la importación al país de artículos reglamentados, a fin de prevenir la introducción y dispersión de plagas reglamentadas
d998b39_13	736	0.25879015418274476	Que el Servicio Agrícola y Ganadero está facultado para establecer los requisitos fitosanitarios para la importación al país de artículos reglamentados, a fin de prevenir la introducción y dispersión de plagas reglamentadas
e1cd5a7_5	737	0.25879015418274476	Que el Servicio Agrícola y Ganadero está facultado para establecer los requisitos fitosanitarios para la importación al país de artículos reglamentados, a fin de prevenir la introducción y dispersión de plagas reglamentadas
e3a54d8_8	738	0.25879015418274476	Que el Servicio Agrícola y Ganadero está facultado para establecer los requisitos fitosanitarios para la importación al país de artículos reglamentados, a fin de prevenir la introducción y dispersión de plagas reglamentadas
e72e28e_7	739	0.25879015418274476	Que el Servicio Agrícola y Ganadero está facultado para establecer los requisitos fitosanitarios para la importación al país de artículos reglamentados, a fin de prevenir la introducción y dispersión de plagas reglamentadas
f5431a6_3	740	0.25879015418274476	Que el Servicio Agrícola y Ganadero está facultado para establecer los requisitos fitosanitarios para la importación al país de artículos reglamentados, a fin de prevenir la introducción y dispersión de plagas reglamentadas
cd20008_371	741	0.258742185271468	Todo elemento, dispositivo o equipo, que por su modo de uso u operación es capaz de proveer, ya sea en forma permanente o esporádica, la energía térmica necesaria para encender mezclas de vapores de combustible y aire, entre otras, todo tipo de llamas, rayos, superficies calientes, calor radiante, cigarrillos y otros materiales para fumar, operaciones de corte y soldadura, arco eléctrico, material de ignición espontánea, calor debido a roce o chispas, chispas eléctricas y mecánicas, electricidad estática, corrientes vagabundas, hornos, calderas, artefactos para la calefacción o aire acondicionado
c349ac5_31	742	0.2587107912854242	8) Los agentes comercializadores y trasportistas que realicen movimiento del recurso Huiro negro (Lessonia berteroana) desde el sector de playa, además de los documentos tributarios y declaraciones de operación que acreditan el origen legal, deberán contar con una bitácora de pesajes con la siguiente información:
c7255b0_342	743	0.25866404474617766	En caso que el proyecto postulado esté emplazado en terrenos fiscales, municipales o de otros servicios públicos, se deberá presentar la autorización del propietario, tanto para ejecutar las obras en el terreno, como para que los interesados soliciten los permisos de edificación y la recepción final correspondiente
cf4bd92_62	744	0.2586437931783905	e) Transporte de material sin que los camiones cumplan las exigencias legales y administrativas de seguridad, tales como hacerlo sin la carpa protectora
f33e182_67	745	0.2580191100495953	"3, se entenderá por ""Nuevas Inversiones de Carácter Menor"" toda nueva obra, proyecto, estudio, equipamiento industrial, mobiliario no clínico o sistema industrial e informático no contemplado en el Contrato de Concesión y que pasará a formar parte de la Infraestructura, Equipamiento Industrial o del Mobiliario No Clínico de la concesión y del registro de bienes y derechos afectos a ésta, de acuerdo con lo establecido en el artículo 46 número 2 del Reglamento de la Ley de Concesiones; necesario para cubrir un requerimiento no previsto en el Contrato de Concesión y que diga relación con el objeto del mismo, cuyo valor individual de cada inversión, incluyendo el monto por concepto de mantención, reparación y reposición, la actualización de los planos as built, estos dos conceptos si correspondieren, y el IVA, no podrá ser superior a UF 3,500"
52ef3c0_37	746	0.25801827089955864	Del procedimiento de toma, obtención, manipulación, conservación, transporte y custodia de muestras y contramuestras del trigo
1d2ee3d_14	747	0.2579266245019798	Que, el Servicio Agrícola y Ganadero está facultado para establecer los requisitos fitosanitarios para la importación al país de artículos reglamentados, a fin de prevenir la introducción y dispersión de plagas reglamentadas
4c407fd_12	748	0.2579266245019798	Que, el Servicio Agrícola y Ganadero está facultado para establecer los requisitos fitosanitarios para la importación al país de artículos reglamentados, a fin de prevenir la introducción y dispersión de plagas reglamentadas
6751e64_14	749	0.2579266245019798	Que, el Servicio Agrícola y Ganadero está facultado para establecer los requisitos fitosanitarios para la importación al país de artículos reglamentados, a fin de prevenir la introducción y dispersión de plagas reglamentadas
d07395b_12	750	0.2579266245019798	Que, el Servicio Agrícola y Ganadero está facultado para establecer los requisitos fitosanitarios para la importación al país de artículos reglamentados, a fin de prevenir la introducción y dispersión de plagas reglamentadas
74c55bd_77	751	0.2578898884443728	, (iii) terminal marítimo SIT en la bahía de Tocopilla, perteneciente a Servicios Integrales de Tránsitos y Transferencias S
b9c811f_16	752	0.2575232940984695	Habilitación: Autorización dada por la autoridad sanitaria del país de destino o el SAG según corresponda, para que un establecimiento exportador de productos pecuarios pueda faenar, producir, elaborar, preparar, procesar, conservar y/o almacenar productos para un mercado o país determinado
dfe46c7_556	753	0.2574815827267736	Se prohíbe el uso de maquinaria de vinifi ación y vasijas fabricadas o revestidas con materiales que cedan sustancias tóxicas o cualquier otro componente indeseable a los mostos o al vino
079319b_64	754	0.25748100288208375	Artículo 15º: Los vehículos que transporten escombros producto de excavaciones o demoliciones y de material o elementos destinados a la construcción deberán ceñirse al siguiente horario para la carga y descarga:
08645ac_30	755	0.25739935730502106	Para tal efecto se debe considerar el tipo de medio de transporte de acercamiento al SI/CDI, unidad de transporte (contenerizada), acceso a la mercancía (superior, posterior, lateral), tipo de embalaje (tambor, maxibag, caja, bolsas, sacos, entre otras), condiciones especiales (mantención de la cadena de frío), entre otras
0663b0d_5	756	0.25722000611331164	- Que es necesario prohibir la extracción, transporte, comercialización, elaboración, traslado, procesamiento y tenencia de mariscos bivalvos provenientes del área geográfica señalada en el numeral I de lo resolutivo, tanto de bancos naturales como de centros de cultivo
96d27fd_5	757	0.25722000611331164	- Que es necesario prohibir la extracción, transporte, comercialización, elaboración, traslado, procesamiento y tenencia de mariscos bivalvos provenientes del área geográfica señalada en el numeral I de lo resolutivo, tanto de bancos naturales como de centros de cultivo
af60f9c_5	758	0.25722000611331164	- Que es necesario prohibir la extracción, transporte, comercialización, elaboración, traslado, procesamiento y tenencia de mariscos bivalvos provenientes del área geográfica señalada en el numeral I de lo resolutivo, tanto de bancos naturales como de centros de cultivo
0df2ca7_28	759	0.25699025733110914	Para acceder al beneficio de la patente especial el concesionario o arrendatario, en su caso, deberá contar con los permisos y servidumbres que fueren necesarios para explotar las pertenencias a que se refiere el inciso anterior
3434b51_424	760	0.25697834304977385	el valor correspondiente a los derechos relacionados con el uso de suelo y los gastos e indemnizaciones pagadas para el establecimiento de las servidumbres voluntarias o forzosas, entre otros
0b93061_3	761	0.2569295662356248	Artículo 2: Establécese las siguientes tarifas para el pago de los derechos por otorgamiento de Pasaportes Diplomáticos y Oficiales:
85d0f2a_111	762	0.25687597826892694	Asimismo, la Corporación deberá presentar al Ministerio un informe al 31 de diciembre de cada año, respecto de los movimientos de bienes muebles y variaciones físicas y valor monetario de los bienes corporales de uso incluidos en el inventario y la consecuente variación de los mismos, según los instructivos que el Ministerio establece para esos fines
f5394e1_105	763	0.25687597826892694	Asimismo, la Corporación deberá presentar al Ministerio un informe al 31 de diciembre de cada año, respecto de los movimientos de bienes muebles y variaciones físicas y valor monetario de los bienes corporales de uso incluidos en el inventario y la consecuente variación de los mismos, según los instructivos que el Ministerio establece para esos fines
06cbac6_114	764	0.2568514487238127	La Municipalidad podrá efectuar directamente el cobro del derecho de aseo a los predios exentos del pago de impuesto territorial o contratar el servicio con terceros
23f9ab3_118	765	0.2567786015039689	Artículo 25° Los vehículos que transportan escombros producto de excavaciones o demoliciones y de material o elementos destinados a la construcción deberán ceñirse al siguiente horario para la carga y descarga:
84b9120_3	766	0.2567227572928559	Que el Servicio se encuentra facultado para establecer los requisitos fitosanitarios para la importación al país de artículos reglamentados, a fin de prevenir la introducción y dispersión de plagas reglamentadas en el territorio nacional
72cff83_10	767	0.2566314641214815	- Traslados de funcionarios a sitios de inspección de productos agropecuarios de importación y exportación (Transferencia)
550f908_26	768	0.25657415787242077	d) Comercio: Exportación, reexportación, importación o introducción procedente del mar
bd52956_54	769	0.25642864704243284	Para los efectos de lo dispuesto en el inciso anterior, se entenderá por unidades instaladas, la instalación de ascensores, tanto verticales como inclinados, de funiculares, montacargas, escaleras o rampas mecánicas
532b09c_8	770	0.2563883835094687	Para los efectos de la presente resolución se entenderá por semillas o material vegetal de propagación destinados sólo para exportación, aquellos productos de post cosecha que sean destinados en forma íntegra a su exportación y que para tal efecto no cuenten con plaguicidas autorizados para su tratamiento fitosanitario
ce9b57f_6	771	0.2563883835094687	Para los efectos de la presente resolución se entenderá por semillas o material vegetal de propagación destinados sólo para exportación, aquellos productos de post cosecha que sean destinados en forma íntegra a su exportación y que para tal efecto no cuenten con plaguicidas autorizados para su tratamiento fitosanitario
173245a_10	772	0.25633866695993646	- Traslados de funcionarios a sitios de inspección de productos agropecuarios de importación y exportación (Transferencias)
e121350_8	773	0.2562767121520355	Que se ha desarrollado el Análisis de Riesgo de Plagas para Plagas Cuarentenarias de frutos frescos de palta para consumo, procedentes de los Departamentos de Moquegua, Tacna, Ica, Lima, La Libertad y Arequipa, de Perú, lo que ha permitido establecer los requisitos de importación,
52ef3c0_79	774	0.2561324307500006	Para la obtención, identificación, manipulación, conservación, transporte y custodia de muestras y contramuestras, se utilizarán los siguientes procedimientos:
5faa2a1_63	775	0.2561324307500006	Para la obtención, identificación, manipulación, conservación, transporte y custodia de muestras y contramuestras, se utilizarán los siguientes procedimientos:
96193f8_79	776	0.2561324307500006	Para la obtención, identificación, manipulación, conservación, transporte y custodia de muestras y contramuestras, se utilizarán los siguientes procedimientos:
cd875ca_199	777	0.25609492610448836	Si el postulante, su cónyuge o conviviente, acreditado en la Ficha CAS o en el instrumento que la reemplace con el cual postula, hubiesen obtenido del SERVIU, o de sus antecesores legales, o de las Municipalidades, o del Ministerio de Bienes Nacionales, o a través de los mecanismos del Impuesto Habitacional, una vivienda, o una infraestructura sanitaria, o un sitio, salvo que ese sitio sea parte del proyecto que se desarrollará; como tampoco si hubiesen adquirido o construido una vivienda con aplicación de un subsidio habitacional o de una subvención municipal, a través de cualesquiera de los sistemas que regulan o hayan regulado dichos beneficios, o con financiamiento proveniente de un préstamo habitacional obtenido del SERVIU o de sus antecesores legales, sea directamente o a través de cooperativas de vivienda
a4ac0fd_50	778	0.2560859388786467	a) Con multa de 2 a 100 Unidades Tributarias Mensuales a quien encargue el traslado o depósito, siempre que cualquiera de ellos se haya ejecutado
9dffc7f_14	779	0.2559944040927473	- Prohíbase la extracción, transporte, comercialización, elaboración, traslado, procesamiento y tenencia de mariscos bivalvos provenientes del área geográfica señalada anteriormente, tanto de bancos naturales como de centros de cultivo
c97bc22_14	780	0.2559944040927473	- Prohíbase la extracción, transporte, comercialización, elaboración, traslado, procesamiento y tenencia de mariscos bivalvos provenientes del área geográfica señalada anteriormente, tanto de bancos naturales como de centros de cultivo
cd10e40_15	781	0.2559944040927473	- Prohíbase la extracción, transporte, comercialización, elaboración, traslado, procesamiento y tenencia de mariscos bivalvos provenientes del área geográfica señalada anteriormente, tanto de bancos naturales como de centros de cultivo
d88cd53_13	782	0.2559944040927473	- Prohíbase la extracción, transporte, comercialización, elaboración, traslado, procesamiento y tenencia de mariscos bivalvos provenientes del área geográfica señalada anteriormente, tanto de bancos naturales como de centros de cultivo
1adb72b_953	783	0.2559080561091467	e) Aeropuertos, terminales de buses, camiones y ferrocarriles, vías férreas, estaciones de servicio, autopistas y los caminos públicos que puedan afectar áreas protegidas
5823444_22	784	0.25588992855499215	En caso de transporte marítimo, el envío deberá estar en contenedores o bodegas, y con envíos de similar condición fitosanitaria
2799ee4_129	785	0.25588834413753636	i) Cualquier otra materia que el asesor experto estime necesaria para cumplir su mandato de garantizar un acceso libre, objetivo y no discriminatorio a todas las instalaciones y servicios del terminal por parte de las empresas de servicio de transporte de pasajeros
3434b51_222	786	0.2558803754003064	- del presente reglamento respecto de los Tramos de Transporte que aún no hayan sido calificados, y que no cuenten con equipamiento que operativamente permita prescindir de los mismos
b7fba47_30	787	0.25587190433590834	Resolución que establece requisitos fitosanitarios y declaraciones adicionales: Acto administrativo de carácter fitosanitario dictado por el Servicio Agrícola y Ganadero, en base al resultado del Análisis de Riesgo de Plagas, que establece el manejo del riesgo de las plagas cuarentenarias identificadas y asociadas a la importación de artículos reglamentados, a través del establecimiento de requisitos fitosanitarios y declaraciones adicionales por tipo de material, especie vegetal y origen
381a3e7_4	788	0.25584642597054663	Que, se han adoptado todas las medidas pertinentes para el embalaje, transporte y seguros de la obra cuya salida se autoriza, y
64b769b_6	789	0.25573150220498153	Que se deberán adoptar todas las medidas pertinentes para el embalaje, transporte y seguros de las piezas cuya salida se autoriza, las que serán de cargo y responsabilidad de la Dirección de Bibliotecas Archivos y Museos y,
90d4553_5	790	0.25573150220498153	Que se deberán adoptar todas las medidas pertinentes para el embalaje, transporte y seguros de las piezas cuya salida se autoriza, las que serán de cargo y responsabilidad de la Dirección de Bibliotecas Archivos y Museos y,
1211173_17	791	0.2556049797403741	En caso de transporte aéreo, la partida deberá venir cubierta por malla tipo mosquitera y debidamente empacada, con sello o precinto en cada pallet; o en contenedores debidamente sellados
ea6944d_30	792	0.25550235483742656	La señal A dará cuenta de la existencia, dentro de la vía exclusiva, de una o más pistas de uso exclusivo para buses, en el costado derecho de la vía, quedando las restantes pistas para el uso exclusivo del resto de los móviles autorizados para hacerlo, incluidos los taxis y los propios buses
f805d78_3	793	0.25544855963947866	Que, para cumplir ese mandato legal, se encuentra facultado para establecer los requisitos fitosanitarios para la importación al país de artículos reglamentados, a fin de prevenir la introducción y dispersión de plagas reglamentadas
dfe46c7_82	794	0.2553933399529079	Material de propagación: Todo órgano vegetal y sus partes (rizomas, tubérculos, esquejes, raíces, corte de hoja o de tallo, yemas, entre otros) que se utilizan en la producción y propagación de plantas, incluyendo plantines o plántulas
1649ae6_28	795	0.2553522702274107	- Deberá existir un encargado del ganado para las operaciones de carga, transporte y descarga
04b4822_37	796	0.2553067577229773	c) Gastos en vehículos destinados a la ejecución de las labores de administración y fiscalización
06cbac6_67	797	0.2553067577229773	c) Gastos en vehículos destinados a la ejecución de las labores de administración y fiscalización
6c3cb89_37	798	0.2553067577229773	c) Gastos en vehículos destinados a la ejecución de las labores de administración y fiscalización
c586e8a_22	799	0.2553067577229773	c) Gastos en vehículos destinados a la ejecución de las labores de administración y fiscalización
5ab4b8f_30	800	0.2553018875943319	"""La obtención y constitución de los derechos de ocupación del suelo (título de dominio, servidumbres mineras, arrendamientos, etc"
5823444_21	801	0.2552992065507944	En caso de transporte terrestre, el envío deberá venir encarpado o en contenedores, lo cual permita asegurar la condición fitosanitaria del embarque y la no contaminación
5faa2a1_32	802	0.25515262323527055	Realizada la recepción del Lote y entregada la guía de despacho por el responsable del medio de transporte, se procederá a realizar el pesaje y/o cubicación y toma de muestra del producto, de manera separada o simultánea
96193f8_36	803	0.25515262323527055	Realizada la recepción del Lote y entregada la Guía de Despacho por el responsable del medio de transporte, se procederá a realizar el pesaje y/o cubicación y toma de muestra del producto, de manera separada o simultánea
96193f8_176	804	0.2551480075900704	La metodología para la obtención, manipulación, conservación, transporte y análisis de las muestras del maíz importado se realizará de conformidad con lo dispuesto en el Título II del presente Reglamento
1fff589_42	805	0.25511211206024065	Las vías que deberán usar los servicios de transporte público rural, prestados con taxis colectivos para ingresar y salir del lugar en la vía pública, ubicado en Av
92888bd_867	806	0.25499612574137354	El proyecto incluye todas las obras y labores necesarias para la ejecución y puesta en servicio, tales como adecuación de las protecciones, SCADA, obras civiles, montaje, malla de puesta a tierra y pruebas de los nuevos equipos, etc
255f43a_4	807	0.25484864302993515	a) Traslados de funcionarios a sitios de inspección de productos agropecuarios de importación y exportación (Transferencias)
ac421a2_4	808	0.25484864302993515	a) Traslados de funcionarios a sitios de inspección de productos agropecuarios de importación y exportación (Transferencias)
2b55309_9	809	0.2546796457850258	Inmovilización de materiales vegetales hospederos de Sirex noctilio, de los géneros botánicos Pinus, Pseudotsuga, Abies, Picea y Larix
2d89d00_9	810	0.25462634888580615	La necesidad de regular a través de un marco normativo respecto de los derechos y deberes vinculados con la protección del medio ambiente comunal, en relación con la extracción, procesamiento, comercialización y transporte de áridos en bienes nacionales de uso público de la comuna de Los Andes, con miras a contribuir a la debida protección de la calidad de vida de los ciudadanos, y a una correcta gestión ambiental en la comuna
cf4bd92_31	811	0.2542288486364106	Por lo mismo, será también obligatorio el cumplimiento de medidas de mitigación a todo evento, para el control de ruidos, emisión de material particulado, polvo en suspensión o caída de material durante el transporte del mismo
0702296_48	812	0.2541929611351028	En caso de transporte aéreo, el envío deberá venir cubierto por malla tipo mosquitera o cubiertos por plástico y debidamente empacado, con sello o precinto en cada pallet, o en contenedores debidamente sellados
d9bd42d_14	813	0.2541322086736766	Que es necesario establecer la participación de este servicio en la suscripción del cumplimiento de dichas normas oficiales, en lo relativo a los productos primarios, a fin de poder emitir los certificados de aptitud para el consumo humano de los productos destinados a la exportación
af5083d_6	814	0.25409604773488703	Que el mismo cuerpo legal señalado precedentemente define como mercadería peligrosa para los vegetales: Cualquier medio potencialmente capaz de constituir o transportar plagas y que plaga es: Cualquier organismo vivo o de naturaleza especial que, por su nivel de ocurrencia y dispersión, constituya un grave riesgo para el estado fitosanitario de las plantas o sus productos
f1ebd15_83	815	0.25391500152949353	"""La Corporación"" podrá contar para el cumplimiento eficiente de la responsabilidad de administrar el mencionado establecimiento educacional, además del aporte a que se refieren los incisos precedentes, con los recursos propios del plantel, el derecho de matrícula, derecho de escolaridad y el rédito del aporte fiscal, sin perjuicio de otros aportes voluntarios y o donaciones que pueda recibir"
06cbac6_18	816	0.2538944631545449	Por la expresión servicio se entenderá la recolección, transporte y disposición final de residuos sólidos domiciliarios, que no sobrepasen por usuario un volumen diario promedio de sesenta litros; por derechos de aseo a la tarifa que cobrará la Municipalidad por el servicio domiciliario por extracción usual y ordinaria de residuos sólidos domiciliarios; por usuario los inmuebles destinados a vivienda o unidades habitacionales (exentos y no exentos de impuesto territorial), los locales, oficinas, kioscos y sitios eriazos, afectos al cobro del servicio; y por unidad productora al usuario que produce residuos domiciliarios que no sobrepasen el volumen diario promedio de sesenta litros
3fa42ac_73	817	0.253756196414485	"El contratista recibirá la totalidad de los pagos generados por el concepto de comercialización de los productos de litio, incluyendo el impuesto al valor agregado (""IVA"") para las ventas que ocurran dentro de Chile"
a4ac0fd_64	818	0.25362538964349857	El vehículo que sea retirado de circulación en conformidad con el inciso precedente sólo será devuelto al propietario contra entrega del comprobante de pago de las multas respectivas y de los costos asociados al traslado y disposición de los Rescon
532b09c_17	819	0.2535764084700207	"h) Los productos tratados sólo estarán destinados a la exportación y los envases que las contengan serán rotulados con la leyenda ""Semillas/Material Vegetal de Propagación sólo para Exportación"""
20e94b6_4	820	0.25356308013046824	"""Artículo 12 :El cobro de las cuotas de este derecho a los predios exentos de impuesto territorial, se efectuará cada cuatro meses, los meses de mayo, julio, septiembre y noviembre"
71f93af_55	821	0.25350843286639235	* En caso de transporte terrestre, el envío deberá estar encarpado o en contenedores, lo cual permita asegurar la condición fitosanitaria del embarque y la no contaminación
8ca2290_36	822	0.25350843286639235	* En caso de transporte terrestre, el envío deberá estar encarpado o en contenedores, lo cual permita asegurar la condición fitosanitaria del embarque y la no contaminación
