1649ae6_38	268	0.3309525454489204	- La persona encargada de la manipulación y desplazamiento del ganado durante la carga, transporte y descarga deberá demostrar que se encuentra capacitada, mediante un curso en aspectos de manejo y bienestar animal, o que es profesional o técnico del área agropecuaria, que le permitan llevar a cabo estos cometidos de forma eficaz, evitando el dolor y sufrimiento innecesario
71753b7_321	269	0.3306675646673597	La dosis a aplicar será estimada en base a las pautas técnicas elaboradas por el Director Regional respectivo
71753b7_323	270	0.3306675646673597	La dosis a aplicar será estimada en base a las pautas técnicas elaboradas por el Director Regional respectivo
71753b7_325	271	0.3306675646673597	La dosis a aplicar será estimada en base a las pautas técnicas elaboradas por el Director Regional respectivo
7ba47f4_310	272	0.3306675646673597	La dosis a aplicar será estimada en base a las pautas técnicas elaboradas por el Director Regional respectivo
7ba47f4_312	273	0.3306675646673597	La dosis a aplicar será estimada en base a las pautas técnicas elaboradas por el Director Regional respectivo
7ba47f4_314	274	0.3306675646673597	La dosis a aplicar será estimada en base a las pautas técnicas elaboradas por el Director Regional respectivo
8c2c48c_320	275	0.3306675646673597	La dosis a aplicar será estimada en base a las pautas técnicas elaboradas por el Director Regional respectivo
8c2c48c_322	276	0.3306675646673597	La dosis a aplicar será estimada en base a las pautas técnicas elaboradas por el Director Regional respectivo
8c2c48c_324	277	0.3306675646673597	La dosis a aplicar será estimada en base a las pautas técnicas elaboradas por el Director Regional respectivo
bad8297_335	278	0.3306675646673597	La dosis a aplicar será estimada en base a las pautas técnicas elaboradas por el Director Regional respectivo
bad8297_337	279	0.3306675646673597	La dosis a aplicar será estimada en base a las pautas técnicas elaboradas por el Director Regional respectivo
bad8297_339	280	0.3306675646673597	La dosis a aplicar será estimada en base a las pautas técnicas elaboradas por el Director Regional respectivo
c1487d7_317	281	0.3306675646673597	La dosis a aplicar será estimada en base a las pautas técnicas elaboradas por el Director Regional respectivo
c1487d7_319	282	0.3306675646673597	La dosis a aplicar será estimada en base a las pautas técnicas elaboradas por el Director Regional respectivo
c1487d7_321	283	0.3306675646673597	La dosis a aplicar será estimada en base a las pautas técnicas elaboradas por el Director Regional respectivo
e7414a8_269	284	0.3301933121039381	Corresponderá a ODEPA velar por que la información que respecto de cada operador tengan INDAP y SAG, esté consolidada y disponible para los usuarios
a577c52_42	285	0.3292852781932629	Las especificaciones técnicas de dicha carpeta serán aprobadas por este Servicio de Salud, a propuesta de la Dirección de Vialidad del Ministerio de Obras Públicas o, en su defecto, por un profesional idóneo en la materia
a577c52_48	286	0.3292852781932629	Las especificaciones técnicas de dicha carpeta serán aprobadas por este Servicio de Salud, a propuesta de la Dirección de Vialidad del Ministerio de Obras Públicas o, en su defecto, por un profesional idóneo en la materia
43dd633_40	287	0.3290259437257612	9º Finalmente, se hace presente que, sin perjuicio de lo antes instruido y las demás acciones que esta Superintendencia estime conveniente, de acuerdo con lo preceptuado en el artículo 9º del DS 160/2008, las disposiciones contenidas en la reglamentación vigente no obstan a las demás medidas que corresponde tomar a los propietarios u operadores de las instalaciones de CL, para garantizar tanto su integridad como otras características técnicas relativas a la seguridad de éstas
2bb3805_140	288	0.3288290087462641	Dicho sistema se aplicará de acuerdo a las características particulares del proyecto y según la metodología establecida en el Manual de Inspección Técnica de Obras, aprobado por el MINVU, o el instrumento que lo reemplace
2bb3805_199	289	0.32859949857940474	Acerca del Tratamiento Particular de Servicios o de Proyectos que Contemplen Servicios Combinados de Asistencia Técnica y Fiscalización Técnica de Obras
2bb3805_169	290	0.32839597127614906	El pago correspondiente a los servicios de Asistencia Técnica, tanto para subsidios colectivos, como individuales, según corresponda, operará en cada caso, de la siguiente forma:
a33f788_62	291	0.32831480409633274	- Las notificaciones y comunicaciones dirigidas al Coordinador y al Solicitante que se efectúen en el proceso de autorización de la ejecución de instalaciones de transmisión que no forman parte de la planificación, se practicarán a través de medios electrónicos
e1040e8_130	292	0.3282190390536044	forestación, recuperación de suelos degradados, estabilización de dunas, poda y raleo se incrementará en $ 61,208/ha por concepto asesoría profesional, el que es desagregado en $ 38,561/ha por concepto de asistencia técnica en terreno y $ 22,648/ha por concepto de elaboración de estudios técnicos
f3e8d33_48	293	0.3282010542041629	Generar propuestas técnicas de actividades y planes de trabajo
2bb3805_23	294	0.3277515528320677	Para Proyectos correspondientes a los Títulos I y II del Programa de Habitabilidad Rural, la Asistencia Técnica comprende los siguientes servicios y actividades, según corresponda:
3297093_64	295	0.32771363740396064	Nómina de profesionales y técnicos que efectuaron directamente las labores de instalación, mantención o certificación, indicando su RUT y las funciones específicas realizadas por cada uno
ed1f15e_152	296	0.3276158008164731	Los operadores de las Plantas de GNL, deberán velar por su correcta operación, mantenimiento e inspección posterior a puesta en servicio, a objeto de desarrollar las actividades en forma segura, disminuyendo al máximo los eventuales riesgos que la operación presente para las personas y cosas
3297093_84	297	0.3274789224216972	En todo proyecto u obra en que intervenga el Mantenedor, mientras no cumpla con este requisito, deberá contar con la aprobación de un profesional o técnico de aquellos a que se refiere dicho artículo, quien deberá suscribir el informe respectivo
664379c_3	298	0.3273114481518634	3° Que de acuerdo con lo señalado, se deben adoptar medidas destinadas a garantizar que exista la capacidad técnica, operativa y administrativa de las personas, tanto naturales como jurídicas, que efectúan la inspección periódica de las instalaciones interiores de gas
e7414a8_927	299	0.3272218261732909	No obstante, será responsabilidad del beneficiario el conservar y mantener boletas, facturas, recibos o documentos originales que permitan acreditar los volúmenes y/o cantidades de insumos y servicios que ha debido adquirir de terceros para la correcta ejecución de las prácticas especificadas en el correspondiente Plan de Manejo
131f13b_19	300	0.3271886496370935	Se excluyen de la aplicación de esta reglamentación a los beneficiarios de Indap, quienes en esa calidad acceden en forma permanente a créditos, asistencia técnica y otros incentivos establecidos en su Ley Orgánica
a4ac0fd_26	301	0.3270348513286947	- El propietario del predio donde se emplaza la obra conjuntamente con el profesional competente acreditarán ante la Dirección de Obras Municipales al momento de solicitar su recepción municipal, que han dado cumplimiento a las disposiciones de la presente Ordenanza relativas al retiro, traslado y disposición de los residuos provenientes de ella
ce638af_485	302	0.3269614455114822	Para el caso de Planes de Manejo que comprendan más de una práctica o labor, o bien esté aprobada la ejecución de una misma práctica en etapas, el beneficiario podrá solicitar el pago parcial de las prácticas o sus etapas efectivamente ejecutadas antes de la fecha de término del Plan de Manejo o de su etapa anual
c7cac5b_45	303	0.3261163333736007	ee) Asimismo, se ha dado cumplimiento a lo dispuesto en los artículos 15º y siguientes de la ley 18,883, en el sentido de respetar la carrera funcionaria, ya que se contempla en las plantas de directivos, jefaturas, profesionales, técnicos, administrativos y auxiliares, existan distintos grados que permitan el ingreso en el último grado de la respectiva planta y con ello se concreta la posibilidad de ascender a las personas acorde a sus méritos
74d057e_186	304	0.3255300549567879	e) Tratándose de beneficiarios que hubieren postulado colectivamente y/o contratado las obras en forma colectiva, declaración jurada de los dirigentes del grupo en que se indique el grado de parentesco y/o de relación laboral que vincula a cada uno de los dirigentes con el constructor y con el prestador de servicios de asistencia técnica, cuando dicha función no sea cumplida por el Serviu;
93f3cbb_132	305	0.32543492664234674	1) Una vez realizadas las labores especificadas en el Plan de Manejo, el usuario podrá solicitar al Jefe de Area correspondiente hacer efectivo el beneficio
8de11b7_102	306	0.32527053314371557	Apruébase el proyecto técnico base de la solicitud presentado por la concesionaria, correspondiente a su propuesta relativa al proyecto El Carmen, Código 001554 en lo concerniente a los sistemas y equipos de telecomunicaciones autorizados en el presente decreto, conforme a las disposiciones técnico legales que rigen el servicio de telecomunicaciones concedido
1739c19_168	307	0.3252469255581827	"La Administradora se obligará a dar la publicidad adecuada al apoyo que reciban del ""Programa de Financiamiento a Fondos de Inversión de Capital de Riesgo para el Fomento Forestal y Maderero - Fondo Forestal y Maderero"", difundiéndolo de manera apropiada y visible, en los medios que empleen para promover sus actividades de acuerdo a los lineamientos de Corfo, y acreditar en conjunto con la información requerida en el Nº 9"
93f3cbb_104	308	0.32511353488425965	1) Calidad Técnica, se refiere a la coherencia técnica y económica entre las prácticas sugeridas en el Plan de Manejo y los objetivos del programa específico a desarrollar
d3b3f42_1031	309	0.3243464058695278	- Se deberán instalar letreros que describan las instrucciones para operar correctamente las unidades de suministro por parte del usuario
ce638af_378	310	0.32417219710502265	Los Planes de Manejo considerados admisibles administrativamente, serán objeto de una evaluación de pertinencia técnica, que corresponde a la cualidad de un Plan de Manejo de ser técnica, ambiental y económicamente factible de ejecutar, en cuanto a su oportunidad, costo, implementación y sustentabilidad
e7414a8_692	311	0.32417219710502265	Los Planes de Manejo considerados admisibles administrativamente, serán objeto de una evaluación de pertinencia técnica, que corresponde a la cualidad de un Plan de Manejo de ser técnica, ambiental y económicamente factible de ejecutar, en cuanto a su oportunidad, costo, implementación y sustentabilidad
c7255b0_33	312	0.3241610847073748	Entidad de Gestión Rural: Persona natural o jurídica, pública o privada, con o sin fines de lucro, cuyo objetivo es prestar Asistencia Técnica a los postulantes, desarrollando los proyectos contemplados en este Programa y presentarlos para ser aprobados por el SERVIU correspondiente
66ab9b6_17	313	0.32398853545018214	Un plano a escala, firmado por profesional o técnico competente, del predio rústico afectado, donde conste su superficie total y la parte de ésta correspondiente a pastos de uso ganadero, expresada en hectáreas
33c40e6_279	314	0.32398620455095617	- Los funcionarios traspasados conforme al artículo 10°, que sean titulares de un cargo directivo, profesional, técnico, administrativo y auxiliares, se encasillarán en cargos de igual grado al que detentaban a la fecha del encasillamiento, con excepción de lo señalado en la letra anterior, manteniendo el orden del escalafón de mérito
a33f788_55	315	0.3238855253560746	d) Garantías de fiel cumplimiento del cronograma de ejecución de obras y de las características técnicas de las mismas, en caso de corresponder
78115af_58	316	0.32370849936687307	Apruébase el proyecto técnico base de la solicitud presentado por la concesionaria, correspondiente a su propuesta relativa al Proyecto Gorbea, Código 002374 en lo concerniente a los sistemas y equipos de telecomunicaciones autorizados en el presente decreto, conforme a las disposiciones técnico legales que rigen el servicio de telecomunicaciones concedido
ea67edc_619	317	0.32353153779928945	En caso de autoconstrucción asistida se deberá entregar manual de ejecución confeccionado por la empresa que aprobó el sistema incluyendo detalles de conservación, mantención y capacitaciones respectivas
1575906_104	318	0.3232390480887384	- Respecto a cada propuesta recibida, cumplimiento de las Bases en sus aspectos técnicos y administrativos, determinando aquellas propuestas que son aptas para ser evaluadas por el jurado de acuerdo a los requisitos establecidos en las bases
ee4c230_7	319	0.3232031816503449	Que con el propósito de perfeccionar el procedimiento para la inspección de las instalaciones interiores de gas, esta Superintendencia dispuso un conjunto de medidas destinadas a garantizar que exista la capacidad técnica, operativa y administrativa de las personas, tanto naturales como jurídicas, que efectúan la inspección periódica de las instalaciones interiores de gas, entre las cuales se encuentra la acreditación de las Entidades de Certificación de Instalaciones Interiores de Gas
e737aea_3	320	0.32296393736569884	Que, el artículo 9º de la ley 20,925 establece que los indicadores de los impactos positivos en el aumento de la cobertura algal y de las condiciones para el desarrollo sustentable de la actividad económica en las zonas de intervención, serán establecidos mediante resolución del ministerio, previa recomendación de los grupos técnicos de asesores expertos, e informe técnico de la Subsecretaría
7cffd6b_159	321	0.3229200791721396	e) Módulo de Operación y Explotación, que permitirá ejecutar comandos relacionados con la administración técnica del SGP
565565e_62	322	0.322630946888919	Contar con un equipo técnico idóneo y capacitado para cumplir con los requerimientos del proceso de certificación
565565e_177	323	0.322630946888919	Contar con un equipo técnico idóneo y capacitado para cumplir con los requerimientos del proceso de certificación
256a069_20	324	0.32235724296853596	- Para su adecuado funcionamiento, el Consejo contará con:
695f34c_91	325	0.3223005052971665	La DP del CDEC-SIC, mediante auditorías técnicas de la ejecución del Proyecto, deberá supervisar el avance y cumplimiento de los hitos relevantes antes identificados, aprobar el cumplimiento de los mismos, e informar los eventuales incumplimientos de plazos y condiciones técnicas al Ministerio, para efecto que se hagan efectivas las garantías correspondientes
92d6297_8	326	0.3220633749323131	Que, asimismo, se requiere realizar diversas capacitaciones tanto prácticas como teóricas para verificar correctamente el cumplimiento de los requisitos de los planes de cosecha que el decreto establece
12c0ba4_50	327	0.32197387596588456	Iniciada la ejecución de las actividades, se deberá acreditar anualmente el grado de avance del plan respectivo, a través de un informe que señale las actividades ejecutadas y el cumplimiento de las medidas de protección, de acuerdo a las prescripciones técnicas contenidas en dicho plan, acompañado de la cartografía digital georeferenciada que fuere presentada con antelación
1f6ae9d_24	328	0.3217311506650389	-Fuerza ejercida por el trabajador durante la ejecución de las acciones técnicas necesarias para el cumplimiento de la tarea
34e689d_32	329	0.32165181756600814	b) Proponer orientaciones estratégicas y prestar apoyo técnico a los procesos de implementación de la política de los Biocombustibles
e7414a8_217	330	0.32162209373408546	Cuando el CTR lo estime conveniente, podrá también invitar a participar a personas representativas de operadores, laboratorios acreditados u otras personas relacionadas con el Programa, a fin de consultar su opinión sobre temas específicos
cd875ca_284	331	0.32110070698118465	No obstante lo anterior, por causas justificadas no imputables a la empresa constructora ni al Prestador de Servicios de Asistencia Técnica, se podrá prorrogar la vigencia de los Certificados de Subsidio, mediante resoluciones fundadas del SEREMI respectivo
a2b08ba_3	332	0.320935025944173	Que es necesario fijar las normas de funcionamiento del Consejo Consultivo del Bosque Nativo, que le permitan constituirse e iniciar sus actividades
14b1c87_239	333	0.3209021611663183	Si el Servicio rechazare el Plan de Cierre, indicará las correcciones, rectificaciones y modificaciones precisas y específicas que estimare procedentes al Plan de Cierre, a efectos de ajustar el mismo a las medidas técnicas necesarias conforme a la ley y el Reglamento
bb5d9d5_5	334	0.3205250566286151	Que la solicitud anterior, encuentra sustento en que estos vehículos, de la dotación institucional, realizarán revisiones y controles en terreno de los trabajos topográficos entregados por los consultores, a nivel nacional, lo que significa transportar maquinaria, herramientas y personal para realizar estas mediciones
58e0fc6_154	335	0.3204310083471227	Los abogados deben ayudar con sus consejos y sus conocimientos a los indigentes que ocurran a ellos solicitándoles protección y amparo legal
5058cc5_69	336	0.32002741303650406	Si en alguna región no hubieren operadores acreditados, la elaboración de los planes de manejo estará a cargo de funcionarios habilitados del SAG o del INDAP, según proceda
93f3cbb_50	337	0.32002741303650406	Si en alguna región no hubieren operadores acreditados, la elaboración de los planes de manejo estará a cargo de funcionarios habilitados del SAG o del INDAP, según proceda
e7414a8_933	338	0.3199589313837754	- Para el caso de Planes de Manejo que comprendan más de una práctica, o bien esté aprobada la ejecución de una misma práctica en etapas, el beneficiario podrá solicitar el pago parcial de las prácticas o sus etapas efectivamente ejecutadas, antes de la fecha de término del Plan de Manejo o de su etapa anual
c468332_36	339	0.3196364221642731	La Dirección de Obras Municipales verificará el cumplimiento de los requisitos señalados precedentemente y en caso de que el proyecto cumpla con las exigencias técnicas del caso, emitirá una certificación que dará cuenta de la autorización municipal para proceder a efectuar los trabajos de instalación
1a10f23_70	340	0.31959039646097465	El número de postulantes seleccionados alcanzará hasta el número de subsidios susceptibles de financiar con los recursos previstos en el resuelvo anterior, incluidos sus respectivos servicios de asistencia técnica, fiscalización técnica de obras y los subsidios complementarios, si corresponden
fbed789_51	341	0.31959039646097465	El número de postulantes seleccionados alcanzará hasta el número de subsidios susceptibles de financiar con los recursos previstos en el Resuelvo anterior, incluidos sus respectivos servicios de asistencia técnica, fiscalización técnica de obras y los subsidios complementarios, si corresponden
2bb3805_244	342	0.3193133473546659	En aquellos proyectos en los que aplique el subsidio para la discapacidad, sólo para los casos en que el beneficiario califique bajo esta condición, el monto adicional de Asistencia Técnica para el servicio de Elaboración y Presentación de Proyectos Técnicos y Contratación de Obras ascenderá a 3 UF por familia
b110551_15	343	0.3191413043486073	Adjuntar a la Solicitud de Autorización, en forma detallada, las características técnicas del equipamiento e instrumentación, con el fin de permitir su correcta identificación y condiciones de operación, debiendo al menos indicar lo siguiente:
6d02705_19	344	0.31887895386683685	2º La implementación práctica de esta medida será sometida a evaluaciones técnicas periódicas, a fin de efectuar, si fuere pertinente, las correcciones que eventualmente resulten necesarias
84bfbd9_30	345	0.3188417277110307	2006, se cuenta con la certeza técnica de que la prórroga de la postergación de permisos, permitirá dar término y promulgar el Plan Regulador Comunal de Hualpén
1649ae6_13	346	0.3181467584719233	Que corresponde al Servicio proponer disposiciones legales, reglamentarias y normas técnicas, y dictar las resoluciones necesarias para la consecución de los objetivos en las materias de su competencia
3434b51_567	347	0.317981495238266	Adjudicar a la Propuesta que sea la mejor combinación de factores técnicos y económicos, de conformidad a lo que se establezca en las Bases respectivas;
8c20f47_48	348	0.3179074241207609	Apruébese proyecto técnico presentado por la concesionaria, en lo relacionado con los sistemas y equipos de telecomunicaciones autorizados en el presente decreto, conforme a las disposiciones técnico legales que rigen el servicio de telecomunicaciones concedido
d899887_49	349	0.31776714131413697	incorpora sus requerimientos para adelantar las actividades clínicas en los nuevos hospitales del programa de concesiones y la evaluación favorable de éstos antecedentes expresadas por las coordinaciones técnicas de los respectivos Servicios de Salud, motivo por el cual da su opinión favorable y solicita que se dispongan los actos administrativos que se requieran para llevar adelante las medidas, planes y programación que se deriva de la Carta Nº 2030-MOP-13, de fecha 7 de febrero de 2013
cd875ca_221	350	0.31765585445937616	- Para el ingreso del Proyecto al Banco, se deberá acompañar un Proyecto de Asistencia Técnica y Social el cual comprende la habilitación del postulante, la elaboración del Proyecto Habitacional, el Plan de Habilitación Social y la gestión para la ejecución de las obras
93f3cbb_16	351	0.3172949674298635	l) Operador acreditado: Son los profesionales o técnicos que cumplen los requisitos establecidos en la ley y que se encuentran incorporados en los registros correspondientes
e7414a8_288	352	0.31700075439754893	especialidad que el postulante a operador desea acreditar; y
e089569_46	353	0.3167193827478456	Las Empresas Involucradas podrán formular observaciones de carácter técnico a los Estudios de Interconexión, las cuales serán evaluadas por el Coordinador y, en los casos que corresponda, puestas en conocimiento de la Empresa Solicitante
2e22c13_23	354	0.31667461003032815	Apruébase el proyecto técnico base de la solicitud presentada por la concesionaria, conforme a las disposiciones técnico legales que rigen el servicio de telecomunicaciones concedido
c18bb13_21	355	0.31667461003032815	Apruébase el proyecto técnico base de la solicitud presentada por la concesionaria, conforme a las disposiciones técnico legales que rigen el servicio de telecomunicaciones concedido
fd6d180_4	356	0.3166411209497928	Que, por su parte, el artículo 7 de la ley 18,956, establece que la División de Educación General contará con una unidad encargada de prestar apoyo técnico pedagógico a los establecimientos educacionales subvencionados y que reciben aporte del Estado, velando por el mejoramiento continuo de la calidad del servicio prestado por éstos y para el cumplimiento de dicha función deberá desarrollar estrategias e identificar y difundir las mejores prácticas en materias técnico pedagógicas, curriculares, administrativas y de gestión institucional a la asesoría que entrega el Ministerio de Educación
ce638af_158	357	0.31662850637305606	Los temas de las pruebas de suficiencia serán propuestos por cada CTR, según la especialidad que el postulante a operador desea acreditar; y
e7414a8_321	358	0.31659281021872365	Técnico, el plazo de ejecución de un Plan de Manejo podrá ser de hasta
a094c4d_48	359	0.3165900905907242	El Comité Ambiental Municipal, que podrá usar la sigla CAM, es una instancia asesora que tiene la función de apoyar diligentemente y deliberar en cuanto a decisiones a nivel comunal respecto a la Política Ambiental, las líneas estratégicas y todas aquellas acciones que lo ameriten, proponiendo las acciones que estime convenientes
9795dfb_151	360	0.31649856421959544	f) Parámetros técnicos que justifiquen la correcta ejecución de la actividad;
2bb3805_243	361	0.3163475570286305	Las obras adicionales que financiará el mayor monto de subsidio deberán estar consideradas en el proyecto de habitabilidad, debiendo la vivienda contemplar la implementación de obras que contribuyan a paliar tales limitaciones y cumplir además con los requerimientos establecidos en el Cuadro Normativo de Estándar Técnico de Habitabilidad Rural
d3b3f42_1027	362	0.31611140492055934	- El operador de una Instalación de Abastecimiento de CL desarrollará sus actividades sólo con personal debidamente capacitado en los procedimientos operacionales y de emergencia de la instalación, además de cumplir con los demás requisitos establecidos en el presente reglamento
5960769_17	363	0.3160655385673121	Apruébase el proyecto técnico base de la solicitud presentado por la concesionaria, conforme a las disposiciones técnico-legales que rigen el servicio de telecomunicaciones concedido
28477ef_60	364	0.31557284385438233	Para solicitar esta ayuda, deberá comprobarse la necesidad mediante un certificado extendido por el Servicio Público correspondiente, o por la persona técnico o profesional que la Comisión Nacional de Riego destine para tal efecto
