01e1622_110	343	0.25353762706215277	Los ingresos generados se destinarán al mantenimiento y funcionamiento de los inmuebles y se administrarán separados de los fondos que el Servicio de Bienestar destina al otorgamiento de beneficios a sus afiliados
fb9f67e_170	344	0.2534189727049144	Producto del análisis a que se refiere el presente artículo, se obtendrá la calificación definitiva de las instalaciones pertenecientes al sistema de transmisión nacional
0cf9d51_10	345	0.25338929707321967	- Que la detección de esta plaga en un cultivo podría comprometer gravemente el esfuerzo productivo y exportador del país
656570b_23	346	0.25330207485598333	Incorporar un sistema de pediluvio activo para el ingreso, salida y tránsito de las personas, en el área donde se realizan las labores de injertación o estén las plantas
6d8b3ba_29	347	0.2531231766361516	), 2015, se deberá acreditar al momento del ingreso al Sistema Informático Rukan, calculado al valor de la UF del 30 de noviembre del año en curso
cd20008_2248	348	0.2530495038784438	El techo móvil deberá usar sistemas de protección que eviten su deterioro en el tiempo, debido a la reposición de los cilindros
93f3cbb_109	349	0.2529826800266346	6) Comportamiento crediticio del interesado, que considerará los antecedentes que sobre este respecto tengan los postulantes que fueren o hayan sido usuarios del Sistema Crediticio de INDAP
7aad2ce_48	350	0.25297380403012215	El productor deberá tomar las medidas necesarias para evitar la presencia de plantas voluntarias
dfe46c7_618	351	0.2529675571823342	Debe llevar un sistema similar de registros para todas las ventas
9bb5e43_18	352	0.2527412085530847	Revisión del resguardo implementado para el traslado de frutos desde los lugares de producción a las empacadoras
f1fe763_24	353	0.25241450397098775	En las zonas abastecidas por sistemas de producción que incorporen la fluoruración del agua potable, el cargo CV1 se incrementará en 7,62 pesos por metro cúbico
a577c52_20	354	0.25238638635635	Sistema de lavado de vehículos que egresen desde galpón
131f13b_39	355	0.2520253296785553	Acreditar la calidad de beneficiario y de damnificado
e7414a8_191	356	0.2519086251451421	superficie podrá ser beneficiada hasta que se haya cumplido el Plan de
3d04ce3_11	357	0.2519064827649967	Las utilidades producto de esta colecta será destinado para apoyar a los pacientes con insuficiencia renal crónica
a8ac695_40	358	0.251680612248278	De los proyectos que se someten al Sistema de Evaluación de Impacto Ambiental (SEIA)
bf25048_182	359	0.2516356359627443	Considerar los sistemas naturales como soporte fundamental en la planificación y diseño de las intervenciones en el territorio
d3b3f42_251	360	0.2513102713236577	Para el diseño de los sistemas de venteo de tanques que cuenten con sistemas de recuperación de vapor debe utilizarse como presión interior máxima la indicada por el fabricante del sistema recuperador de vapores
f8ad8d0_47	361	0.2512733885377374	Conforme aquello, a continuación se presentan las labores de ampliación, referentes a obras realizadas en instalaciones del Sistema de Transmisión Troncal
aa75f37_3	362	0.25119915407338156	Que el Gobierno debe apoyar la recuperación de los activos dañados de los productores agrícolas afectados por las heladas
3434b51_143	363	0.25110094384016945	-, en cuyo caso el Tramo será calificado como perteneciente al Sistema de Transmisión Dedicado
3499081_323	364	0.2510643181179423	Luego, la sumatoria de estos aportes monetarios será dividida por la energía total regulada del respectivo sistema
4e83264_170	365	0.2510643181179423	Luego, la sumatoria de estos aportes monetarios será dividida por la energía total regulada del respectivo sistema
f8ad8d0_213	366	0.2510643181179423	Luego, la sumatoria de estos aportes monetarios será dividida por la energía total regulada del respectivo sistema
74d057e_232	367	0.25095093355690623	Si el producto del remate no alcanzare para cubrir el monto de ambos subsidios a que se refiere el inciso anterior, se restituirá al Serviu el saldo que restare después que el o los acreedores preferentes se paguen de su o sus créditos insolutos, intereses y costas
2bb3805_19	368	0.25093131270867963	- Del Sistema de Información Territorial de la Demanda, de Responsabilidad del SERVIU
bd2e63d_116	369	0.250875346041602	Si durante las inspecciones se detectara que la mantención no cumple con las condiciones como tal, la producción no se aceptará en el sistema de certificación
545dc02_9	370	0.25080679083605895	La sistematización de esta información aumentará la eficiencia y eficacia de la aplicación de los programas pecuarios, entregando un mejor servicio a los usuarios
3499081_16	371	0.2506965552302334	, y del Sistema Interconectado del Norte Grande, en adelante
418ca89_56	372	0.2506790680056976	pago de este beneficio, cuando curse estudios regulares de enseñanza
c7255b0_231	373	0.2504884780862833	Este subsidio cubrirá en todo o en parte la diferencia entre dicho producto y el valor par de las letras cuya emisión financia el crédito, con un monto máximo de hasta 80 Unidades de Fomento por operación
1739c19_270	374	0.2504720704927452	Sistemas y políticas de administración de los aportes, giros y otros;
92827d2_26	375	0.24912961382978194	Toda fábrica y planta elaboradora de alimentos y suplementos deberá disponer de los sistemas de registros que correspondan, y que den la garantía suficiente del cumplimiento de la presente resolución
630f624_8	376	0.24899678243470147	La necesidad de conservar el sistema global y mantenerlo libre de contaminación, incentivando la reposición de los suelos dañados por su explotación
776a525_8	377	0.24890427497347056	No obstante, la suspensión podrá ser levantada en la medida en que el Servicio evalúe positivamente, en origen, el sistema de producción y certificación fitosanitaria de los productos referidos y se fijen, en cada caso, los requisitos de importación para su ingreso al territorio nacional
131f13b_54	378	0.2488993382010698	Autorizar expresamente a Indap para usar la información financiera y económica generada por el crédito, en conformidad a las disposiciones legales vigentes
0839ce8_18	379	0.2488759403823707	Focalización, beneficiarios y requisitos del Subsidio Bono Leña
e7414a8_875	380	0.24878638388419616	efectiva la asignación de los recursos disponibles para la implementación
8867a3d_8	381	0.24854817287708242	4) Que, para mejorar la productividad es necesaria la optimización de los procesos ligados a los proyectos y operaciones, además de establecer incentivos ligados a resultados en conjunto con polifuncionalidad y flexibilidad para acordar jornadas de trabajo y sistemas de turnos más adecuados para la operación minera
c1487d7_349	382	0.24852368182151663	Artículo segundo: Derógase el decreto N° 23, de 2015, del Ministerio de Agricultura, que establece tabla de costos para el año 2015, que fija los valores de las actividades que se bonificarán en el marco del Sistema de Incentivo para Sustentabilidad Agroambiental de los Suelos Agropecuarios
cd875ca_7	383	0.24849189801920235	Banco de Proyectos, en adelante Banco: sistema de información para preparar y recibir los proyectos a que se refiere el presente reglamento
6588ed6_10	384	0.248272031886408	- Las utilidades producto de esta colecta, serán destinadas para apoyar a los pacientes con Insuficiencia Renal Crónica
faf0b7e_168	385	0.2479146358158011	Para que una poda resulte ventajosa debe ejecutarse con oportunidad y moderación
62124de_14	386	0.24790948982004934	Vicepresidente Ejecutivo de la Corporación de Fomento de la Producción
7584465_3	387	0.2477146291800295	- La conveniencia de fijar el texto refundido y sistematizado de esta Ordenanza,
d3b3f42_236	388	0.247267224340724	- En el caso de tanques verticales de techo fijo, dicho sistema podrá estar constituido por una junta débil techo-manto, la cual deberá ceder con preferencia a toda otra soldadura
8aa3262_33	389	0.24711166438862064	Las empresas deberán acreditar estar al día en el pago de las cotizaciones del Seguro de Desempleo
e7414a8_553	390	0.2468552805967561	como pequeño productor agrícola, conforme a lo dispuesto por el
a681ded_8	391	0.24665912221211306	Que los predios lecheros por su sistema productivo tienen mayor riesgo de difusión de la enfermedad, y que en Biblioteca del Congreso Nacional de Chile - www
f1fe763_27	392	0.24663068538507382	En las zonas abastecidas por sistemas de producción que incorporen la fluoruración del agua potable, el cargo CV2 se incrementará en 7,62 pesos por metro cúbico
244ed62_109	393	0.24632445308836837	En las zonas abastecidas por sistemas de producción que incorporen la fluoruración del agua potable, el cargo CV3 se incrementará 20,29 pesos por metro cúbico
58e0fc6_131	394	0.2460918637570081	Quien considere uno i otro sistema en su conjunto (
d2f9b79_464	395	0.24564345976105806	permitidos para su utilización en la elaboración de
3434b51_760	396	0.2454306012377756	En caso de que no existan empresas generadoras que se hayan visto afectadas negativamente, no se realizará la reasignación de Ingresos Tarifarios Reales
fcefde2_183	397	0.24536208631344536	Aporte de financiamiento reembolsable por capacidad de producción de agua potable ($/m3):
5626830_72	398	0.24520191915955047	Instalación de Sistema de Transmisión al Software DGA
0be5366_107	399	0.24508222558440762	Dicha planilla mantendrá la misma imponibilidad que aquella de las remuneraciones que compensa
418ca89_79	400	0.24439166804650403	- Para conceder un préstamo el Consejo Administrativo deberá considerar, especialmente, las posibilidades de recuperación de los dineros prestados
12c0ba4_22	401	0.24406495724978194	Asimismo, para obtener los beneficios que la Ley establece, se deberá contar con un plan de manejo aprobado por la Corporación
086db85_25	402	0.243839417519075	j) Premio en la evaluación de la oferta: Recompensa a que tiene derecho el postulante de un proyecto de iniciativa privada, que se licita por el sistema de concesión, que consiste en un puntaje adicional al obtenido en su oferta económica
e7414a8_253	403	0.24374465562009495	de sus Planes de Manejo, así como los montos máximos posibles a pagar por
1adf9ce_72	404	0.24330512624571332	Los costos del proceso de certificación serán de cargo del productor
d3b3f42_314	405	0.24326877687228854	a) Estos sistemas deberán ser impermeables a los CL
26b00aa_261	406	0.24282552949991187	Servicio Ecosistémico: contribución directa o indirecta de los ecosistemas al bienestar humano
e29c890_2	407	0.2427545825298496	2018, y por error del sistema de postulación no pudieron acreditarse al momento de la postulación
244ed62_191	408	0.2427421565075183	Aportes de financiamiento reembolsables por capacidad de producción de agua potable ($/m3): AFRP
d6b5576_93	409	0.2427421565075183	Aportes de financiamiento reembolsables por capacidad de producción de agua potable ($/m3): AFRP
f1fe763_51	410	0.2427421565075183	Aportes de financiamiento reembolsables por capacidad de producción de agua potable ($/m3): AFRP
74d057e_117	411	0.24262291526734248	Esta asistencia técnica es obligatoria para el beneficiario de este subsidio
cb1ceff_29	412	0.2426192537880867	Los sistemas del filtro sanitario deberán tener conexión directa al desagüe
0984111_126	413	0.242555037834419	Definición y Valor de los Costos de Capacidad por Sistema
e7548c2_99	414	0.242555037834419	Definición y valor de los costos de capacidad por sistema
0984111_145	415	0.24249047091516163	Valor máximo a cobrar por concepto de aportes de financiamiento reembolsable
244ed62_221	416	0.24249047091516163	Valor máximo a cobrar por concepto de aportes de financiamiento reembolsable
d6b5576_101	417	0.24249047091516163	Valor máximo a cobrar por concepto de aportes de financiamiento reembolsable
e7548c2_118	418	0.24249047091516163	Valor máximo a cobrar por concepto de aportes de financiamiento reembolsable
f1fe763_71	419	0.24249047091516163	Valor máximo a cobrar por concepto de aportes de financiamiento reembolsable
d9bd42d_15	420	0.2419237984098096	Que el establecimiento de un sistema de supervisión para el método de producción Orgánica es indispensable para la exportación de los productos orgánicos a los mercados internacionales de mayor relevancia para el país
cd875ca_1	421	0.24189480072186642	Artículo único: Apruébase el siguiente Reglamento del Sistema de Subsidio Habitacional Rural:
418ca89_17	422	0.24165177535743965	Estos beneficios serán informados a los socios a través de circulares
ce638af_5	423	0.2412450549270111	Que la referida Ley ha entregado la regulación de diversos aspectos, propios del sistema establecido, a un reglamento
e7414a8_5	424	0.2412450549270111	Que la referida ley ha entregado la regulación de diversos aspectos, propios del sistema establecido, a un reglamento
92888bd_517	425	0.2407886962310266	6 del Sistema D del presente decreto, en una misma licitación, con el objeto de que sean adjudicadas a un mismo oferente
dfe46c7_19	426	0.23983712587655792	f) Propender a un balance armonioso entre la producción de cultivos y la producción animal, y
c05ad89_43	427	0.23975691080828176	Para dichos efectos, la Superintendencia elaborará un programa de trabajo para incorporar progresivamente a los organismos sectoriales en el sistema de manera tal que se encuentre operativo para el año 2018
8aa3262_14	428	0.2396374925282473	a) Sistemas de Gestión de Calidad bajo la Norma ISO 9001
a577c52_18	429	0.2395399658879963	Sistema fijo de red de agua para nebulizar los concentrados minerales
bd2e63d_27	430	0.23950544242237737	Para ello, los productores deberán cumplir las siguientes exigencias:
dfe46c7_489	431	0.2393663721490208	El sustrato utilizado en la fase de producción se debe obtener mediante normas de producción orgánica
b9b7f6b_26	432	0.2389013769818561	participar en el mercado, apoyando la mejora de sus planes de trabajo para
eab951b_108	433	0.2388255254451117	Valor máximo a cobrar por concepto de aportes de financiamiento
2ce1de8_59	434	0.23866409528770882	vi) Contar con un sistema de control de la calidad interno que asegure el
2bb3805_381	435	0.23847951456180727	- Acerca del Procedimiento y Sistema de Pago de los Servicios de Asistencia Técnica y Pagos Complementarios
92888bd_846	436	0.23835765185980418	4 del Sistema C del presente decreto, en una misma licitación, con el objeto de que sean adjudicadas a un mismo oferente
92888bd_857	437	0.23835765185980418	4 del Sistema C del presente decreto, en una misma licitación, con el objeto de que sean adjudicadas a un mismo oferente
6f6307e_184	438	0.2383330896511755	Características de los sistemas de filtrado u otros sistemas de pretratamiento aplicados para la remoción de partículas suspendidas previo a la desinfección
1739c19_119	439	0.2382525027325909	Procederá el prepago del total de los préstamos otorgados por Corfo:
6f6307e_64	440	0.2378066022451265	Plan de contingencia ante fallas del sistema de desinfección
35d6c99_80	441	0.2376707352111418	Si se precisaren bancos de mayores dimensiones a las establecidas en esta ordenanza, se deberán incluir en el sistema de explotación propuesto, justificando la ingeniería del proyecto
dfe46c7_670	442	0.23762105898781627	Las instalaciones para envasar o embalar productos orgánicos se pueden encontrar fuera de la unidad productiva en que se obtienen las materias primas
aa75f37_16	443	0.2374027388560127	- Condiciones de los créditos que otorguen las instituciones financieras a los beneficiarios con los recursos otorgados por INDAP serán las siguientes:
047b8c5_265	444	0.2371770419047402	"El sistema de distribución corresponde a mangueras tipo ""Planza"" de mínimo 1""¼"
dfe46c7_348	445	0.23700498561379013	El número de animales debe ser acorde con la superficie del establecimiento, con la naturaleza de la especie de que se trate, con el objetivo de producción y con los sistemas de manejo utilizados
e7508a5_108	446	0.23696222018088864	Las empresas productoras de tabaco elaborado serán responsables de resguardar las marcaciones adquiridas, reportando a través de los sistemas de la empresa proveedora del sistema toda pérdida, deterioro, robo o cualquier otra situación que afecte la validez de las marcaciones
74d057e_218	447	0.23690167754984726	El máximo del monto de crédito residual con subsidio implícito que obtendrá el postulante no podrá exceder de 280 Unidades de Fomento
047b8c5_95	448	0.23678920497823608	Se sugiere ejecutar la labor en suelo seco a fin de mejorar la eficiencia
7ba47f4_72	449	0.23678920497823608	Se sugiere ejecutar la labor en suelo seco a fin de mejorar la eficiencia
83fb6c7_59	450	0.23678920497823608	Se sugiere ejecutar la labor en suelo seco a fin de mejorar la eficiencia
c1487d7_71	451	0.23678920497823608	Se sugiere ejecutar la labor en suelo seco a fin de mejorar la eficiencia
71753b7_316	452	0.23626164863625487	Se consideran tres densidades, según grado de cobertura, además, el plan de manejo deberá contener el desarrollo de un plan productivo para el área afecta al beneficio
7ba47f4_305	453	0.23626164863625487	Se consideran tres densidades, según grado de cobertura, además, el plan de manejo deberá contener el desarrollo de un plan productivo para el área afecta al beneficio
8c2c48c_315	454	0.23626164863625487	Se consideran tres densidades, según grado de cobertura, además, el plan de manejo deberá contener el desarrollo de un plan productivo para el área afecta al beneficio
bad8297_330	455	0.23626164863625487	Se consideran tres densidades, según grado de cobertura, además, el plan de manejo deberá contener el desarrollo de un plan productivo para el área afecta al beneficio
c1487d7_312	456	0.23626164863625487	Se consideran tres densidades, según grado de cobertura, además, el plan de manejo deberá contener el desarrollo de un plan productivo para el área afecta al beneficio
522fea8_52	457	0.23601892702875515	f) Los recursos con que cuenta cada equipo de trabajo, para mejorar la productividad en los procesos seleccionados
f1fe763_29	458	0.235927025483461	En las zonas abastecidas por sistemas de producción que incorporen la fluoruración del agua potable, el cargo CV3 se incrementará en 17,55 pesos por metro cúbico
4209c33_15	459	0.23576514590941822	- Declárase, fuerza mayor con el objetivo de postergar los muestreos requeridos para dar cumplimiento a la obligación de elaborar los informes ambientales (Infas), fundada en el terremoto y posterior tsunami que afectó a la comuna de Coquimbo, para todos los centros de cultivos con sistema de producción extensivos y sistemas de producción intensivos, cuyas especies autorizadas se alimenten exclusiva y permanentemente de macroalgas, emplazados en mar y/o tierra, siendo estos los siguientes:
0219260_56	460	0.23569857190829746	Si en el Sistema de Evaluación de Impacto Ambiental no se indicare la cantidad a extraer, el interesado deberá presentar una declaración jurada notarial donde indique la producción total estimada
fb9f67e_174	461	0.23528947488831298	Producto del análisis a que se refiere el presente artículo, se obtendrá la calificación definitiva de las instalaciones pertenecientes a los sistemas de transmisión dedicada y zonal
c7255b0_209	462	0.23512377710988752	Los créditos no se podrán caucionar con garantía general
3434b51_765	463	0.23499944906632297	La recaudación mensual total de cada segmento y sistema, se pagará a prorrata del V
92888bd_376	464	0.23437638386236048	El siguiente cuadro presenta las obras de ampliación necesarias para el Sistema A de Transmisión Zonal
b726b57_60	465	0.2342986837383929	En las zonas abastecidas por sistemas de producción que incorporen la fluoruración del agua potable, el cargo CV1 se incrementará en 3,37 pesos por metro cúbico
9ae6c1c_197	466	0.23429819198113178	Las familias beneficiadas con subsidios correspondientes al DS N° 1 (V
fcefde2_106	467	0.23427127397561343	En las zonas abastecidas por sistemas de producción que incorporen la fluoruración del agua potable, el cargo CV1 se incrementará en 22,37 pesos por metro cúbico
92888bd_865	468	0.23404873337219734	3 del Sistema C del presente decreto, en una misma licitación, con el objeto de que sean adjudicadas a un mismo oferente
d3b3f42_931	469	0.23398924713202862	- Se deberá disponer de un sistema de protección catódica para atenuar los efectos de la corrosión, preferentemente del tipo de corriente impresa
dfe46c7_264	470	0.23398798475837723	b) Los animales se deberán alimentar principalmente con productos de la unidad de producción
2ce1de8_21	471	0.23394903573090176	Requisitos para acreditar la representación del productor, agroindustrial e intermediario
35d6c99_71	472	0.23394768920484743	Con lo anterior, se presentará el sistema de recuperación de aguas de proceso de manera de minimizar su gasto durante la vida útil del proyecto
0500c5e_133	473	0.23385971052239274	(15) Información a reportar por cada sistema de abatimiento
2bb3805_108	474	0.23375730757826685	Para calcular el monto a pagar, se aplicará el sistema de pago señalado en el número 1 del artículo 3° de esta resolución
369f121_35	475	0.23367643889440237	ii) Copia del comprobante de recaudación (Core) del pago de la tarifa por concepto de renovación de la autorización de uso distinto, realizado de acuerdo al sistema tarifario vigente
ecf5ff3_218	476	0.23341001027808073	Los montos máximos a cobrar por concepto de aportes
92827d2_19	477	0.23329793419057343	Disponer de un sistema de empaque o envase y de almacenamiento y distribución que garantice una adecuada protección al producto terminado
e7508a5_139	478	0.2332860456516378	Nivel Básico: corresponde a la incorporación en el sistema de gestión de la información, hasta los datos de activación en línea de la producción e importación
e7414a8_525	479	0.23292517280577418	acompañados; que se compromete a asumir el pago de la diferencia del
c7255b0_283	480	0.23291744003723192	Para el caso de deudores de entidades financieras o sus cesionarias que no suscriban convenio a que se refiere el inciso anterior, el MINVU implementará un mecanismo a fin de hacer efectiva la aplicación del beneficio
5058cc5_279	481	0.23291028066905284	a) En primer término se agruparán los planes de manejo de predios que no hayan obtenido incentivos del Sistema y los que los hayan obtenido hasta por tres veces
93f3cbb_222	482	0.23291028066905284	a) En primer término se agruparán los planes de manejo de predios que no hayan obtenido incentivos del Sistema y los que los hayan obtenido hasta por tres veces
58820aa_17	483	0.23288040889208883	Clase 2R: Son suelos que presentan sólo ligeras limitaciones en su uso y de buena capacidad productiva
01e1622_72	484	0.2326297407138449	- Las personas designadas como beneficiarias por el
2d8b308_33	485	0.23260996701143433	r) Servicios ecosistémicos: contribución directa o indirecta de los ecosistemas al bienestar humano
58820aa_12	486	0.23256453574495817	Clase 1R: Son suelos sin limitaciones en su uso y con muy buena capacidad productiva
565565e_52	487	0.23240601697921182	Ser conservadas y mantenidas por Productores Mantenedores Registrados
15f9c97_197	488	0.23239986388707556	Porcentaje de financiamiento de parte del interesado Puntaje
586f4e7_228	489	0.23239269271625318	e) Concurrir, a solicitud de INDAP, a las evaluaciones de desempeño y categorización a través del sistema que el Instituto indique
5de4585_10	490	0.23233454264028253	Sistemas de Gestión de la Inocuidad de los Alimentos bajo Norma ISO 22000
aa75f37_154	491	0.23232169264297076	3) Los requisitos para acceder al beneficio de asistencia técnica serán los siguientes: a) tener su sistema productivo en una de las comunas declaradas como zona de catástrofe, b) acreditar que reúne los requisitos para ser calificado como mediano productor y c) inscribirse en alguna de las instituciones que prestarán asistencia técnica en su región
cc84fe7_147	492	0.2322483969361917	En el evento que se realice fluoruración, el costo de capacidad del sistema de producción se incrementará en 358,54 pesos, por metro cúbico el cargo CCP
b7925cf_11	493	0.23216488717132233	que se relacionen con los sistemas de riego por acequias de las principales avenidas de la comuna y mantenerlas en condiciones de uso
4b668fc_200	494	0.232149333917276	Deberá contar con un sistema de registro del movimiento de los animales del recinto, indicando claramente los ingresos y las salidas
50a8313_51	495	0.23209919588275763	Las menciones anteriormente indicadas serán de exclusiva responsabilidad del productor
565565e_55	496	0.23182101680256162	Bajo el Sistema de Certificación Varietal de Semillas de la Organización para la Cooperación y Desarrollo Económico (OECD)
013a174_11	497	0.23177946704000485	e) Un representante de la Corporación de Fomento de la Producción (CORFO);
19f0b36_51	498	0.23170647850961745	c) Sistema de agrupamiento: Postérguense los permisos de edificación asociados a sistema de agrupamiento continuo fijado en la Ordenanza Local
19f0b36_60	499	0.23170647850961745	c) Sistema de agrupamiento: Postérguense los permisos de edificación asociados a sistema de agrupamiento continuo fijado en la Ordenanza Local
12a91a7_131	500	0.23148154262848986	a) En primer término, se agruparán los planes de manejo de predios que no hayan obtenido incentivos del Sistema y los que lo hayan obtenido hasta por tres veces
5058cc5_2	501	0.23144051654807063	Que la actual regulación del sistema se encuentra contenida en el D
bac1377_7	502	0.23143089819611007	Deberán identificarse los productos y las áreas afectadas, separando los productos comprometidos del resto de la producción
