e7508a5_44	190	190	0.5655762859762429	Controlar que los productos importados para su comercialización en el país no sean extraídos de los recintos de depósito aduanero ni de los locales o recintos particulares para el depósito de mercancías habilitados por el Director Nacional de Aduanas de conformidad al artículo 109 de la Ordenanza de Aduanas, sin que hayan cumplido con la obligación de que sus productos tengan las correspondientes marcaciones y se encuentren activadas
5b5b0b0_20	191	191	0.5654698913464329	Lo anterior, sin perjuicio de la regla especial de imputación aplicable al armador titular de límite máximo de captura de Merluza común establecida en el artículo 16º letra b) del decreto exento Nº 1,675 de 2008, del Ministerio de Economía, Fomento y Reconstrucción
08645ac_122	192	192	0.5654486834025318	Una condición determinante para el diseño y ubicación del SI/CDI, es que el movimiento de cargas de importación no debe afectar a las de exportación, de ámbito SAG
e18d168_228	193	193	0.565411206918166	b) La autorizacion o renovacion a exportadores, 1/4 de SMM; y
c586e8a_43	194	194	0.5653788158481471	Artículo 10º: El cobro del derecho de aseo por vivienda o unidad habitacional se aplicará a aquellas propiedades que no se encuentren exentas en virtud del texto refundido y sistematizado del decreto ley Núm
86f240c_19	195	195	0.5652660702330924	"- Destínase y transfiérase al Servicio de Evaluación Ambiental el dominio de los bienes muebles de propiedad de la Comisión Nacional del Medio Ambiente que se detallan en el documento ""Inventario de Bienes Muebles Servicio de Evaluación Ambiental"", que se entiende formar parte integrante de este decreto"
1b355dc_3	196	196	0.5649651275397771	- La Ordenanza Local sobre Condiciones Necesarias para la Fijación de Tarifas del Servicio Domiciliario por la Extracción de Basuras y Exención Total y Parcial, de la I
630f624_21	197	197	0.5648718691208777	b) Dirección y Rol del Servicio de Impuestos Internos de el o los predio(s) de que se extraerán áridos
aac0b1b_26	198	198	0.5647549265420254	Que, el documento tributario que se presente para visación deberá contener, al menos, la siguiente información:
06cbac6_18	199	199	0.5645751557688459	Por la expresión servicio se entenderá la recolección, transporte y disposición final de residuos sólidos domiciliarios, que no sobrepasen por usuario un volumen diario promedio de sesenta litros; por derechos de aseo a la tarifa que cobrará la Municipalidad por el servicio domiciliario por extracción usual y ordinaria de residuos sólidos domiciliarios; por usuario los inmuebles destinados a vivienda o unidades habitacionales (exentos y no exentos de impuesto territorial), los locales, oficinas, kioscos y sitios eriazos, afectos al cobro del servicio; y por unidad productora al usuario que produce residuos domiciliarios que no sobrepasen el volumen diario promedio de sesenta litros
0c5f5ad_239	200	200	0.5642649187630788	Las edificaciones comerciales y de servicios contaran con un area de carga y descarga y area de estacionamiento y maniobras dentro de los limites de propiedad
