b6ffa9d_56	161	161	0.6345850693120246	El operador así autorizado, deberá mantener una contabilidad separada de la de sus actividades ordinarias o extraordinarias y los excedentes que se puedan generar por esta actividad deberán ser destinados únicamente a los fines de la ley, de manera que para estos efectos la actividad será sin fines de lucro
1739c19_179	162	162	0.6340678813359862	Opcionalmente, las Administradoras podrán optar por entregar como garantía, en las mismas condiciones establecidas anteriormente y con idéntico propósito, un vale vista, o un depósito a plazo renovable a favor de la Corporación
c7255b0_820	163	163	0.633519843486632	En los casos en que se acredite disponibilidad de terrenos fiscales en trámite de cesión por el Ministerio de Bienes Nacionales, el monto anticipable podrá alcanzar hasta el 100% del total de los subsidios sin la deducción señalada anteriormente
0df2ca7_14	164	164	0.632223180985594	La sociedad legal minera que se constituye por el solo ministerio de la ley, en los términos contemplados en el artículo 173 y siguientes del Código de Minería, que explota una o más pertenencias mineras, que cuenta con un número de dependientes no superior a 12 y en que cada socio trabaja personalmente en la explotación de las referidas pertenencias
99801b1_34	165	165	0.6318377664775476	Los terrenos son fiscales, por lo cual no se requerirá realizar expropiaciones
67240be_167	166	166	0.6316574718968888	10,3) La Sociedad Concesionaria, a su costa, restituirá al Ministerio de Obras Públicas todos los antecedentes de los estudios de impacto ambiental vinculados al contrato de concesión que obren en su poder y la RCA del mismo, todos los cuales se reconocerán de dominio exclusivo del Ministerio de Obras Públicas
f33e182_105	167	167	0.6315445278730446	(a) El precio unitario de cada una de las partidas involucradas en las actividades o Nuevas Inversiones de Carácter Menor que instruya realizar
0df2ca7_33	168	168	0.6314573931198607	La persona natural, que haya obtenido la certificación de minero artesanal o pequeño minero, que explote pertenencias mineras de las que es titular, con una superficie total máxima de 50 o 100 hectáreas, respectivamente, computándose para ello aquellas de que sean dueños o arrendatarios sus parientes por consanguinidad hasta el segundo grado o por afinidad hasta el tercero, en la misma comuna en que se ubican la o las pertenencias mencionadas
aa75f37_45	169	169	0.6308042782906204	El monto de dichos depósitos podrá ser expresado en pesos o unidades de fomento y devengarán intereses en favor de INDAP, de acuerdo a las condiciones establecidas en el Contrato de Administración
161bb8d_13	170	170	0.6305942293816785	e) Instrumento público o privado en que conste la transferencia de la bonificación, cuando el solicitante sea persona distinta del propietario del predio, en cuyo caso, no será necesario acreditar el dominio del predio
4e220b5_173	171	171	0.6305020698765114	Es la parte profunda del terreno a la cual no llegan los aprovechamientos superficiales de los predios y donde las leyes consideran estatuido el dominio publico, facultando a la autoridad gubernativa para otorgar concesiones mineras
0df2ca7_74	172	172	0.630310283276556	Vencido el plazo mencionado en el inciso anterior sin que el interesado presentare la solicitud de renovación, el beneficio se extinguirá automáticamente y, por consiguiente, la o las pertenencias deberán ser amparadas, a partir del período siguiente, mediante el pago de la patente a que se refiere el inciso primero del artículo 142 del Código de Minería
01e1622_110	173	173	0.6299507082734771	Los ingresos generados se destinarán al mantenimiento y funcionamiento de los inmuebles y se administrarán separados de los fondos que el Servicio de Bienestar destina al otorgamiento de beneficios a sus afiliados
3fa42ac_4	174	174	0.629565293305687	Que, asimismo, la Constitución Política dispone, en el inciso décimo del artículo 19 Nº 24, que la exploración, la explotación o el beneficio de los yacimientos que contengan sustancias no susceptibles de concesión minera, podrán ejecutarse directamente por el Estado o por sus empresas o por medio de concesiones administrativas o de contratos especiales de operación, con los requisitos y bajo las condiciones que el Presidente de la República fije, para cada caso, por decreto supremo
742f481_19	175	175	0.6291083203323118	Tarifa: Precio de compra determinado por Enami para la adquisición del mineral de los proveedores mineros
3eb7dca_25	176	176	0.62847568612714	- Es el documento que acredita a los otorgantes de instrumentos en los que constan gravamen o enajenacion de inmuebles comprendidos en los Distritos de Riego y Avenamiento que no adeudan cantidad alguna en concepto de cuotas o tarifas
742f481_46	177	177	0.6284599557713074	El precio a pagar a los Beneficiarios en la compra de minerales será igual a la suma de la Tarifa y el Componente de Sustentación
418ca89_66	178	178	0.6284046978657609	seguros contratados por la Empresa Nacional de Minería
586f4e7_39	179	179	0.6281484738655569	f) Certificado del organismo competente (Dirección del Trabajo) que acredite que no existen reclamos pendientes por remuneraciones y cumplimiento de obligaciones previsionales con sus trabajadores por más de un año o que, teniéndolas, se encuentra acogida a un convenio de pago con sus cuotas al día
d44820b_73	180	180	0.6278410220552879	garantias derivadas de la aplicacion de esta Ley, estaran exentas del pago de los derechos y tasas registrales y catastrales, asi como las transferencias a favor del Instituto Salvadoreño de Transformacion Agraria y las adjudicaciones que este realice de conformidad “con su Ley de Creacion y demas leyes aplicables
0df2ca7_19	181	181	0.6276570997415849	La sociedad legal minera que se constituye por el solo ministerio de la ley, en los términos contemplados en el artículo 173 y siguientes del Código de Minería, que explota una o más pertenencias mineras, que cuenta con un número de dependientes no superior a 6 y en que cada socio trabaja personalmente en la explotación de las referidas pertenencias
1739c19_112	182	182	0.6275804446436326	Los créditos otorgados por Corfo con cargo a la Línea y sus capitalizaciones podrán ser prepagados total o parcialmente, sin gastos adicionales
58e0fc6_284	183	183	0.6271852005977787	"Por lo mismo, ""la justa retribución debe entenderse referida como un concepto amplio, el que comprende tanto al trabajador independiente como al subordinado"" (Héctor Humeres, Derecho del Trabajo y de la Seguridad Social, Tomo I, p"
3fa42ac_47	184	184	0.6269038318071373	El Ministerio podrá, a su costo y sin entorpecer indebidamente las actividades que se desarrollen, solicitar una auditoría de los informes presentados por el contratista durante la fase de exploración y prospección
df1cb13_7	185	185	0.6261735927521033	"- c), referida a las ""Pólizas de Seguros de Garantía a Primer Requerimiento para Cierre de Faenas Mineras"", para cuyos efectos se requiere por parte del Servicio, una resolución exenta que apruebe el Condicionado General que haya sido incorporado al Depósito de Pólizas, que para estos efectos mantiene la Comisión para el Mercado Financiero (CMF)"
0df2ca7_81	186	186	0.625474110121441	Artículo décimo tercero: Para los efectos de lo dispuesto en los artículos 146 y siguientes del Código de Minería, el Servicio informará al Tesorero General de la República, en forma separada, aquellas concesiones mineras con patentes impagas amparadas con la patente especial, de aquellas que se rigen por la norma general del inciso primero del artículo 142 del citado Código
2bb3805_270	187	187	0.6249160466327607	El pago se efectuará a la EGR o a la empresa constructora o contratista, dependiendo de quién haya contratado el servicio, sólo contra la presentación y aprobación por el SERVIU del informe del estudio y demás antecedentes técnicos y administrativos que den cuenta de su completa realización, conforme al valor señalado en la documentación presentada, no debiendo superar dicho pago el monto máximo indicado
67240be_199	188	188	0.6248543264305311	- La Sociedad Concesionaria renuncia a toda acción o reclamación contra el Fisco de Chile y el Ministerio de Obras Públicas, que diga relación con el contrato de concesión terminado anticipadamente y de sus convenios complementarios y renuncia además a solicitar cualquier indemnización
d44820b_57	189	189	0.6247959923561379	Quedando unicamente a cargo de los beneficiarios de esta Ley, el pago
742f481_13	190	190	0.6247816307011438	Beneficiarios: Todos aquellos productores mineros que, cumpliendo con los requisitos establecidos en el artículo 2 de la ley, cumplan además con las normas de empadronamiento de Enami que los habilita como vendedores de minerales y productos mineros de cobre para la empresa
c52aa3f_29	191	191	0.6244628763955767	- Que, la declaración de zona de interés científico para efectos mineros mencionada en el artículo 17 del Código del Minería, tiene por finalidad establecer una prohibición a la facultad de catar y cavar, y de los derechos derivados de la concesión minera a su titular, teniendo como fin último la protección de intereses públicos
721cb00_6	192	192	0.6235490585686632	y Foote Minera e Inversiones Limitada, por una parte, y, con las empresas SQM Salar S
3aee665_14	193	193	0.6230141542150266	"""Sin perjuicio de lo anterior, para aquellas empresas mineras cuyo fin sea la extracción o beneficio de uno o más yacimientos mineros, y cuya capacidad de extracción de mineral sea superior a diez mil toneladas brutas (10,000 t) mensuales por faena minera, e inferior o igual a quinientas mil toneladas brutas (500,000 t) mensuales por faena minera, la vida útil del proyecto minero corresponderá al cálculo que se efectúe en función de los recursos minerales medidos, indicados e inferidos, certificados por una Persona Competente en Recursos y Reservas Mineras, conforme al Estudio de Diagnóstico, establecido en el Código para la Certificación de Prospectos de Exploración, Recursos y Reservas Mineras, de acuerdo a las disposiciones de la ley Nº 20,235"
8658e37_86	194	194	0.6226058774431594	podrá eximirse del requisito de firma del profesional responsable, recayendo la responsabilidad ante cualquier situación derivada de su instalación en y/o funcionamiento o daños a terceros, en el propietario del aviso
785e300_31	195	195	0.622521642253661	Esta obligación sólo es válida para aquellas instalaciones que hagan uso de bienes nacionales de uso público, terrenos fiscales o terrenos particulares, en virtud de servidumbres constituidas
880fead_27	196	196	0.622521642253661	Esta obligación sólo es válida para aquellas instalaciones que hagan uso de bienes nacionales de uso público, terrenos fiscales o terrenos particulares, en virtud de servidumbres constituidas
b60c35b_29	197	197	0.622521642253661	Esta obligación sólo es válida para aquellas instalaciones que hagan uso de bienes nacionales de uso público, terrenos fiscales o terrenos particulares, en virtud de servidumbres constituidas
c4740ea_34	198	198	0.622521642253661	Esta obligación sólo es válida para aquellas instalaciones que hagan uso de bienes nacionales de uso público, terrenos fiscales o terrenos particulares, en virtud de servidumbres constituidas
7cedf6a_24	199	199	0.6218908193872548	Artículo Segundo: Para poder ejecutar cualesquiera labores mineras en el área declarada como de interés científico para efectos mineros, los titulares de las concesiones mineras ubicadas en dicha área deberán contar el respectivo permiso a que se refiere el artículo 17 Nº6 del Código de Minería
c3b69cd_29	200	200	0.6218405003043627	Los poseedores no propietarios de un inmueble afecto al pago de tarifa de aseo domiciliario podrán beneficiarse de la exención referida en los artículos 38 y 39, sólo en el caso que estén obligados a pagarla en virtud del contrato, acto jurídico que los habilita a usar el bien raíz o, en el caso de no contar con aquellos instrumento, con una declaración jurada extendida ante Notario Público, en la que se indique que es poseedor del inmueble y que está obligado a responder por el pago de la tarifa de aseo domiciliario
