f33e182_99	87	87	0.5845821814630815	Los precios unitarios que constituyen dicho anexo consideran en su valor los costos de mano de obra, materiales y gastos generales, sin incluir el IVA, y podrán ser modificados y/o actualizados anualmente por el Inspector Fiscal, mediante anotación en el Libro de Explotación de la Obra o mediante Oficio, a solicitud de la Sociedad Concesionaria o por propia iniciativa, si considera que existen razones que fundamenten el cambio
fb48731_4	88	88	0.5845314463555228	de propiedad fiscal, compuesta por dos lotes A y B, en el sector Chacalluta Punta Gallinazo, para desarrollar un centro de almacenamiento de carga y terminal de servicios extraportuarios en la comuna de Arica, que permitirá atender el movimiento de mercancías a granel generadas por el comercio exterior y el transporte internacional;
43f0373_28	89	89	0.5845104218945303	TRATO NACIONAL: Conceder a las mercancias importadas un trato no menos favorable que el otorgado a las mercancias identicas o similares de origen nacional;
4a61160_35	90	90	0.5839167898292256	La madera de los embalajes y pallet, como también la madera utilizada como material de acomodación, deberá cumplir con las regulaciones cuarentenarias para el ingreso al país
4af4057_23	91	91	0.5839167898292256	La madera de los embalajes y pallet, como también la madera utilizada como material de acomodación, deberá cumplir con las regulaciones cuarentenarias para el ingreso al país
773687f_22	92	92	0.5839167898292256	La madera de los embalajes y pallet, como también la madera utilizada como material de acomodación, deberá cumplir con las regulaciones cuarentenarias para el ingreso al país
e27381d_16	93	93	0.5825578958175578	- Se deja constancia de que la exposición a que se refiere este decreto gozará de la exención de los impuestos fiscales y municipales que indica el artículo 1º de la ley Nº 11,534
0eab4fd_51	94	94	0.582297122306514	Las empresas o negocios dedicados a la compra de chatarra y/o venta de repuestos usados, tendran las mismas obligaciones mencionadas en el presente articulo
819398e_52	95	95	0.582297122306514	Las empresas o negocios dedicados a la compra de chatarra y/o venta de repuestos usados, tendran las mismas obligaciones mencionadas en el presente articulo
8e3b82d_52	96	96	0.582297122306514	Las empresas o negocios dedicados a la compra de chatarra y/o venta de repuestos usados, tendran las mismas obligaciones mencionadas en el presente articulo
9b804bd_26	97	97	0.582297122306514	Las empresas o negocios dedicados a la compra de chatarra y/o venta de repuestos usados, tendran las mismas obligaciones mencionadas en el presente articulo
b3d21c2_53	98	98	0.582297122306514	Las empresas o negocios dedicados a la compra de chatarra y/o venta de repuestos usados, tendran las mismas obligaciones mencionadas en el presente articulo
cd11969_58	99	99	0.582297122306514	Las empresas o negocios dedicados a la compra de chatarra y/o venta de repuestos usados, tendran las mismas obligaciones mencionadas en el presente articulo
d79b35d_50	100	100	0.582297122306514	Las empresas o negocios dedicados a la compra de chatarra y/o venta de repuestos usados, tendran las mismas obligaciones mencionadas en el presente articulo
f162ca0_51	101	101	0.582297122306514	Las empresas o negocios dedicados a la compra de chatarra y/o venta de repuestos usados, tendran las mismas obligaciones mencionadas en el presente articulo
30ba71c_40	102	102	0.5821155805439308	Propietario: Persona natural o juridica responsable de la actividad productiva, obra o proyecto avicola relacionado a la produccion, industrializacion, comercio y prestacion de servicio
785e300_31	103	103	0.5814048255145904	Esta obligación sólo es válida para aquellas instalaciones que hagan uso de bienes nacionales de uso público, terrenos fiscales o terrenos particulares, en virtud de servidumbres constituidas
880fead_27	104	104	0.5814048255145904	Esta obligación sólo es válida para aquellas instalaciones que hagan uso de bienes nacionales de uso público, terrenos fiscales o terrenos particulares, en virtud de servidumbres constituidas
b60c35b_29	105	105	0.5814048255145904	Esta obligación sólo es válida para aquellas instalaciones que hagan uso de bienes nacionales de uso público, terrenos fiscales o terrenos particulares, en virtud de servidumbres constituidas
c4740ea_34	106	106	0.5814048255145904	Esta obligación sólo es válida para aquellas instalaciones que hagan uso de bienes nacionales de uso público, terrenos fiscales o terrenos particulares, en virtud de servidumbres constituidas
ce638af_340	107	107	0.581361809003151	Tratándose de comuneros por sucesión hereditaria, copia autorizada del auto de posesión efectiva otorgado por el tribunal correspondiente o certificado de posesión efectiva emitido por el Servicio de Registro Civil e Identificación, según corresponda, y de la inscripción especial de herencia en el Conservador de Bienes Raíces correspondiente, respecto del predio objeto del subsidio
35b8443_63	108	108	0.5810116469274166	del infractor de la presente Ordenanza, a retirarlos mediante grua u otro transporte adecuado para tal efecto, sin perjuicio de la multa correspondiente
33c40e6_203	109	109	0.5808223023879615	- Traspásense los bienes que correspondan y sean necesarios para la debida implementación y funcionamiento de las Subsecretarías del Ministerio de las Culturas, las Artes y el Patrimonio, desde el Consejo Nacional de la Cultura y las Artes al fisco, para que sean destinados a dichas Subsecretarías
e7414a8_328	110	110	0.5794728413839033	En el caso de arrendatarios, comodatarios, usufructuarios y medieros, los
7092a6e_98	111	111	0.5793895081613855	En caso de transporte marítimo, y en los envíos que vengan en contenedores, bodegas y con envíos de similar condición fitosanitaria, se aceptará el uso de sellos comerciales; el número del sello y el número de identificación del contenedor deberán venir consignados en la Guía o Factura Comercial
2ee719a_15	112	112	0.5792327804774114	c) Ejecutar los trámites y gestiones necesarias para realizar el término de giro ante el Servicio de Impuestos Internos, pudiendo otorgar poderes especiales para este objeto
e7508a5_45	113	113	0.5791108414070623	Enviar al Servicio de Impuestos Internos la información necesaria para contar con la trazabilidad de los productos en la forma que se acuerde mediante convenio entre ambos Servicios
532b09c_10	114	114	0.5790869782115219	a) Individualizar el producto a exportar señalando país de destino, volumen a tratar, tipo y capacidad de los envases cuando corresponda, número de lote o partida y plaguicida a utilizar
ce9b57f_8	115	115	0.5790869782115219	a) Individualizar el producto a exportar señalando país de destino, volumen a tratar, tipo y capacidad de los envases cuando corresponda, número de lote o partida y plaguicida a utilizar
20e94b6_6	116	116	0.5789460650259743	"""Artículo 15: Quedan exentos de la obligación de pago establecida en esta Ordenanza los siguientes contribuyentes:"
72885ab_13	117	117	0.5787486540451235	Para materializar el envío al exterior de los servicios calificados como exportación en la presente resolución, sean escritos o magnéticos con exclusión de los envíos vía Internet y E-mail, la empresa beneficiada deberá dar cumplimiento a las exigencias y formalidades establecidas para las exportaciones, contenidas en el Capítulo IV del Compendio de Normas Aduaneras
c586e8a_76	118	118	0.5786866080767871	Artículo 23º: Los derechos a los cuales se refiere esta ordenanza corresponden a las extracciones usuales y ordinarias de residuos provenientes de los servicios domésticos
7238bd1_14	119	119	0.5785116172332946	El envío deberá estar libre de suelo y malezas cuarentenarias
70be962_39	120	120	0.578256534251742	Constituir el Fideicomiso de conformidad a las disposiciones de esta Ley, al Codigo de Comercio y demas leyes que resulten aplicables, en lo que no contrarien esta Ley;
61d03f5_21	121	121	0.5779614575834098	La madera de los embalajes y pallets, como también la madera utilizada como material de acomodación, deberán cumplir con las regulaciones cuarentenarias para el ingreso al país
7336e0c_22	122	122	0.5779614575834098	La madera de los embalajes y pallets, como también la madera utilizada como material de acomodación, deberán cumplir con las regulaciones cuarentenarias para el ingreso al país
917b388_19	123	123	0.5779614575834098	La madera de los embalajes y pallets, como también la madera utilizada como material de acomodación, deberán cumplir con las regulaciones cuarentenarias para el ingreso al país
e7508a5_67	124	124	0.5777187071154033	Para el control de los productos, tanto nacionales como importados, se instalará una marcación, que cumpla con las siguientes características, en el formato específico y bajo los parámetros establecidos por el Servicio de Impuestos Internos mediante resolución fundada
06cbac6_115	125	125	0.5770898722208139	Asimismo, podrá suscribir un convenio con el Servicio de Impuestos Internos y con el Servicio de Tesorerías para efectos de la emisión y despacho de las boletas de cobro
f7cbe02_29	126	126	0.5764614814415807	f) Se deja expresa constancia que, al término de la presente concesión, cualquiera sea la causa que la produzca, las mejoras introducidas en el inmueble quedarán a beneficio del Fisco, sin derecho a indemnización ni cargo alguno para éste, excepto aquellas que puedan retirarse sin detrimento del bien raíz
860c282_22	127	127	0.5761338901089679	La madera de los embalajes y pallets, como también la madera utilizada como material de acomodación deberán cumplir con las regulaciones cuarentenarias para su ingreso al país
0f03aa3_708	128	128	0.5756971884651587	: VENTA DE ARTICULOS COMERCIALES E INDUSTRIALES Actividades/Usos de Suelo Permitidos: No contempla usos permitidos para esta subcategoria
b1855c7_104	129	129	0.5756924332361093	Deléguese en la Dideco la facultad de evaluar y determinar conforme a los antecedentes socioeconómicos presentados por los postulantes el beneficio de exención o rebaja en el cobro de derechos de aseo domiciliario
ca327ce_113	130	130	0.5756355525288023	* Rol del Servicio de Impuestos Internos de la(s) propiedad(es) del proyecto y de la(s) propiedad(es) colindantes
2ef7a2d_72	131	131	0.5754799721228511	f) Autorizar el traslado temporal de los bienes adquiridos con la bonificación fuera del predio o del sistema de regadío (artículo 28, inciso 3º del Reglamento)
32b2220_23	132	132	0.5752821938552842	Establécense las siguientes regulaciones de importación para plantas, estacas y ramillas de las siguientes especies: Prunus avium, Prunus amygdalus (= P
78a302a_160	133	133	0.575131018989089	a) Cobro de tarifas a las personas usuarias del servicio, b) Las multas establecidas en el Capitulo sobre Disposiciones Sancionatorias
708b180_46	134	134	0.5750451907584263	Las empresas o negocios dedicados a la compra de chatarra o venta de repuestos usados, tendran las mismas obligaciones mencionadas en el presente articulo
c3b69cd_19	135	135	0.5747253216114749	- Los poseedores a cualquier título de un inmueble cuyo avalúo fiscal no supere las 500 UTM y que se encuentre afecto al pago de tarifa de aseo domiciliario, podrán solicitar la exención total, siempre y cuando registren Ficha de Protección Social o el instrumento o indicador socioeconómico que lo reemplace, vigente en la comuna y acrediten además alguno de los siguientes requisitos:
c349ac5_23	136	136	0.5746219495215058	4) Durante el traslado del recurso Huiro negro (Lessonia berteroana) y/o sus productos derivados, los agentes comercializadores y/o elaboradores deberán portar el documento tributario de traslado, junto con las declaraciones de abastecimiento, producción y/o destino correspondiente
1585c05_29	137	137	0.5741355986289359	Los costos de los análisis que el Servicio requiera efectuar a estos portainjertos, serán de cargo del importador
371e773_6	138	138	0.5740390950848818	a) De los impuestos a la renta y contribuciones territoriales que afecten a los bienes raíces de su propiedad
55fdbb4_393	139	139	0.5734958291310603	El propietario del inmueble receptor podra cobrar un estipendio razonable para los transportes que lleguen al sitio
71e0ae7_253	140	140	0.5734958291310603	El propietario del inmueble receptor podra cobrar un estipendio razonable para los transportes que lleguen al sitio
889f980_498	141	141	0.5734958291310603	El propietario del inmueble receptor podra cobrar un estipendio razonable para los transportes que lleguen al sitio
8e81fe2_493	142	142	0.5734958291310603	El propietario del inmueble receptor podra cobrar un estipendio razonable para los transportes que lleguen al sitio
a0a19ee_263	143	143	0.5734958291310603	El propietario del inmueble receptor podra cobrar un estipendio razonable para los transportes que lleguen al sitio
9462c2d_135	144	144	0.5730571794721865	Razones y disposiciones legales que fundamentan la imposicion de multa;  Orden de emision del mandamiento de ingreso que corresponda;
33c40e6_207	145	145	0.5730419823083339	Traspásense los bienes que correspondan y sean necesarios para la debida implementación y funcionamiento del Servicio Nacional del Patrimonio Cultural, desde la Dirección de Bibliotecas, Archivos y Museos al fisco, para que sean destinados a dicho Servicio
cd875ca_374	146	146	0.573012687456218	Si no se destinare el producto de la enajenación autorizada, a la adquisición de otra vivienda que reúna los requisitos, características y condiciones exigidos, dentro del plazo indicado, o no se constituyere la prohibición de enajenar respectiva dentro de ese mismo plazo, el SERVIU podrá hacer efectivo el depósito a plazo endosado a su favor para aplicar su valor a la restitución tanto del subsidio directo como del subsidio implícito recibidos y del subsidio a la originación, cuando corresponda, devolviendo al vendedor el excedente, si lo hubiere
c3b69cd_33	147	147	0.5729321205024597	- Las exenciones y rebajas a que se refiere este Título se concederán exclusivamente respecto de aquellos bienes raíces que estén destinados a habitación permanente del peticionario en cualquiera calidad jurídica
21dcf30_180	148	148	0.5729195157216432	Excepciones en la identidad de un propietario de semoviente
2b97317_137	149	149	0.5729195157216432	Excepciones en la identidad de un propietario de semoviente
6d0d8b5_22	150	150	0.5727961189998794	Los artículos que estén constituidos en parte por Sorgum vulgare, y sus otros componentes correspondan a artículos reglamentados (ejemplo: mangos de escoba de madera cepillados), deberán cumplir con lo establecido en la normativa vigente para su importación, de acuerdo a cada caso en particular
ad2f35f_23	151	151	0.5726755305352024	El envío debe venir libre de suelo y malezas cuarentenarias
6d8b3ba_57	152	152	0.5723913875819258	En los casos de los usufructos constituidos sobre tierras indígenas regidas por la ley Nº 19,253, para el pago del certificado de subsidio no será necesario constituir prohibición de enajenar o gravar sobre la vivienda construida con el subsidio, bastando acompañar declaración jurada de conocer el usufructuario las limitaciones que establece respecto de ellos la ley Nº 19,253, de conformidad con lo establecido en la letra a) del artículo 68 del DS 10 (V
e7414a8_518	153	153	0.5723476158019892	Tratándose de arrendatarios, medieros o aparceros y comodatarios, éstos
5058cc5_121	154	154	0.5722215567815194	Tratándose de comunero por sucesión hereditaria, copia del auto de posesión efectiva o de la inscripción especial de herencia en el Conservador de Bienes Raíces correspondiente, respecto del predio objeto del subsidio y declaración jurada del mismo sobre el uso efectivo que hace del predio
643a949_30	155	155	0.5710029477516256	Contraer prestamos internos y externos; Adquirir los bienes necesarios para su propio uso
941814b_54	156	156	0.5706460248659138	Art 16 Los vehiculos que transportan desperdicios, arena, ripio, tierra u otros materiales o mercaderias, ya sea solido o liquidos que pueda escurrir o caer en la cera publica, estaran constituidas o llevaran los dispositivos necesarios en forma que ello no ocurra; pero por si causa alguna se produjera el escurrimiento o caida de lo transportado debera el conductor o propietario del vehiculo asear la zona afectada
c7255b0_799	157	157	0.5705386827714438	En caso de acreditarse disponibilidad de terrenos fiscales en trámite de cesión por el Ministerio de Bienes Nacionales, para proceder a pagar el subsidio al contratista no será exigible el requisito de presentar los documentos señalados en las letras a) y b) precedentes
e7508a5_43	158	158	0.5702063389443824	Recibir información del Servicio de Impuestos Internos, en la forma que se acuerde entre ambos Servicios, a fin de controlar la internación de productos con marcaciones y su validez
17bb4a1_26	159	159	0.5699371768959455	La madera de los embalajes y pallet, como también la madera utilizada como material de acomodación, deberán cumplir con las regulaciones cuarentenarias para su ingreso al país
70be962_33	160	160	0.5697194117932318	Los bienes fideicomitidos podran utilizarse por el Fiduciario para los propositos establecidos en el articulo 1 de esta Ley, asi como para el pago de cualquier otro pasivo que el mismo posea de conformidad con lo establecido en esta Ley o en su escritura de constitucion
1ee01ea_11	161	161	0.569710651690322	Establécense los requisitos fitosanitarios para la importación, admisión temporal y tránsito de maquinaria usada
70c86d5_19	162	162	0.5696914940091674	b) Usos de Suelo: Postérgase los permisos de edificación asociados a equipamiento comercio con carga ocupación sobre 500 personas, servicentros y discotecas, independiente de la categoría de la vía que enfrenten
70c86d5_24	163	163	0.5696914940091674	b) Usos de Suelo: Postérgase los permisos de edificación asociados a equipamiento comercio con carga ocupación sobre 500 personas, servicentros y discotecas, independiente de la categoría de la vía que enfrenten
70c86d5_34	164	164	0.5696914940091674	b) Usos de Suelo: Postérgase los permisos de edificación asociados a equipamiento comercio con carga ocupación sobre 500 personas, servicentros y discotecas, independiente de la categoría de la vía que enfrenten
e7508a5_68	165	165	0.5691801514951348	Dicha marcación deberá permitir, visualmente o mediante elementos tecnológicos, como tinta termovirante, microtextos, tinta invisible, banda holográfica, hologramas o mecanismos semejantes, la comprobación de la validez del elemento distintivo y, a través de la utilización de dispositivos electrónicos genéricos o específicos, de manera remota o electrónica, tanto a consumidores como fiscalizadores, contar con información sobre el productor o importador así como también datos del origen del producto, impuesto pagado u otros que sean de interés fiscal o público que se definan por el Servicio de Impuestos Internos mediante resolución
d3123a5_437	166	166	0.5690999429959895	iv) El concesionario podrá explotar los Servicios Complementarios que sean aprobados por el Inspector Fiscal, de acuerdo a lo señalado en el artículo 1,10
8dbb961_126	167	167	0.5690594762813515	- Al término de la presente concesión, cualquiera sea la causa que la produzca, las mejoras introducidas en el inmueble quedarán a beneficio del Fisco, sin derecho a indemnización ni cargo alguno para éste, excepto aquellas que puedan retirarse sin detrimento del inmueble fiscal
fbddd70_41	168	168	0.5689672545158784	- Establécese, a contar desde el 1º de noviembre de 2000 y hasta el 31 de octubre de 2001, una rebaja que se aplicará a las sumas que correspondan pagar por concepto de derechos ad valórem del Arancel Aduanero, a la importación de los productos indicados en el artículo 1º
06cbac6_117	169	169	0.5685726625593445	No obstante, los usufructuarios, arrendatarios y, en general, los que ocupen la propiedad en virtud de un acto o contrato que no importe transferencia, no estarán obligados a pagar el derecho de aseo devengado con anterioridad al acto o contrato; efectuado el pago por el arrendatario, éste quedará autorizado para deducir la suma respectiva de los cánones de arrendamiento
d739811_10	170	170	0.5685726625593445	No obstante, los usufructuarios, arrendatarios y, en general, los que ocupen la propiedad en virtud de un acto o contrato que no importe transferencia, no estarán obligados a pagar el derecho de aseo devengado con anterioridad al acto o contrato; efectuado el pago por el arrendatario, éste quedará autorizado para deducir la suma respectiva de los cánones de arrendamiento
753300f_278	171	171	0.5684601382398347	- Se permitira el acopio temporal y exportacion de todo material separado proveniente de los residuos, especialmente de aquellos que por falta de tecnologia en el pais, no pueden ser reciclados o valorizados, siempre que se de cumplimiento con la normativa nacional e internacional correspondiente
d3b3f42_504	172	172	0.5682139466505577	- Sin perjuicio de lo establecido en los Títulos I al IV del presente reglamento, las instalaciones que reciben a granel CL para su almacenamiento, mezcla y/o envasado, para su posterior consumo o distribución, deberán cumplir, además, con las disposiciones del presente Título
e7414a8_657	173	173	0.5676160417363598	Certificación de avalúo fiscal de las propiedades postuladas a las
e7508a5_21	174	174	0.5673080141697295	El Sistema de Trazabilidad Fiscal deberá incorporarse en las líneas de producción o en los procesos productivos utilizados por los fabricantes e importadores de los bienes sujetos a control y contará con los siguientes componentes:
e7414a8_598	175	175	0.5672827335876368	autorización que para estos efectos otorgue el propietario, importará la
f1ebd15_45	176	176	0.5669723254220995	"""El Ministerio"", entrega el uso gratuito a ""la Corporación"", del inmueble individualizado precedentemente, que comprende tanto los edificios y construcciones, como el predio o terreno y los bienes muebles del Liceo que se detallan en el inventario anexo firmado por las partes, el que forma parte del presente convenio"
d4f4fe5_24	177	177	0.5667114360354603	"3,6 La madera de los embalajes y pallets, como también la madera utilizada como material de acomodación, debe estar libre de corteza; debiendo además cumplir con las regulaciones cuarentenarias para el ingreso de embalaje de madera"""
52ef3c0_99	178	178	0.5666518047906209	El número de guía de despacho, factura o cualquier otro documento similar aceptado por el Servicio de Impuestos Internos emitido por el productor o su representante;
0f03aa3_1125	179	179	0.5666024606281028	Actividades/Usos de Suelo Permitidos: Venta de equipos electricos, sanitarios, repuestos automotrices, equipo medico, ferreterias, venta de vehiculos, venta de muebles
265c79d_62	180	180	0.5666024606281028	ACTIVIDADES/USOS DE SUELO PERMITIDOS: Venta de equipos Electricos, Sanitarios, Repuestos automotrices, equipo medico, ferreterias, venta de vehiculos, venta de muebles
2947ddf_109	181	181	0.5666024606281028	ACTIVIDADES/USOS DE SUELO PERMITIDOS: Venta de equipos Electricos, Sanitarios, Repuestos automotrices, equipo medico, ferreterias, venta de vehiculos, venta de muebles
2947ddf_133	182	182	0.5666024606281028	ACTIVIDADES/USOS DE SUELO PERMITIDOS: Venta de equipos Electricos, Sanitarios, Repuestos automotrices, equipo medico, ferreterias, venta de vehiculos, venta de muebles
4781b04_28	183	183	0.5665591509897453	9,4 La madera de los embalajes y pallets, como también la madera utilizada como material de acomodación, debe estar libre de corteza; debiendo además cumplir con las regulaciones cuarentenarias para el ingreso de embalaje de madera
36b76c7_39	184	184	0.566080100270084	16,1 En caso de transporte terrestre, la partida deberá venir en contenedores con sello oficial, lo cual permita asegurar la condición fitosanitaria del embarque y la no contaminación
3434b51_448	185	185	0.5660166336754024	- Las sumas percibidas en exceso calculadas de acuerdo a lo señalado en el artículo anterior deberán ser descontadas de los ingresos que correspondan a los propietarios, arrendatarios, usufructuarios o quienes exploten a cualquier título las instalaciones pertinentes
74d057e_252	186	186	0.5659693697022763	Si no se destinare el producto de la enajenación autorizada a la adquisición de otra vivienda que reúna los requisitos, características y condiciones exigidos, dentro del plazo indicado, o no se constituyere la prohibición de enajenar respectiva dentro de ese mismo plazo, el Serviu podrá hacer efectivo el depósito a plazo endosado a su favor para aplicar su valor a la restitución tanto del subsidio directo como del subsidio implícito recibidos, devolviendo al vendedor el excedente, si lo hubiere
e53e3f3_20	187	187	0.5658701825495527	Déjase sin efecto el decreto supremo Nº 660, de fecha 6 de agosto de 2004, que aprueba el convenio complementario Nº 1 que modifica el contrato de concesión de la obra pública fiscal denominada ''Camino de la Madera'', por razones de buen servicio
fc7393e_230	188	188	0.5657288483255289	- Los Titulares de Licencias y Concesiones a que se refiere esta Ley, deberan cumplir con las obligaciones formales y sustantivas, en relacion a los impuestos fiscales y municipales, tasas y contribuciones que de acuerdo a las leyes respectivas se establecen; y los concesionarios ademas, a cumplir con el pago de Regalias
e7508a5_71	189	189	0.5657059418021962	Las marcaciones serán producidas y entregadas o incorporadas, según corresponda, por el proveedor del sistema, tanto para productores, fabricantes, importadores, elaboradores, envasadores, distribuidores y comerciantes, debiendo cumplir con el formato y procedimiento definido por el Servicio de Impuestos Internos
