3c9f2f3_3	83	83	0.6537192840567806	1º) Que, el artículo 23º de la Ley de la Renta establece un impuesto único a los pequeños mineros artesanales por las rentas provenientes de dicha actividad minera y que se aplica en relación a una escala de tasas conformada en base al precio internacional del cobre
41a18a6_4	84	84	0.6537192840567806	1º) Que, el artículo 23º de la Ley de la Renta establece un impuesto único a los pequeños mineros artesanales por las rentas provenientes de dicha actividad minera y que se aplica en relación a una escala de tasas conformada en base al precio internacional del cobre
5a7732c_1	85	85	0.6537192840567806	1º) Que, el artículo 23º de la Ley de la Renta establece un impuesto único a los pequeños mineros artesanales por las rentas provenientes de dicha actividad minera y que se aplica en relación a una escala de tasas conformada en base al precio internacional del cobre
5b8a7ca_1	86	86	0.6537192840567806	1º) Que, el artículo 23º de la Ley de la Renta establece un impuesto único a los pequeños mineros artesanales por las rentas provenientes de dicha actividad minera y que se aplica en relación a una escala de tasas conformada en base al precio internacional del cobre
81901ed_1	87	87	0.6537192840567806	1º) Que, el artículo 23º de la Ley de la Renta establece un impuesto único a los pequeños mineros artesanales por las rentas provenientes de dicha actividad minera y que se aplica en relación a una escala de tasas conformada en base al precio internacional del cobre
b0dc87a_2	88	88	0.6537192840567806	1º) Que, el artículo 23º de la Ley de la Renta establece un impuesto único a los pequeños mineros artesanales por las rentas provenientes de dicha actividad minera y que se aplica en relación a una escala de tasas conformada en base al precio internacional del cobre
a5e63c3_16	89	89	0.652878163105251	La base imponible de cada Contribucion Especial, atendiendo los principios de generalidad, equidad, capacidad contributiva y no confiscacion, es para CEL ya que es donde se realizaran los planes y acciones antes mencionados en las zonas aledañas a la Central Hidroelectrica Guajoyo
206b871_1	90	90	0.6527362077066577	1º) Que el artículo 23º de la Ley de la Renta establece un impuesto único a los pequeños mineros artesanales por las rentas provenientes de dicha actividad minera y que se aplica en relación a una escala de tasas conformada en base al precio internacional del cobre
8b78ff1_3	91	91	0.6527362077066577	1º) Que el artículo 23º de la Ley de la Renta establece un impuesto único a los pequeños mineros artesanales por las rentas provenientes de dicha actividad minera y que se aplica en relación a una escala de tasas conformada en base al precio internacional del cobre
41a18a6_5	92	92	0.6522314555334543	2º) Que, por otra parte, el Nº1 del artículo 34º de la Ley de la Renta, presume de derecho una Renta Líquida Imponible de Primera Categoría, determinada de acuerdo a una escala de tasas según el precio promedio de la libra de cobre en el año o ejercicio respectivo para los mineros de mediana importancia, que no sean pequeños mineros artesanales y con excepción de las sociedades anónimas, en comandita por acciones y de los contribuyentes señalados en el Nº2 del artículo anteriormente mencionado
9462c2d_69	93	93	0.6519048720042075	El o la interesado(a) con el permiso de funcionamiento se presentara al Catastro a inscribirse como contribuyente, so pena de efectuar Determinacion Tributaria de Oficio y la imposicion de las multas respectivas
4acdb9d_60	94	94	0.6514525025159532	Los costos derivados de la formulación de la postulación en que incurrirá el postulante serán de su cargo, no dando origen a indemnización alguna en caso de ser rechazada, desestimada o no considerada
f33e182_131	95	95	0.6512447466504881	(i) En cualquier caso, la Sociedad Concesionaria podrá subcontratar las actividades y Nuevas Inversiones de Carácter Menor correspondientes
3fa42ac_109	96	96	0.6507893652525695	Durante la vigencia del contrato el contratista no podrá vender, ceder, transferir, traspasar o disponer de todo o una parte de sus derechos estipulados en el contrato, durante cualquiera de las etapas contempladas en el mismo, salvo autorización escrita, previa y fundada del Ministro de Minería y previa aceptación en todo caso por parte del cesionario de las obligaciones comprendidas bajo este contrato
f33e182_99	97	97	0.6504390103617206	Los precios unitarios que constituyen dicho anexo consideran en su valor los costos de mano de obra, materiales y gastos generales, sin incluir el IVA, y podrán ser modificados y/o actualizados anualmente por el Inspector Fiscal, mediante anotación en el Libro de Explotación de la Obra o mediante Oficio, a solicitud de la Sociedad Concesionaria o por propia iniciativa, si considera que existen razones que fundamenten el cambio
f9f96ff_30	98	98	0.6498896544187338	La valorización eficiente por sistema dedicado resultante de la suma de la anualidad del valor de la inversión y de los costos de operación, mantenimiento y administración, separado por cada propietario u operador, en la parte que los usuarios sujetos a fijación de precios hacen uso de estas instalaciones; y iv
784d79f_3	99	99	0.6497744395706286	1°) Que, el artículo 23° de la Ley sobre Impuesto a la Renta establece un impuesto único a los pequeños mineros artesanales por las rentas provenientes de dicha actividad minera y que se aplica en relación a una escala de tasas conformada en base al precio internacional del cobre
8a9bc11_3	100	100	0.6494593537233617	1°) Que, el artículo 23º de la Ley de la Renta establece un impuesto único a los pequeños mineros artesanales por las rentas provenientes de dicha actividad minera y que se aplica en relación a una escala de tasas conformada en base al precio internacional del cobre
3fa42ac_67	101	101	0.6490571537310293	Se comprende en esta definición a las personas que: (a) reciben productos del Contratista en pago de créditos que hubiesen otorgado a este último o a precios preferentes; o (b) refiere el artículo cien de la Ley Nº 18,045, Ley de Mercado de Valores
8c9a951_1	102	102	0.6487084313975083	1º Que, el artículo 23º de la Ley de la Renta establece un impuesto único a los pequeños mineros artesanales por las rentas provenientes de dicha actividad minera y que se aplica en relación a una escala de tasas conformada en base al precio internacional del cobre
9795dfb_138	103	103	0.6485687872063262	c) Copia del Rol Único Tributario del titular del proyecto adjudicado o cesionario;
78a302a_56	104	104	0.6484028643858486	Adjudicar cuando lo estime conveniente, mediante justa retribucion los desechos solidos aptos para ser utilizados con fines industriales o agricolas a personas naturales o juridicas que cumplan con los requisitos que a tales fines sean establecidos
d739811_39	105	105	0.6483939667487518	Artículo 16º: Quedarán exentos automáticamente del pago por el servicio de extracción usual y ordinario de residuos domiciliarios aquellos usuarios cuya vivienda o unidad habitacional a la que se otorga el servicio, tenga un avalúo fiscal igual o inferior a 225 unidades tributarias mensuales
ce2bd55_102	106	106	0.6470822816514911	Para garantizar la indemnizacion por daños y perjuicios, el propietario de la obra y los otros operadores que la utilicen, estaran obligados a contratar un seguro contra todo riesgo que pudiera ocasionar la obra de su propiedad, cediendo los beneficios de la poliza de seguros a las personas afectadas por los daños, cualquiera que fuera la causa del accidente ocasionado por la obra
3996e2e_38	107	107	0.646603995315109	- Es financiado íntegramente por las empresas empleadoras, sin cargo para los trabajadores
206b871_2	108	108	0.6451760255232817	2º) Que, por otra parte, el Nº 1 del artículo 34º de la Ley de la Renta, presume de derecho una Renta Líquida Imponible de Primera Categoría determinada de acuerdo a una escala de tasas según el precio promedio de la libra de cobre en el año o ejercicio respectivo para los mineros de mediana importancia, que no sean pequeños mineros artesanales y con excepción de las sociedades anónimas, en comandita por acciones y de los contribuyentes señalados en el Nº 2 del artículo anteriormente mencionado
2981bfd_2	109	109	0.6451760255232817	2º) Que, por otra parte, el Nº 1 del artículo 34º de la Ley de la Renta, presume de derecho una Renta Líquida Imponible de Primera Categoría determinada de acuerdo a una escala de tasas según el precio promedio de la libra de cobre en el año o ejercicio respectivo para los mineros de mediana importancia, que no sean pequeños mineros artesanales y con excepción de las sociedades anónimas, en comandita por acciones y de los contribuyentes señalados en el Nº 2 del artículo anteriormente mencionado
3179729_2	110	110	0.6451760255232817	2º) Que, por otra parte, el Nº 1 del artículo 34º de la Ley de la Renta, presume de derecho una Renta Líquida Imponible de Primera Categoría determinada de acuerdo a una escala de tasas según el precio promedio de la libra de cobre en el año o ejercicio respectivo para los mineros de mediana importancia, que no sean pequeños mineros artesanales y con excepción de las sociedades anónimas, en comandita por acciones y de los contribuyentes señalados en el Nº 2 del artículo anteriormente mencionado
33c023b_3	111	111	0.6451760255232817	2º) Que, por otra parte, el Nº 1 del artículo 34º de la Ley de la Renta, presume de derecho una Renta Líquida Imponible de Primera Categoría determinada de acuerdo a una escala de tasas según el precio promedio de la libra de cobre en el año o ejercicio respectivo para los mineros de mediana importancia, que no sean pequeños mineros artesanales y con excepción de las sociedades anónimas, en comandita por acciones y de los contribuyentes señalados en el Nº 2 del artículo anteriormente mencionado
5a7732c_2	112	112	0.6451760255232817	2º) Que, por otra parte, el Nº 1 del artículo 34º de la Ley de la Renta, presume de derecho una renta líquida imponible de Primera Categoría determinada de acuerdo a una escala de tasas según el precio promedio de la libra de cobre en el año o ejercicio respectivo para los mineros de mediana importancia, que no sean pequeños mineros artesanales y con excepción de las sociedades anónimas, en comandita por acciones y de los contribuyentes señalados en el Nº 2 del artículo anteriormente mencionado
5b8a7ca_2	113	113	0.6451760255232817	2º) Que, por otra parte, el Nº 1 del artículo 34º de la Ley de la Renta, presume de derecho una renta líquida imponible de Primera Categoría determinada de acuerdo a una escala de tasas según el precio promedio de la libra de cobre en el año o ejercicio respectivo para los mineros de mediana importancia, que no sean pequeños mineros artesanales y con excepción de las sociedades anónimas, en comandita por acciones y de los contribuyentes señalados en el Nº 2 del artículo anteriormente mencionado
7e0a5a3_2	114	114	0.6451760255232817	2º) Que, por otra parte, el Nº 1 del artículo 34º de la Ley de la Renta, presume de derecho una renta líquida imponible de Primera Categoría determinada de acuerdo a una escala de tasas según el precio promedio de la libra de cobre en el año o ejercicio respectivo para los mineros de mediana importancia, que no sean pequeños mineros artesanales y con excepción de las sociedades anónimas, en comandita por acciones y de los contribuyentes señalados en el Nº 2 del artículo anteriormente mencionado
8a9bc11_4	115	115	0.6451760255232817	2º) Que, por otra parte, el Nº 1 del artículo 34º de la Ley de la Renta, presume de derecho una Renta Líquida Imponible de Primera Categoría determinada de acuerdo a una escala de tasas según el precio promedio de la libra de cobre en el año o ejercicio respectivo para los mineros de mediana importancia, que no sean pequeños mineros artesanales y con excepción de las sociedades anónimas, en comandita por acciones y de los contribuyentes señalados en el Nº 2 del artículo anteriormente mencionado
b0dc87a_3	116	116	0.6451760255232817	2º) Que, por otra parte, el Nº 1 del artículo 34º de la Ley de la Renta, presume de derecho una Renta Líquida Imponible de Primera Categoría determinada de acuerdo a una escala de tasas según el precio promedio de la libra de cobre en el año o ejercicio respectivo para los mineros de mediana importancia, que no sean pequeños mineros artesanales y con excepción de las sociedades anónimas, en comandita por acciones y de los contribuyentes señalados en el Nº 2 del artículo anteriormente mencionado
f9f96ff_29	117	117	0.6450299746601206	La valorización eficiente por sistema de transmisión zonal resultante de la suma de la anualidad del valor de inversión y de los costos de operación, mantenimiento y administración, separado por cada propietario u operador; iii
81901ed_2	118	118	0.6449416133116324	2º) Que, por otra parte, el Nº 1 del artículo 34º de la Ley de la Renta, presume de derecho una renta líquida imponible de Primera Categoría determinada de acuerdo a una escala de tasas según el precio promedio de la libra de cobre en el año o ejercicio respectivo para los mineros de mediana importancia, que no sean pequeños mineros artesanales y con excepción de las sociedades anónimas, en comandita por acciones y de los contribuyentes señalados en el Nº2 del artículo anteriormente mencionado
3d2bed3_238	119	119	0.6439324999243337	Segundo: Acuerdo de Indemnizaciones para compensar a la Sociedad Concesionaria por concepto de Montaje y Desmontaje de los Equipos
2f7642d_18	120	120	0.6438216114026443	Que, de acuerdo a lo establecido en el artículo 24 de la Ley N° 19,657, sobre Concesiones de Energía Geotérmica, las referidas concesiones pueden ser transferidas total o parcialmente a terceros mediante escritura pública, agregando dicho precepto que, otorgada que sea la escritura pública de transferencia, el nuevo concesionario se subrogará al concesionario anterior, por el solo ministerio de la ley, en las obligaciones y derechos de la concesión
714abe5_11	121	121	0.6438216114026443	Que, de acuerdo a lo establecido en el artículo 24 de la Ley N° 19,657, sobre Concesiones de Energía Geotérmica, las referidas concesiones pueden ser transferidas total o parcialmente a terceros mediante escritura pública, agregando dicho precepto que, otorgada que sea la escritura pública de transferencia, el nuevo concesionario se subrogará al concesionario anterior, por el solo ministerio de la ley, en las obligaciones y derechos de la concesión
086db85_34	122	122	0.6436484181844165	El uso accesorio será ofrecido por el concesionario bajo su exclusiva responsabilidad, pudiendo cobrar un precio o tarifa al usuario
e7414a8_334	123	123	0.6436427788086618	otorgue el propietario, importará la renuncia del mismo a los beneficios
8c9a951_2	124	124	0.6435472928983079	2º Que, por otra parte, el Nº 1 del artículo 34º de la Ley de la Renta, presume de derecho una renta líquida imponible de Primera Categoría determinada de acuerdo a una escala de tasas según el precio promedio de la libra de cobre en el año o ejercicio respectivo para los mineros de mediana importancia, que no sean pequeños mineros artesanales y con excepción de las sociedades anónimas, en comandita por acciones y de los contribuyentes señalados en el Nº 2 del artículo anteriormente mencionado
0df2ca7_80	125	125	0.643516411558435	y domicilio del arrendador, y la singularización exacta de la o las pertenencias objeto del contrato, en que se ubica la faena minera
0df2ca7_5	126	126	0.643500230210325	719, que establece una patente minera especial para pequeños mineros y mineros artesanales, a la vez que condona recargos legales y concede facilidades de pago para patentes atrasadas, que modifica el artículo 142 del Código de Minería, se hace indispensable la reglamentación de sus disposiciones, de manera tal, de facilitar el acceso de las personas a los beneficios establecidos en este precepto legal, así como hacer eficiente la gestión del Servicio Nacional de Geología y Minería, como órgano llamado al discernimiento, control y fiscalización de estos mismos beneficios; y
75f87e8_11	127	127	0.6433481820491282	d) Que, conforme al artículo 291-21 del Decreto Supremo Nº 327, de 1997 del Ministerio de Minería, Reglamento de la Ley y sus modificaciones, la Dirección de Operación del respectivo Centro de Despacho Económico de Carga (CDEC) y las empresas eléctricas no podrán discriminar arbitrariamente entre clientes en la aplicación de medidas que adopten respecto a las suspensiones de suministro, debiendo los programas de cortes asegurar duraciones similares de corte entre clientes, salvo la excepción prevista en ese mismo precepto;
d44820b_71	128	128	0.6428347774763533	- Para los efectos de esta Ley, se considerara como una sola obligacion crediticia el saldo de capital e intereses adeudados del, o de los creditos que las Asociaciones Cooperativas tengan, provenientes del valor de la tierra, adelantos ISTA, BFA, y deuda del FFRAP
8b78ff1_4	129	129	0.6426427593370428	2º) Que, por otra parte, el Nº1 del artículo 34º de la Ley de la Renta, presume de derecho una Renta Líquida Imponible de Primera Categoría determinada de acuerdo a una escala de tasas según el precio promedio de la libra de cobre en el año o ejercicio respectivo para los mineros de mediana importancia, que no sean pequeños mineros artesanales y con excepción de las sociedades anónimas, en comandita por acciones y de los contribuyentes señalados en el Nº2 del artículo anteriormente mencionado
e29032b_89	130	130	0.6425383890438091	Las partes acuerdan que se entenderá como Valor de Indemnización Total al pago que efectuará el MOP a la Sociedad Concesionaria por todos los efectos y costos asociados a la extinción del Contrato de Concesión, que se regula en el presente convenio
0df2ca7_32	131	131	0.6423450061670343	Artículo cuarto: Podrán optar al beneficio de la patente especial los siguientes concesionarios comprendidos dentro del concepto de Pequeño Minero o de Minero Artesanal, en los términos previstos por la ley 19,719 y en el presente Reglamento:
3fa42ac_32	132	132	0.6401388182081189	El objeto del contrato será autorizar al contratista para realizar, llevar a cabo y desarrollar en forma exclusiva, toda clase de actividades y labores de exploración, sobre las sustancias de litio ubicadas en el área del contrato, definida en el artículo 3º del presente decreto, como operaciones de explotación y beneficio sobre las sustancias de litio ubicadas en el área que se defina como consecuencia de las labores desarrolladas por éste en la fase de exploración y prospección, a cambio de una retribución y sujeto a un pago específico, con excepción de aquellas zonas cubiertas por concesiones mineras constituidas conforme al Código de Minería de 1932
2fdb0be_7	133	133	0.6386808805225536	Que de acuerdo a lo establecido en el artículo 24 de la ley Nº 19,657, sobre Concesiones de Energía Geotérmica, estas concesiones podrán ser transferidas total o parcialmente a terceros mediante escritura pública, agregando dicho precepto que, otorgada que sea la escritura pública de transferencia, el nuevo concesionario se subrogará al concesionario anterior, por el solo ministerio de la ley, en las obligaciones y derechos de la concesión
c7255b0_846	134	134	0.6379009375838908	No será exigible la boleta bancaria de garantía cuando exista un avance de obras igual o superior al monto total de anticipos solicitados, pudiendo el SERVIU pagar anticipos al contratista hasta por el valor del porcentaje de avance físico de obras conforme a lo señalado en el artículo anterior
88ad2ff_46	135	135	0.6371314655453205	a) Por Compensacion: Los propietarios que estuviesen de acuerdo aportaran los terrenos y se constituyen en Junta de Compensacion, salvo que todos los terrenos pertenezcan a un solo propietario
6d8b3ba_57	136	136	0.6370152544772688	En los casos de los usufructos constituidos sobre tierras indígenas regidas por la ley Nº 19,253, para el pago del certificado de subsidio no será necesario constituir prohibición de enajenar o gravar sobre la vivienda construida con el subsidio, bastando acompañar declaración jurada de conocer el usufructuario las limitaciones que establece respecto de ellos la ley Nº 19,253, de conformidad con lo establecido en la letra a) del artículo 68 del DS 10 (V
dab85da_75	137	137	0.6369584939031419	Ninguna ruptura de pavimento, excavación o trabajo en el subsuelo podrá ejecutarse en perjuicio de las obras, canalizaciones o instalaciones existentes, siendo de cargo del permisionario todos los destrozos, daños, gastos o indemnizaciones que se deriven de su obra
c735210_20	138	138	0.6368000501490364	e) Instrumento público o privado en que conste la transferencia de la bonificación, cuando el solicitante sea persona distinta del propietario del predio, en cuyo caso no será necesario acreditar el dominio del predio
047b8c5_37	139	139	0.6365693439903969	Esta práctica sólo considera la bonificación del valor del producto
047b8c5_40	140	140	0.6365693439903969	Esta práctica sólo considera la bonificación del valor del producto
71753b7_39	141	141	0.6365693439903969	Esta práctica sólo considera la bonificación del valor del producto
71753b7_45	142	142	0.6365693439903969	Esta práctica sólo considera la bonificación del valor del producto
7ba47f4_38	143	143	0.6365693439903969	Esta práctica sólo considera la bonificación del valor del producto
7ba47f4_42	144	144	0.6365693439903969	Esta práctica sólo considera la bonificación del valor del producto
83fb6c7_20	145	145	0.6365693439903969	Esta práctica sólo considera la bonificación del valor del producto
83fb6c7_23	146	146	0.6365693439903969	Esta práctica sólo considera la bonificación del valor del producto
8c2c48c_39	147	147	0.6365693439903969	Esta práctica sólo considera la bonificación del valor del producto
8c2c48c_43	148	148	0.6365693439903969	Esta práctica sólo considera la bonificación del valor del producto
bad8297_38	149	149	0.6365693439903969	Esta práctica sólo considera la bonificación del valor del producto
bad8297_42	150	150	0.6365693439903969	Esta práctica sólo considera la bonificación del valor del producto
c1487d7_37	151	151	0.6365693439903969	Esta práctica sólo considera la bonificación del valor del producto
c1487d7_41	152	152	0.6365693439903969	Esta práctica sólo considera la bonificación del valor del producto
2bb3805_258	153	153	0.636321530028825	El pago se efectuará a la EGR o a la empresa constructora o contratista, dependiendo de quién haya contratado el servicio, sólo contra la presentación y aprobación por el SERVIU del informe de el o los estudios y demás antecedentes técnicos y administrativos que den cuenta de su completa realización, conforme al valor señalado en la documentación presentada, no debiendo superar dicho pago el monto máximo indicado en este caso
fb9f67e_32	154	154	0.6361779263159272	"Di: Depreciación anual de los activos del tramo ""i"" determinada para efectos de la valorización de los impuestos a la renta que le correspondería pagar a la empresa eficiente, la cual se define de la siguiente forma:"
f33fed1_18	155	155	0.6360339469606789	g) Renta concesional: Suma, expresada en unidades de Fomento o la unidad que la reemplace, que deberá pagar el concesionario al Ministerio de Bienes Nacionales por el uso y goce de un inmueble fiscal otorgado en Concesión Turística, conforme lo dispuesto en el inciso cuarto del artículo 61 del decreto ley N° 1,939, de 1977 ,y su legislación complementaria
fc7393e_216	156	156	0.6360209204170986	- La Constitucion de Servidumbres a que se refiere esta Ley es temporal; su ejercicio e indemnizaciones que correspondan se estableceran por mutuo acuerdo entre el Titular y el propietario u ocupante del terreno, mediante Escritura Publica, que se inscribira en el Registro de la Propiedad correspondiente y se anotara en el Registro de la Direccion
e33e6ef_83	157	157	0.635759809792651	- Las personas naturales o juridicas que sean propietarias, administradoras o poseedores, que exploten comercialmente las fuentes de agua o pozos ubicados dentro de la jurisdiccion del municipio de San Cristobal, pagaran el respectivo tributo segun lo establezca en su momento, La Ordenanza Reguladora de Tasas por Servicios de la Villa de San Cristobal
67240be_178	158	158	0.6354024479949998	10,10) El Ministerio de Obras Públicas restituirá a la Sociedad Concesionaria todas las boletas de garantía y/o pólizas de garantía otorgadas con motivo del Contrato de Concesión, con la salvedad de que la Sociedad Concesionaria, previo a la restitución indicada en este punto, deberá garantizar suficientemente el pago de la multa de 200 UTM cursada por el MOP, actualmente reclamada en el cuaderno 3 que conoce esta H
0df2ca7_44	159	159	0.6350253224270709	c) Dejar constancia que, durante la vigencia del contrato respectivo, el pago de la patente minera será de cargo del arrendatario, en los términos y para los efectos establecidos en el inciso final del artículo 164 del Código de Minería
d739811_9	160	160	0.6348908657906125	Conforme lo establece el artículo 9 del DL Nº 3,063 sobre Rentas Municipales, el derecho de aseo será pagado por el dueño o por el ocupante de la propiedad, ya sea usufructuario, arrendatario o mero tenedor, sin perjuicio de la responsabilidad que afecte al propietario
