9646403_63	80	0.7592220963854847	f) desarrollar programas de educación ambiental in situ y en las zonas de amortiguamiento, respecto de los recursos naturales y culturales presentes en el área
7d43803_79	81	0.7589895163726806	b) Las políticas medio ambientales y de sustentabilidad que pudieran incidir en la política, plan o instrumento de ordenamiento territorial que se pretende implementar;
7d43803_82	82	0.7589790711143487	e) Las implicancias sobre el medio ambiente y la sustentabilidad que generarían las opciones de desarrollo planteadas en la presentación de la política, plan o instrumento de ordenamiento territorial;
15f9c97_7	83	0.75865028525772	Que la Ley Nº 20,283 tiene como objetivo la protección, recuperación y mejoramiento de los bosques nativos, con el fin de asegurar la sustentabilidad forestal y la política ambiental, haciendo necesario establecer diversas regulaciones y normas de protección ambiental
51bf5af_66	84	0.7584369351186913	a) Mantener áreas de carácter único o representativas de la diversidad ecológica natural del país o del lugar con comunidades animales o vegetales, paisajes o formaciones geológicas naturales, a fin de posibilitar la educación e investigación y de asegurar la continuidad de los procesos evolutivos, las migraciones animales, los patrones de flujo genético y la regulación del medio ambiente;
086db85_27	85	0.7581234643866547	l) Programa de conservación: Plan elaborado por el Instituto de las diferentes acciones de conservación que debe realizar el concesionario en beneficio de las instalaciones situadas en el área de la concesión
2c2ec8c_5	86	0.7576491065355507	Que se hace necesario armonizar y actualizar las normas reglamentarias sobre especies forestales declaradas monumento natural, con la ley sobre Bases Generales del Medio Ambiente y el Reglamento del Sistema de Evaluación de Impacto Ambiental, en cuanto éstos exigen que los proyectos o actividades susceptibles de causar impacto ambiental, deben someterse a dicho Sistema, garantizando la protección del medio ambiente, la preservación de la naturaleza y la conservación del patrimonio ambiental, mediante el cumplimiento de planes, medidas y acciones de mitigación, reparación y/o compensación que eliminen o mitiguen los efectos adversos que dichos proyectos o actividades pudieren tener
2c2ec8c_2	87	0.7575836619949647	Que la política ambiental para un desarrollo sustentable del supremo Gobierno, exige compatibilizar el desarrollo económico y social con la protección del medio ambiente
15b1a56_7	88	0.7563513564849548	Que el objetivo de la señalada ley es la protección, recuperación y mejoramiento de los bosques nativos, con el fin de asegurar la sustentabilidad forestal y la política ambiental
c8b1297_2	89	0.7562630518614506	Que, la ley N° 20,283, sobre Recuperación del Bosque Nativo y Fomento Forestal tiene como objetivos la protección, la recuperación y el mejoramiento de los bosques nativos, con el fin de asegurar la sustentabilidad forestal y la política ambiental
26b00aa_130	90	0.7555021073684903	En materia de inversión se considera relevante adecuar las normas y metodologías a las características de los espacios rurales, centrando las iniciativas en la competitividad y sustentabilidad de los territorios
2d8b308_5	91	0.7537196747590227	"Que, una de las directrices de la resolución 70/1 de la Asamblea General de las Naciones Unidas consiste en ""proteger el planeta contra la degradación, incluso mediante el consumo y la producción sostenibles, la gestión sostenible de sus recursos naturales y medidas urgentes para hacer frente al cambio climático, de manera que pueda satisfacer las necesidades de las generaciones presentes y futuras"
77fd10b_57	92	0.7534028543918798	Mantener áreas de carácter único o representativas de la diversidad ecológica natural del país o del lugar con comunidades animales o vegetales, paisajes y formaciones geológicas naturales, a fin de posibilitar la educación e investigación y de asegurar la continuidad de los procesos evolutivos, las migraciones animales, los patrones de flujo genético y la regulación del medio ambiente;
60881e6_7	93	0.7532819356439165	Que el Servicio Agrícola y Ganadero tiene por objeto la protección y conservación de los recursos naturales renovables que inciden en el ámbito de la producción agropecuaria del país
739c6f2_300	94	0.7527353867682754	"- El ""Parque Nacional Isla Magdalena"" tendrá como objetivo general de Protección, la preservación de una muestra de los ecosistemas de Bosques Húmedos Templados, asegurando su biodiversidad y sus procesos evolutivos"
ce638af_131	95	0.7514591201554134	k) Proponer prácticas que favorezcan la biodiversidad, vinculadas directamente a las propiedades del suelo, posibles de incorporar al Programa y que contribuyan a la sustentabilidad de los suelos
d38c3d2_24	96	0.7514577463271802	Que la consagración de estos terrenos para fines de conservación y protección ofrece una valiosa oportunidad para integrar la educación ambiental y la participación ciudadana, así como valorar el trabajo desempeñado por instituciones públicas, privadas y comunitarias en el proceso de estudio y propuesta de la unidad de manejo para este predio;
0185327_3	97	0.7506625150311653	Que la Ley Nº 20,283 sobre Recuperación del Bosque Nativo y Fomento Forestal tiene como objetivos la protección, la recuperación y el mejoramiento de los bosques nativos, con el fin de asegurar la sustentabilidad forestal y la política ambiental
051d513_35	98	0.7503671778574805	Dicho plan contendrá las acciones concretas para hacer efectiva la protección y conservación del área, además de los responsables de su ejecución
6556153_45	99	0.7503671778574805	Dicho plan contendrá las acciones concretas para hacer efectiva la protección y conservación del área, además de los responsables de su ejecución
874aae4_28	100	0.7503671778574805	Dicho plan contendrá las acciones concretas para hacer efectiva la protección y conservación del área, además de los responsables de su ejecución
