079319b_6	73	0.6266055792735246	Artículo 1º: Las obras de construcción, reconstrucción, reparación, alteración, ampliación y demolición de edificios y obras de urbanización, se regirán por las normas contempladas en la presente Ordenanza, sin perjuicio de las normas contenidas en la Ley General de Urbanismo y Construcciones, en la Ordenanza General de Urbanismo y Construcciones, en la Ordenanza Local del Plan Regulador y en las demás normas legales y reglamentarias que fueran aplicables
e7508a5_36	74	0.6262910670293439	Autorizar a los contribuyentes, según sea procedente y de conformidad a los artículos 1º y 7º de la Ley Orgánica del Servicio de Impuestos Internos contenida en el DFL Nº 7, de Hacienda, de 1980, y al artículo 6º letra A) del Código Tributario, la compra de marcaciones, pudiendo revocar esta autorización o restringir la cantidad de las mismas que pueden ser adquiridas, mediante la comunicación con los sistemas implementados por el proveedor del sistema
f7cbe02_29	75	0.6262035005790861	f) Se deja expresa constancia que, al término de la presente concesión, cualquiera sea la causa que la produzca, las mejoras introducidas en el inmueble quedarán a beneficio del Fisco, sin derecho a indemnización ni cargo alguno para éste, excepto aquellas que puedan retirarse sin detrimento del bien raíz
99801b1_30	76	0.626060926678597	son las siguientes: Despeje del área; extracción, uso y manejo de recursos e insumos; movimientos de tierra; transporte de material de construcción y movimiento de maquinarias; construcción de obras permanentes; pavimentación y señalización; construcción de accesos al aeropuerto y faenas; uso y manejo de empréstitos; uso y manejo de botaderos; operación de plantas de producción de materiales; y operación y abandono de faenas
74d057e_11	77	0.6257675730513897	Excepcionalmente, por resoluciones del Ministro de Vivienda y Urbanismo, dictadas a requerimiento de la Secretaría Ministerial respectiva, podrá autorizarse la aplicación de este Subsidio a viviendas emplazadas en las áreas antes excluidas
c7255b0_248	78	0.6256719776181985	"Para operaciones de crédito hipotecario a beneficiarios de un subsidio habitacional de este reglamento, en que el crédito no exceda de 700 UF, el MINVU otorgará al postulante un subsidio adicional destinado a solventar los costos de originación y administración del crédito o mutuo, denominado ""Subsidio a la Originación"""
a6ba1c5_59	79	0.6255351467629066	En el diseño de los conjuntos habitacionales y de sus viviendas podrán incluirse, además, elementos de pertinencia geográfica y/o de eficiencia energética, así como también equipamientos básicos de uso comercial o de servicios, según la Ordenanza General de Urbanismo y Construcciones (OGUC)
ae6dc4d_57	80	0.6255351467629066	En el diseño de los conjuntos habitacionales y de sus viviendas podrán incluirse, además, elementos de pertinencia geográfica y/o de eficiencia energética, así como también equipamientos básicos de uso comercial o de servicios, según la Ordenanza General de Urbanismo y Construcciones (OGUC)
c7255b0_326	81	0.6251855398727746	En estos casos el propietario del terreno deberá constituir prohibición de gravar y enajenar a favor del SERVIU, la que éste alzará para los efectos de la transferencia de las respectivas viviendas a cada beneficiario
cd20008_677	82	0.6244992044464177	"Nº 2, de 1959, del Ministerio de Vivienda y Urbanismo, sobre Plan Habitacional; las construidas por las ex Corporaciones de la Vivienda, de Servicios Habitacionales y de Mejoramiento Urbano y por los Servicios de Vivienda y Urbanización y los edificios ya construidos que al ser rehabilitados o remodelados se transformen en viviendas, en todos los casos siempre que la superficie edificada no supere los 140 (m2) y reúna los requisitos, características y condiciones establecidas en la ""Ordenanza General de Urbanismo y Construcciones"", o disposición que la reemplace"
c3b69cd_33	83	0.6243896158949455	- Las exenciones y rebajas a que se refiere este Título se concederán exclusivamente respecto de aquellos bienes raíces que estén destinados a habitación permanente del peticionario en cualquiera calidad jurídica
c7baa1f_80	84	0.6240476993057695	Artículo 24°: Los escombros a disponer deberán ser obligatoriamente de origen inerte, que no impliquen riesgos para la salud de las personas y el medio ambiente natural; entre estos se incluyen principalmente los desechos provenientes de la construcción, tales como tierra, piedras, rocas, ladrillos, bloques de concreto, arena, ripio, fierro viejo de construcción, hormigón sólido, revoques, adobes, restos de fibrocemento, cerámicos, restos leñosos y otros residuos sólidos asimilables
74d057e_116	85	0.6235823951918104	Junto a la entrega del Certificado de Subsidio a que alude el inciso anterior, el Serviu designará para el beneficiario uno o más prestadores de servicios de asistencia técnica expresamente contratados por dicho Serviu de acuerdo a lo dispuesto en la resolución Nº 533, del Ministerio de Vivienda y Urbanismo, de 1997, y sus modificaciones, para asesorar técnicamente al beneficiario, cuyos servicios serán pagados directamente por el Serviu, con cargo a los recursos destinados al efecto en la Ley de Presupuestos y que no se cargará al beneficiario o al subsidio para cuyo goce resultó seleccionado
52ea45c_81	86	0.6225940745639944	d) Respecto de instalaciones referidas a permisos de edificación de obras emplazadas en predios que pertenezcan en dominio a una sociedad anónima o a otra persona jurídica en que sea socio, director, administrador, trabajador o autoridad superior, según corresponda
7546484_33	87	0.6224384200556317	f) Copia del Título de Inscripción vigente que acredite calidad de propietario del inmueble desde el cual se pretende extraer áridos, o contrato de arrendamiento o título que acredite la autorización del uso del inmueble en caso que no lo explote el propietario
e7414a8_328	88	0.6222143304635136	En el caso de arrendatarios, comodatarios, usufructuarios y medieros, los
cd875ca_374	89	0.6221376319603635	Si no se destinare el producto de la enajenación autorizada, a la adquisición de otra vivienda que reúna los requisitos, características y condiciones exigidos, dentro del plazo indicado, o no se constituyere la prohibición de enajenar respectiva dentro de ese mismo plazo, el SERVIU podrá hacer efectivo el depósito a plazo endosado a su favor para aplicar su valor a la restitución tanto del subsidio directo como del subsidio implícito recibidos y del subsidio a la originación, cuando corresponda, devolviendo al vendedor el excedente, si lo hubiere
630f624_33	90	0.6218610189637445	f) Copia del título de inscripción vigente que acredite calidad de propietario del inmueble desde el cual se pretende extraer áridos, o contrato de arrendamiento o título que acredite la autorización de uso del inmueble en caso que no lo explote el propietario
74d057e_277	91	0.6215557664009277	- No obstante lo dispuesto en el artículo 4º de este reglamento, el postulante podrá aplicar el certificado de subsidio obtenido al pago del precio de adquisición o construcción de una vivienda emplazada en otro terreno, siempre que éste se encuentre ubicado en la misma región, provincia, comuna o Area de Desarrollo Indígena, según corresponda, y cumpla con las condiciones establecidas en el artículo 3º de este reglamento
c7255b0_49	92	0.6214404477567683	Superficie edificada: Es la superficie construida de la vivienda o el equipamiento, de acuerdo a lo señalado en el artículo 1,1
dab85da_10	93	0.6214052158841255	Apruébase la Ordenanza Local para Ocupación o uso Temporal y Transitoria por Obras, Trabajos, Instalaciones, Rupturas y/o Reposición de los Bienes Nacionales de uso Público
b1855c7_104	94	0.6207184117025571	Deléguese en la Dideco la facultad de evaluar y determinar conforme a los antecedentes socioeconómicos presentados por los postulantes el beneficio de exención o rebaja en el cobro de derechos de aseo domiciliario
bd52956_114	95	0.6203216896359632	d) Respecto de instalaciones referidas a permisos de edificación de obras emplazadas en predios que pertenezcan en dominio a una sociedad de personas de la cual el certificador sea socio o a una sociedad anónima o a otra persona jurídica en que sea socio, director, administrador o autoridad superior, según corresponda
3434b51_448	96	0.6193401970440477	- Las sumas percibidas en exceso calculadas de acuerdo a lo señalado en el artículo anterior deberán ser descontadas de los ingresos que correspondan a los propietarios, arrendatarios, usufructuarios o quienes exploten a cualquier título las instalaciones pertinentes
c7255b0_818	97	0.6191055027871055	Tratándose de proyectos relacionados con postulaciones colectivas y operaciones individuales de construcción en sitio del residente, que reúnan los requisitos para iniciar obras, si las disponibilidades de caja lo permiten, el contratista podrá solicitar anticipos a cuenta del pago del subsidio, destinados a financiar la ejecución física de las obras
9ae6c1c_212	98	0.619035919050107	2, letra b), donde menciona que tratándose de programas habitacionales para familias vulnerables o para proyectos de integración social podrán enajenarse al valor de su avalúo fiscal, sin prejuicio de lo establecido en los decretos que reglamenta dichos programas habitacionales
2761cdd_50	99	0.6185683233623072	"Modifícanse, por razones de interés público, las características de las obras y servicios del contrato de concesión de la obra pública fiscal denominada ""Camino de la Madera"", en el contexto de la extinción del contrato de concesión por mutuo acuerdo y la entrega de su operación al MOP, en el sentido que la Sociedad Concesionaria debe mantener vigente las garantías a que se refieren las disposiciones del artículo I"
1ee01ea_11	100	0.6183952031217299	Establécense los requisitos fitosanitarios para la importación, admisión temporal y tránsito de maquinaria usada
