fd6d180_92	80	0.6898198449098654	Elaborar una síntesis de los hallazgos relevantes recogidos a través de la experiencia, como aporte técnico a la enseñanza rural multigrado; los resultados de los aprendizajes de las y los estudiantes y los logros relativos al compromiso y la participación de la(s) comunidad(es) educativa(s) de la(s) escuela(s) involucradas en la experiencia
e7414a8_100	81	0.6894016086367818	Pequeño productor agrícola: persona que tenga esta calidad de acuerdo a
9347035_11	82	0.68935172785074	- Que corresponde a la Administración Activa corregir de oficio errores que detecte en el desarrollo de sus funciones, de manera de determinar precisa y correctamente los antecedentes e información que permita fijar los establecimientos tanto urbanos como rurales, objeto de la asignación de desempeño difícil
ccb1b57_51	83	0.6891321828517458	- El apoyo técnico y administrativo que se requiera para el funcionamiento de la Comisión será proporcionado por el Ministerio de Agricultura, a través de su Subsecretaría
93f3cbb_101	84	0.6891246905163068	Se considerarán también como pequeños productores agrícolas, las personas indicadas en el inciso tercero del artículo 16 de este reglamento, que cumplan con lo dispuesto en el inciso anterior
ce638af_293	85	0.6889099590218705	Antecedentes que acrediten su condición de pequeño, mediano o gran productor agrícola, según lo dispuesto en el presente Reglamento
c7255b0_710	86	0.687051999211944	Podrán acogerse al procedimiento de autoconstrucción asistida los postulantes que así lo hayan declarado al momento de la postulación, la que se realizará a través de una Entidad de Gestión Rural
e7414a8_146	87	0.6855004675916051	Esta actividad o subprograma, y sólo para el caso de los pequeños productores agrícolas, también contempla la mantención de los niveles recuperados a través de los elementos químicos y otras sustancias señaladas precedentemente
428f7df_3	88	0.6850121125247596	Que para el eficiente cumplimiento de dichas labores es imprescindible que los vehículos del Instituto de Desarrollo Agropecuario de las Direcciones Regionales puedan circular sin restricción en los días sábado en la tarde, domingo y festivos, sin sujeción a la jornada ordinaria de trabajo,
4ed6a0d_9	89	0.6847970225893478	Que para el eficiente cumplimiento de dichas labores es imprescindible que el vehículo del Instituto de Desarrollo Agropecuario de la Dirección Regional de la Segunda Región pueda circular sin restricción en los días sábados en la tarde, domingos y festivos, sin sujeción a la jornada ordinaria de trabajo
d7726f7_11	90	0.682376963129208	Para los mismos efectos, la representación de los agroindustriales o intermediarios se acreditará mediante contrato de trabajo de los trabajadores dependientes siempre que contenga en las funciones del trabajador la de representar a su empleador para los efectos de suscribir la guía de recepción
5058cc5_50	91	0.6820031512139939	Los Directores Regionales de INDAP y de SAG, por resoluciones fundadas en los recursos asignados y en las necesidades específicas de sus respectivas regiones, podrán, para las temporadas correspondientes, otorgar prioridad y asignar financiamiento al desarrollo de sólo algunos de los programas específicos señalados precedentemente o a determinadas prácticas de algunos de esos programas, pudiendo focalizarlos a áreas agropecuarias específicas, a localidades determinadas, a suelos que registren avanzados niveles de degradación o con otros criterios técnicos
93f3cbb_100	92	0.6818741233003803	- Los incentivos que otorgue INDAP, se asignarán directamente, de acuerdo a la demanda de los usuarios o a un programa de selección de postulaciones, a quienes acrediten para los efectos de este reglamento, tener la calidad de pequeño productor agrícola según lo dispuesto en el artículo 13 de la ley N° 18,910
ce638af_36	93	0.6808616550705255	Este pago no libera al agricultor de la obligación del cumplimiento de la totalidad de las prácticas comprometidas en el Plan de Manejo
2bb3805_9	94	0.68056178195251	Actividad o Actividades de Asistencia Técnica: La o las labores de carácter técnico, jurídico y social que debe realizar la Entidad de Gestión Rural, la empresa constructora o contratista o el SERVIU, en su caso, comprendidas dentro de los Servicios de Asistencia Técnica, Jurídica y Social que regula la presente resolución
586f4e7_2	95	0.6804790094815958	Que el objetivo de este programa es asegurar una gestión eficaz y de alto impacto en el apoyo a los usuarios del Instituto, que genere condiciones y capacidades para un desarrollo sostenible y sustentable de la agricultura familiar campesina, mediante el desarrollo de un mercado de proveedores que asegure la calidad de los servicios prestados y la satisfacción de los usuarios
ce638af_151	96	0.6799062572581345	Corresponderá a la Subsecretaría de Agricultura velar porque la información que respecto de cada operador tengan INDAP y SAG, esté consolidada y disponible para los usuarios
348cb25_22	97	0.6797636286641955	a) Contratar servicios profesionales especializados para elaborar orientaciones, estrategias y materiales técnicos sobre enseñanza-aprendizaje, organización y gestión de los procesos educativos en la educación rural, a fin de logar el mejoramiento de los resultados de aprendizaje de sus estudiantes
4f9b054_3	98	0.6792280120277677	Que para el eficiente cumplimiento de dichas labores es imprescindible que los vehículos del Instituto de Desarrollo Agropecuario de las Direcciones Regionales puedan circular sin restricción en los días sábados en la tarde, domingos y festivos, sin sujeción a la jornada ordinaria de trabajo,
c7255b0_422	99	0.6784980531860032	Declaración suscrita por el o los representantes legales de la Entidad de Gestión Rural en que se dejará constancia de que el terreno en que se ejecutará el proyecto cuenta con factibilidad de dación de servicios de agua potable, alcantarillado y de suministro eléctrico, o en caso de no, existir empresas de servicios en el área, se dejará constancia de que se desarrollarán los proyectos correspondientes por profesionales competentes
c735210_18	100	0.6782506860250919	d) Copia autorizada ante notario o según lo dispuesto en la ley Nº 19,088, del certificado de especialización profesional, para acreditar la calidad de ingeniero agrónomo especializado, cuando corresponda
