f84b563_11	1	0.9327580759428235	Asistencia técnica para la elaboración del Plan de Manejo: asesoría prestada al usuario por un operador acreditado para la confección de un plan de manejo, la que debe contener, además de la documentación exigida, una propuesta de las prácticas a postular, señalando la descripción pormenorizada de ellas y la ubicación de los potreros a intervenir, sólo podrán postular a esta asistencia, los pequeños productores agrícolas
ce638af_191	2	0.8655106125803852	f) Cuando corresponda y sólo para pequeños productores agrícolas, los costos de la asistencia técnica destinada a apoyarlos en la elaboración y ejecución de sus Planes de Manejo
e7414a8_900	3	0.8068845905518521	Además, para el caso de los pequeños agricultores, éstos deberán presentar factura o boleta de honorarios que certifique el pago al operador por los servicios prestados en la elaboración y/o ejecución del plan de manejo, si correspondiere este último y según lo declarado como costo de asistencia técnica
ce638af_467	4	0.7798996798750847	- Tratándose de los pequeños productores agrícolas, se podrá bonificar los costos de la asistencia técnica destinada a apoyarlos en la elaboración y ejecución de sus Planes de Manejo
e7414a8_906	5	0.7798996798750847	- Tratándose de los pequeños productores agrícolas, se podrá bonificar los costos de la asistencia técnica destinada a apoyarlos en la elaboración y ejecución de sus planes de manejo
c7255b0_715	6	0.7763417777294869	Cada beneficiario o grupo de beneficiarios que opten por el procedimiento de autoconstrucción asistida como forma de aplicación de su subsidio, contarán con la asesoría de una Entidad de Gestión Rural, la que además de las labores establecidas en el Párrafo III del Capítulo V, deberá realizar la inspección técnica de las obras de construcción y capacitar a las familias en los aspectos esenciales y de mayor complejidad del proyecto específico
2bb3805_89	7	0.7763215453771996	Con todo, los profesionales que desarrollen los Servicios de Asistencia Técnica podrán contar con el apoyo de personas que estén en posesión de un título técnico de sus respectivas áreas, para ejecutar las actividades contempladas en la presente resolución, debiendo la Entidad de Gestión Rural ingresar al SERVIU la individualización de dichas personas, copias de los títulos técnicos que posean y la declaración jurada precedentemente señalada, debiendo el SERVIU dar su aprobación para la participación de estas personas
ce638af_189	8	0.766318573553449	e) Un Informe Técnico, que justifique la propuesta hecha en el Plan de Manejo, la relacione coherentemente con los fines de la explotación agrícola del usuario e indique las recomendaciones que debe implementar el agricultor respecto de las prácticas del Programa señaladas en el Plan de Manejo
f84b563_9	9	0.76364991414482	"""sólo podrán postular a esta asistencia, los pequeños productores agrícolas"
586f4e7_3	10	0.7619619094327302	Que por todo lo indicado, el Instituto considera estratégico contar con un Registro de Proveedores que permita conocer e identificar el universo de profesionales y técnicos interesados en prestar servicios de fomento a INDAP y en los negocios agropecuarios de los pequeños productores agrícolas y/o campesinos, para disponer de la información necesaria que permita seleccionar al proveedor que más se ajuste a los requerimientos de prestación de servicios del Instituto y de sus usuarios
565565e_69	11	0.7612319238607309	Contar con un ingeniero agrónomo u otro profesional idóneo, y un responsable del proceso de selección
ce638af_138	12	0.759083351587485	r) Proponer, para el caso de los pequeños productores agrícolas, las prácticas que requieran asistencia técnica en la elaboración y ejecución de sus Planes de Manejo, así como los montos máximos posibles a pagar por este concepto, dentro de los máximos establecidos en el artículo 32 de este Reglamento
2bb3805_92	13	0.7518236362793619	- El pago del subsidio por los Servicios de Asistencia Técnica, sólo procederá respecto de aquellos servicios efectivamente realizados y habiéndose obtenidos los productos que se especifican en el presente artículo, además de cumplir las demás condiciones que se señalan en este acto administrativo, debiendo en cada oportunidad acreditarse por la Entidad de Gestión Rural o la empresa constructora o contratista, según corresponda, que no tiene pendientes deudas previsionales ni laborales en relación al proyecto u operación de que se trate, como asimismo que no tiene deudas tributarias de ningún tipo
fe9c066_65	14	0.7490673568175045	º Poseer un coordinador(a) técnico con título profesional en el área agropecuaria
2bb3805_109	15	0.7456987353483917	- El SERVIU pagará a la Entidad de Gestión Rural y al contratista, según corresponda, los Servicios de Asistencia Técnica efectivamente realizados
bd2e63d_46	16	0.7454827961218868	a) Contar con la asesoría de un Ingeniero Agrónomo validado por el Servicio y de un responsable del proceso de selección
f84b563_37	17	0.7408798531250677	"""Con todo, los interesados en optar al incentivo ante el Instituto de Desarrollo Agropecuario o ante el Servicio Agrícola y Ganadero, según corresponda, sólo podrán presentar por concurso, un plan de manejo, por un mismo predio"
ce638af_188	18	0.7382378167732548	d) El compromiso entre el Estado y el agricultor para garantizar los niveles mínimos técnicos que se hayan alcanzado en las prácticas de recuperación, y para el desarrollo de aquellas prácticas agroambientales cuya ejecución implique un mayor costo o una disminución de renta del agricultor
c7255b0_33	19	0.7343255304940115	Entidad de Gestión Rural: Persona natural o jurídica, pública o privada, con o sin fines de lucro, cuyo objetivo es prestar Asistencia Técnica a los postulantes, desarrollando los proyectos contemplados en este Programa y presentarlos para ser aprobados por el SERVIU correspondiente
161bb8d_17	20	0.7328492658386345	"""Los costos por asesoría profesional, en el caso de pequeños propietarios forestales, comprenderán aquellos relacionados con la asistencia técnica y con la elaboración de estudios técnicos y planes de manejo, los que se pagarán en forma conjunta, salvo que dichos propietarios se acojan a los estudios o planes tipo que elabore la Corporación de acuerdo al artículo 9º del decreto ley, en cuyo caso, sólo se considerarán aquellos costos referidos a la asistencia técnica"
d3b3f42_1027	21	0.7290255216433689	- El operador de una Instalación de Abastecimiento de CL desarrollará sus actividades sólo con personal debidamente capacitado en los procedimientos operacionales y de emergencia de la instalación, además de cumplir con los demás requisitos establecidos en el presente reglamento
e7414a8_553	22	0.7283142506854686	como pequeño productor agrícola, conforme a lo dispuesto por el
5e68532_6	23	0.7247822584095298	Que el Servicio Agrícola y Ganadero es la autoridad oficial encargada de velar por el patrimonio fitosanitario del país y está facultado para adoptar medidas técnicas que estime procedentes
2bb3805_12	24	0.7228792151811329	Entidad de Gestión Rural: Persona natural o jurídica, pública o privada, con o sin fines de lucro, cuyo objetivo es prestar asistencia técnica, jurídica y social a los postulantes, desarrollando los proyectos contemplados en este Programa y presentándolos para ser evaluados y aprobados por el SERVIU correspondiente
c7255b0_709	25	0.7165422472196441	En la autoconstrucción asistida que establece el presente artículo, el beneficiario individual o el grupo de beneficiarios asumen directamente la ejecución de las obras relativas a su solución de habitabilidad, para lo cual contarán con el apoyo y la asesoría de una Entidad de Gestión Rural o en su caso del SERVIU
e7414a8_348	26	0.716355305250625	el agricultor respecto de las prácticas del Programa señaladas en el Plan
2bb3805_94	27	0.7161393118799301	No obstante lo anterior, conforme a los antecedentes presentados y a la situación particular del proyecto, el SERVIU podrá, fundadamente, realizar un pago proporcional de acuerdo al avance realizado por la Entidad de Gestión Rural, respecto a uno o más Servicios de Asistencia Técnica desarrollados, ello cuando se determine que existen factores ajenos al trabajo de la EGR que impiden la ejecución del Servicio de Asistencia Técnica completo
ce638af_90	28	0.7148660386457515	La aplicación de las labores o prácticas contempladas en esta actividad o subprograma, deberá ser focalizada sobre aquellos suelos que efectivamente reúnan las condiciones para ser puestos bajo explotación agropecuaria sin sufrir deterioros en sus condiciones físicas, químicas y/o biológicas
ce638af_471	29	0.7141421019220332	- En caso de emergencia agrícola o catástrofe declaradas por la autoridad competente, los Directores Regionales del SAG e INDAP proporcionarán las facilidades que sean necesarias en el proceso de postulación de los usuarios, de modo que las prácticas a las que éstos postulen se implementen de manera óptima y oportuna
1649ae6_38	30	0.7137832836266419	- La persona encargada de la manipulación y desplazamiento del ganado durante la carga, transporte y descarga deberá demostrar que se encuentra capacitada, mediante un curso en aspectos de manejo y bienestar animal, o que es profesional o técnico del área agropecuaria, que le permitan llevar a cabo estos cometidos de forma eficaz, evitando el dolor y sufrimiento innecesario
e7414a8_911	31	0.7131399038878647	- En caso de emergencia agrícola o catástrofe, declaradas por la autoridad competente, los Directores Regionales del SAG e INDAP proporcionarán las facilidades que sean necesarias en el proceso de postulación de los usuarios, de modo que las prácticas a las que éstos postulen se implementen de manera óptima y oportuna
3891b8d_9	32	0.7119596519606157	Que para el eficiente cumplimiento de dichas labores, es imprescindible que un vehículo del Instituto de Desarrollo Agropecuario de la Dirección Regional pueda circular sin restricción en los días sábados en la tarde, domingos y festivos, y sin sujeción a la jornada ordinaria de trabajo
4a66c96_9	33	0.7119596519606157	Que para el eficiente cumplimiento de dichas labores, es imprescindible que un vehículo del Instituto de Desarrollo Agropecuario de la Dirección Regional pueda circular sin restricción en los días sábados en la tarde, domingos y festivos, y sin sujeción a la jornada ordinaria de trabajo
cf81250_9	34	0.7119596519606157	Que para el eficiente cumplimiento de dichas labores, es imprescindible que un vehículo del Instituto de Desarrollo Agropecuario de la Dirección Regional pueda circular sin restricción en los días sábados en la tarde, domingos y festivos, y sin sujeción a la jornada ordinaria de trabajo
5058cc5_71	35	0.7117726978531524	- El plan de manejo contendrá un informe técnico, debiendo firmarse ambos documentos tanto por el mismo operador acreditado como por el agricultor, y un croquis que permita la ubicación de los potreros a intervenir con indicación georreferenciada del punto central del o los potreros involucrados
fc50484_7	36	0.7115242229319524	Que el Director Nacional del Instituto de Desarrollo Agropecuario (INDAP) requiere un vehículo de respaldo para el cumplimiento de su trabajo, en días y horas inhábiles, sin disco fiscal y fundado en las siguientes labores:
e7414a8_166	37	0.7106221032109389	La aplicación de las prácticas contempladas en esta actividad o subprograma, deberá ser focalizada sobre aquellos suelos que efectivamente reúnan las condiciones para ser puestos bajo explotación agropecuaria sin sufrir deterioros en sus condiciones físicas, químicas y/o biológicas
f6e00c3_23	38	0.7099255968635818	- El plan de manejo contendrá un informe técnico, ambos documentos firmados por el mismo operador acreditado y el agricultor, y un croquis que permita la ubicación de los potreros a intervenir con indicación georeferenciada del punto central del o los potreros involucrados
2bb3805_414	39	0.7083585894769538	El ejercicio de estas facultades supondrá que la SEREMI, entre otras acciones, podrá monitorear el desarrollo y ejecución de los distintos proyectos de habitabilidad, pudiendo visitar las obras en ejecución, sin que estas visitas constituyan una Fiscalización Técnica de las Obras visitadas, asistir a las reuniones, talleres o asambleas y solicitar al SERVIU, la Entidad de Gestión Rural o al fiscalizador técnico de obras, los antecedentes e información que requiera en su oportunidad
3cfb0bd_7	40	0.7081348113089397	Contar con al menos una contraparte técnica competente ante el SAG, de profesión Ingeniero Agrónomo u otro profesional idóneo
92d6297_6	41	0.7049586840553607	Que, el Servicio Agrícola y Ganadero ha informado que, durante el tiempo de vacancia del referido decreto, ha advertido deficiencias logísticas y técnicas para implementar de manera oportuna, eficiente y eficaz el sistema de control y fiscalización de las obligaciones que impone dicho instrumento
1af4f43_12	42	0.7038339208277132	- Realizar jornadas de trabajo y talleres de especialización en materias agrícolas, efectuados en las distintas direcciones regionales de INDAP, a fin de aunar criterios, procedimientos y perfeccionamiento sobre el uso de distintos instrumentos de fomento y/o créditos en apoyo a la agricultura familiar campesina
fc50484_20	43	0.7038339208277132	- Realizar jornadas de trabajo y talleres de especialización en materias agrícolas, efectuados en las distintas direcciones regionales de INDAP, a fin de aunar criterios, procedimientos y perfeccionamiento sobre el uso de distintos instrumentos de fomento y/o créditos en apoyo a la agricultura familiar campesina
2bb3805_279	44	0.7029674050627244	Para fijar el valor definitivo a pagar por los servicios de Asistencia Técnica, el SERVIU deberá determinar previamente, para cada proyecto, las actividades que obligatoriamente debió ejecutar la Entidad de Gestión Rural o el Contratista, en su caso, descontando el o los servicios que no se hubieren ejecutado
101735c_8	45	0.7007230678984403	Las observaciones y el trabajo en conjunto con el Servicio Agrícola y Ganadero, que ha prestado su colaboración técnica en esta materia
93f3cbb_36	46	0.7003700289027295	Los Directores Regionales de INDAP y de SAG, por resoluciones fundadas en los recursos asignados y en las necesidades específicas de sus respectivas regiones, podrán, para las temporadas correspondientes, otorgar prioridad y asignar financiamiento al desarrollo de sólo algunos de los programas específicos señalados precedentemente o a determinadas prácticas de algunos de esos programas, pudiendo focalizarlos a zonas agropecuarias específicas, a suelos que registren avanzados niveles de degradación o con otros criterios técnicos
4b17c9f_7	47	0.6991998411138681	Que el Director Nacional del Instituto de Desarrollo Agropecuario requiere un vehículo de respaldo, para el cumplimiento de su labor pública, en días y horas inhábiles, sin disco fiscal
7dac333_6	48	0.6990705983981588	Que, para el eficiente cumplimiento de las labores antes mencionadas, es necesario que los vehículos que más adelante se indican, asignados al Instituto de Desarrollo Agropecuario, puedan circular sin restricción durante los días sábado, domingo y festivos y sin sujeción a jornada ordinaria de trabajo
1a10f23_64	49	0.6985306587003742	Para efectos de obtener el puntaje correspondiente a la construcción de recintos complementarios asociados a Emprendimiento Productivo, se deberá acreditar en el Formulario N° 6,1 Diagnóstico Técnico-Social, que forma parte del expediente de postulación, que el destino de dicho recinto será acoger emprendimientos productivos, vinculados a la fabricación y/o venta de productos silvoagropecuarios y/o artesanales o a actividades asociadas al turismo rural, que el postulante ya desarrolle en pequeña escala y con anterioridad al presente llamado
07348d3_9	50	0.6982033127662146	Que para el eficiente cumplimiento de dichas labores, es imprescindible que determinados vehículos del Instituto de Desarrollo Agropecuario de las Direcciones Regionales puedan circular sin restricción en los días sábados en la tarde, domingos y festivos, y sin sujeción a la jornada ordinaria de trabajo
f30304d_8	51	0.6978147416598781	b) Promover, mediante instrumentos de corto, mediano y largo plazo, la incorporación de la gestión integral de los riesgos agropecuarios a la gestión responsable de los agronegocios;
b6ffa9d_1042	52	0.6975727056773137	Para la primera fijación tarifaria la Subdirección deberá entregar toda la información necesaria, sin perjuicio de aquella que se deba recabar directamente de los operadores rurales para tales fines, identificando claramente los bienes considerados como aportes de terceros
586f4e7_4	53	0.6968902942026551	Que un registro como el descrito debe estar organizado por áreas y especialidades dentro del sector de la agricultura, contando con información confiable referente a la preparación académica, experiencia laboral, capacidad económica, evaluación de desempeño, competencias e inhabilidades de los proveedores y otras materias de interés para los usuarios
3385efc_6	54	0.6968539026780273	Que para el eficiente cumplimiento de las labores antes mencionadas, es necesario que los vehículos que más adelante se indican, asignados al Instituto de Desarrollo Agropecuario, puedan circular sin restricción durante los días sábados, domingos y festivos y sin sujeción a jornada ordinaria de trabajo
2bb3805_408	55	0.6958968117392691	Tomar las medidas que correspondan a fin de hacer cumplir las disposiciones establecidas en la presente normativa, incluyendo las labores que al respecto deben realizar los profesionales del SERVIU, las de responsabilidad de las Entidades de Gestión Rural, de las constructoras o contratistas y del fiscalizador técnico de obras
4df017a_89	56	0.6950098923154369	En casos excepcionales en que un semillero haya sido rechazado por las inspecciones en campo, y ante solicitud técnicamente fundada del cliente, el Servicio Agrícola y Ganadero podrá condicionar la aprobación de la certificación, según análisis de laboratorio de la semilla cosechada
e7414a8_213	57	0.6948677785479636	- Por parte del sector privado participarán en el CTR, un representante del Instituto de Investigaciones Agropecuarias, en adelante indistintamente INIA, agricultores representativos de organizaciones de pequeños y medianos productores agrícolas, designados por el Seremi respectivo, sobre la base de propuestas realizadas por las organizaciones de productores agrícolas de la región
0391589_8	58	0.6947416891971223	Que para el eficiente cumplimiento de dichas labores es imprescindible que determinados vehículos del Instituto de Desarrollo Agropecuario de las Direcciones Regionales puedan circular sin restricción en los días sábados en la tarde, domingos y festivos, sin sujeción a la jornada ordinaria de trabajo
5f1e046_9	59	0.6947416891971223	Que para el eficiente cumplimiento de dichas labores es imprescindible que determinados vehículos del Instituto de Desarrollo Agropecuario de las Direcciones Regionales puedan circular sin restricción en los días sábados en la tarde, domingos y festivos, sin sujeción a la jornada ordinaria de trabajo
36ea46f_6	60	0.6944863000615457	Que, para el eficiente cumplimiento de las labores antes mencionadas, es necesario que los vehículos que más adelante se indican, asignados al Instituto de Desarrollo Agropecuario, puedan circular sin restricción en los días sábados, domingos y festivos y sin sujeción a la jornada ordinaria de trabajo
4106409_7	61	0.6943668739912235	Que para el eficiente cumplimiento de las labores antes mencionadas, es necesario que los vehículos que más adelante se indican, asignados al Instituto de Desarrollo Agropecuario, puedan circular sin restricción durante los días sábados, domingos y festivos y sin sujeción a la jornada ordinaria de trabajo
2bb3805_111	62	0.6937629571092652	- En el caso de proyectos de habitabilidad rural, cuya población presente características sociales, culturales o productivas propias, las EGR deberán considerar las características, particularidades y requerimientos que presentan dichas familias o grupos, a objeto de ejecutar con eficiencia y oportunidad el desarrollo de los servicios de asistencia técnica y las actividades que son de su incumbencia para el desarrollo del proyecto, así también para garantizar la pertinencia cultural y grupal en el trabajo de acompañamiento que las EGR deben realizar con las familias postulantes y beneficiarias de este Programa
49c16e5_2	63	0.6933905876522938	Apruébase el siguiente Reglamento Especial de Calificaciones para el personal del Servicio Agrícola y Ganadero, el cual tiene por objeto fijar los parámetros y criterios para evaluar el desempeño y las aptitudes de dicho personal:
dfe46c7_613	64	0.6926494426857177	Las unidades productivas y los establecimientos deben mantener los registros necesarios que les permitan demostrar al organismo de certificación y a la autoridad competente, la aplicación de las normas técnicas de agricultura orgánica correspondientes
4fd39ce_8	65	0.692629749860765	Que para el eficiente cumplimiento de las labores antes mencionadas, es necesario que los vehículos que más adelante se indican, asignados al Instituto de Desarrollo Agropecuario, puedan circular sin restricción durante los días sábado, domingo y festivos y sin sujeción a la jornada ordinaria de trabajo
37c4b5a_7	66	0.6921822760622426	Que el Director Nacional del Instituto de Desarrollo Agropecuario requiere un vehículo de respaldo para el cumplimiento de su labor pública, en días y horas inhábiles, sin disco fiscal
ce638af_110	67	0.6921699257979277	- Para efectos de asesorar a los Directores Regionales del INDAP y del SAG en la administración de los concursos del Programa, se conformará un Comité Técnico Regional, presidido por el respectivo Secretario Regional Ministerial de Agricultura, en adelante indistintamente SEREMI, e integrado por personeros del sector público agropecuario y del sector privado relacionados con la actividad
16c1d7d_66	68	0.6921393374582805	En casos excepcionales, y ante solicitud técnicamente fundada del cliente, el Servicio Agrícola y Ganadero calificará y podrá condicionar la aprobación de la certificación de un semillero en campo a análisis de la semilla cosechada
cd875ca_229	69	0.691474079017052	- Los interesados en postular al Programa que regula este reglamento, sólo podrán hacerlo en forma individual, para aplicar el beneficio a soluciones singulares aisladas
c7255b0_626	70	0.6913037172901546	Si los antecedentes ingresados presentan observaciones y/o no resultan suficientes para la correcta evaluación del Proyecto, el SERVIU emitirá las observaciones a la Entidad de Gestión Rural, en un solo acto
fe29140_5	71	0.6911855173954674	a) Servir de instancia técnica para favorecer la pertinencia indígena de las actuaciones e inversiones del Ministerio de Agricultura, sus órganos dependientes y organismos relacionados, según corresponda, tanto en el ejercicio de sus tareas como al interior de la organización, proponiendo cursos de acción y acompañando su implementación;
ce638af_75	72	0.6910567657183246	Esta actividad o subprograma y sólo para el caso de los pequeños productores agrícolas, también contempla la mantención de los niveles recuperados a través de los elementos químicos y otras sustancias señaladas precedentemente
ce638af_113	73	0.6910471580491255	Por parte del sector privado participarán agricultores representativos de organizaciones de pequeños y medianos productores agrícolas, designados por el SEREMI respectivo, sobre la base de propuestas realizadas por las organizaciones de productores agrícolas de la región
2bb3805_404	74	0.6908477260541722	Aprobar y cursar los pagos a la Entidad de Gestión Rural, al contratista y al fiscalizador técnico de obras, según corresponda, por los servicios y actividades efectivamente desarrolladas
20182ce_63	75	0.690574453674782	Sin perjuicio de lo anterior, el productor afectado por un rechazo, podrá presentar una reclamación fundada y por escrito al Servicio Agrícola y Ganadero, en sus oficinas regionales
515c8ee_66	76	0.690574453674782	Sin perjuicio de lo anterior, el productor afectado por un rechazo, podrá presentar una reclamación fundada y por escrito al Servicio Agrícola y Ganadero, en sus oficinas regionales
7aad2ce_63	77	0.690574453674782	Sin perjuicio de lo anterior, el productor afectado por un rechazo, podrá presentar una reclamación fundada y por escrito al Servicio Agrícola y Ganadero, en sus oficinas regionales
6eba675_55	78	0.6904219016188433	En casos excepcionales en que un semillero haya sido rechazado por las inspecciones en campo, y ante solicitud técnicamente fundada del productor, el Servicio Agrícola y Ganadero podrá condicionar la aprobación de la certificación, según análisis de laboratorio de la semilla cosechada
ce638af_21	79	0.6901223312942775	Asistencia técnica para la ejecución del Plan de Manejo: asesoría prestada al usuario por un operador acreditado, conducente a acompañar y apoyar la adecuada ejecución técnica en terreno de aquellas prácticas comprometidas en el Plan de Manejo
