7a834d1_12	1	0.7101338438093192	Artículo 15°: Tratándose de inmuebles que se usen como vivienda y como establecimientos comercial, industrial, oficinas profesionales u otros establecimientos análogos, el pago del derecho ordinario o especial del servicio de extracción de basura, deberá aplicarse en la contribución territorial y en el giro de la respectiva patente comercial, en atención a que se trata de contribuyentes distintos o de actividades comerciales separadas del uso habitacional
74d057e_254	2	0.7061191731264296	También el Serviu autorizará la enajenación de la vivienda afecta a prohibición en razón del subsidio recibido, para que sea permutada por otra vivienda que reúna los requisitos, características y condiciones indicados en el inciso primero
cd875ca_376	3	0.7061191731264296	También el SERVIU autorizará la enajenación de la vivienda afecta a prohibición en razón del subsidio recibido, para que sea permutada por otra vivienda que reúna los requisitos, características y condiciones indicados en el inciso primero
c7255b0_861	4	0.6929275375343006	Ésta podrá utilizarse en establecimientos comerciales adheridos a esta modalidad, para la adquisición de los insumos a utilizar en la construcción de la vivienda
3d2bed3_210	5	0.6826990439151618	Establécese que el Impuesto al Valor Agregado (IVA) que soporte la Sociedad Concesionaria en relación con las modificaciones a las características de las obras y servicios a que se refiere el presente decreto supremo, recibirá el tratamiento establecido en los numerales 2,6 y 3,9 del Convenio Ad-Referéndum N°1 que se aprueba en el N°4 siguiente
06cbac6_111	6	0.6772818644477764	Artículo 18º Tratándose de propiedades que sirvan como vivienda y además como locales comerciales, industrias, oficinas profesionales u otros, el pago del derecho ordinario o especial del servicio deberá aplicarse en el impuesto territorial, en el cobro directo o en las contribuciones de patentes respectivas, según sea el caso; siempre y cuando correspondan a un mismo contribuyente o titular
74d057e_245	7	0.6760086909039131	- El Serviu también autorizará la venta de una vivienda, dentro del periodo de vigencia de la prohibición de enajenar para este subsidio, bajo la condición que el producto de esa enajenación se destine a la adquisición de una vivienda económica que reúna los requisitos, características y condiciones fijados en el D
cd875ca_367	8	0.6748980091968033	- El SERVIU también autorizará la venta de una vivienda, dentro del período de vigencia de la prohibición de enajenar para este subsidio, bajo la condición que el producto de esa enajenación se destine a la adquisición de una vivienda económica que reúna los requisitos, características y condiciones fijados en el D
379c758_172	9	0.6723651475115069	d) Quedan exentos de pago de derechos por ocupación o rotura de BNUP aquellas empresas que ejecutan obras cuyo mandante es la Municipalidad de Concepción, certificando dicha condición mediante certificado de la unidad técnica
70c86d5_19	10	0.6718473114012891	b) Usos de Suelo: Postérgase los permisos de edificación asociados a equipamiento comercio con carga ocupación sobre 500 personas, servicentros y discotecas, independiente de la categoría de la vía que enfrenten
70c86d5_24	11	0.6718473114012891	b) Usos de Suelo: Postérgase los permisos de edificación asociados a equipamiento comercio con carga ocupación sobre 500 personas, servicentros y discotecas, independiente de la categoría de la vía que enfrenten
70c86d5_34	12	0.6718473114012891	b) Usos de Suelo: Postérgase los permisos de edificación asociados a equipamiento comercio con carga ocupación sobre 500 personas, servicentros y discotecas, independiente de la categoría de la vía que enfrenten
c7255b0_769	13	0.6698398345816353	El SERVIU autorizará la venta de la vivienda afecta a prohibiciones en razón de los subsidios recibidos, bajo la condición que el pago del precio de esa enajenación se destine a la adquisición de una vivienda o se restituya al SERVIU la totalidad de los dineros recibidos por concepto de subsidios, al valor de la Unidad de Fomento vigente a la fecha de la restitución
d739811_28	14	0.6678576590627251	Artículo 10º: Tratándose de propiedades que sirvan como vivienda y además como locales comerciales, industriales, oficinas de profesionales y otros, el pago del derecho ordinario o especial del servicio deberá aplicarse por vivienda y en las patentes que correspondan de acuerdo al artículo anterior
4861b11_91	15	0.6629034722635652	El costo de materiales comprende el costo de adquisición de las instalaciones puestas en obra, es decir, incluyendo los fletes y cualquier otro costo que resulte necesario dadas las condiciones normales de adquisición del tipo de instalaciones de que se trate
cd875ca_4	16	0.661177297506724	El Ministerio de Vivienda y Urbanismo,directamente o a través de los Servicios de Vivienda y Urbanización, otorgará mediante este sistema de atención, un subsidio destinado a financiar la construcción de una vivienda cuya tasación no sea superior a las 650 Unidades de Fomento
c7255b0_712	17	0.6584007499651912	Este procedimiento de ejecución permitirá, además de la compra de materiales, la adquisición o arriendo de herramientas, o bien, la contratación de servicios que sean necesarios relacionados con el proyecto de habitabilidad, tales como retiro de escombros, demoliciones, transporte de materiales, entre otros, los que deberán estar considerados en los proyectos aprobados por el SERVIU
f1ebd15_45	18	0.6572097932880073	"""El Ministerio"", entrega el uso gratuito a ""la Corporación"", del inmueble individualizado precedentemente, que comprende tanto los edificios y construcciones, como el predio o terreno y los bienes muebles del Liceo que se detallan en el inventario anexo firmado por las partes, el que forma parte del presente convenio"
85d0f2a_107	19	0.6561668201314652	El informe a la comunidad deberá comprender las obras de transformación, ampliación o habilitación que la Corporación hubiere efectuado en el inmueble o en sus edificios, como asimismo respecto de la incorporación y movimiento de bienes muebles, variaciones físicas y valor monetario de los bienes corporales de uso que se incluyen en el inventario del establecimiento, conforme con lo que se establece en la cláusula décima quinta siguiente
f5394e1_101	20	0.6561668201314652	El informe a la comunidad deberá comprender las obras de transformación, ampliación o habilitación que la Corporación hubiere efectuado en el inmueble o en sus edificios, como asimismo respecto de la incorporación y movimiento de bienes muebles, variaciones físicas y valor monetario de los bienes corporales de uso que se incluyen en el inventario del establecimiento, conforme con lo que se establece en la cláusula décima quinta siguiente
52ea45c_7	21	0.6550616824840956	El Registro Nacional de Instaladores, Mantenedores y Certificadores de Ascensores, tanto verticales como inclinados o funiculares, montacargas y escaleras o rampas mecánicas, dependerá del Ministerio de Vivienda y Urbanismo, en adelante el Registro y el MINVU, respectivamente
bd52956_7	22	0.6550616824840956	El Registro Nacional de Instaladores, Mantenedores y Certificadores de Ascensores, tanto verticales como inclinados o funiculares, montacargas y escaleras o rampas mecánicas, dependerá del Ministerio de Vivienda y Urbanismo, en adelante el Registro y el MINVU, respectivamente
e7414a8_518	23	0.6541168334763926	Tratándose de arrendatarios, medieros o aparceros y comodatarios, éstos
c586e8a_43	24	0.653409989666075	Artículo 10º: El cobro del derecho de aseo por vivienda o unidad habitacional se aplicará a aquellas propiedades que no se encuentren exentas en virtud del texto refundido y sistematizado del decreto ley Núm
c7255b0_828	25	0.6528582095606531	c) Para proyectos de Construcción en Sitio del Residente, se deberá acreditar que el terreno en el que se emplazará la vivienda respectiva está afecto a prohibición de enajenar a favor del SERVIU, inscrita en el Conservador de Bienes Raíces, la que será alzada al constituirse la prohibición a que se refiere el artículo 64 de este reglamento
371e773_7	26	0.6521836230607532	b) Del impuesto establecido en el título segundo del decreto ley Nº 825, de 1974, por la adquisición de bienes o utilización de servicios destinados a la construcción, equipamiento y alhajamiento de sus oficinas y dependencias en general, como también por las adquisiciones de bienes o utilización de servicios necesarios para la operación de su observatorio
4861b11_93	27	0.6511673695769634	El costo de montaje de las instalaciones podrá considerar una metodología de costeo basada en cubicación estándar, considerando que una empresa contratista realiza las obras
c7255b0_863	28	0.6498291203513071	El SERVIU entregará la tarjeta o el instrumento afín, que permita la adquisición de insumos a utilizar para la ejecución del proyecto, los que deberán ser adquiridos en comercios que hayan sido habilitados por el Ministerio de Vivienda y Urbanismo para el registro de dichas compras, quienes a su vez, solicitarán el pago al SERVIU respectivo de los materiales entregados al beneficiario
bd52956_11	29	0.6484459829132049	Los propietarios que de acuerdo a lo previsto en el artículo 159 bis de la Ley General de Urbanismo y Construcciones, agregado por la Ley N° 20,296, contraten Instaladores, Mantenedores y Certificadores de Ascensores, deberán recurrir a aquellos inscritos en el Registro, en la categoría que corresponda de acuerdo con el presente Reglamento
379c758_176	30	0.646199320215238	Quedan exceptuados del pago de estos recargos las emergencias calificadas por la Dirección de Construcciones
cd875ca_147	31	0.6442323628995837	Excepcionalmente, por resoluciones del Ministro de Vivienda y Urbanismo, dictadas a requerimiento de la SEREMI respectiva, podrá autorizarse la aplicación de este subsidio a viviendas emplazadas en las áreas antes excluidas
19f0b36_28	32	0.6441037404496652	b) Usos de Suelo: Postérguense los permisos de edificación asociados a equipamiento comercio con carga de ocupación sobre 500 personas y servicentros, independiente de la calle que enfrenten
19f0b36_49	33	0.6441037404496652	b) Usos de suelo: Postérguense los permisos de edificación asociados a equipamiento comercio con carga de ocupación sobre 500 personas y servicentros, independiente de la calle que enfrenten
19f0b36_58	34	0.6441037404496652	b) Usos de suelo: Postérguense los permisos de edificación asociados a equipamiento comercio con carga de ocupación sobre 500 personas y servicentros, independiente de la calle que enfrenten
2bb3805_160	35	0.6433889001749036	Adicionalmente, en el caso de proyectos de habitabilidad combinados, que consideren distintas tipologías de obras y que contemplen, por tanto, distintos regímenes de fiscalización (A, B o C), la entidad o profesional responsable de esta función, deberá cumplir con la exigencia de visitas que se le exige para cada obra o vivienda, con excepción de aquellos proyectos cuyo régimen de fiscalización ha sido modificado mediante autorización fundada de la SEREMI
c7255b0_826	36	0.6427091049198105	b) Si el terreno no se encuentra a nombre de SERVIU, para proyectos de Construcción de Conjuntos Habitacionales, se deberá acreditar la constitución e inscripción en el Conservador de Bienes Raíces, de la hipoteca y prohibición de enajenar a favor del SERVIU
696c460_153	37	0.6416746784041685	El traslado vía terrestre de materiales de construcción y/o desechos tales como arena, ripio, tierra, productos de elaboración, maderas, que puedan escurrir o caer al suelo o esparcirse, sólo podrá hacerse en vehículos acondicionados para cumplir dicho menester, provistos de carpas u otros elementos protectores que cubran totalmente la carga
31de35e_41	38	0.641281093107678	Artículo 6°: Cuando se realicen los trabajos de instalación del mobiliario y se produzca cualquier daño en el área a intervenir o a terceros será de costos del contratista y/o propietario y se reparará quedando en su estado anterior a los trabajos
4e83264_49	39	0.6390795300835714	de dichas instalaciones, tales como costos asociados a labores de desmontaje, a faenas en instalaciones energizadas, costos por construcción de variantes provisorias, etc
6c3cb89_62	40	0.6386826721847847	Artículo 15º: Tratándose de propiedades que sirvan como vivienda y además como locales comerciales, industriales, oficinas profesionales u otros, el pago del derecho ordinario o especial del servicio deberá aplicarse en la contribución territorial, en el cobro directo o en las patentes respectivas, según sea el caso
1585c05_26	41	0.6385381232167097	Los portainjertos nacionales que se requieran utilizar para la injertación del material de importación que ingrese a Cuarentena Absoluta, podrán ser proporcionados por:
dab85da_26	42	0.6375764210330204	Uso transitorio: consiste en toda ocupación transitoria de un bien nacional de uso público con el objeto de ejecutar trabajos, rupturas y/o reparación de pavimentos, calzadas, aceras, jardines y sus restituciones, excavaciones, rellenos y acopio de materiales, funcionamiento de maquinarias y otros similares
371e773_12	43	0.6372397116277774	d) De los impuestos y derechos municipales que afecten a las construcciones que realice para desarrollar su actividad en el país
4861b11_97	44	0.6369348402686252	El costo de obras civiles podrá considerar una metodología de costeo basada en cubicación estándar, basada en una empresa contratista que realiza las obras
42dad74_59	45	0.636930296318023	No obstante lo anterior limítase en toda la zona M-1 el uso permitido de vivienda, permitiéndose sólo aquellas necesarias para el funcionamiento y resguardo de las instalaciones propias de los equipamientos, actividades productivas y complementarias a la vialidad y transporte admitidas en el área
c7255b0_782	46	0.6358081245175882	El SERVIU pagará el subsidio, incluidos todos los subsidios complementarios que correspondan, cuando las viviendas se encuentren con Recepción Definitiva de Obras de Edificación por parte de la DOM e inscritas en el Conservador de Bienes Raíces a nombre del beneficiario, deducido el monto de los giros efectuados por concepto de anticipos a cuenta del pago de éste, si existen, contra la presentación de los siguientes documentos:
8dbb961_125	47	0.6334691127160069	Cuando las leyes o reglamentos exijan como requisito ser propietario del terreno en que recae la concesión, los beneficiarios podrán solicitar los permisos, la aprobación de los planes de manejo y la asistencia técnica y crediticia que se requieran para construir o realizar en el bien concesionado las inversiones necesarias para el cumplimiento del proyecto aprobado
379c758_49	48	0.6334166889020352	El Director de Construcciones podrá autorizar la instalación de dichas cámaras en el BNUP, de no ser factible esta solución la restitución de fachadas producto de la anexión subterránea en caso de obras en BNUP, que impliquen la transformación del sistema aéreo al subterráneo, será de responsabilidad del propietario
c7255b0_864	49	0.6329901384122585	Mediante resoluciones fundadas el Ministro de Vivienda y Urbanismo establecerá las condiciones para ingresar al sistema de proveedores de autoconstrucción asistida, pudiendo limitar los montos de adquisición de materiales en atención al cumplimiento de hitos de avance físico de la obra
2bb3805_297	50	0.6326972202579911	En aquellos casos en que no se requiera la transferencia de la vivienda al beneficiario, se exigirá la inscripción en el Conservador de Bienes Raíces respectivo de la prohibición de gravar, enajenar y celebrar acto o contrato alguno que importe cesión de uso y goce del inmueble, sea a título gratuito u oneroso, a favor del SERVIU, o bien, mediante declaraciones juradas, señalando que se conocen las prohibiciones contenidas tanto en el artículo 13 de la Ley N° 19,253, que Establece Normas sobre Protección, Fomento y Desarrollo de los Indígenas, y crea la Corporación Nacional de Desarrollo Indígena como en el artículo 819 del Código Civil, en los casos que los beneficiarios sean titulares de dominio o derecho de goce de tierras indígenas o titulares de derecho real de uso, respectivamente
74d057e_120	51	0.6326294060958282	La infracción a lo dispuesto en este artículo será sancionada con la restitución del subsidio habitacional recibido, al valor de la Unidad de Fomento vigente a la fecha de la restitución
74d057e_242	52	0.6326294060958282	La infracción a lo dispuesto en este artículo será sancionada con la restitución del subsidio habitacional recibido, al valor de la Unidad de Fomento vigente a la fecha de la restitución
2bb3805_334	53	0.6324816855532736	También puede aplicarse para la tipología Construcción de Conjuntos Habitacionales (CCH), pero sólo en lo que respecta a ejecución de viviendas y equipamiento, no así para obras de urbanización u otras obras de mayor complejidad, como canalizaciones, contención de taludes, habilitación y mejoramiento estructural de terrenos y otras de similar naturaleza, para las cuales deberá ser contratada una empresa constructora o un contratista, especializado en la ejecución de este tipo de obras
b1855c7_109	54	0.6324052523222173	Certificado de Avalúo del Servicio de Impuestos Internos con uso habitacional
c7255b0_362	55	0.6316022300034909	En el caso de las Tipologías de Proyectos de Mejoramiento y de Ampliación de la Vivienda, y de Mejoramiento del Entorno Inmediato, las que a la fecha de postular sean propietarias o asignatarias de más de una vivienda, salvo cuando se autorice mediante resolución fundada del SEREMI, y siempre que la vivienda que integra el proyecto corresponda a la que habitan
d739811_40	56	0.6308418809896025	Artículo 17º: Se establecen las siguientes rebajas o exenciones en el pago por el servicio de extracción usual y ordinario de residuos domiciliarios en favor de los siguientes beneficiarios, que así lo soliciten:
8658e37_2	57	0.6307595968022571	Artículo 1º: La presente ordenanza establece las normas por las cuales se regula el otorgamiento de permisos para la instalación de elementos publicitarios, para la exhibición de elementos de propaganda o publicidad del tipo gráfico-luminosa, iluminada, proyectada, reflectante, ornamental, comercial o de cualquier otro tipo, ubicada en propiedad pública o privada y que se realice hacia los bienes nacionales de uso público, como aquella que se fija en el exterior de edificios, estructuras, vehículos, aeronaves, globos aerostáticos o cualquier otra forma apropiada a su naturaleza, o por alguno de los medios contemplados en la Ley de Rentas Municipales, inclusive aquellas de patrocinio de la Municipalidad de Estación Central
c586e8a_45	58	0.6302017681928487	Artículo 11º: Tratándose de propiedades que sirvan como viviendas y además como locales comerciales, industriales, oficinas profesionales, entre otros, el pago del derecho ordinario o especial del servicio deberá aplicarse en la contribución territorial, en caso que se trate de distinto usuario se aplicará en la patente comercial
52ea45c_79	59	0.63008388543768	b) Respecto de instalaciones referidas a permisos de edificación de obras en los que le cabe alguna participación a la persona jurídica de la cual forman parte o a otro de los socios, directores, administradores o autoridades superiores de dicha persona jurídica, en calidad de propietario, constructor, arquitecto, calculista, supervisor, inspector técnico o revisor independiente
bd52956_112	60	0.63008388543768	b) Respecto de instalaciones referidas a permisos de edificación de obras en los que le cabe alguna participación a la persona jurídica de la cual forman parte o a otro de los socios, directores, administradores o autoridades superiores de dicha persona jurídica, en calidad de propietario, constructor, arquitecto, calculista, supervisor, inspector técnico o revisor independiente
f1ebd15_49	61	0.630015160652773	"- ""La Corporación"" se hace cargo de la conservación y reparaciones ordinarias de los edificios o construcciones que le entrega ""el Ministerio"" en virtud de este convenio"
469698c_25	62	0.6298339037323867	Los proyectos y construcción de instalaciones domiciliarias, incluyendo arranques, uniones domiciliarias, conexiones y empalmes, podrán ser ejecutados por ingenieros civiles, arquitectos, ingenieros de ejecución en obras sanitarias, ingenieros constructores, constructores civiles y, en general, por cualquier profesional de la construcción habilitado para ello por disposiciones legales y reglamentarias vigentes
6d8b3ba_57	63	0.6297819031165265	En los casos de los usufructos constituidos sobre tierras indígenas regidas por la ley Nº 19,253, para el pago del certificado de subsidio no será necesario constituir prohibición de enajenar o gravar sobre la vivienda construida con el subsidio, bastando acompañar declaración jurada de conocer el usufructuario las limitaciones que establece respecto de ellos la ley Nº 19,253, de conformidad con lo establecido en la letra a) del artículo 68 del DS 10 (V
8658e37_95	64	0.6297321274352076	Artículo 16º: El permiso concedido para la instalación de un elemento publicitario implica la autorización de ocupación de la vía pública durante el plazo necesario para efectuar los trabajos, previo pago de los derechos correspondientes, así como las facilidades para ejecutar las tareas de conservación del mismo
cd875ca_372	65	0.6295847651827793	Para garantizar que el producto de la venta autorizada se destinará a la adquisición de una vivienda que reúna los requisitos, características y condiciones exigidos, dentro del plazo establecido y que se constituirá sobre ella prohibición de enajenar, parte del precio de la enajenación, equivalente tanto al monto del subsidio directo como del subsidio implícito recibidos y del subsidio a la originación, cuando corresponda, determinados conforme a la liquidación que practicará el SERVIU, deberá enterarse mediante depósito a plazo renovable automáticamente, por períodos no superiores a 90 días, expresado en Unidades de Fomento, con interés, tomado en un banco o sociedad financiera a nombre del vendedor quien lo endosará nominativamente a favor del SERVIU respectivo
fb51c9b_14	66	0.6294205543001581	Modifícase el uso de suelo y normas urbanísticas correspondientes a los lotes ubicados originalmente en la Zona Industrial EX-I1 y fíjase un nuevo uso de suelo y normas urbanísticas como sigue: Roles SII N°395-49 a 395-53, 395-72 a 395-104 y 395-106 como Zona Urbana V2, a parte del lote 1B1 Rol SII 847-421 como Zona AV-2, a parte del lote 1B1 Rol SII 847-421 como Zona E2, según lo indicado en la Memoria Explicativa y el Plano Seccional Miravalle que son parte integrante del presente decreto
2bb3805_218	67	0.628778145934648	El Subsidio de Mejoramiento del Terreno podrá destinarse al pago de obras de mejoramiento estructural del suelo, rellenos estructurales compactados, muros de contención, estabilización de taludes, defensas fluviales, canalización de quebradas o cursos de agua que afecten la construcción o habitabilidad de la vivienda, pilotajes profundos u otro tipo de fundaciones especiales, mejoramiento de vías de acceso a la vivienda, pavimentación cuando la vía proyectada tenga una pendiente superior al 10%, obras especiales para mitigación por zonas de riesgo, control de plagas, demolición de edificaciones o elementos existentes, retiro de escombros u otras obras de similar naturaleza
c7255b0_138	68	0.628778145934648	El Subsidio de Mejoramiento del Terreno podrá destinarse al pago de obras de mejoramiento estructural del suelo, rellenos estructurales compactados, muros de contención, estabilización de taludes, defensas fluviales, canalización de quebradas o cursos de agua que afecten la construcción o habitabilidad de la vivienda, pilotajes profundos u otro tipo de fundaciones especiales, mejoramiento de vías de acceso a la vivienda, pavimentación cuando la vía proyectada tenga una pendiente superior al 10%, obras especiales para mitigación por zonas de riesgo, control de plagas, demolición de edificaciones o elementos existentes, retiro de escombros u otras obras de similar naturaleza
06cbac6_117	69	0.6275200143416354	No obstante, los usufructuarios, arrendatarios y, en general, los que ocupen la propiedad en virtud de un acto o contrato que no importe transferencia, no estarán obligados a pagar el derecho de aseo devengado con anterioridad al acto o contrato; efectuado el pago por el arrendatario, éste quedará autorizado para deducir la suma respectiva de los cánones de arrendamiento
d739811_10	70	0.6275200143416354	No obstante, los usufructuarios, arrendatarios y, en general, los que ocupen la propiedad en virtud de un acto o contrato que no importe transferencia, no estarán obligados a pagar el derecho de aseo devengado con anterioridad al acto o contrato; efectuado el pago por el arrendatario, éste quedará autorizado para deducir la suma respectiva de los cánones de arrendamiento
e7414a8_578	71	0.6272738078252997	sobre arrendamiento de predios rústicos, medierías o aparcerías y otras
2bb3805_350	72	0.6268893697480458	- Del pago del Subsidio de Asistencia Técnica, Jurídica y Social para la Modalidad de Autoconstrucción Asistida
