15b1a56_8	58	0.33426173364281997	Que el artículo 22 del referido cuerpo legal instaura un fondo concursable destinado a la conservación, recuperación y manejo sustentable del bosque nativo, a través del cual se otorgará una bonificación destinada a contribuir a solventar el costo de las actividades comprendidas en dicha norma
1739c19_10	59	0.3341193066657515	El Programa está destinado a fomentar la creación de fondos de inversión que permitan el financiamiento y desarrollo de proyectos de forestación en terrenos de aptitud preferentemente forestal, en especial en las áreas afectadas por los incendios forestales de la zona centro-sur del país, para proyectos de recuperación productiva y ambiental de bosques; en las tierras indígenas reguladas por la Ley Nº 19,253 (previa consulta y consentimiento libre e informado de las comunidades); en bosque nativo susceptible de recuperación vía manejo silvícola sostenible; y en las Zonas de Rezago definidas por el Ministerio del Interior y Seguridad Pública
c7d2571_20	60	0.3340744893673573	En virtud de lo dispuesto en el inciso primero del artículo 2º de la Ley Orgánica de la Superintendencia del Medio Ambiente, los destinatarios de la presente instrucción deberán remitir a la Superintendencia del Medio Ambiente, la información respecto de las condiciones, compromisos o medidas, que ya sea por medio de monitoreos, mediciones, reportes, análisis, informes de emisiones, estudios, auditorías, cumplimiento de metas o plazos, y en general cualquier otra información destinada al seguimiento ambiental del proyecto o actividad, según las obligaciones establecidas en su Resolución de Calificación Ambiental
442e009_5	61	0.3330546397343115	Que la Ley Nº 20,283, sobre Recuperación del Bosque Nativo y Fomento Forestal, crea un Fondo concursable destinado a la conservación, recuperación y manejo sustentable del bosque nativo a través del cual se otorgarán bonificaciones para contribuir a solventar los costos de actividades inherentes a los objetivos de la creación de ese Fondo
e679c30_71	62	0.3327871966639525	Acerca de PPDA, la estrategia se enfoca en desarrollar actividades de fiscalización ambiental diferenciadas, en función de los distintos tipos de medidas contempladas en cada Plan, considerando inspecciones ambientales, requerimientos de información, a Unidades Fiscalizables afectas, además de la implementación y uso de herramientas tecnológicas para el chequeo de compromisos rutinarios, y de sistemas de gestión de información para el seguimiento ambiental de determinadas acciones
cfb8115_7	63	0.3310962094565557	1) Operador Forestal: Persona natural o jurídica que realiza actividades forestales de aquellas contempladas en el artículo 12 del decreto ley Nº 701, de 1974, sobre Fomento Forestal y sus reglamentos, y aquellas contempladas en la tabla de costos respectiva, tales como preparación de suelos, forestación, construcción de cercos, obras de recuperación de suelos, estabilización de dunas, podas, raleos, cortinas cortavientos, asistencia técnica en terreno y otras actividades complementarias a la bonificación forestal, tales como la captación de propietarios de terrenos forestables, la gestión de créditos de enlace ante entidades crediticias públicas y/o privadas y las gestiones necesarias para la ejecución de las faenas bonificables
93daad2_1	64	0.33105470694981	Que el artículo 42 de la Ley Nº 20,283, sobre Recuperación del Bosque Nativo y Fomento Forestal, en adelante la Ley, establece que la Ley de Presupuestos de la Nación contemplará todos los años un fondo destinado a la investigación del bosque nativo, cuya finalidad será promover e incrementar los conocimientos en materias vinculadas con los ecosistemas forestales nativos, su ordenación, preservación, protección, aumento y recuperación, sin perjuicio de los aportes privados que puedan complementarlo
1d447d5_6	65	0.3309058104972866	Que muchas de las especies cumplen un importante rol ecológico en el sistema humedal, como especies beneficiosas para la actividad silvoagropecuaria y/o benéficas para la mantención del ecosistema
83388fc_12	66	0.3309058104972866	Que muchas de las especies cumplen un importante rol ecológico en el sistema humedal, como especies beneficiosas para la actividad silvoagropecuaria y/o benéficas para la mantención del ecosistema
b331239_18	67	0.32983296009248475	"Que, los estuarios poseen una función biológica irremplazable en la producción y el desarrollo de numerosas especies, a tal punto que son reconocidos como verdaderas ""áreas de crianza"" y hábitats promotores para el desarrollo de larvas de distintas especies de peces, debido a su alta producción biológica, tanto primaria como secundaria"
b577c3d_10	68	0.32874662300845614	"""q) Cultivo o actividad experimental: Actividad de cultivo de recursos hidrobiológicos que tiene por objeto la investigación científica, mejora genética, el desarrollo tecnológico o la docencia"
65969c7_13	69	0.32818634973603333	El objetivo del presente programa es definir los lineamientos y las medidas para mejorar la eficacia de los tratamientos y reducir los riesgos asociados a la emergencia de resistencia de microorganismos a los antimicrobianos, con el fin de proteger la sanidad y el bienestar animal, junto con garantizar la inocuidad de los alimentos derivados de la salmonicultura y otros peces de cultivo
55ecbc4_13	70	0.3271838194010612	a) Incluir variables biológicas (bioindicadores y ensayos ecotoxicológicos), que tengan relación con la biodiversidad, con miras a cumplir con el objetivo de preservación y conservación de los ecosistemas acuáticos
dfe46c7_148	71	0.3267187373693743	Se prohíbe, en la producción orgánica, la utilización de organismos genéticamente modificados y de productos derivados de éstos, tales como: Productos e ingredientes alimenticios (incluidos aditivos y aromas); auxiliares tecnológicos (incluidos los solventes de extracción); alimentos para animales; piensos compuestos; materias primas para la alimentación animal; aditivos en la alimentación animal; auxiliares tecnológicos en los alimentos para animales; determinados productos utilizados en la alimentación animal (tales como aminoácidos, proteínas obtenidas a partir de microorganismos, algas, subproductos de la fabricación de antibióticos obtenidos por fermentación, sales de amonio y subproductos de la fabricación de aminoácidos por fermentación); animales; plaguicidas; fertilizantes; acondicionadores del suelo; semillas y materiales de propagación vegetativa
047b8c5_8	72	0.3258575489103772	Fíjase la siguiente Tabla de Costos que establece, para el año 2012, los valores de las actividades que se bonificarán en el marco del Sistema de Incentivos para la Sustentabilidad Agroambiental de los Suelos Agropecuarios, las especificaciones técnicas generales y los niveles mínimos técnicos de aquellas prácticas que correspondan:
131f13b_19	73	0.32529282145504	Se excluyen de la aplicación de esta reglamentación a los beneficiarios de Indap, quienes en esa calidad acceden en forma permanente a créditos, asistencia técnica y otros incentivos establecidos en su Ley Orgánica
52a3a10_216	74	0.32520993340081605	- El Director Nacional del SAG y del Indap, en ejercicio de las atribuciones que les confieren las leyes orgánicas de tales servicios, podrán celebrar convenios con entidades públicas o privadas para la ejecución de las labores por apoyo técnico, operacional, de seguimiento y evaluación del impacto productivo y ambiental que generen las actividades contempladas en el Programa de Recuperación de Suelos Degradados
77fd10b_58	75	0.32437316841269337	Promover el desarrollo de actividades recreativas, asociadas a las potencialidades existentes y limitaciones que se requieran en ambientes de alta diversidad y complejidad natural, como bosques subantárticos prístinos, topografía montañosa, campos de hielo, y numerosos glaciares, ventisqueros que se descuelgan hacia lagos, fiordos, senos y canales;
dfe46c7_122	76	0.3231033810284525	Los sistemas de cultivos perennes emplean fórmulas similares consistentes en cultivos asociados, intercultivos y setos vivos para introducir biodiversidad
8c2c48c_6	77	0.3226945057136741	Fíjase la siguiente Tabla de Costos que establece, para el año 2018, los valores de las actividades que se bonificarán en el marco del Sistema de Incentivos para la Sustentabilidad Agroambiental de los Suelos Agropecuarios, las especificaciones técnicas generales y los niveles mínimos técnicos de las siguientes prácticas:
25a3671_41	78	0.3226336784725854	"- El ""Parque Nacional Patagonia"" tendrá como objetivo general preservar muestras de los ecosistemas transicionales, de pastizales, montañas, bosques de coigüe y humedales, asegurando la biodiversidad y los procesos evolutivos en ellos"
b3e1ce7_14	79	0.32263162048762206	Que uno de los objetivos que se ha trazado este Comité es la creación de nuevas áreas para ser incorporadas al Sistema Nacional de Áreas Silvestres Protegidas del Estado (SNASPE), con la finalidad de propender a la protección efectiva de muestras representativas de ecosistemas relevantes del territorio nacional, así como la de velar por el cumplimiento de la Estrategia Nacional de la Biodiversidad y su correspondiente Plan de Acción País
3f5633c_139	80	0.3220025254096588	BIOTÉCNIAS: Consisten en el trabajo biológico con especies herbáceas y leñosas-arbustivas recuperadoras y estabilizadoras de suelos degradados
1adb72b_1351	81	0.32158982588721163	ñ) las alteraciones que pueda generar sobre otros elementos naturales y/o artificiales del medio ambiente la introducción al territorio nacional de alguna especie de flora o de fauna; así como la introducción al territorio nacional, o uso, de organismos modificados genéticamente o mediante otras técnicas similares;
25a72fc_24	82	0.3214605548842646	Que, con la finalidad de complementar lo anterior, el Ministerio del Medio Ambiente solicitó un informe al Instituto de Ecología y Biodiversidad, a objeto de determinar la importancia de la diversidad biológica y el valor ecológico del ecosistema Campo Dunar Punta de Concón;
77fd10b_57	83	0.3211476394956223	Mantener áreas de carácter único o representativas de la diversidad ecológica natural del país o del lugar con comunidades animales o vegetales, paisajes y formaciones geológicas naturales, a fin de posibilitar la educación e investigación y de asegurar la continuidad de los procesos evolutivos, las migraciones animales, los patrones de flujo genético y la regulación del medio ambiente;
ce638af_131	84	0.3206509273378544	k) Proponer prácticas que favorezcan la biodiversidad, vinculadas directamente a las propiedades del suelo, posibles de incorporar al Programa y que contribuyan a la sustentabilidad de los suelos
8c43822_9	85	0.32063025089852937	Fíjase la siguiente Tabla de Costos que establece, para el año 2013, los valores de las actividades que se bonificarán en el marco del Sistema de Incentivos para la Sustentabilidad Agroambiental de los Suelos Agropecuarios, las especificaciones técnicas generales y los niveles mínimos técnicos de aquellas prácticas que correspondan:
2c2ec8c_5	86	0.3206101228951591	Que se hace necesario armonizar y actualizar las normas reglamentarias sobre especies forestales declaradas monumento natural, con la ley sobre Bases Generales del Medio Ambiente y el Reglamento del Sistema de Evaluación de Impacto Ambiental, en cuanto éstos exigen que los proyectos o actividades susceptibles de causar impacto ambiental, deben someterse a dicho Sistema, garantizando la protección del medio ambiente, la preservación de la naturaleza y la conservación del patrimonio ambiental, mediante el cumplimiento de planes, medidas y acciones de mitigación, reparación y/o compensación que eliminen o mitiguen los efectos adversos que dichos proyectos o actividades pudieren tener
efda249_8	87	0.3204959986222551	Que, de conformidad con lo dispuesto por el artículo 173 del decreto supremo Nº 430/91 del Ministerio de Economía, Fomento y Reconstrucción, hoy Ministerio de Economía, Fomento y Turismo, que fija el texto refundido, coordinado y sistematizado de la ley Nº 18,892, General de Pesca y Acuicultura, se determina la creación del Fondo de Administración Pesquero, destinado a financiar proyectos de investigación pesquera y acuicultura, y de fomento y desarrollo a la pesca artesanal; y programas de vigilancia, fiscalización y administración de las actividades pesqueras; de capacitación, apoyo social y reconversión laboral para los trabajadores que, durante el periodo de vigencia de la ley Nº 19,713, hayan perdido su empleo, y de capacitación para los actuales trabajadores de las industrias pesqueras extractivas y de procesamiento
0982088_148	88	0.32017065318243265	BIOTECNIAS: Consisten en el trabajo biológico con especies herbáceas y leñosas-arbustivas recuperadoras y estabilizadoras de suelos degradados
8fa1307_157	89	0.32017065318243265	BIOTECNIAS: Consisten en el trabajo biológico con especies herbáceas y leñosas-arbustivas recuperadoras y estabilizadoras de suelos degradados
bd53430_164	90	0.32017065318243265	BIOTECNIAS: Consisten en el trabajo biológico con especies herbáceas y leñosas-arbustivas recuperadoras y estabilizadoras de suelos degradados
c3e1746_158	91	0.31942418266292694	c) Experiencia: prestación de servicios o actividades desarrolladas en el área de biología, pesquería, acuicultura o ciencias del mar, periodo y tipo de servicio o actividad; en el caso de personas jurídicas, breve reseña del desarrollo de la entidad, incluyendo los tipos de servicios prestados desde la fecha de su constitución y la experiencia en el área de la certificación;
c900e7d_13	92	0.3193047487385059	Que los objetivos de preservación que son posibles en la mayor parte de esta área en la que predominan ambientes primitivos y que es extensa, sólo son compatibles con actividades humanas de educación, investigación y recreación bajo adecuadas técnicas de manejo
dfe46c7_404	93	0.31922696925514016	Los colmenares o apiarios, se deben ubicar a una distancia mínima de 3,0 kilómetros de zonas expuestas al uso de métodos, productos o actividades que pueden afectar la condición orgánica de la producción apícola, tales como centros urbanos, industriales y vertederos
c7baa1f_26	94	0.31877842058548067	La Municipalidad, implementará un Plan de Reforestación, que incluirá la reposición de árboles y arbustos, de hoja perenne, y la creación y mantención de áreas verdes, en coordinación con las Juntas de Vecinos, u otras instituciones, con el objetivo de hermosear la comuna y contribuir a bajar los índices de material particulado, regular la temperatura ambiente
51bf5af_14	95	0.31813481677242705	Que uno de los objetivos que se ha trazado este Comité, es la creación de nuevas áreas para ser incorporadas al Sistema Nacional de Áreas Silvestres Protegidas del Estado (SNASPE), con la finalidad de propender a la protección efectiva de muestras representativas de ecosistemas relevantes del territorio nacional, así como la de velar por el cumplimiento de la Estrategia Nacional de la Biodiversidad y su correspondiente Plan de Acción País
4ff9995_3	96	0.3177767330886624	Que, conforme lo dispone el artículo 37, 70 letra i) de la Ley sobre Bases Generales del Medio Ambiente, es atribución del Ministerio del Medio Ambiente proponer políticas y formular planes, programas y acciones que establezcan los criterios básicos y las medidas preventivas para favorecer la recuperación y conservación de los recursos hídricos, genéticos, la flora, la fauna, los hábitats, los paisajes, ecosistemas y espacios naturales, en especial los frágiles y degradados, contribuyendo al cumplimiento de los convenios internacionales de conservación de la biodiversidad
9646403_16	97	0.31762689585917836	Que uno de los objetivos que se ha trazado este Comité, es la creación de nuevas áreas para ser incorporadas al Sistema Nacional de Áreas Silvestres Protegidas del Estado (SNASPE), con la finalidad de propender a la protección efectiva de muestras representativas de ecosistemas relevantes del territorio nacional, así como la de velar por el cumplimiento de la Estrategia Nacional de la Biodiversidad y su correspondiente Plan de Acción País;
1739c19_22	98	0.31756009638745875	Abarca la planeación del proceso productivo completo: plantación, manejo silvicultural y cosecha, así como todas las actividades derivadas de estos procesos, y debe seguir los lineamientos establecidos para su sustentabilidad en el Protocolo de Plantaciones Forestales, desarrollado por el Consejo de Política Forestal o el que la reemplace, además de contar con la aprobación mediante resolución de Conaf
252d6fa_9	99	0.31738576315587763	- Corresponden a las instalaciones donde se desarrollan, indistintamente, las actividades de recepción, preparación y almacenamiento de sustrato, producción, almacenamiento, tratamiento, transferencia, suministro y uso o consumo de biogás
e24a9dd_193	100	0.31738088878643245	"- El ""Parque Nacional Corcovado"", tendrá como objetivo general, la preservación de una muestra de los ecosistemas de Bosque Templado Lluvioso, asegurando su biodiversidad y sus procesos evolutivos"
